Id,Title,Company,Location,Required Qualifications,Link,Page Rank,
39,"Intern","CBRE","New York, NY","About CBRE

With broader and deeper capabilities than any other company, CBRE is the leading full-service real estate services and investment organization in the world. A CBRE internship gives you a unique opportunity to get a head start in the commercial real estate industry by working alongside some of our top producing professionals. Our associates will gain valuable real-life experience and learn the business by working on CBRE projects.

CBRE Group, Inc. is the world’s largest commercial real estate services and investment firm (based on 2019 revenues) with more than 100,000 employees (excluding affiliates). CBRE has been included in the Fortune 500 since 2008, ranking #128 in 2020. It also has been voted the industry’s top brand by the Lipsey Company for 19 consecutive years and has been named one of Fortune’s “Most Admired Companies” in the real estate sector for eight years in a row. Its shares trade on the New York Stock Exchange under the symbol “CBRE”.

The company serves real estate investors and occupiers through approximately 530+ offices worldwide (excluding affiliates). CBRE offers a broad range of integrated services, including facilities, transaction and project management; property management; investment management; appraisal and valuation; property leasing; strategic consulting; property sales; mortgage services and development services.

Responsibilities

This internship is designed for current college students, undergraduate or graduate seeking a career in commercial real estate. Participation in the program is intended to provide a well-rounded knowledge of the commercial real estate business and valuable skills, earned by working alongside talented professionals in the largest and most successful global commercial real estate services firm.

The internship accelerates your learning and development by providing you with a strong foundation upon which to build your commercial real estate sales career. The program provides you with a unique perspective on our integrated service lines. As a program participant, you will also partake in learning and development activities designed especially for you.

Responsibilities May Include

Conduct company, property and industry-specific research

Manage and update prospects in an internal tracking database

Assist in developing and preparing marketing and presentation materials

Track local and regional activity, e.g., economy, employment statistics, major company activity, industry trends and demographics that affect the local real estate market

Contribute to special projects in support of business development

Provide ongoing support with current deals, including market surveys, proposal reviews and summaries, lease reviews, financial analysis

Qualifications

This internship is designed for candidates with a strong academic background, preferably in business or real estate. Applicants should be self-motivated, creative and disciplined, seeking to excel in the commercial real estate industry.

Current college junior, senior, or graduate level student

Desire to work in the commercial real estate industry

Experience with MS Office with preferred experience in Salesforce and Tableau

Strong presentation skills

Ability to network and develop strong relationships

Detail-oriented and highly organized

Strong analytical and problem-solving skills

Solid written and oral communication skills

Ability to work independently and collaboratively

To be considered for a position with CBRE, please apply online at http://cbre.com/careers. Click on “Search and Apply” on the left side of the screen. If a pop-up window does not open, please check your browser’s settings. On the login window either login with your existing username and password or click on “Register Today” to create one. Once you are logged in you can either apply for specific jobs or submit your general application using the link at the bottom of the page.

EOE & AA Employer M/F/D/V","https://www.linkedin.com/jobs/view/externalApply/2490345356?url=https%3A%2F%2Fcbre%2Ereferrals%2Eselectminds%2Ecom%2Fjobs%2Fintern-86288%3Fsrc%3DJB-10160&urlHash=Xdj3&refId=edae8af6-556e-473a-9135-45171729d366&trackingId=%2B8qgiBL%2BnsZC5fiVwCx4Uw%3D%3D&trk=public_jobs_apply-link-offsite",0.0043163973584566095,
46,"Intern- Inclusion & Diversity","Gilead Sciences","Foster City, CA","Gilead Sciences is continuing to hire for all open roles. Our interview process may be conducted virtually and some roles will be asked to temporarily work from home. Over the coming weeks and months, we will be implementing a phased approach to bringing employees back to site to ensure the health and safety of our teams.

For Current Gilead Employees And Contractors

Please log onto your Internal Career Site to apply for this job.

Job Description

A summer internship is available in the Human Resources Department at the Foster City, CA, campus of Gilead Sciences. The ideal candidate should be enrolled in an Undergraduate or Graduate Program with a Major in Human Resources, Industrial Organizational Psychology, Communications or Business. The candidate will help support a key strategic program, The Advancing Black Leadership strategy. This intern position is in the Talent, Development and Inclusion function.

Essential Functions

Under general supervision, the intern responsibilities may include:
Provide support in driving key aspects of the Advancing Black Leadership Strategy; may focus on one workstream in order to maximize experience and input.
Actively participates in Advancing Black Leadership core team meetings, reviews and planning.
Develop a current knowledge of HR laws, as well as company policies and procedures.
Prepare HR-related reports and surveys.
Attend meetings relative to Talent, Development and Inclusion function.
Develop a working knowledge of HR information databases and searchable resources.

Knowledge, Experience & Skills
Must be at least 18 years old
Undergraduate (or graduate student, if applicable) in the or related field enrolled in a 4-year accredited university/college; including enrollment in the Fall Semester after completing the internship
Microsoft Word, Excel, PowerPoint skills
Demonstrated leadership skills
Workday knowledge a plus
Demonstrated strong problem-solving skills
Strong interpersonal skills
Ability to convey a positive and professional image to internal and external clients
Ability to maintain high standards of confidentiality
Show strong passion for building a career in Human Resources
Good verbal and written communication skills and interpersonal skills are required
Ability to complete 10-12 consecutive weeks between May and September

Please note, no relocation is available for this position**

If this is not the right move for you now but you remain interested in a career at Gilead Sciences, please connect with us via our talent community: https://gilead.avature.net/careers/

About Gilead

Gilead Sciences, Inc. is a research-based biopharmaceutical company that discovers, develops and commercialises innovative medicines in areas of unmet medical need. With each new discovery and investigational drug candidate, we seek to improve the care of patients living with life-threatening diseases around the world. Gilead’s therapeutic areas of focus include HIV/AIDS, liver diseases, cancer and inflammation, and serious respiratory and cardiovascular conditions.

For Jobs In The United States

As an equal opportunity employer, Gilead Sciences Inc. is committed to a diverse workforce. Employment decisions regarding recruitment and selection will be made without discrimination based on race, color, religion, national origin, gender, age, sexual orientation, physical or mental disability, genetic information or characteristic, gender identity and expression, veteran status, or other non-job related characteristics or other prohibited grounds specified in applicable federal, state and local laws. In order to ensure reasonable accommodation for individuals protected by Section 503 of the Rehabilitation Act of 1973, the Vietnam Era Veterans' Readjustment Act of 1974, and Title I of the Americans with Disabilities Act of 1990, applicants who require accommodation in the job application process may contact careers@gilead.com for assistance.

For more information about equal employment opportunity protections, please view the ‘EEO is the Law’ poster.

NOTICE: EMPLOYEE POLYGRAPH PROTECTION ACT
YOUR RIGHTS UNDER THE FAMILY AND MEDICAL LEAVE ACT

PAY TRANSPARENCY NONDISCRIMINATION PROVISION

Our environment respects individual differences and recognizes each employee as an integral member of our company. Our workforce reflects these values and celebrates the individuals who make up our growing team.

Gilead provides a work environment free of harassment and prohibited conduct. We promote and support individual differences and diversity of thoughts and opinion.","https://www.linkedin.com/jobs/view/externalApply/2447112478?url=https%3A%2F%2Fgilead%2Ewd1%2Emyworkdayjobs%2Ecom%2Fen-US%2Fgileadcareers%2Fjob%2FUnited-States---California---Foster-City%2FIntern--Inclusion---Diversity_R0016811-1%3Fsid%3D132&urlHash=0r30&refId=edae8af6-556e-473a-9135-45171729d366&trackingId=345mKRAC94MUTPQJS%2BliEw%3D%3D&trk=public_jobs_apply-link-offsite",0.006926746939916862,
21,"Community Engagement Intern","International Rescue Committee","New York, NY","Requisition ID: req12377

Job Title: Community Engagement Intern

Sector: Education

Employment Category: Intern

Employment Type: Part-Time

Open to Expatriates: No

Location: New York, NY RAI USA

Background

Job Description

Founded in 1933, the International Rescue Committee is a leading, non-sectarian, non-profit organization providing emergency relief, protection, rehabilitation assistance, resettlement services, and advocacy for refugees and victims of oppression or violent conflict. Domestically, our 26 offices across the U.S. ensure new arrivals have food, shelter, and clothing, and work with refugees to help them gain self-sufficiency.

Since 1999, the IRC has developed partnerships with New York City public schools, community-based organizations, and local colleges and universities to support the positive development of refugee youth and their communities in New York City. The Education and Learning department provides year round programming working directly with refugee youth, their parents and families, and their schools.

Scope Of Work

The Newcomer Youth Summer Academy is a six-week program focusing on preparing newly arrived refugee youth to succeed at their grade level in the New York City public school system. Up to 130 students ages 5 – 21 from over 20 countries will participate in academic, creative arts, physical education, and social emotional learning classes. Field Trips are held on Fridays.

The Community Engagement Intern will work closely with the Dean of Student Support to ensure the smooth daily operation of Newcomer Youth Summer Academy student support services. The intern will assist the Dean in managing enrollment and referrals into the program, collaborate with local agencies and organizations, and support the Student Support Team in the smooth implementation of student socioemotional supports and special events.
This is an unpaid internship.

Learning Objectives

Develop skills in building rapport with newly arrived immigrant families and building their understanding of the American education system
Gain skills in the maintenance and organization of referral and enrollment processes
Cultivate relationships with partner organizations and schools
Develop skills in planning and implementing Community Events with a variety of stakeholders

Essential Job Functions
Complete online training modules, participate in live training, as well as all program meetings and staff development activities thereafter
Prior to the start of the Academy, conduct outreach to families confirming their attendance, as well as coordinating the distribution and translation of the Newcomer Youth Summer Academy Welcome Packet
Assist in enrolling new students into the Academy in compliance with IRC policies and procedures
Prepare new student information sheet for teachers for newly enrolled students
Manage the waitlist for potential students and coordinate intakes as space becomes available during the first two weeks of the Academy
In partnership with the Dean of Student Support, coordinate with Community partners regarding referrals, enrollments and special events (ex: Educator Roundtable, Graduation)
Upload enrolled student information into ETO
Coordinate one Parent Workshop in conjunction with Advocates for Children of New York & Caregiver Engagement Intern
Coordinate with Dean of Student Support, Student Support Team, & Operations team to organize 1-2 community building activities over the course of the Academy
Participate in weekly Student Support team meeting, recording and distributing minutes
Assist in the coordination and set up of Parent Teacher Conferences & Family Orientation
Support newly arrived families in enrolling their children in New York City public schools throughout the summer
Requirements

Qualifications
Minimum rising senior in college, graduate degree candidate in Education, School Counseling, Education Administration, Social Work, or related field
Experience with data collection and analysis
Strong organizational skills
Strong written and oral communicative skills
Cultural competence and cross-cultural or overseas experience required
Experience working with refugee and/or immigrant populations desirable
Ability to work independently and as part of a team
Fluency in written and spoken English required. Second language proficiency in relevant language highly desirable (including Spanish, French, Pashto, Fulani, Wolof, Dari, Farsi, Arabic, Russian, Ukrainian, Mandingo, Haitian Creole, Nepali, Tigrinya, Mam, Garifuna)
Must be available for all training days and for the entire duration of the Academy
Working Environment: In the event of an in-person program, the Academy takes place in a centrally located New York City public school (TBD). In the event of a virtual program, the Academy will take place primarily on Zoom. All participants must be willing to relocate to New York City for the entirety of the Program in the event of being in-person.

We are an equal opportunity employer and value diversity at our company. We do not discriminate on the basis of race, religion, color, national origin, sex, gender, gender expression, sexual orientation, age, marital status, veteran status, or disability status. We will ensure that individuals with disabilities are provided reasonable accommodation to participate in the job application or interview process, to perform essential job functions, and to receive other benefits and privileges of employment. Please contact us to request accommodation.","https://www.linkedin.com/jobs/view/externalApply/2468078031?url=https%3A%2F%2Frescue%2Ecsod%2Ecom%2Fux%2Fats%2Fcareersite%2F1%2Fhome%2Frequisition%2F12377%3Fc%3Drescue%26source%3DLinkedInA&urlHash=MEQv&refId=65f52e84-36e5-4b54-bcb8-209ca5e89f05&trackingId=yf9QzqXvIsB3y76KMda1Rg%3D%3D&trk=public_jobs_apply-link-offsite",0.004199503588714378,
44,"Intern, Africa / Summer 2021","National Endowment for Democracy","Washington, DC","2128 Intern, Africa / Summer 2021 - (Job #2128)

National Endowment for Democracy (NED)

Washington, D.C.

The National Endowment for Democracy (NED) is a federally funded, private, nonprofit grant making organization that works to support freedom around the world, and is seeking a paid Intern for the Africa Program. The position is based in Washington, D.C.

Position Summary: The Africa regional program team seeks an individual with strong research, writing, communication, and organizational skills who has a demonstrated interest in sub-Saharan Africa and in democracy work in the region to serve as an Intern for Summer 2021. Energetic, creative and flexible team players who take initiatives, prioritize several competing tasks, and work independently are encouraged to apply. The paid internship is open to current graduate or undergraduate students.

Responsibilities
Conduct research to track political developments throughout Africa;
Assist in drafting invitation letters, organizing event logistics, note taking, meeting agendas and newsletters;
Take notes during meetings and draft minutes;
Attend lectures and roundtable discussions on African policy issues; and,
Work with other members of the Africa team as requested.


Requirements
Candidate must be a registered student enrolled in an undergraduate or graduate-level program.
Qualified candidates should have excellent writing skills, strong analytical skills, maintain a strong work ethic and have sharp attention to detail. Students must also have strong computer skills.


Time Commitment: 24-40 hrs./week (not to exceed 40 hours per week) for the duration of the internship.

NED Application Deadline: n/a; All internships are posted until filled.

Anticipated Start Date: o/a June 1, 2021

Orientation Dates: o/a June 1st - 4th, 2021

Anticipated End Date: o/a August 27, 2021

Authorization: Candidates must be authorized to work in the U.S.

How To Apply

Applications must include a cover letter, resume, and contact information for three professional references, one of which should be a supervisor. Please, no phone calls.

For more information, please visit our website at www.ned.org or careers@ned.org. The NED is an Equal Opportunity Employer.","https://www.linkedin.com/jobs/view/externalApply/2440208663?url=https%3A%2F%2Fwww%2Ened%2Eorg%2Fabout%2Fjobs%2F%23op-439682-2128-intern%2C-africa-%2F-summer-2021&urlHash=RAKm&refId=edae8af6-556e-473a-9135-45171729d366&trackingId=9t4uEE%2FQOiZnAVA1FQ9SpA%3D%3D&trk=public_jobs_apply-link-offsite",0.02208656982231298,
24,"Intern, The Ascend Fund (Remote)","Panorama Global","Seattle, WA","About The Ascend Fund

The Ascend Fund is a collaborative fund dedicated to accelerating the pace of change toward gender parity in U.S. politics. The fund pools philanthropic capital and make mission-driven investments in nonpartisan, nonprofit organizations that break down barriers preventing women from running for office and winning.  Learn more about The Ascend Fund here.

Position Summary & Key Responsibilities

The Intern will be exposed to various workstreams within the organization, including but not limited to:

Communications
Assemble daily media clips for distribution to partners.
Develop content for the editorial calendar, including daily social media, monthly column, and quarterly newsletter.
Identify external communication opportunities to raise awareness of fund, issue, and partners.
Grant Management
Support grant work stream including RFP process, review and analysis of grant proposals, and funding approval process utilizing Blackbaud grantmaking software.
Explore new opportunities for innovative investment to advance mission of TAF.
Assist with the monitoring and evaluation process, including tracking and documenting partners’ activities.
Fundraising
Assist staff and consultants in execution of TAF fundraising plan, including donor communications and special events.
Conduct background research on potential donors and assess interest alignment with TAF.
Update CRM database (Salesforce).
Programmatic Support
Provide administrative and logistical support to the Director of the Ascend Fund in advancing fund’s goals.
Identify and track relevant stakeholders and organizations working in the sphere at state and national levels (landscape assessment).
Monitor, analyze, and report on developments related to women and politics in the United States.
This position reports to the Director of the Ascend Fund but will work closely with the Senior Project Manager as well.

Goals And Learning Objectives
Rewarding experience that further develops skillsets and gains knowledge in new areas that will be applicable to future interests and career ambitions.
Meets manager’s requests for administrative support to projects, while also engaging in higher level work indicative of skills, experience, and ability to contribute to organization overall.
As becomes more familiar with projects, increased comfort in taking initiative and working independently.

Position Requirements & Qualifications

This full-time (40 hours/week) internship is designed for undergraduate students in their junior or senior year of college, or for individuals 18+ with at least three years of professional experience, who are interested in learning more about the field.

Internships will start in early June and conclude in early September, with some flexibility and consideration given to your schedule and school system’s calendar. Due to the COVID-19 pandemic and Washington’s “Stay Home, Stay Healthy” proclamation, all Summer 2021 internships will be remote.
Demonstrated passion for electing women of all ethnicities, from diverse backgrounds and socioeconomic statuses, on both sides of the aisle, at all levels of offices, across the country.
Possess a basic knowledge of the political/electoral landscape in the U.S., and expressed interest in learning more about the unique barriers women face when running for office.
Evidence of leadership or leadership potential, including political or community involvement, commitment to public service, and ability to think critically and challenge self and others.
Excellent oral and written communication skills as well as demonstrable interpersonal skills and willingness to work in collaborative environment.
Able to thrive in fast-paced environment, prioritize workflow and balance needs of multiple projects, while maintaining close attention to detail.

Compensation

Panorama offers paid internships with compensation at $13.69/hour, based on the Washington State minimum wage requirements including those working outside of WA State. If the intern is located in a municipality with a higher minimum wage, Panorama will pay the local minimum wage as required by law.

How To Apply

Interested candidates should submit a resume, cover letter, and one relevant writing sample of their choice through our Careers Page portal.

Applications received by Monday, April 19, 2021 will receive priority review.

Top candidates will receive an invitation to interview and offers will be extended by mid-May.

About Panorama

The Ascend Fund is powered by Panorama, a platform for social change committed to solving pressing global problems through strategic partnerships, collaborative funds, and scalable solutions.

Established in 2017, Panorama is a diverse team of aspirational thinkers with the know-how to get things done in a fast-paced and flexible environment. We work closely with partners to identify their needs and co-develop practical and results-oriented strategies. Approaching our work with an entrepreneurial spirit, we initiate our own projects when we are uniquely positioned to fill a gap. We are a growing organization that is committed to creating a culture of fun, inclusivity, and openness, always celebrating individual and project milestones.

The values we share in our work and in our lives also inspire our name and logo.
We take a Global Perspective, and embrace diverse thinking and experiences.
Our Vision requires that we see the big picture and examine all angles.
Personal and professional Integrity positions us to wholly commit and steadfastly hold to our purpose.
Believers in Servant Leadership, Panorama is a mission-driven organization working for the greater good.
We strive for Impact, and our team acts boldly and creates a ripple effect.
Panorama is committed to creating a diverse team and is proud to be an equal opportunity employer. We know that representation matters in the workplace and with our partners; to that end we are committed to a hiring process grounded in equity and inclusion. All qualified applicants will receive consideration without regard to race, color, religion, gender, sexual orientation, national origin, disability, or age.

Panorama Global is tax-exempt under section 501(c)(3) of the Internal Revenue Code. Panorama Strategy is a social purpose corporation incorporated under the laws of the State of Washington.

In compliance with federal law, all persons hired will be required to verify identity and eligibility to work in the United States and to complete the required employment eligibility verification form upon hire.

Final offer is contingent on successful completion of a background check.","https://www.linkedin.com/jobs/view/externalApply/2497540247?url=http%3A%2F%2Fpanoramaglobal%2Eorg%2F%3FjobId%3DDNOt3tqoI-4W%26ft_source%3D3000076902%26ft_medium%3D3000071063&urlHash=l9zX&refId=65f52e84-36e5-4b54-bcb8-209ca5e89f05&trackingId=dWmcR3UN%2BGnl2%2BC5YUycQg%3D%3D&trk=public_jobs_apply-link-offsite",0.0039352529251629525,
