Id,Title,Company,Location,Required Qualifications,Link,Page Rank,
83,"Intern","Public Consulting Group","Boston, MA","Overview

About Public Consulting Group

Public Consulting Group, Inc. (PCG) is a leading public sector solutions implementation and operations improvement firm that partners with health, education, and human services agencies to improve lives. Founded in 1986 and headquartered in Boston, Massachusetts, PCG has over 2,500 professionals in more than 60 offices worldwide—all committed to delivering solutions that change lives for the better. The firm has four designated practice areas with extensive experience in all 50 states, clients in six Canadian provinces, and a growing practice in Europe. Often combining resources from two or more practice areas, PCG offers clients a multidisciplinary approach to solve their challenges or pursue opportunities. To learn more, visit www.publicconsultinggroup.com .

Responsibilities
An intern with PCG will have the opportunity to gain hands-on experience across a wide array of fields in a fast-paced and challenging environment.
Participate in team meetings with an open and curious mindset.
Perform research and analysis to support team initiatives.
Recommend solutions to improve effectiveness and efficiency.
Other duties as assigned.

Qualifications
Must be currently enrolled in a full time degree program .
Excellent verbal and written communication skills
Detail-oriented with strong organizational skills
Effective interpersonal skills
Desire to learn and achieve
Experience with Microsoft Office

EEO Statement

Public Consulting Group is an Equal Opportunity Employer dedicated to celebrating diversity and intentionally creating a culture of inclusion. We believe that we work best when our employees feel empowered and accepted, and that starts by honoring each of our unique life experiences. At PCG, all aspects of employment regarding recruitment, hiring, training, promotion, compensation, benefits, transfers, layoffs, return from layoff, company-sponsored training, education, and social and recreational programs are based on merit, business needs, job requirements, and individual qualifications. We do not discriminate on the basis of race, color, religion or belief, national, social, or ethnic origin, sex, gender identity and/or expression, age, physical, mental, or sensory disability, sexual orientation, marital, civil union, or domestic partnership status, past or present military service, citizenship status, family medical history or genetic information, family or parental status, or any other status protected under federal, state, or local law. PCG will not tolerate discrimination or harassment based on any of these characteristics. PCG believes in health, equality, and prosperity for everyone so we can succeed in changing the ways the public sector, including health, education, technology and human services industries, work.

Connect With Public Consulting Group!

Not ready to apply? Connect with Public Consulting Group for general consideration.","https://www.linkedin.com/jobs/view/externalApply/2486745421?url=https%3A%2F%2Fcareers-pcgus%2Eicims%2Ecom%2Fjobs%2F6357%2Fjob&urlHash=RhGZ&refId=246dc3be-fb59-428a-a0ce-ce15fcdb9f8b&trackingId=oT0wO3T40%2BByLFA96tEuJg%3D%3D&trk=public_jobs_apply-link-offsite",0.03659976973511435,
12,"Public Policy Internship (Fall 2021)","Tesla","Washington, DC","Disclaimer: This position is expected to start around August or September 2021 and continue through the entire Fall term (i.e. through December/January) or into early Spring 2022 if available. We ask for a minimum of 12 weeks, full-time, for most internships. Please consider before submitting an application.

International Students: If your work authorization is through CPT, please consult your school before applying. You must be able to work 40 hours per week. Many students will be limited to part-time depending on their academic standing.

Internship Program at Tesla

The Internship Recruiting Team is driven by the passion to recognize emerging talent. Our year around program places the best students in positions that they will grow both technically and personally through their experience working closely with their Manager, Mentor, and team. We are dedicated to providing an experience that allows for the intern to experience life at Tesla by given them projects that are critical to their team’s success.

Instead of going on coffee runs and making copies, you’ll be seated at the table making critical decisions that will influence not only your team, but the overall achievement of Tesla’s mission.

Locations
Washington, D.C. or Palo Alto, CA

About The Team

This internship will provide opportunities to work with the North American Public Policy & Business Development team on policy and business development, market analysis, and strategic engagement. The incumbent will have the opportunity to learn and grow, working across the team to support its full range of efforts, with a particular focus on renewable energy and EV charging policy, public utility regulation, and renewable energy market opportunities.

What To Expect

As the Policy and Business Development Intern, you’ll gain experience in the following areas:

Gain breadth and depth of knowledge of regulatory policy issues facing Tesla, with a focus on EV charging, renewable energy generation, storage, permitting and electricity rates regulations.
Analyze policy initiatives for their impacts on Tesla
Support the development of new policy and business initiatives
Collaborate with internal and external stakeholders

Requirements

Currently pursuing a graduate or undergraduate degree in relevant field such as Political Science, Public Policy, International Studies, Economics or Business Administration
Able to make 3-6 month commitment
Capable of working in a fast paced and always changing environment
Capable of working remotely with a high degree of productivity
Self-starting and solutions oriented
A strong team player","https://www.linkedin.com/jobs/view/externalApply/2369696529?url=https%3A%2F%2Fwww%2Etesla%2Ecom%2Fcareers%2Fsearch%2Fjob%2Fpublic-policy-internship-fall-2021-80322%3Fsource%3DLinkedIn&urlHash=o-2l&refId=034a3105-e49d-4e4b-bbc2-1916821ebef8&trackingId=AByXl8G9L9WBwGWxXRSQOg%3D%3D&trk=public_jobs_apply-link-offsite",0.00813038869942853,
35,"Internship: Gender Justice in the HIV response, HIV/AIDS Section, Programme Division, NYHQ - Req # 539504","UNICEF","New York, NY","UNICEF works in some of the world’s toughest places, to reach the world’s most disadvantaged children. To save their lives. To defend their rights. To help them fulfill their potential.

Across 190 countries and territories, we work for every child, everywhere, every day, to build a better world for everyone.

And we never give up.

For every child, hope.

Background

The ‘Education Plus’ initiative is a new, high-profile initiative to accelerate actions and investments to halt and reverse the disproportionate burden due to HIV borne by adolescent girls and young women. It is centered on the empowerment of adolescent girls and young women and the achievement of gender equality in sub-Saharan Africa - with secondary education as the strategic entry point. The initiative is co-led by UNAIDS, UNICEF, UN Women, UNFPA and UNESCO and is focused on driving country-level impact, with champion governments and supported by a wide network of regional bodies and global coalitions and partners.

It responds to the urgent need to effectively address the alarming numbers of adolescent girls and young women acquiring HIV and dying of AIDS, among other threats to their survival, well-being, human rights and fundamental freedoms. It brings added pressure to persuade governments to roll out universal secondary education, free for girls and boys, and scale up multi-sectoral policies, actions and investments that empower adolescent girls and young women.

Education

The ‘Education Plus’ approach is centered on the essential elements of empowerment that every adolescent girl and young woman should be entitled to in their transitions to adulthood
Completion of quality secondary education
Universal access to comprehensive sexuality education
Fulfillment of sexual and reproductive health and rights
Freedom from gender-based and sexual violence
Successful school-to-work transitions and young women’s economic empowerment

UNICEF leads the pillar on engagement and participation of adolescent girls and young women through a Nerve Center consisting of young leaders recruited across East and Southern Africa and West and Central Africa. This pillar will engage young women from recognized global and regional constituencies or movements active in promoting gender justice, girls’ education, sexual and reproductive health and rights, the HIV response, and women’s economic empowerment and human rights.

Purpose of the Internship

The intern recruited to this position will work across key business and technical units in UNICEF HQ, to support the work of the new joint initiative for girls and young women. The intern will support the young engagement pillar of the initiative, including direct support to the work of the core leads of the initiative’s work on young women’s engagement (the nerve center), drawn from and endorsed by the feminist, girl-, ad young women-led networks. This will also include various analytical and knowledge pieces, technical briefs, commitments monitoring, advocacy agendas, knowledge dissemination, and other elements that align with and support the agenda of the initiative.

Main Duties And Tasks

Under the supervision of the Senior Specialist – Adolescents and HIV (HIV/AIDS Section), the intern will
Contribute to the Section’s knowledge management function, including preparation of literature reviews, programmatic toolkits, programming briefs, advocacy pieces, landscape analyses, resource libraries, and technical updates on adolescent-responsive programming;
Engage in efforts to advance incorporation of cutting-edge and novel programmatic tools within country programme and regional portfolios, learning from cutting-edge practice in the field;
Engage in collaborative learning communities to advance the state of the art in programming for the most marginalized and vulnerable populations, specifically adolescents living with HIV, adolescent girls and young women at substantial risk of acquiring HIV, adolescents from the key populations, and pregnant adolescents;
Contribute to high-level technical advocacy and strategy-setting for key and priority populations of adolescents and young people living with and affected by HIV;
Support strategic engagement of adolescent and youth networks within and beyond the global HIV, health, and gender response;
Participate in HQ-based technical assistance and technical exchanges to regional and field offices;
Participate in planning and preparation for various internal and external consultations and convenings;
Any other tasks assigned by the supervisor


Benefits To Intern
This internship will provide hands-on experience in shaping the agenda within an inter-agency context, through meaningful engagement with multi-lateral, academic, civil society, and community-led entities.
The intern will gain insight into the operations and agenda-setting processes within the UN system
Participants will receive mentorship, training and dedicated support to enable their full participation in the substantive work of UNICEF, offered through a variety of modalities (virtual/remote and in-person).

Duration

1 May 2021 – 30 July 2021, with the possibility of an extension of the internship. Max duration is 26 weeks.

Salary/Payment

In accordance to UNICEF’s guidelines, interns will be paid a stipend of US $1,700 per month. There is no expectation of employment at the end of the internship.

Insurance

UNICEF will not be responsible for costs arising from accidents and/or illness incurred during the intern’s service, whether on or off UNICEF premises. Therefore, the selected candidate must provide proof of enrolment in a health/accident plan prior to start the internship with the HIV/AIDS Section.

Living Conditions And Working Environment

The intern will be remote based and work from home. The intern will work with the HIV/AIDS Section and report to the supervisor of this internship. The intern is not expected to travel during the assignment. The intern will be expected to participate in the section’s meetings, as well as other UNICEF meetings of interest to the intern including the seminar series for UNICEF interns. Guidance will be provided on a regular basis.

To qualify as an advocate for every child you will…
Currently enrolled in an undergraduate, graduate, or Ph.D. degree program or have graduated within the past two years.
Applicants must be at least 18 years old
Fluent in at least one UN official language widely used in the sub-Saharan Africa Region – specifically, English, French, and/or Portuguese;
Experience in gender equality at the local/community, national, or regional level;
Experience in HIV and/or sexual and reproductive health and rights (SRHR) programming
Applicants with demonstrable analytical skills will be competitive
Strong writing skills required

For every Child, you demonstrate…

Our core values of Commitment, Diversity and Integrity and core competencies in Communication, Working with People and Drive for Results. To view our competency framework, please click here.

Only shortlisted candidates will be contacted and advance to the next stage of the selection process.

UNICEF is committed to diversity and inclusion within its workforce, and encourages all candidates, irrespective of gender, race, sexual orientation, nationality, culture, appearance, socio-economic status, ability, age, religious and ethnic backgrounds to apply to become a part of the organization.","https://www.linkedin.com/jobs/view/externalApply/2474645383?url=https%3A%2F%2Fsecure%2Edc7%2Epageuppeople%2Ecom%2Fapply%2F671%2Fgateway%2Fdefault%2Easpx%3Fc%3Dapply%26lJobID%3D539504%26lJobSourceTypeID%3D796%26sLanguage%3Den-us&urlHash=53Ra&refId=65f52e84-36e5-4b54-bcb8-209ca5e89f05&trackingId=h1aG90moWQfqLNdifYPsdQ%3D%3D&trk=public_jobs_apply-link-offsite",0.0032876874425418227,
5,"Future Academy Intern","AKQA","New York, NY","At AKQA we believe in the imaginative application of art and science to create beautiful ideas, products, and services. With an entrepreneurial and collaborative approach, we design adaptive digital services and applications that capture the imagination, delivering impressive returns for our clients.

The Future Academy exists to ignite curiosity in everyone. This is an 8-week internship program designed to discover and foster the next generation of creative innovators.

The Future Academy includes a holistic curriculum, which consists of real-world, cutting-edge work experience on global brands, sprints on proactive client briefs, ongoing mentorship, personal and professional development training, knowledge-sharing from AKQA experts, and custom online courses.

Who We Are Looking For

We are looking for new ways of thinking, hunger for learning and passion to grow with us. We believe in the potential of raw curiosity and creativity.

Individuals at AKQA apply artistry and craftsmanship to strategic insights, creative thinking and bring to life beautiful ideas that move the world. We provide a multidisciplinary environment which facilitates an entrepreneurial spirit, fosters skilled storytellers, and consistently delivers results for clients.

We seek to find our core values of Innovation, Service, Quality, and Thought in every candidate.

The Brief

To help us learn more about you, and to help you discover a little more about what’s important to us, we ask prospective Future Academy interns to complete a response to the following questions.

We are open to all forms of application responses (i.e. written, video, audio, collage, whatever method speaks to you). If written, please keep responses to 100 words or less per question; video submissions 5 minutes or less in total; visual files 4 MB or less in total. You can enter your answers on the application page.
Mission and Vision:
AKQA exists to create the future. What is your vision for the future? And what is your role in creating this vision?
Qualities:
Please provide examples of where you have demonstrated the qualities that make for a successful and happy career with us at AKQA. These qualities are Adventurous, Imaginative, Passionate, Leadership, Flexibility, Conscientiousness; please choose two of the six for your response. More on these qualities can be found here.
Cultural Impact:
Please share an example of any creative work (for example but not limited to: digital user experience; AI; machine learning; industrial design; graphic design; architecture; copywriting, fine art, etc.), either contemporary or from another era, that you feel has made a substantial cultural impact and explain why.

Thank you for taking the time to apply. Our recruitment team will be in touch.

AKQA is an Equal Opportunities Employer, we believe that diversity is vital to AKQA’s ability to provide our clients with the best recommendations and are committed to fostering a varied and inclusive work environment. Your race, color, ancestry, religion, gender, gender identity, national origin, sexual orientation, age, marital status, disability or veteran status have no bearing on our hiring decisions. If you have a disability or special need that requires accommodation, please let us know.","https://www.linkedin.com/jobs/view/externalApply/2479958381?url=https%3A%2F%2Fwww%2Eakqa%2Ecom%2Fcareers%2Ffuture-academy-intern-3048770%2F&urlHash=iDY6&refId=034a3105-e49d-4e4b-bbc2-1916821ebef8&trackingId=NKrMNiBdjRtrpLQ73eD62g%3D%3D&trk=public_jobs_apply-link-offsite",0.0061821268204835,
26,"People Intern","Zwift","Long Beach, CA","About The Role And About You

At Zwift we are passionate about People and investing in initiatives that have a positive impact on individual and collective performance. You will be seen as a strategic partner to the business as you build relationships and help improve the capability of our most important resource; our people! If you are motivated to invest in others and find creative solutions to challenging problems then this is the place for you.

We Have The Following People Intern Positions Available
People Operations (Total Rewards)
People Performance & Growth
People DEIBS (Diversity, Equity, Inclusion, Belonging, and Social Impact)


What You’ll Do
You will help drive key People Team initiatives across the company
Collaborate across our People team to align program objectives and improve processes.
Develop data, insights, dashboards, and data visualizations that help optimize program and organizational performance.
Drive engagement through internal communication and marketing


What We’re Looking For
You’ll have strong verbal and written communication skills
You’ll have an ability to think strategically and operationally
You’ll have excellent organizational skills and attention to detail
You’ll challenge conventional thinking through research and analysis.
You’ll collaborate and build strong relationships across teams.


Bonus Points
Experience in video gaming or health & fitness industries
Passion for cycling, running and/or fitness
Experienced Zwifter


How To Stand Out Among The Rest

Your resume/CV is enough to show off your skills, accomplishments, and experience. However, if you choose to include a cover letter introducing us to your awesome personality, we will read that too.

Values

Of course, we are nothing without our values. Our values ground us. They ensure we run and build a company where people love to work, feel like they are welcomed, included, and belong. Only then can they thrive and do their best work. The values we strive to live every day are:
Make It Fun
Elevate Teammates
Cultivate Our Community
Always Level Up
One Zwift for All

We strongly believe that different backgrounds and ideas are a competitive advantage; we hire candidates of any race, color, ancestry, religion, sex, national origin, sexual orientation, gender identity, age, marital or family status, disability, Veteran status, and any other status. Zwift is proud to be an Equal Opportunity Employer. If you have a disability or special need that requires accommodation, please let us know by emailing careers@zwift.com.

Zwift, Inc. is an Equal Opportunity Employer.","https://www.linkedin.com/jobs/view/externalApply/2477284211?url=https%3A%2F%2Fapp%2Egreenhouse%2Eio%2Fembed%2Fjob_app%3Ftoken%3D5165327002%26s%3DLinkedIn%26source%3DLinkedIn&urlHash=LC6D&refId=65f52e84-36e5-4b54-bcb8-209ca5e89f05&trackingId=iVKxY4kyjIghyAzua%2FeVYQ%3D%3D&trk=public_jobs_apply-link-offsite",0.04437722069337266,
