Id,Title,Company,Location,Required Qualifications,Link,Page Rank,
85,"VBP Academy 2021 - Internship","Venables Bell and Partners","Francisco, IN","What We’re Looking For

Truth

We are honest with our clients. With each other. Even when it’s awkward and especially when it’s hard. We are clear. About where we want to go and what it will take to get there. About what we expect from our people and our clients. About what they can expect from us. We are transparent. About where we’re progressing. About our success. And especially about our failures and how we learn from them to do better.

Fire

People who are fearless in pushing limits and trying new things in pursuit of ideas that cut through the noise. We are passionate about creativity, and believe it is our weapon to move brands and businesses forward. Those who are excitable and proactive about solving client’s problems.

Love

We know that putting people first gets better results. We believe that diversity and creativity are inextricably intertwined: the best work, the best culture are co-created by people with diverse skill sets, perspectives and experiences. People who are inclusive, supportive and motivating.

The Academy Class of 2021 will be a 100% remote internship over the course of 9 weeks. We are actively monitoring the COVID-19 pandemic conditions in the Bay Area and throughout the United States. Should an opportunity arise where we can invite you to the office, we would love to meet you in person! That said, the health and safety of our employees comes first. VB+P has been operating remotely for almost a year and our teams are well equipped and eager to welcome you on board remotely.

INTERNSHIP DATES: JUNE 14, 2021 to AUGUST 13, 2021

For You To Do

Client: Local Government

Product: Tap Water

Value Proposition: The healthiest, cleanest and most sustainable water you can drink!

Audience: local households parents 25-45

Answer two questions referring to the above brief from options below:
Create an ad for this client (can be anything from a social post, to TV storyboard, radio script etc)*
What is a new audience this product/service could be relevant to in order to open up a new market to sell it? How would you position this product best? Give us a one liner and an explanation for it.
If you’re making a :30 TV ad for the brand, who would you choose to direct the ad and why? What do you think they could bring to the table? Would you hire a spokesperson? If so, who would you choose and why?
What’s a PR stunt that could get the client/campaign noticed?
Only use a black marker and paper to mock this up- we want to see the idea, not how well you can use photoshop.
Please type in your answers in the next section within the application.

At Venables Bell + Partners, we celebrate and support our differences. We know building a team rich in diverse thoughts, experiences, and opinions allows our employees, our work and our community to flourish. VB+P is an equal opportunity workplace. We are dedicated to equal employment opportunities regardless of race, ancestry, religion, sex, national origin, sexual orientation, age, socio-economic status, citizenship, marital status, disability, gender identity, Veteran status, or any protected class or social identity. We value equity here at VB+P as much as equality.","https://www.linkedin.com/jobs/view/externalApply/2434751204?url=https%3A%2F%2Fjobs%2Elever%2Eco%2Fvenablesbell%2F94fd188d-2b45-45f2-99c4-7c4a50f884f9&urlHash=70WQ&refId=246dc3be-fb59-428a-a0ce-ce15fcdb9f8b&trackingId=1yY2%2FvcsKp8ACY15faX%2FAA%3D%3D&trk=public_jobs_apply-link-offsite",0.004143597903265819,
49,"Intern: People Experience (HR)","Volvo Cars","Mahwah, NJ","Everything we do starts with people.

Our human-centric focus is what makes us different from all other car companies, and it’s at the heart of everything we create. The path you choose today will have a big impact on the future. As an intern, you’ll be immersed in a global organization that currently employs over 40,000 colleagues around the world. If you want to join us in our mission to make people’s lives less complicated, we offer you a chance to grow with talented people who want to make a true difference.

Who are we and what do we do?

People experience is Human Resources rebranded! People are making the difference and are vital to our success; Experience is making everyday life easier for our employees. The goal is to create a higher engagement, while making sure that the everyday lives and future work environments meet our employees’ expectations. Traditionally, the Human Resources department has been a one-size-fits-all suit, but with a new company purpose and updated people strategy the name change is part of the department's ongoing transformation.

The People Experience (PX) Intern will be a key member of the VCUSA HR team based in our headquarters out of Mahwah, NJ. You will have the opportunity to apply your education in a professional setting, while gaining valuable experience and skills in a fast-paced organization. You will support professional, confidential, and high level administrative duties in a variety of functional areas, as well as own a project and present findings at the conclusion of the internship. You will have the opportunity to support the onboarding process, create and send internal communications as well as assist the Recruitment team on operational tasks, projects, and other events or processes as needed.

Are you up for a challenge?

This is a great opportunity to join a career boosting 10-week program designed around your potential. You will have the opportunity to support different tasks and projects which include weekly learning sessions on various areas in the organization, individual career development supported by your manager and other department team members, out-of-the-office activities as well as fun-competitive events supported by the People Experience team.

Do you want to change the world with us?

We are looking for undergraduates who are full of energy, committed to success and eager to make a difference. We’re looking for team members who have the ability to drive results, has strong work ethic, and shows initiative. You need to be organized, agile, and curious to discover opportunities in a constantly changing business environment.

As an intern, you are results-oriented and committed to go the extra mile. We believe you are a great networker, and communicator. You are a team-player with a positive attitude, interested in developing yourself, others, and our business.

In order to be considered for this program, you need to be currently enrolled in a related Undergraduate degree program as a rising, Junior, Senior or anticipate graduating within the calendar year. Program is set to begin early June 2021.","https://www.linkedin.com/jobs/view/externalApply/2499675512?url=https%3A%2F%2Fjobs%2Evolvocars%2Ecom%2Fjob%2FMahwah-Intern-People-Experience-%2528HR%2529-NJ-07430%2F649665901%2F&urlHash=U63S&refId=edae8af6-556e-473a-9135-45171729d366&trackingId=ipNFsqqVK%2F1ZPKq2reTVYg%3D%3D&trk=public_jobs_apply-link-offsite",0.02018062219509885,
4,"Intern, Paid Social","SEPHORA","San Francisco, CA","Job ID: 188479
Location Name: CA-FSC SF Off (0174)
Address: 525 Market St, 32nd Floor, San Francisco, CA 94105, United States (US)
Job Type: Full Time
Position Type (Regular/Temporary): Intern/Trainee
Job Function: Internship

Position: Intern - Marketing, Paid Social

Location: Remote

Rate of Pay: $22/HR

Start Dates: May 24th or June 7th (10 week program)

Requirement: Rising Senior (graduating Spring/Summer 2022)

At Sephora, we offer a wide range of internship opportunities across our business. As part of our Emerging Talent Program, our internships focus on providing an inclusive and comprehensive experience that equips young professionals with the tools needed in order to align their passions with their work.

2021 Summer interns will be eligible to apply for a fulltime position in our newly created Rotational Management Program launching mid-2022 designed to support a diverse talent pipeline and build our future inclusive leaders. Applicants will be offered a role in one of the three participating functions of Marketing, Merchandising, Inventory Management and work in each of these areas learning our core business processes and store operations. More information on the Program experience and application process will be available later this year.

Your Role At Sephora

As an Intern, you will assist the Paid Social team in the management and optimization of Sephora’s Paid Social marketing program. The role is responsible for managing Paid Social operations that help support the activation and quality of the business. In addition, you will:
Manage Creative handoffs and QA
Get exposure to cross-functional teams. Sephora has a highly collaborative culture so you are encouraged and expected to work closely with other related teams across Media (Search, Display, Brand, Testing)
Support monthly billing process
Perform the facilitation of reporting requests and related engagements with Agency partners.
Research the latest beauty, skincare and wellness trends to inform content strategy
Assist in general reporting and technical audits
Develop, grow, and have fun!
Demonstrate our Sephora values of Passion for Client Service, Innovation, Expertise, Balance, Respect for All, Teamwork, and Initiative.
Lead or assist on projects using a hands-on approach
Learn from the best in the industry by interacting with a dynamic team of digital marketing professionals and understand the role of Paid Social for Sephora by working with best in class media experts
Develop a solid understanding of Digital Marketing and Media

We’re Excited About You If You Have
Have an interest in learning how to be a more inclusive leader and ally.
Demonstrated leadership skills as evidenced by involvement in organizations, community involvement, sports, and other activities.
Currently working on completion of Bachelor’s degree in related field in Business, Analytics, Marketing, or Communications and is currently a junior or senior in credit hours
Data-driven mindset with the ability to gather insights and draw conclusions
Excellent written and verbal communication skills
Ability to work well in a fast-paced team environment
Innate sense of intellectual curiosity that drives you to be constantly learning
Taking initiative in problem solving and out of the box thinking
Adaptable to a variety of tasks and projects
Positive attitude - eager to get involved in projects

You’ll Love Working Here Because
The manifesto. Sephora believes in championing all beauty, living with courage, and standing fearlessly together to celebrate our differences. We will never stop building a community where diversity is expected, self-expression is honored, all are welcomed, and you are included. We belong to something beautiful.
The people. You will be surrounded by some of the most talented, supportive, smart, and kind leaders and teams - people you can be proud to work with.
The product. Employees enjoy a product discount and receive free product (“gratis”) various times throughout the year. (Think your friends and family love you now? Just wait until you work at Sephora!)
The business. It feels good to win - and Sephora is a leader in the retail industry, defining experiential retail with a digital focus and creating the most loved beauty community in the world…with the awards and accolades to back it up.
The perks. Sephora offers comprehensive medical benefits, generous vacation/holiday time off, commuter benefits, and “Summer Fridays” (half-days every Friday between Memorial and Labor Day)…and so much more.
The LVMH family. Sephora’s parent company, LVMH, is one of the largest luxury groups in the world, providing support to over 70 brands such as Louis Vuitton, Celine, Marc Jacobs, and Dior.

Working at Sephora’s Field Support Center (FSC)

Our North American operations are based in the heart of San Francisco’s Financial District, but you won’t hear us call it a headquarters - it’s the Field Support Center (FSC). At the FSC, we support our stores in providing the best possible experience for every client. Dedicated teams cater to our client’s every need by creating covetable assortments, curated content, compelling storytelling, smart strategy, skillful analysis, expert training, and more. It takes a lot of curious and confident individuals, disrupting the status quo and taking chances. The pace is fast, the fun is furious, and the passion is real. We never rest on our laurels. Our motto? If it’s not broken, fix it.

Sephora is an equal opportunity employer and values diversity at our company. We do not discriminate on the basis of race, religion, color, national origin, ancestry, citizenship, gender, gender identity, sexual orientation, age, marital status, military/veteran status, or disability status. Sephora is committed to working with and providing reasonable accommodation to applicants with physical and mental disabilities.

Sephora will consider for employment all qualified applicants with criminal histories in a manner consistent with applicable law.

Company Overview

SEPHORA has been changing the face of prestige cosmetics since its debut in 1970s Paris. Sephora was acquired by luxury group Moët Hennessy Louis Vuitton (LVMH) in 1997 then launched stateside in 1998, and is currently home to 200 world-class brands - including its own private label, SEPHORA COLLECTION. Sephora's curated assortment features more than 14,000 products including makeup, skin care, perfume, hair care, body, professional tools and more. Sephora is the beauty education hub, offering consultations at the Beauty Studio, a variety of complimentary classes, one-on-one service from Personal Beauty Advisors, and exclusive retail technology SKINCARE IQ, COLOR IQ, and FRAGRANCE IQ. Sephora is an international force in beauty, and its award-winning website and ever-growing presence on social-media make it the world's premier digital beauty destination.","https://www.linkedin.com/jobs/view/externalApply/2479948140?url=https%3A%2F%2Fjobs%2Esephora%2Ecom%2FUSA%2Fjob%2FSan-Francisco-Intern%252C-Paid-Social-CA-94105%2F712773600%2F%3FfeedId%3D178800%26utm_source%3DLinkedInJobPostings%26utm_campaign%3Dsephora_media&urlHash=WWXc&refId=034a3105-e49d-4e4b-bbc2-1916821ebef8&trackingId=eJKlAhFaMryhPn3cLo9CEA%3D%3D&trk=public_jobs_apply-link-offsite",0.003704699622286243,
77,"Fall 2021 Heritage Internship","The Heritage Foundation","Washington, DC","The Heritage Foundation's Fall 2021 Intern Program begins Monday, September 7 through Friday, December 3. Your health and safety are our priority. Depending upon COVID-19 meeting restrictions, the internship may be offered virtually or in person at The Heritage Foundation’s building in Washington, D.C. Either way, approximately 60 interns will be selected to serve. Interns may work part-time (a minimum of 22.5 hours per week), to be determined on a case-by-case basis. Fall applicants must be at least a rising junior to qualify. Recent college graduates, master's students, and law students are also encouraged to apply. International students who are authorized to be employed in the United States are eligible for a Heritage internship.

To Apply For An Internship At The Heritage Foundation
Email an official transcript directly from your university and two letters of recommendation sent from your college professors or employers to the following address:
internships@heritage.org

Transcripts or Letters of Recommendations can also be sent electronically directly to: internships@heritage.org .
Online applications and materials must be submitted by July 1, 2021.","https://www.linkedin.com/jobs/view/externalApply/2438837844?url=https%3A%2F%2Fheritageinternship%2Eapplicantstack%2Ecom%2Fx%2Fdetail%2Fa28p2ezen6ds%2Faa1b%3Fnoia%3D1&urlHash=DgPz&refId=246dc3be-fb59-428a-a0ce-ce15fcdb9f8b&trackingId=dIK7y3akAs78zUcL9Cfk4g%3D%3D&trk=public_jobs_apply-link-offsite",0.004944554431416225,
58,"Intern/ Rights & Liberties Program","Sunwater Institute","Rockville, MD","THE SUNWATER INSTITUTE
The Sunwater Institute is a nonprofit, nonpartisan public policy organization established to create, discuss, and implement fundamental ideas that advance liberty, knowledge, and power for individuals and society. The Sunwater Institute’s interdisciplinary, long-term orientation and focus on the building blocks of social systems sets it apart as haven for bold, fresh ideas and free, constructive dialogue.
 POSITION
The Institute is seeking Interns to contribute to its new program on rights and liberties. Obviously this moment is a period in which there is a great deal of debate about human rights, constitutional rights, and related ideas about rights and liberties, so this is a most exciting time to be engaged in such research. This internship offers a chance to learn more about rights and liberties, to engage in original research, and to potentially publish that research.
 This internship is an unpaid position. Applicants must be willing to work a minimum of 20 hours per week, with at least half of those hours during standard business hours on-site at the Sunwater Institute in N. Bethesda. MD. The Sunwater Institute is on the Red Line, about a 10 minute walk, or a short bus ride, from Twinbrook Metro. Students will typically be hired on the standard academic semester calendar, so some flexibility in hours will be allowed around exams and other periods of high academic demand on the intern’s time.
 RESPONSIBILITIES
 Interns will engage in research concerning rights and liberties. For any given right that is studied, we seek to understand a number of more granular questions, such as:
Differing approaches to the right in different cultures or political regimes
The ideas or events that led to the right being considered a right
Conceptions of the role of the right in the wider state and society
Conceptions of potential limitations of the right
Policy recommendations concerning the right
 Under guidance of full-time staff at the Institute, interns will engage in research that will allow for better understanding of rights and liberties, along the lines indicated above.

REQUIREMENTS
Current enrollment in a college program, recent college graduate, or admission to a graduate program
Strong academic foundation in economics, politics, philosophy, history, or a related field
Expected to work remotely and transition to working onsite after a month

How to Apply – submit an application package including:
Cover letter: Your cover letter should explain your interest in rights and liberties, and your academic experiences that would inform your research at Sunwater
Resume or CV
Writing sample: Please submit a paper you have written for an academic course. It need not be about rights and liberties, but it should be work which shows your writing skills
Names and contact information for two academic or professional references","https://www.linkedin.com/jobs/view/externalApply/2468657777?url=https%3A%2F%2Fwww%2Eapplytracking%2Ecom%2Fx%2Easpx%3Fmethod%3Ddirect%26type%3Dapply%26board%3DD92FCD45-1292-4AE2-B555-D7A273418B42%26Job%3DJREQ140105%26ClientCode%3D12585%26src%3DJB-13260&urlHash=vXpo&refId=922a997f-ba79-4752-84c1-6b4d66c5c0dd&trackingId=HBgvuBbzcvhQVE8HFXbFwA%3D%3D&trk=public_jobs_apply-link-offsite",0.004089287060030811,
23,"Intern, Social Impact (Summer 2021)","Panasonic North America","Newark, NJ","Panasonic – Intern, Social Impact

Every moment of every day, people all over the world turn to Panasonic to make their lives simpler, more enjoyable, more productive and more secure. Since our founding almost a century ago, we’ve been committed to improving peoples’ lives and making the world a better place–one customer, one business, one innovative leap at a time. Come join our journey.

Click here to learn more about how Panasonic is creating a better life, a better world.

Watch this video to see how our employees are shaping the technologies that move us.

What You Will Get To Do

This position is responsible for supporting the day-to-day activities of the Office of Social Impact & Inclusion (OSII) at Panasonic Corporation of North America. You will join an exciting team that is building out Panasonic’s social impact strategy across its North American business footprint.

Research And Data
Perform research and analysis on corporate social responsibility best practices as it relates to employee volunteerism, social impact, and philanthropic initiatives.
Design reporting mechanism for business units across company to gather group-wide social impact activities
Develop plan to introduce new Panasonic employees to the firm’s CSR efforts and strategy
Prepare research briefs on special projects, evaluation tools, and other areas of interest, as needed
Manage data bases and run analysis on key metrics for quarterly reports

Programmatic
Assist in implementing employee volunteer programs/events.
Attend volunteer events and support set up and execution, as needed.

Administrative
Prepare correspondence to external partners regarding their grant/sponsorship applications
Prepare for staff meetings with internal/external stakeholders including taking meeting notes
Maintain product inventory for contributions to strategic partners
Perform other administrative tasks, as needed

Communications
Work closely with communications lead to develop and disseminate employee volunteerism and CSR impact content through multiple channels
Design and update flyers and marketing materials for various events, as needed

What You’ll Bring

Education & Experience:
Must be enrolled in an undergraduate/graduate degree program with a minimum of 1-2 year of college completed
Strong analytical skills with fluency in Excel. Experience manipulating and analyzing data.
Previous experience working in a professional office setting
Fluent in PowerPoint and Word applications. Graphic and presentation skills, including Photoshop and/or Canva, a plus

Competencies
Self-starter, willing to take initiative
Ability to complete assigned projects in a timely fashion
Teamwork support mindset
Eager to learn and ask questions

Communications
Maintains confidentiality of sensitive individual and company data without exception.
Excellent written and oral communication skills are required
Ability to interact with senior leaders at Panasonic and external partners

Other Requirements
Full time during the summer and a minimum of 3 days/week, 15-20 hours per week during academic year.
Start June 2021.
Preferably a year-long commitment

Panasonic is proud to be an Equal Opportunity/Affirmative Action employer. All qualified applicants will receive consideration for employment without regard to race, color, religion, gender identity, sex, sexual orientation, national origin, disability status, protected veteran status, and any other characteristic protected by law or company policy. All qualified individuals are required to perform the essential functions of the job with or without reasonable accommodation. Pre-employment drug testing is required for safety sensitive positions or as may otherwise be required by contract or law. Due to the high volume of responses, we will only be able to respond to candidates of interest. All candidates must have valid authorization to work in the U.S. Thank you for your interest in Panasonic Corporation of North America.

#LJC1","https://www.linkedin.com/jobs/view/externalApply/2483104195?url=http%3A%2F%2Fapp%2Ejobvite%2Ecom%2FCompanyJobs%2FCareers%2Easpx%3Fc%3DqvJaVfw3%26j%3DoIVPefwq%26k%3DApply%26su%3DfqqaVfwF%26s%3DLinkedIn&urlHash=eKXh&refId=65f52e84-36e5-4b54-bcb8-209ca5e89f05&trackingId=HLo%2FcFDDXb9wGTHK8KO%2Bqw%3D%3D&trk=public_jobs_apply-link-offsite",0.015133899562180796,
