Id,Title,Company,Location,Required Qualifications,Link,Page Rank,
0,"Corporate Real Estate Intern","Thermo Fisher Scientific","Waltham, MA","Job Title

Corporate Real Estate Intern

When you’re part of the team at Thermo Fisher Scientific, you’ll do important work. You’ll have the opportunity to grow and learn in a culture that empowers your development. We have created an inclusive, global environment that values the power of diverse talent, backgrounds, and experiences to drive speed, productivity, innovation, and growth.

Our internship program will give you a chance to get real world business experience and build your network before graduation. We are seeking an energetic, responsible intern to join our growing organization. In this position, you will be expected to learn the ins-and-outs of our daily routines and procedures. You will focus on learning how our organization runs, and can be expected to gain valuable insight that can further your interest in your chosen career field.

Thermo Fisher Scientific Inc. (NYSE: TMO) is the world leader in serving science. With revenues of $25 billion and the largest investment in R&D in the industry, we give our 80,000 employees the resources and opportunities to make significant contributions to the world. The customers we serve fall within pharmaceutical and biotech companies, hospitals and clinical diagnostic labs, universities, research institutions and government agencies. Our products and services help accelerate the pace of scientific discovery, and solve challenges ranging from complex research to routine testing to field applications.

Summary Of Internship

The Corporate Real Estate Internship position provides an opportunity for students who are currently pursuing a management, real estate, facilities, construction, or architectural related degree to get hands on experience working with professionals in a fast-paced environment. They will be a part of the global corporate real estate team that supports over 31 million square feet of space in over 50 countries. They should have an analytical background with some experience in real estate and a passion for continuous improvement and excellence. The intern should be creative with an attention to detail and the desire to manage and design space delivering the best employee and visitor experience, while supporting the company’s businesses in a fiscally responsible manner to ensure we’re maximizing shareholder value. The position starts in June, paid working 40 hours per week through August.

Essential Functions
Will work closely with the Director of Global Real Estate and the team on projects involving Thermo Fisher properties
Will be mentored by Real Estate Manager, Director of PMO (Project Management Office), Senior Office Services and other functional personnel to help develop the intern's skill set
Will have exposure to project management process for real estate including becoming familiar with the various technology platforms the group currently uses to support the portfolio and their facilities
Will participate in various quarterly reviews with the company’s divisional leadership teams and corporate functions such as IT, Security, Risk Management and other adjacent groups
Will help to review department’s reporting tools including the quarterly real estate report; the intern will be expected to evaluate and recommend ways to enhance these reports to provide better data analytics to the company
Will participate in developing KPIs and other ways to manage, evaluate and improve third party vendors such as facilities service providers, and CRE partners such as brokerage and project managers
Support an ongoing initiative to publish an updated corporate real estate playbook to document standards and processes as well as reviewing the company’s new Global Flexible Workplace Strategy and other ways to help drive improved productivity and space optimization
Participate in the team’s annual real estate meeting with exposure to the global team in Mid-June
Assist the facilities team with the day to day operation of the company’s global headquarters and become familiar with daily tasks to help review and make recommendations on ways we can improve the service delivery and overall efficiency of the team
Specific tasks will be tailored to the intern’s experience level and abilities
Accept candid feedback and look for areas of opportunity for continuous improvement and improved productivity

Skills And Abilities
Ability to work independently and as a member of a cross-functional team
Willingness to learn, be mentored, and improve their aptitude in global real estate
Desire to contribute and improve new and existing real estate processes
Exceptional customer focus – we strive to exceed expectations
Desire to teach members of the team about technology, trends and in other areas of expertise that can help improve the team’s ability to deliver best in class real estate solutions
Desire to contribute and improve new and existing real estate processes

Qualifications
Student currently enrolled in classes leading to a degree in a related field
Familiar with real estate, preferably commercial properties, construction or design

At Thermo Fisher Scientific, each one of our 80,000 extraordinary minds has a unique story to tell. Join us and contribute to our singular mission—enabling our customers to make the world healthier, cleaner and safer. Apply today!

Thermo Fisher Scientific is an EEO/Affirmative Action Employer and does not discriminate on the basis of race, color, religion, sex, sexual orientation, gender identity, national origin, protected veteran status, disability or any other legally protected status.","https://www.linkedin.com/jobs/view/externalApply/2495376449?url=https%3A%2F%2Fthermofisher%2Econtacthr%2Ecom%2F81988878%3FrefId%3D34jd24&urlHash=fprA&refId=7582830c-f642-42c0-9c06-888cf3a5301d&trackingId=aY1wkwMWYwSiuJmL%2FrV2Aw%3D%3D&trk=public_jobs_apply-link-offsite",0.0195007263524204,
1,"Real Estate Development Intern","Carmel Partners","New York, NY","Carmel Partners is a well-capitalized private real estate firm with expertise in the investment and development of multi-family real estate. Our mission is to build and enhance high quality communities using innovative ideas and solutions that create value for our investors, residents and associates. 

The Development Intern will be responsible for supporting the Development and structured finance teams in providing financial modeling, deal underwriting and analysis, market research, transaction due diligence, and approval memoranda for development and acquisitions. This position offers an excellent opportunity to learn and experience the real estate development business. 

Who you are

You’re productive in collaborative team settings as well as on your own, and either way you deliver quality work. You’re a pro at communicating on and off the page, and understand the importance of building great relationships. You keep a cool head while managing multiple projects in a fast-paced environment. Above all, you always demonstrate impeccable judgement and integrity.

What you’ll do:

Conducts long term market research, and rent studies
Performs financial analysis
Assists with due diligence
Writes memoranda
Produces reports, including cash flow projections, excel modeling, and associated sensitivity analyses
Prepare development pro forma and perform financial feasibility and sensitivity analysis
Works closely with NY Development team members
Attend meetings with architects, sellers, brokers, site visits, etc.
Create and maintain routine and ad hoc reporting
Assist with closings
What you’ll bring

Currently pursuing an undergraduate or graduate degree in Architecture, Real Estate, Finance, Computer Science, or Business with a strong record of academic achievement
Familiarity with ESRI
General understanding of real estate and development industry
Strong Excel skills and financial modeling experience
General understanding of financial statement.
Excellent written communication skills
Key Program Components:

Internships last 8 - 12 weeks
Candidates must be authorized to work in the United States
Carmel Partners will not sponsor visas for this position
This is a paid internship program. Compensation is based on company guidelines. No additional benefits are offered with this position 
Carmel Partners, Inc. is an equal opportunity employer and affords equal opportunity to all applicants for all positions without regard to race, color, religion, gender (including pregnancy), national origin, age, disability, veteran status, sexual orientation, or any other status protected under local, state, or federal laws.","https://www.linkedin.com/jobs/view/externalApply/2466468044?url=https%3A%2F%2Frecruiting%2Eultipro%2Ecom%2FCAR1041%2FJobBoard%2Ff19a3aa9-abdb-1b6d-46ec-d3e4716019ec%2FOpportunity%2FOpportunityDetail%3FopportunityId%3Da4f54347-1f09-475d-a027-9dd832df8c81%26utm_source%3DLINKEDIN&urlHash=6is3&refId=7582830c-f642-42c0-9c06-888cf3a5301d&trackingId=XLdWA1HP4wXocs2mypeiIQ%3D%3D&trk=public_jobs_apply-link-offsite",0.04275538788890028,
19,"University Intern, Ankura Real Estate Advisory Services","Ankura","Houston, TX","Ankura is a team of excellence founded on innovation and growth.

This position supports the Ankura Turnaround & Restructuring Business Group - one of seven practices focused on client delivery services across the Firm.

Position Summary: Ankura has an immediate opening for an Intern within our Ankura Real Estate Advisory Services (AREA) team. The Intern will provide support for AREA projects and professionals located across the United States. The intern will assist in each of AREA’s four key disciplines – Turnaround and Restructuring; Advisory; Valuation and Litigation Support and Expert Witness Testimony; along with working with our industry leading Hospitality and Leisure Group.

Essential Duties & Responsibilities
Working on active engagements including Creditor Restructuring, Asset Management, Company Restructuring Advisory and Interim Management
Assisting in gathering market research for the most comprehensive and accurate data for support
Understanding the standard appraisal methods and steps
Assist management in the appraisal management process for clients such as major banks, pension funds, and insurance companies
Assisting in gathering and drafting communication to third-party appraisers and clients discussing quarterly valuation reviews
Tracking changes between valuations from quarter to quarter
Providing assistance in researching and understanding inconsistencies and discrepancies in appraisal reports.
Understanding key fundamentals of the real estate industry
Verifying and confirming accuracy of key data points which supply industry leading proprietary database
Communicating with clients to successfully perform appraisal management and review work
Analyzing and reviewing ARGUS Enterprise models for accuracy and reasonableness
Assisting clients in real estate portfolios and business enterprises to achieve their short, medium, and long term goals, and generate sustainable bottom line results
Assisting in providing customized solutions with the optimal combination of debt and equity, private placements, strategic partnerships, privatization, public private partnership financing, securitizations, incentives, and structured finance to our clients;
Actively working with our Hospitality and Leisure Group

Basic Qualifications, Skills, And Characteristics
Ability to work in a team environment as well as work autonomously to accomplish complicated tasks with limited supervision
Resourcefulness and ability to take initiative, including self-motivation
Willingness to support teammates in tackling the group’s workload
High attention to detail
Strong written and oral communication skills
Ability to multi-task and prioritize projects and portfolios; strong time-management skills
Ability to represent the organization and team by projecting a positive and professional image at all times
High level of intellectual curiosity
Ability to work effectively and efficiently
Dedication to the growth of the company and the desire to provide credible, reliable data to our clients on a consistent and timely basis
Ankura is proud to be an equal opportunity employer committed to fostering a diverse and inclusive environment where mutual respect and collaboration is paramount. All qualified applicants will receive consideration for employment without regard to age, race, color, religion, sex, sexual orientation, gender identity and expression, disability, protected veteran status, national origin, or any other legally protected status.","https://www.linkedin.com/jobs/view/externalApply/2478071821?url=https%3A%2F%2Fankura%2Ewd5%2Emyworkdayjobs%2Ecom%2Fen-US%2FAnkura%2Fjob%2FHouston-TX%2FUniversity-Intern--Ankura-Real-Estate-Advisory-Services_R101421&urlHash=dCy3&refId=7582830c-f642-42c0-9c06-888cf3a5301d&trackingId=inq7LcbZ0Id3sCDjom16%2BA%3D%3D&trk=public_jobs_apply-link-offsite",0.025421617073011146,
5,"Summer Real Estate Intern","Wedgewood LLC","Redondo Beach, CA","What began as a very small team more than three decades ago has grown into a nationally recognized leader in the real estate investment industry, and Wedgewood is ready for our next class of interns who share our drive to innovate, take risks, and grow. If you’re looking for a company that empowers their team and a chance to learn more than just data entry, you’ve found it. Our summer interns will specialize in their preferred fields, gaining hands-on real-world experience. You won’t just learn about Real Estate - you’ll learn about investment strategy, acquisitions, real estate brokerage, design and flips, asset management, and more, all in a competitive and fun environment.

Up for the challenge? We are looking for well-rounded, hardworking students who are eager to learn alongside successful professionals in a fast-paced team setting. Our program is designed so that you can gain a meaningful, consolidated and in-depth view of our business, giving you the tools you need to succeed long-term. 40% of our interns in the past received full-time offers - will you be next?

What You’ll Do
Assist our real estate brokerage team- Maxim Properties on regular projects
Work collaboratively with other departments on special intern projects
Perform additional duties as needed, including data entry, filing, and maintaining organizational systems

What You’ll Need
Junior or Senior class standing at your University or College
Coursework experience in Real Estate
Strong communication, organization, and time management skills
The ability to work collaboratively
Drive to learn, and willingness to take on challenges

What's In It For You
Direct exposure to high profile, successful entrepreneurs
Insight into the real estate industry and Wedgewood’s multiple lines of business including:
Acquisition & Rehab
Real Estate Brokerage: Asset Sales
Asset Management
Accounting & Finance
Private Money Lending
Legal
IT
The potential for full-time employment after graduation
If you are hired as a full-time employee after your internship, you will enjoy the subsequent benefits and perks.","https://www.linkedin.com/jobs/view/externalApply/2484932533?url=https%3A%2F%2Fapp%2Ejobvite%2Ecom%2FCompanyJobs%2FCareers%2Easpx%3Fk%3DApply%26j%3DoC76efwN%26s%3DLinkedInLimited&urlHash=WsxF&refId=7582830c-f642-42c0-9c06-888cf3a5301d&trackingId=h21VzMihR6YUsems%2BxLVKQ%3D%3D&trk=public_jobs_apply-link-offsite",0.06065386189230035,
26,"Summer Intern, Property Operations - Asset Management","New York City Economic Development Corporation","New York, NY (+1 other)","Our Vision : To make New York City the global model for inclusive innovation and economic growth, fueled by the City’s diverse people and businesses. Our Mission : To create shared prosperity across New York City’s five boroughs by strengthening neighborhoods and growing good jobs. Want to be part of an organization changing NYC? Do you see yourself giving back to a community? Want to help change the NYC skyline? Want to create jobs and strengthen neighborhoods? Asset Management makes it happen. NYCEDC’s Asset Management (AM) Division manages the overall strategy for conventional and non-traditional assets across all five boroughs of New York City including commercial real estate properties as well as transportation, critical infrastructure, and energy assets. The Asset Management division pursues a double-bottom line strategy, targeting not just economic returns but also multiple social metrics including but not limited to job creation and growing equitable neighborhoods. The overall assets are divided into multiple portfolios, each managed by a Portfolio Manager/SVP, with a Portfolio Surveillance group that monitors and enforces standards and practices across the portfolio. The division-wide portfolio encompasses all property types including those that are standard in the real estate industry (Retail, Mixed-Use/Commercial, Industrial, etc.) with individual Portfolio Managers also managing assets particular to public sector and public/private partnerships (Transportation assets including Ferry, Cruise, Freight/Rail, and Aviation, Retail and Market assets, Cultural, Industrial and Commercial assets). In fiscal year 2018, the department actively managed over 220 properties and over 64 million square feet at a 94% occupancy rate, generating more than $240 million in revenue. Your Internship: Spend 12 weeks interning with NYCEDC and learn about asset management, double-bottom line financing, and value capture. You’ll have leadership engagements, tour EDC assets, attend company events and more. Asset Management interns are integrated into teams and will do real, hands-on work. At NYCEDC, you will help with advancing large scale catalytic developments, drive comprehensive neighborhood planning, maintain quality jobs today and grow innovative jobs for tomorrow. Summer internships are typically full-time (Mon-Fri, 9am-5pm). All internships are paid. Responsibilities may include: Work on active development projects in the industrial sector Oversee tenant communications and respond to tenant requests Assist project managers in overseeing property requests and working with field team to respond accordingly. Oversee and build a robust inspection tracking sheet for all of our 65+ properties Oversee and maintain our tracking sheet to highlight in office cost savings at our properties Prepare proposal packages and oversee invoices to ensure billing is correct Attend and assist at property events, oversee set up for internal departments and act as the point of contact on site. Respond to requests for site access, walkthroughs and informational sessions. Work with building managers on overseeing building systems, creating tracking systems to monitor state of good repair Track requests for the NYC Ferry system and assist the Project Manager in responding to requests from internal and external stakeholders. Assist in preparing the annual property budget and long-term capital investment plans. Conduct random visits to tenants in order to maintain customer satisfaction. Monitor all tenant improvements ensuring compliance with building codes and insurance regulations. Respond to all tenant emergencies. Provide immediate action to alleviate problems. Interact with all tenants at various levels. Qualifications: Eligible applicants include any graduate student currently enrolled in an urban planning, city planning, economic development, urban studies, real estate development, business, transportation, logistics, or related program A GPA of 3.0 or higher Impressive academic and extracurricular qualifications, consistently strong performance, and a passion for innovation and success An ability to work and communicate well in a fast paced environment while interacting with a wide variety of people Teamwork and problem-solving skills A willingness to accept responsibility, ask tough questions, and solve problems Passion for public service and New York City Bachelor’s Degree in Facilities Management, Architecture, Engineering, Business or equivalent 1-3 years' experience in building, and/or maintenance management Experience overseeing multiple properties and projects with competing priorities Strong interpersonal skills Ability to work with maintenance and janitorial staff Experience in project management and easily able to communicate with contractors for project updates Capable user of computers and such programs as Microsoft Word, Excel, Outlook, Access, and PowerPoint Strong written and oral communication skills Ability to work with diverse staff, while providing solutions to team members, tenants and self Ability to work in a team environment and to work on individual projects with minimal oversight","https://paralleldesk.com/amp/summer-intern-property-operations-asset-management?utm_campaign=google_jobs_apply&utm_source=google_jobs_apply&utm_medium=organic",0.01305766492776365,
6,"Summer Real Estate Intern","Advanced Air, LLC","Redondo Beach, CA","What began as a very small team more than three decades ago has grown into a nationally recognized leader in the real estate investment industry, and Wedgewood is ready for our next class of interns who share our drive to innovate, take risks, and grow. If you’re looking for a company that empowers their team and a chance to learn more than just data entry, you’ve found it. Our summer interns will specialize in their preferred fields, gaining hands-on real-world experience. You won’t just learn about Real Estate – you’ll learn about investment strategy, acquisitions, real estate brokerage, design and flips, asset management, and more, all in a competitive and fun environment.

Up for the challenge? We are looking for well-rounded, hardworking students who are eager to learn alongside successful professionals in a fast-paced team setting. Our program is designed so that you can gain a meaningful, consolidated and in-depth view of our business, giving you the tools you need to succeed long-term. 40% of our interns in the past received full-time offers – will you be next?

What You’ll Do
Assist our real estate brokerage team- Maxim Properties on regular projects
Work collaboratively with other departments on special intern projects
Perform additional duties as needed, including data entry, filing, and maintaining organizational systems

What You’ll Need
Junior or Senior class standing at your University or College
Coursework experience in Real Estate
Strong communication, organization, and time management skills
The ability to work collaboratively
Drive to learn, and willingness to take on challenges

What's In It For You
Direct exposure to high profile, successful entrepreneurs
Insight into the real estate industry and Wedgewood’s multiple lines of business including:
Acquisition & Rehab
Real Estate Brokerage: Asset Sales
Asset Management
Accounting & Finance
Private Money Lending
Legal
IT
The potential for full-time employment after graduation
If you are hired as a full-time employee after your internship, you will enjoy the subsequent benefits and perks.

SDL2019-128","https://www.linkedin.com/jobs/view/externalApply/2485916364?url=https%3A%2F%2Fwww%2Estartwire%2Ecom%2Fjobs%2Fredondo-beach-ca%2Fsummer-real-estate-intern-2760213221%3Fcampaign%3D129%26source%3DLI&urlHash=aTu7&refId=7582830c-f642-42c0-9c06-888cf3a5301d&trackingId=4yz8AzUFmMP14v42x2hKxw%3D%3D&trk=public_jobs_apply-link-offsite",0.07783912252990456,
