Id,Title,Company,Location,Required Qualifications,Link,Page Rank,
25,"Property Operations Summer Intern","Avalonbay Communities Incorporated","Lexington, MA","Job Information

AvalonBay Communities Property Operations Summer Internship in Lexington, Massachusetts

Job Type: Non Exempt

State: :MA City: Lexington

Brand: Avalon

Overview

AvalonBay is proud to be named one of Glassdoor's Best Places to Work in 2019.

Creating a better way to liveis the purpose that binds AvalonBay associates. At AvalonBay, every day you can make a difference in someone's life. We take that purpose seriously and expect you will as well. From helping someone choose one of our communities as their home to providing great service throughout a resident's stay to supporting your fellow associates, your positive, professional and consistent personal interactions make AvalonBay a great place to work. Our purpose and our core values - A Commitment to Integrity , A Spirit of Caring , and A Focus on Continuous Improvement - set us apart.

So if you're looking for a rewarding career opportunity with the top property management organization in the country, we'd like to hear from you!

At AvalonBay, you will have access to outstanding training and career advancement opportunities. We also offer a competitive benefits package, including rental discounts at our communities.

The Role

As Property Operations Summer Intern you will gain valuable hands-on experience in the the residential property management industry. Responsibilities will include welcoming current and prospective residents to the community, facilitating the move-in/move-out process, assisting with coordination of resident events, administrative duties and special projects. If you're interested in learning about the property management industry from a sales and customer service perspective, this may be the perfect internship for you!

This is an internship program from late May until mid August.

You Have...

Qualified candidates will have at least 1 year of sales or customer service experience in a retail, hospitality, or multi-family environment, and Microsoft Office skills.

Additional Info

AvalonBay is proud to be an equal opportunity employer and is committed to an inclusive and diverse work environment free of discrimination and harassment. We believe that in order to achieve our purpose of creating a better way to live, we must recruit, develop and retain associates with a wide range of backgrounds, experiences and perspectives and create an environment that encourages all voices to be heard, understood and appreciated. With this we know we can do great things.

AvalonBay will consider for employment qualified applicants with criminal histories in a manner consistent with requirements under the law","https://www.internships.com/posting/bug_38959987204?context=merch&utm_campaign=google_jobs_apply&utm_source=google_jobs_apply&utm_medium=organic",0.03339488207725061,
10,"Houston Real Estate / Acquisitions Intern","Xite Realty","Austin, TX","Xite Realty, LLC is a Texas-based commercial real estate company focused on representing the needs of Healthcare professionals and organizations. Our growing, entrepreneurial firm seeks an intern for our Houston, TX office whose role will be to assist brokers in the day-to-day operations of the company.

Responsibilities
To provide administrative support as required for Houston and Austin teams
Run and manage our market area demographics using ESRI
Update our internal property map with brochure links
Handle communication of clients and others in an effective manner (i.e. gathering of building information for market studies)
Prepare (type, revise, add graphics, etc.) market studies
Assist brokers in the preparation of real estate documents such as letters of intent, market studies (in google maps), contracts, etc.
Organize and coordinate client/visitor/property tours
Assist brokers in preparation for meetings (i.e. set up the conference room with any materials needed & set up virtual meetings
Prepare (type, revise, add graphics, etc.) marketing materials
Provide database management (adding, updating, deleting, quality control) incorporating client-specific information into a CRM to manage clients and lead distribution


Requirements
Proficiency in Microsoft Word, Excel & Outlook, PowerPoint, ESRI, SalesForce, Costar, and Loopnet is a plus
Experience as an administrative assistant and/or in commercial real estate is a plus
Possess good organization, communication and follow-up skills
Be tactful and diplomatic through accurate verbal, written, and interpersonal skills
Be mature, reliable, dependable and professional
Be detail-oriented and possess critical thinking skills
Ability to work independently yet also thrive working as a team member
Willingness to learn
This position is not remote, only local resumes will be considered


Benefits

This position pays $10 per hour and is flexible to adapt to your schedule.

Schedule M-Th 10 00am-3 00pm | Flexible

Please email your resume’ to afox@xiterealty.com or visit our website at www.xiterealty.com","https://www.linkedin.com/jobs/view/externalApply/2485415736?url=https%3A%2F%2Fjobs%2Ejedunn%2Ecom%2Fjob%2FKansas-City-Campus-Intern-Real-Estate-MO-64106%2F722852600%2F&urlHash=2kZP&refId=7582830c-f642-42c0-9c06-888cf3a5301d&trackingId=1xQHtVnhlcO8J4eYr6pj0Q%3D%3D&trk=public_jobs_apply-link-offsite",0.012611024481997201,
16,"Real Estate Intern","BankWest - South Dakota","Pierre, SD","Scope of Job
The BankWest internship program gives energetic, responsible college students the opportunity to learn about the banking industry, community banks, customer service and community involvement. This position will teach the incumbent how our organization functions in the assigned areas of responsibility, giving them valuable insight that can further their interest in their chosen career field.
Primary Duties
Assist with daily tasks as assigned, including but not limited to basic processing functions, final title policy review and submission and assistance with construction draws. Other projects to include uploading to OnBase, checkbacks of items uploaded and review of existing/dated documents for ability to purge.
Assist various members of both the mortgage and manufactured housing teams. In addition to tasks and projects, Intern would be provided the ability to shadow with various team members to learn the mortgage process.
Secondary Duties
Work as a team with departmental counterparts on planning and implementing assigned projects and products.
Participate on various committees and project teams as deemed appropriate by management.
Attend, actively participate in organization, job specific training offered, and Quality Service programs.
Adhere to all applicable Policies and Procedures of BankWest organization. Community involvement is strongly encouraged.
Other duties as assigned.

Requirements

Education (The minimum qualifications for internal/external applicants)

A high school diploma or equivalent.
Incoming Junior or Senior currently enrolled in a full-time undergraduate program in a related field. Will also consider a recent graduate or graduate students.
Minimum 3.2 GPA
Special Skills
Ability to work dependently and/or independently, under pressure, meet deadlines, and adjust work schedules as needed to complete job responsibilities.
Ability to organize and handle multiple responsibilities while delivering quality external and/or internal Customer Service.
Strong interpersonal skills to ensure effective communication with external and/or internal customers.
Knowledge or ability to learn regulatory requirements pertinent to performance of specified duties in job description.
Knowledge of banking terminology and procedures.
Ability to skillfully use a variety of application software, learn computer programs, and comprehend the program output.
Adhere to Federal Privacy Standards in addition to following BankWest requirements for electronic communication and Social Engineering standards.
BankWest is a Sales Organization and all employees are expected to participate directly or indirectly with increasing BankWest's presence in their markets as appropriate.","https://www.linkedin.com/jobs/view/externalApply/2470656253?url=https%3A%2F%2Fwww%2Enexxt%2Ecom%2Fjob%2Easp%3Fid%3D1483984561%26aff%3D16AE119E-722C-4962-8098-083243C4FF3F&urlHash=JhAG&refId=7582830c-f642-42c0-9c06-888cf3a5301d&trackingId=jZn2TtbScmHEaTRbNPAfpw%3D%3D&trk=public_jobs_apply-link-offsite",0.02068469901056701,
29,"2021 Summer Analyst, Real Estate Management and Operations (TO-56B71)","Berkadia","Ambler, PA (+1 other)","","https://www.linkedin.com/jobs/view/credit-operations-intern-at-berkadia-2496794563?utm_campaign=google_jobs_apply&utm_source=google_jobs_apply&utm_medium=organic",0.012196348632764099,
15,"Real Estate Listing Intern","Furner Realty Group","Lancaster, PA","Have you considered getting into Real Estate but not sure where to start? This is your opportunity to dip your toe in the water by helping out a quickly growing real estate team to achieve their 2021 goals! You will gain exposure to all aspects of Real Estate and work on incredibly valuable projects while receiving guaranteed pay. This is a part-time internship with flexible hours to start. Upon learning the culture and gaining experience there may be potential to join the team in the future!

Responsibilities:
• Assist with marketing efforts to find new seller clients
• Help new seller clients prepare to hit the market “for sale”
• Support the sales process for our clients from “for sale” through “SOLD”
• Opportunity to help with other high-value initiatives for the team

Qualifications:
• Must have a driver's license and access to a vehicle
• Must be local to local to Lancaster County, PA or able to travel to and from the area.
• Eager to learn about real estate and excited to work
• Ability to follow instructions and work independently (when appropriate)
• A real estate license is not necessary for this position.

What We Will Do For You:
• One-on-one access to the owner
• Coaching and training for all assigned initiatives
• Guaranteed hourly pay
• Moderate flexibility in hours worked with some remote work allowed

** Remote Work opportunity will be available, but this job will primarily entail in-person responsibilities. **","https://www.linkedin.com/jobs/view/externalApply/2482397331?url=https%3A%2F%2Fjobs%2Ekroger%2Ecom%2Fkroger%2Fjob%2FCincinnati-Real-Estate-Intern-OH-45202%2F728439800%2F%3Futm_source%3DLINKEDIN%26utm_medium%3Dreferrer&urlHash=YseX&refId=7582830c-f642-42c0-9c06-888cf3a5301d&trackingId=Fzt3V61ciq5RnQ%2BjZgv31w%3D%3D&trk=public_jobs_apply-link-offsite",0.030187464059568292,
13,"Summer Internship","Rialto Capital","Miami, FL","Summary

Rialto Capital Advisors:

Rialto Capital is a leading commercial real estate investment and asset management company. Since 2009, Rialto has raised over $9 billion with its global partners. Rialto’s Investment Management group invests this capital into both debt and equity holdings while the Asset Management group works to ensure profitable return.

Summer Internship Program

Rialto Capital offers a 10 week Summer Internship Program designed to immerse our Summer Interns in the daily activities of 1 of our real estate asset management or operations divisions. Summer Interns will be assigned to a specific departments based on the Summer Intern’s interests and skill set.

The program starts with a formal orientation and in-depth asset management training. Responsibilities will vary by department, but will mirror the responsibilities of a fulltime analyst with the company. Summer Interns will also have the opportunity to participate in educational workshops, speaker events, and networking opportunities. Each Summer Intern will be paired with a current Rialto Analyst or Associate mentor.

As the summer concludes, successful Summer Interns may be invited to join the Rialto team in the fall as an Analyst within a specific department or in our Rotational Analyst program for the upcoming year.

Basic Qualifications
Current undergraduate Junior, first year MBA student, or 1L/2L in law school
Passion for real estate
Highly analytical and collaborative
Strong work ethic and organizational abilities
Proficiency in Excel
Excellent oral and written communication skills
Ability to relocate to Miami, FL for the summer

Program Features
10 week program commencing June 2021
Located in Miami, FL
Real estate industry experience Career mentors & educational programing

Asset Management Departments

CMBS Performing Loans : Evaluates various real estate transactions including leasing matters, property sales, property management changes, hotel franchise agreements, etc. An intern in this group will be responsible for performing qualitative and quantitative analysis and subsequently presenting conclusions to the team’s approval committee.

CMBS Loan Workout : Recommends resolution strategies for non-performing loans such as: loan modification, foreclosure, forbearance, discounted payoff, etc. An intern in this group will perform qualitative and quantitative analysis to recommend the most appropriate resolution for a respective loan.

Real Estate Asset Management : Assesses, manages and liquidates real estate owned by Rialto or its subsidiaries. An intern in this group will analyze each owned property to determine its optimal holding period and market value.

Collateral Surveillance : Monitors risk factors associated with the properties underlying Rialto’s CMBS bond investments. Leads annual RE-Underwriting initiative of CMBS loans. An intern in this group will conduct market research and evaluate cash flow projections of CMBS loans.

Operations Departments

CMBS Compliance : Promotes and ensures compliance with transaction documentation and regulatory requirements. The Compliance Team also monitors and evaluates industry and market developments and promote the adherence to best practices across Asset Management departments.

CMBS Investor Reporting : Prepares various CREFC investor reporting, including the Special Servicing Report, fee invoices, liquidations, and ARA calculations. An intern in this group will work with asset managers to board modifications, forbearance agreements, and other workout scenarios.

Working Conditions

While performing the duties of this job, the Associate is occasionally required to stand; walk; sit; use hands to finger, handle, or feel objects, tools or controls; reach with hands and arms; climb stairs; balance; stoop. The Associate must occasionally lift and/or move up to 25 pounds. Evening and/or weekend work may be necessary to meet deadlines. This description outlines the basic tasks and requirements for the position noted. It is not a comprehensive listing of all job duties.

Rialto Capital is committed to the principles of Equal Employment Opportunity. Our policy is to provide equal employment opportunity to all applicants and Associates without regard to race, color, religion, sex, pregnancy, sexual orientation, gender identity or expression, national origin, age (40+), disability, veteran status, genetic information (including family medical history), or any other legally protected status.","https://www.linkedin.com/jobs/view/externalApply/2495153127?url=https%3A%2F%2Fjsco%2Ere%2F9l3mp&urlHash=6GDs&refId=7582830c-f642-42c0-9c06-888cf3a5301d&trackingId=O4ddA%2FeqMyU2w%2BqTFdFgGQ%3D%3D&trk=public_jobs_apply-link-offsite",0.016689508983467195,
21,"Real Estate Operations Summer Internship (BB-778B0)","Citizens Financial Group, Inc.","Johnston, RI","","https://us.bebee.com/job/20210407-4b5dc03cba134bddd99004a2c2a778b0?utm_campaign=google_jobs_apply&utm_source=google_jobs_apply&utm_medium=organic",0.012196348632764099,
2,"Real Estate Intern (Summer 2021)","Rivian","Los Angeles, CA","Rivian is on a mission to keep the world adventurous forever. This goes for the emissions-free Electric Adventure Vehicles we build, and the curious, courageous souls we seek to attract.

As a company, we constantly challenge what’s possible, never simply accepting what has always been done. We reframe old problems, seek new solutions and operate comfortably in areas that are unknown. Our backgrounds are diverse, but our team shares a love of the outdoors and a desire to protect it for future generations.

We operate development centers in Plymouth, Michigan; Southern California (Irvine, Carson & LA); Silicon Valley (San Jose and Palo Alto); Vancouver, British Columbia; and Surrey, England; as well as a manufacturing facility in Normal, Illinois.

Internship Term: Summer 2021
Rivian internships are experiences optimized for student candidates. To be eligible, you must be an undergraduate or graduate student in an accredited program during the internship term. If you are not pursuing a degree, please see our full time positions at Rivian.com/careers

Note that if your university has specific requirements for internship programs, it is your responsibility to fulfill those requirements.

Role Summary

In this position you will support a Regional Manager with the execution of new charging sites in target service areas for DCFC and L2 charging.

Responsibilities
Be the boots on the ground gathering market intelligence, identifying strategic sites and surveying key local partners.
Collaborate with data science team to build suggested travel stops including, but not limited to: SoC (State of Charge) needed when departing, necessary stops en route and charging time at each stop
Support Regional Manager with any documentation related to the transaction process flow and critical dates, such as notices to exercise lease options.
Monitor and maintain internal project tracking system to ensure timely transaction completion .
Preparing presentations to relevant cross functional teams including Legal, Environmental Health & Safety and Executive Leadership.
Autonomy to run full cycle real estate charging process from initial outreach to charger deployment and activation, with support from Regional Manager.
Exposure to all critical charging teams: Site Development (Real Estate), Deployment (Construction), Data Science and Vendor Partners.


Qualifications
Currently pursuing a Bachelor’s or Masters in Real Estate Management, Business, Sustainability or other relevant degrees
Requires strong PowerPoint or Keynote skills
Requires intermediate to advanced Excel skills
Requires a very organized and motivated personality
Requires curiosity, and a desire to learn real estate and the Electric Vehicle charging market.
Requires good communication, writing and presentation skills.


Equal Opportunity

Rivian is an Equal Opportunity Employer and Prohibits Discrimination and Harassment of Any Kind: Rivian is committed to the principle of equal employment opportunity for all employees and to providing employees with a work environment free of discrimination and harassment. All employment decisions at Rivian are based on business needs, job requirements and individual qualifications, without regard to race, color, religion or belief, family or parental status, or any other status protected by the laws or regulations in the locations where we operate. Rivian will not tolerate discrimination or harassment based on any of these characteristics. Rivian encourages applicants of all ages.

Privacy

We take your privacy seriously. For details please see our Candidate Privacy Notice.","https://www.linkedin.com/jobs/view/externalApply/2479941396?url=https%3A%2F%2Fboards%2Egreenhouse%2Eio%2Frivian%2Fjobs%2F4316645003%3Fs%3DLinkedIn%26source%3DLinkedIn&urlHash=0DeA&refId=7582830c-f642-42c0-9c06-888cf3a5301d&trackingId=lXtG7dDERDIHACWg%2B9hHcA%3D%3D&trk=public_jobs_apply-link-offsite",0.014632607958680958,
7,"Real Estate Intern","Cushman & Wakefield","Cincinnati, OH","Job Title
Real Estate Intern

Job Description

Job Description Summary
Provide full administrative support, including front-line phone answering, opening/closing of office, attending/sitting at front reception desk, typing/completing reports, filing (paper and electronic), and distribution of correspondence.
Assist Project Manager with various appropriate duties and learn project management process.
Assist Transaction Manager with various appropriate duties and learn transaction management process.
Assist Capital Manager with various appropriate duties and learn capital project process.
Generate and distribute tenant communication blasts.
Set-up and appropriately utilize tenant contact distribution lists via email and text.
Schedule and coordinate meetings, conference calls, events, as requested.
Assist in client site/building on-boarding activities at the direction of Property Manager.
Execute lease administration activities including gaining initial tenant contact information, quarterly update to the real estate building reference manual, tenant insurance information, etc.
Build and generate reports as requested out of all databases in use (YARDI, CoStar, CMS).
Prepare and code invoices for Property Manager’s approval.
Ensure prompt and accurate completion of vendor/supplier contracts and supporting certificates of insurance. Save all to appropriate databases.
Track and file vendor/supplier contracts and certificates of insurance; utilize provided databases to keep track of expirations and gain new contracts at least 60 days prior to expiration of former contract.
Utilize, monitor, maintain the work order system and prepare monthly reports for Property Manager regarding performance and status of work orders.
Maintain property, lease and contract files (hard copy and electronic) and any other files located within the real estate office.
Promote and foster positive relationships with tenants and owners and track service calls via work order system.
Other duties as assigned.
Cushman & Wakefield provides equal employment opportunity. Discrimination of any type will not be tolerated. Cushman & Wakefield is an Equal Opportunity / Affirmative Action employer. All qualified applicants will receive consideration for employment without regard to race, color, religion, sex, national origin, sexual orientation, gender identity, disability, protected veteran status or any other characteristic protected by state, federal, or local law.","https://www.linkedin.com/jobs/view/externalApply/2425247914?url=https%3A%2F%2Fcareers%2Ecushmanwakefield%2Ecom%2Fglobal%2Fen%2Fjob%2FCUWAGLOBALR110487ENGLOBALEXTERNAL%2FReal-Estate-Intern%3Futm_source%3Dlinkedin%26utm_medium%3Dphenom-feeds&urlHash=zTqh&refId=7582830c-f642-42c0-9c06-888cf3a5301d&trackingId=S5YZmjWvpLjN%2FNbwx0OoyQ%3D%3D&trk=public_jobs_apply-link-offsite",0.02359812557257413,
23,"Real Estate Marketing Intern (UZ-2E94C)","New Empire Corp","New York, NY (+1 other)","New Empire Corp is looking for a motivated and driven real estate intern to assist with day to day operations Get to know us: Increasingly recognized as one of the most active and innovative developers in New York City, New Empire Corp (NEC) successfully renovated, built and developed more than 100 mixed-use residential multifamily and hotel real estate projects in premier locations throughout New York City since its founding in 1997. NEC offers in-house expertise that spans the full range of real estate disciplines-from the sourcing and analysis of target properties to zoning, capital-raising, architecture and design, construction management, marketing and property management. What we are looking for: A successful intern is someone organized who can also handle working in a fast-paced environment. Additionally, they should be someone who is flexible in their work and can handle working on multiple tasks in different areas of real estate development. The intern will work closely with the Director of Marketing and Operations who will provide guidance throughout the duration of their internship. The intern will be paid on a daily rate. Notable skills we are looking for: Integrity and a commitment to excellence Strong analytical and computer skills, proficiency in Excel and Google Drive Excellent written and verbal communication skills and customer service skills Detail oriented Strong organizational skills Interns are paid at an hourly rate. If interested, please send resumes and cover letters to marketing@usnere.com with the subject line NEC Intern Job Application Apply for This Job","https://www.uzoes.com/us/details/2021-04-08_2e94c7cc2ffd39fb69829e465325ec02?utm_campaign=google_jobs_apply&utm_source=google_jobs_apply&utm_medium=organic",0.05002380373726095,