Id,Title,Company,Location,Required Qualifications,Link,Page Rank,
9,"Campus Intern - Real Estate","JE Dunn Construction","Kansas City, MO","Best people + right culture. These are the driving forces behind JE Dunn’s strategy for success. By hiring the best people we can find, giving them interesting and challenging work, and letting them share in the company’s rewards, we’ve found a sustainable way to grow in our industry for the last 90+ years.

JE Dunn believes in providing the best tools for employees to get the job done right. Lean operation processes. Digital document collaboration. LEED-certified, occupant-focused environments. We make sure our workforce is prepared for the job, and we expect the best. Our diverse teams around the country strive to enrich lives through inspired people and places every day, and we need inspired people like you to join us in our pursuit of building perfection.

Role Summary

Key Role Responsibilities - Core

Internship Overview – Projects And Responsibilities
Assist in screening of new investment opportunities, financial modeling, due diligence, and SREO updates as needed.
Intern will review and underwrite live investments with investment team members. An intern will gain proficiency in underwriting different property sectors and an understanding of the full investment process.
Assist in identifying and researching industry trends, and the competitive landscape of the markets across the country.
Entails reviewing third party research reports and preparing summarized reports for team members to review.
Collaborate with company employees in Pre-construction Services for new development opportunities.
Assist in researching and making recommendations on property/asset management issues and coordination.
Obtain additional estimates for ongoing maintenance requirements on company owned properties and compare and make recommendations. Investment managers will provide the agreement and communication from current providers and other pending bids for reference/comparison.
Work with project leads to obtain project related bids for certain properties.


Key Role Responsibilities - Additional Core
Assist in consolidating relevant information/questions in the focus areas where the team needs coordination help. This could be lead generation, and/or partnership opportunities.
Help interface with cross-functional teams
Property and asset management coordination as needed
Scope of internship is varied and complex and requires independent judgement, as it is required to assist where needed.


Knowledge, Skills & Abilities
Able to be flexible
High energy
Leadership potential
Strong work ethic
Excellent written and verbal communication skills
Works well under pressure and in deadline situations


Education
Enrollment in accredited Bachelors Degree program or higher, and coursework in the area(s) related to the internship opportunity


Experience

N/A

Working Environment

At JE Dunn, you’ll receive an abundance of resources dedicated to ensuring your success and future development

Employee-focused culture
Whether it’s our Employee Stock Ownership Plan (ESOP), company wellness program, or modern workspaces, we put the satisfaction of our employees at the forefront of everything we do.

Award-winning Benefits Package

Named one of Plan Sponsor Magazine’s 2015 Plan Sponsors of the Year, JE Dunn’s employee benefits package ranks among the top of our peer group, meeting and exceeding standard expectations.

Professional training opportunities
Our employee development team works full-time to create growth opportunities across the company. We encourage employees to take command of their own development, and we make sure they have what they need to take that next step.

Community-driven workforce
Corporate and personal involvement in the communities in which we work is simply part of the job--JE Dunn as an organization is proud to donate over 10 percent of our pre-tax earnings to charities around the country each year.

JE Dunn Construction is committed to hiring and retaining a diverse workforce. We are proud to be an Equal Opportunity/Affirmative Action Employer and it is our policy to provide equal opportunity to all people without regard to race, color, religion, national origin, ancestry, marital status, veteran status, age, disability, pregnancy, genetic information, citizenship status, sex, sexual orientation, gender identity or any other legally protected category. JE Dunn Construction is a background screening, drug-free workplace.

Accessibility: If you need an accommodation as part of the employment process please contact Human Resources at accommodations@jedunn.com

JE Dunn Construction Company does not accept unsolicited resumes from search firms or agencies. Any resume submitted to any employee of JE Dunn Construction without a prior written search agreement will be considered unsolicited and the property of JE Dunn Construction Company. Please, no phone calls or emails.","https://www.linkedin.com/jobs/view/externalApply/2485415736?url=https%3A%2F%2Fjobs%2Ejedunn%2Ecom%2Fjob%2FKansas-City-Campus-Intern-Real-Estate-MO-64106%2F722852600%2F&urlHash=2kZP&refId=7582830c-f642-42c0-9c06-888cf3a5301d&trackingId=1xQHtVnhlcO8J4eYr6pj0Q%3D%3D&trk=public_jobs_apply-link-offsite",0.01752398442354719,
4,"Real Estate Development Intern","PulteGroup","Tucson, AZ","We know that BUILDING HOMES & COMMUNITIES BEGINS WITH BUILDING THE BEST TEAM!

How would you like to be a part of team that has been providing the American Dream of homeownership to families for more than 60 years? PulteGroup is a FORTUNE 500 company and one of America’s top residential builders. We put the consumer at the center of everything we do and we stand above the competition in our commitment to quality.

Our Vision is to Build Consumer Inspired Homes & Communities to Make Lives Better and we believe that success starts with having the right people.

At PulteGroup, we are committed to diversity and inclusion. We value the differences of each employee and understand that being consumer inspired means that we reflect the diversity of the consumers we serve.

A position with PulteGroup offers a rich, fulfilling and rewarding career across multiple geographies and brands. If you are interested in being a part of our team, let’s talk about your career with PulteGroup!



PulteGroup is offering a unique opportunity to join our team in Tucson as an Intern. The development team at PulteGroup is a small, highly focused group supported by the Arizona Division for back office functions. The Tucson team is constantly evaluating sites for development, project managing new developments, and overseeing construction of new neighborhoods. PulteGroup in Tucson offers three distinct brands to consumers- Pulte Homes, Del Webb, and Centex. We are growing our pipeline of projects and have opened an opportunity for an internship in our Tucson office. Depending on the applicant’s schedule, this position will be around 20 hours per week and pays $20/hour. The Internship begins on April 1st and will run through Summer of 2021.




JOB RESPONSIBILITIES:


Assist in the evaluation and underwriting process for potential residential real estate developments
Attend meetings with consultants and contractors to assist planning a large, multi-phase development
Analyze past costs of development to help create a database of key figures for use in future investment analysis
Visit construction sites to advance knowledge of development and review status
More detailed responsibilities will be assigned depending on the Intern’s strengths and interests. In general, assist the team with acquisition, project management and development.","https://www.linkedin.com/jobs/view/externalApply/2457430623?url=https%3A%2F%2Frecruiting%2Eadp%2Ecom%2Fsrccar%2Fpublic%2FRTI%2Ehome%3Fr%3D5000698749406%26c%3D2160113%26d%3DExternalCareerSite&urlHash=MeIK&refId=7582830c-f642-42c0-9c06-888cf3a5301d&trackingId=u%2FqC4L8zvdxK5yx%2Bh6u7sQ%3D%3D&trk=public_jobs_apply-link-offsite",0.022037160084430622,
11,"Real Estate Marketing Internship (Paid)","The Hoyte Group","Boise Metropolitan Area","Our successful, high energy, and fast growing real estate team is seeking a talented, results-driven and enthusiastic individual to be our Marketing Intern. We are an upbeat and proactive group who work hard, have a passion for real estate, and support one another in a great working environment.
The intern will be provided with learning opportunities throughout the organization so they understand the fundamentals of marketing and transactional work in the residential real estate industry following their experience.
From an everyday perspective, the intern will assist with day-to-day responsibilities, contribute to business development initiatives, and carry out tasks for the team leader, marketing director, and operations manager. Ultimately, ensuring the team maintains optimal performance. The position of intern is responsible for supporting team members in extensive marketing projects, transactional assistance, business matters, client relations, and retention.
The ideal candidate will be a detail-oriented, self-motivator, self-starter, able to work well in a fast-paced environment with tight deadlines, demonstrate clear communication skills, be motivated to learn, and exhibit a strong work ethic – with a passion and interest for a career in marketing and transactional work within Residential Real Estate.
This full time opportunity offers hourly compensation with a flexible schedule. If you are ready to add an invaluable opportunity to your resume, gain more industry experience, and have fun while you do it, we want to hear from you.

An opportunity for long term employment is available, dependent on performance.","https://www.linkedin.com/jobs/view/externalApply/2460192403?url=https%3A%2F%2Fhoytegroup%2Ecom%2Fintern%2F&urlHash=XLXp&refId=7582830c-f642-42c0-9c06-888cf3a5301d&trackingId=UXlBMYryB7JYXC%2F9iYhPVw%3D%3D&trk=public_jobs_apply-link-offsite",0.20520338452021614,
17,"Real Estate Intern - Lange Real Estate","RedGuard","Wichita, KS","About The Company

Rooted in real estate, an industry the company has been involved in since 1986, LANGE has constantly evolved to continue to meet the growing needs of those it serves. Today, the company has branches in portable storage, blast-resistant buildings, asset-based financial solutions and diversified leasing programs. However, through it all, LANGE has remained true to its guiding purpose of providing unique, industry-leading products and services while doing so with integrity and a commitment to its growing family of employees.

For more information, visit https://lange.us.com/companies/
What You Can Expect Working in the Real Estate Intern Position
Department/Division: Lange Real Estate

Reports to: Director of Real Estate

Location: Wichita, KS

Position Type/Hours: Full-time | M-F | 8:00a – 4:30p; Hybrid Schedule

Overtime: Approved Time Only

Travel Requirement: Less than 5%

FLSA Status: Non-Exempt

The Real Estate Intern will work directly with the brokerage and property management teams to learn and understand the residential and commercial real estate market. The Real Estate Intern will perform support functions of this position, learn real estate contracts, leases, eviction plans, and other legal documentation.

Responsibilities
Perform the preparation duties and showings of properties, both residential and commercial for sale and/or for lease.
Review and prepare real estate contracts.
Become familiar and assist with the operation of the MLS, Loopnet and other Real Estate systems and software.
Perform sales techniques to be able to convert a lead to a sale or lease.
Assist with the marketing strategies for the residential and commercial brokerage.
Support and work in coordination with the real estate brokerage team to drive listing and Lange RE presence.
Shadow and work directly with Real Estate agents to understand market best practices.
Promote and hold others accountable for a safe working environment.
Observe safety and security procedures.
Minimum Qualifications
Must be proficient in Microsoft Office Products, including Word, Excel and Outlook.
Must be proficient in Social Media accounts.
Must have reliable transportation and a valid driver’s license.
Internship
This is a summer internship, lasting approximately 12 weeks
Start date: May 24, 2021 – August 13, 2021
Work Environment
The physical demands and work environment characteristics described here are representative of those an employee encounters while performing the essential functions of this job. Reasonable accommodations may be made to enable individuals with disabilities to perform the essential functions.
Sedentary work. Exerting up to 10 pounds of force occasionally and/or negligible amount of force frequently or constantly to lift, carry, push, pull or otherwise move objects, including the human body. Sedentary work involves sitting most of the time. Jobs are sedentary if walking and standing are required only occasionally and all other sedentary criteria are met.
The worker is required to have close visual acuity to perform an activity such as: preparing and analyzing data and figures; transcribing; viewing a computer terminal; extensive reading; visual inspection involving small defects, small parts, and/or operation of machines (including inspection); using measurement devices; and/or assembly or fabrication parts at distances close to the eyes.
The worker is not substantially exposed to adverse environmental conditions (such as in typical office or administrative work.)
The worker can expect to spend most of their workday to spent communicating with individuals via phone.
Legal Jargon
We are an Equal Opportunity Employer. All qualified applicants will receive consideration for employment without regard to race, color, religion, sex, sexual orientation, gender identity, national origin, disability or protected veteran status. Except where prohibited by state law, all offers of employment are conditioned upon successfully passing a drug test. This employer uses E-Verify.

SDL2019-64","https://www.linkedin.com/jobs/view/externalApply/2499320260?url=https%3A%2F%2Fwww%2Estartwire%2Ecom%2Fjobs%2Fwichita-ks%2Freal-estate-intern-lange-2814759341%3Fcampaign%3D128%26source%3DLI&urlHash=tcLY&refId=7582830c-f642-42c0-9c06-888cf3a5301d&trackingId=viJYa9pkRnfHCsinVeWDZA%3D%3D&trk=public_jobs_apply-link-offsite",0.01406337607591673,
18,"Real Estate Intern","First Community Credit Union - Houston, TX","Houston, TX","As a member of the Real Estate team, you will have the opportunity to gain valuable experience in a wide range of mortgage lending duties and functions while working to advance our organization’s practices. This will be done through knowledge and understanding gained on all services and products within the real estate department encompassing all matters of mortgage, home equity, and home improvement loan requirements, guidelines, and policies. As your knowledge and experience expand, the real estate intern will learn to process mortgage and construction loans, including those for investors and in-house loans, as well as, the ability to process home improvement and home equity loans.

Our Real Estate Intern will have the opportunity to work through our loan origination system with knowledge gained for proper input of loan applications, ordering of credit reports, as well as which applications to run through the underwriting platform for conventional loans. They will gain knowledge and understanding of the necessary documentation needed to present loan applications to underwriting, and additionally, gain an understanding of the clearing conditions from the underwriters.

This individual will assist the Real Estate department with member communication via inbound/outbound calls, emails, and other methods of communication as necessary. They will understand the loan closing process and be able to coordinate closings with borrowers and title companies. They will also become knowledgeable of the denial process and will assist in sending our denial letters for real estate loans as directed.

Requirements: Must be pursuing a Bachelor’s or graduate-level degree with a business designation.

Desirable Traits
Excellent oral and written communication skills
Self-motivated to achieve goals
Detail-oriented with strong organizational skills
Ability to multi-task in a fast-paced environment
Proficient computer skills with the ability to learn mortgage software platforms, spreadsheets, and word processing


About Us

First Community Credit Union (FCCU) was chartered in southeast Texas in 1954 to serve the employees of the Spring Branch Independent School District. In 1988, FCCU expanded membership to include the Greater Houston Area, thereafter adding Fort Bend and Montgomery Counties in the 2000s. Over the years, First Community Credit Union has grown to become one of the largest credit unions in Houston with over $1B+ in assets. We have always operated under the philosophy of people-helping-people. First Community Credit Union continues to lead the way as a high-tech, high-touch credit union with leading digital services including Online Banking, Mobile Banking, iPhone/Android Apps, and more. FCCU also works to ensure our members are backed by the latest in security, launching products including EMV chip cards and My Money Maps. As a full-service financial institution, First Community Credit Union proudly serves the daily financial needs of over 130,000 members at our 17 locations.","https://www.linkedin.com/jobs/view/externalApply/2487398179?url=https%3A%2F%2Frecruiting%2Eultipro%2Ecom%2FFIR1030FCCU%2FJobBoard%2F85400acd-0000-4949-8a8d-b257b414d923%2F%2FOpportunityDetail%3FopportunityId%3D0331809e-9161-43d8-b448-6768fc2665b0&urlHash=cD6h&refId=7582830c-f642-42c0-9c06-888cf3a5301d&trackingId=fM6UiigjjBN6RuX5vHDmVQ%3D%3D&trk=public_jobs_apply-link-offsite",0.01354023080048794,
22,"Property Operations Summer Internship","AvalonBay Communities, Inc.","Jersey City, NJ","Job Type: Non ExemptState::NJ City:Jersey CityBrand:Avalon OverviewCreating a better way to liveis the purpose that binds AvalonBay associates. At AvalonBay, every day you can make a difference in someone's life. We take that purpose seriously and expect you will as well. From helping someone choose one of our communities as their home to providing great service throughout a resident's stay to supporting your fellow associates, your positive, professional and consistent personal interactions make AvalonBay a great place to work. Our purpose and our core values - A Commitment to Integrity, A Spirit of Caring, and A Focus on Continuous Improvement - set us apart.So if you're looking for a rewarding career opportunity with the top property management organization in the country, we'd like to hear from you!At AvalonBay, you will have access to outstanding training and career advancement opportunities. We also offer a competitive benefits package, including rental discounts at our communities.The RoleAs Property Operations Summer Intern you will gain valuable hands-on experience in the the residential property management industry. Responsibilities will include welcoming current and prospective residents to the community, facilitating the move-in/move-out process, assisting with coordination of resident events, administrative duties and special projects. If you're interested in learning about the property management industry from a sales and customer service perspective, this may be the perfect internship for you!This is a ten week internship program from late May until early August.You Have...Qualified candidates will have at least 1 year of sales or customer service experience in a retail, hospitality, or multi-family environment, and Microsoft Office skills.Additional InfoAvalonBay is proud to be an equal opportunity employer and is committed to an inclusive and diverse work environment free of discrimination and harassment. We believe that in order to achieve our purpose of creating a better way to live, we must recruit, develop and retain associates with a wide range of backgrounds, experiences and perspectives and create an environment that encourages all voices to be heard, understood and appreciated. With this we know we can do great things","https://www.fox8jobs.com/jobs/property-operations-summer-internship-jersey-city-new-jersey/261851062-2/?utm_campaign=google_jobs_apply&utm_source=google_jobs_apply&utm_medium=organic",0.11092074914135217,
