Id,Title,Company,Location,Required Qualifications,Link,Page Rank,
120,"Social Media Internship","Maternova","Providence, RI (+1 other)","About: Maternova is a pioneering global health venture focused on saving maternal and newborn lives around the world through its pioneering e-commerce platform for health technologies. This award-winning venture seeks to continue to add products and reach new markets and customers and to build its brand using social media.

Internship Description:

The social media intern will be involved in multi-channel social media messaging and connecting with other ventures, countries, and initiatives in women’s health, newborn health, medical devices and diagnostics, and global health. The job will entail increasing posting quality, frequency, and strategic placement on the right platform at the right time. The intern will work with the CEO and Chief Strategy Officer to continue to build a social media strategy that is powered by the mission of the company—to get low-cost, high-quality medical innovations into the hands of those providing clinical care around the world. Twitter is the primary channel, but increasing our LinkedIn ‘voice’ and traffic, as well as Instagram, will be the focus for the semester.

If the candidate speaks another language fluently (esp French or Spanish or Portuguese) this is an added attribute for the position. This is an ideal position for a college senior or graduate student who is taking time off due to Covid and has time to invest in a fast-paced social enterprise with a global brand.

Qualifications and Requirements:
• The candidate must be well versed in Twitter, Instagram, Pinterest, Facebook, LinkedIn and be able to expertly manage across platforms using a social media manager like Hootsuite
• Concrete prior experience in social media messaging (hashtag research, metrics for social media)
• The candidate must have impeccable spelling and grammar and a keen eye for design and composition for the visual aspects of social media (creating compelling images on Canva)
• The candidate will ideally have strong public health and global health knowledge, preferably with a focus on maternal and child health
• Junior/Seniors/Graduate Students only; GPA 3.5 or above only
• Strong work ethic and time management are essential

Schedule: 20 hours per week

Compensation: For academic credit.

Social Enterprise Greenhouse is recruiting for this internship.

Job Types: Part-time, Internship

Benefits:
• Flexible schedule
• Professional development assistance

Schedule:
• Monday to Friday

Work Location:
• Fully Remote

Hours per week:
• 20-29

Internship Compensation:
• College Credit

Company's website:
• https://maternova.net/

Company's Facebook page:
• https://www.facebook.com/Maternova.net/

Work Remotely:
• Yes

COVID-19 Precaution(s):
• Remote interview process
• Virtual meetings","https://www.internships.com/posting/sam_8dd4faf44c8be238?utm_campaign=google_jobs_apply&utm_source=google_jobs_apply&utm_medium=organic",0.002438067679942306,
63,"Social Media Intern - Summer (Current College Student)","The Zebra","Austin, TX","INTRODUCTION

The Zebra -- named a Best Place to Work in Austin four years running -- is looking for a self-motivated college student to serve as our Social Media Intern for the summer of 2021. You will work directly with the Social Media Manager and be a part of the broader Communications team.

At this moment, The Zebra's offices are 100% virtual.

The Social Media Internship provides an incredible opportunity to learn more about a career in digital/social media marketing and communications and have a meaningful impact on the work of a rapidly growing insurtech company. The successful candidate will join our Austin-based team assisting the Social Media Manager with content creation, posting, campaign monitoring/analytics, community management and more.

NOTE: This position is a PAID internship

Please note - all new hires must be able to relocate to Austin, Texas by the time of their start date.

This position is not currently eligible for visa sponsorship

Internship Details
Must be a current college student
May-August 2021
Time commitment will be 10-12 hours a week with a non-negotiable $13/hr
Opportunity to walk away with a repeat internship offer


What You'll Do
Write creative and engaging copy for social media posts and campaigns on Facebook, Twitter, Instagram and LinkedIn
Social media customer service and community management
Track, measure and report social media data/analytics
Monitor/engage/report social media trends through social listening
Attend meetings and brainstorms


Requirements / Qualifications
Pursuing a degree in Marketing, Communications, or a related field (with a strong interest/emphasis on Digital/Social Media) from an accredited College or University
Coachable with a willingness to learn and a commitment to excellence
Superior written communication skills, attention to detail, and reliability
Ability to work in a team environment and have good vibes
An interest in a career in social media/digital marketing
Aren't afraid to get your hands dirty to find creative solutions to problems
Are comfortable taking direction as well as taking the initiative
Revel in being a self-starter and proactively seek out opportunities to learn and improve both yourself and the processes around you
Junior or Senior preferred; previous social media marketing experience/internships a plus

BENEFITS + PERKS:
Competitive Compensation & Stock Option Offering
Health, Dental, Vision & Disability Coverages
HSA offering + employer contribution
401k with match
Unlimited PTO + flexibility to enjoy it
Paid Parental Leave Program
Wellness perk ($100/month)
Pet Adoption Reimbursement ($300/year)
Learning & Development Stipends
Bi-Monthly Wednesday Catered Lunch
Zeal Care - Monthly wellness subscriptions ($35/month)
Curated monthly snack box - sent to your house
Opportunity to join Employee Resource Groups (ERGs) or drive our diversity & inclusion stance by creating your own
Join a team that truly lives their values, and values their lives (outside of the office. Cliche, we know… but we really mean it)


About The Zebra

The Zebra is the nation's leading insurance search comparison site. With its dynamic, real-time quote comparison tool, drivers can identify insurance companies with the coverage, service level, and pricing to suit their unique needs. The Zebra compares more than 100 car insurance companies and provides licensed agent support and educational resources to ensure drivers are equipped to make the most informed decisions about their policies. It's insurance in black and white.

Headquartered in Austin, Texas, The Zebra has garnered the attention and investment of some of the nation's top venture capitalists, and the company's success has been profiled in publications like Inc., Time, Forbes, and TechCrunch. Austin Business Journal named The Zebra a Best Place to Work in 2015, 2016, 2017, 2018 and 2020. Austin American-Statesman awarded The Zebra as a Top Workplace in 2016, 2017 and 2018. Inc. Magazine also awarded The Zebra as Best Workplaces - 2018, 2019, 2020.

The Zebra is aiming to grow our fantastic team to add to our dynamic culture and continue building on our success. Working at The Zebra means never being bored, always being challenged, and supporting one another. We're a happy, hardworking group, and we're eager to add new stripes who share those values.

The Zebra is an equal opportunity employer and at will company.

As part of our dedication to maintaining an inclusive and diverse workforce, The Zebra provides equal employment opportunities (EEO) to all employees and applicants for employment without regard to race, color, religion, sex, national origin, age, disability or genetics. In addition to federal law requirements, The Zebra complies with applicable state and local laws governing nondiscrimination in employment. This policy applies to all terms and conditions of employment, including recruiting, hiring, placement, promotion, termination, layoff, recall, transfer, leaves of absence, compensation and training.

The Zebra expressly prohibits any form of workplace harassment based on race, color, religion, gender, sexual orientation, gender identity or expression, national origin, age, genetic information, disability, or veteran status. Improper interference with the ability of The Zebra's employees to perform their job duties may result in discipline up to and including discharge.

No external recruiters or agents, please.**","https://www.linkedin.com/jobs/view/externalApply/2495162030?url=https%3A%2F%2Fgrnh%2Ese%2F602f390e3us&urlHash=nBsu&refId=b3764ef5-eb9b-46c0-9518-3b47d31c2282&trackingId=dR%2FgleZB%2BWR449du2l4ZSw%3D%3D&trk=public_jobs_apply-link-offsite",0.002361753041301623,
68,"Social Media Intern","The Scotts Miracle-Gro Company","Marysville, OH","Here at Scotts Miracle-Gro there is no such thing as a typical day. Our culture is constantly energized by new and exciting growth opportunities and at a rapid pace. Every Associate plays an important role in providing innovative solutions for today’s gardeners and growers and contributing new ideas to improve operations. In our company you need grit, it is what we were founded on over 150 years ago and is what keeps us growing. Regardless of your level in the organization there is a platform for your voice to be heard and the ability to influence change. Family, community and hard working values are weaved into all that we do. Come grow with us, where we develop and nurture the next generation of leaders.

We’re looking for a Social Media Intern who will join our Integrated Planning and Social Media team. team.

This position may be based remotely or at The Scotts Miracle-Gro world headquarters in Marysville, a suburb of Columbus, OH. Not familiar with Columbus? Visit columbusregion.com/columbus-2020/ .

Our internship program is designed to cultivate the professional growth of students through a dynamic work environment. Over the course of 12 weeks you will work on meaningful projects and have opportunities to learn from industry leaders. We are committed to your development but will also rely on you to bring new knowledge, new ideas, and innovation into our organization.

Scotts Miracle-Gro is searching for a curious and passionate social media intern to grow with us, as we create and build engaged social media communities and industry-leading integrated digital campaigns. This internship position will allow you to work closely with other members of the Marketing Services team, providing exposure to many different facets of the business.

What You’ll Do In This Role
Perform audits and review case studies relating to social media, content, and digital channels at large to surface findings and insights relevant to our category and business goals
Pull and present social listening reports to get an understanding of the sentiment and landscape around our category, competitors, and consumers
Work with our Social Media Analysts to create social campaign measurement reports to share findings with the team
Research competitor trends across social and digital channels
Update the team on the evolving social landscape and relevant trends
Support research, implementation, and management of influencer campaigns
Participate in social media strategy planning and implementation sessions
Attend meetings and reviews with internal stakeholders and partner creative agencies
Work closely with our Social Media Analysts to build organic social content briefs to then be presented to the internal creative team for content development
Brainstorm social content ideas that achieve business or campaign goals
Assist in content calendar implementation and publishing across social media platforms such as Facebook, Instagram, Pinterest, YouTube and Twitter
Engage daily with consumers across social channels, partnering with the Social Analyst and our consumer service team

What You’ll Need To Be Successful
Be enrolled in an accredited college, university or trade school.
Possess strong analytical and leadership skills.
Demonstrate strong written and verbal communication.
Prioritize collaboration and problem solving.
Manage multiple tasks and be detail-oriented.
Passion for the digital marketing landscape, including social media and content.
Have prior internship experience (preferred but not required).
COME GROW WITH US, WHERE THE GRASS REALLY IS GREENER!

Not interested in this role? Stay up to date on future opportunities by joining our ScottsMiracle-Gro and Hawthorne Gardening talent networks.

Scotts is an EEO Employer, dedicated to a culturally diverse, drug free workplace.

EEO/AA Employer/Minority/Female/Disability/Veteran/Sexual Orientation/Gender Identity

Notification To Agencies

Please note that the Scotts Miracle-Gro company does not accept unsolicited resumes from recruiters or employment agencies. In the absence of a signed Master Service Agreement, and specific approval to submit resumes to an approved requisition, the Scotts Miracle-Gro company will not consider or approve payment regarding recruiter fees or referral compensations.","https://www.linkedin.com/jobs/view/externalApply/2469455854?url=https%3A%2F%2Fscottsmiraclegro%2Ewd5%2Emyworkdayjobs%2Ecom%2Fen-US%2FSMGExternal%2Fjob%2FMarysville-OH%2FSocial-Media-Intern_R6416-1%3Fsource%3DLinkedIn&urlHash=9q2m&refId=b3764ef5-eb9b-46c0-9518-3b47d31c2282&trackingId=GBBZYczBJIloXVN0osipnQ%3D%3D&trk=public_jobs_apply-link-offsite",0.003209707478729112,
22,"Social Media Intern","TLDEF","New York County, NY","Internship applications will be accepted until no later than 6:00pm PT on April 23, 2021.

About Us

Founded in 2003, the Transgender Legal Defense & Educational Fund (TLDEF) is a national organization committed to advancing justice and equity for transgender people through impact litigation, direct legal services, advocacy, and public education. In recent months TLDEF has secured a landmark settlement on behalf of our client resulting in one of the nation’s strongest jail policies to protect transgender people in custody, and worked with insurance companies, unions, and employers to increase nationwide access to transgender healthcare in unprecedented ways. And we’re just getting started.

The Opportunity

TLDEF is searching for a curious and motivated Social Media Intern who can draft and curate engaging content on TLDEF’s social media accounts during a critical time for transgender rights. This internship is an ideal fit for individuals seeking to gain exposure and experience working in non-profit communications and have a strong interest in TLDEF’s mission. The Social Media Intern will report to the Program Manager and work with the Communications Consultant.

The Social Media Intern is expected to commit to 10-15 hours per week during the summer semester (May 11 – August 13, 2021). This is a remote internship and work hours are flexible, but the successful candidate will need to schedule some work time between the hours of 10:00am to 6:00pm Eastern. The Social Media Intern is required to have consistent and reliable access to a computer or laptop with Microsoft Office applications, phone and broadband internet, and a stable remote working environment.

Responsibilities
Maintains TLDEF social media calendar for sharing relevant, timely content on TLDEF’s social media pages. Responsible for updating internal content calendar on a regular basis.
Provides day-to-day execution of approved content on Facebook and Twitter as directed by the Program Manager.
Drafts and proofreads copy, graphic assets, and image descriptions for accessibility.
Keeps up-to-date on current social media best practices and recommends new ideas.
Monitors tags, comments, and direct messages and forwards to Program Manager as needed.
Conducts research to inform TLDEF’s social media content, with a focus on national and state news and topics affecting transgender and non-binary people.
Promotes TLDEF’s programs, news, and events to drive social media engagement (i.e., page clicks, attendance, and donations).
Produces periodic progress reports about social media engagement.
Works on special projects as assigned.

Required Qualifications
A passion and commitment to social, racial, economic, and gender justice.
Interest and experience with social media, digital and/or community organizing, advocacy, or other relevant experience.
Experience creating social media content for Twitter and Facebook.
Proficiency in trans-specific and LGBTQ+ news, events, issues, and trends.
Ability to adapt under tight deadlines and breaking developments.
Excellent attention to detail, such as proofreading copy to ensuring consistent font colors and formatting in graphics.
Ability to write clearly, persuasively, and precisely in English.
Familiarity with Microsoft Office applications and other tools such as Slack and Zoom.
Ability to work outside normal office hours as needed.

Preferred Qualifications
Experience managing a Facebook and/or Twitter accounts with over 10,000 followers.
Experience with Canva or Adobe Creative Cloud tools.
Prior social media analytics experience.
Fluency or proficiency in Spanish.

Compensation

$15.00 hourly rate. TLDEF also provides a monthly cell phone/internet access reimbursement.

To Apply

Applications will be accepted until no later than 6:00pm PT on April 23, 2021 . Please submit the following three materials: (1) updated resume or C.V.; (2) cover letter detailing your interest of interning at TLDEF and; (3) three screen grabs of engaging social media posts that you’ve written for either Facebook or Twitter. Applications without the required submission materials will not be considered. No phone calls or emails, please.

TLDEF is an equal opportunity employer. Black people, Indigenous people, people of color; lesbian, gay, bisexual, transgender, queer, and intersex people; women; immigrants; people with disabilities, including those living with HIV; formerly incarcerated people; and people with lived experiences of poverty are strongly encouraged to apply.

Apply for this Position

Thank You
Your application was submitted successfully.

By submitting your interest in this job, you agree to receive text notifications with additional steps to complete your job application. You will receive up to 6 messages from the number 63879. Message & data rates may apply. Please refer to our privacy policy for more information.","https://www.linkedin.com/jobs/view/externalApply/2498403013?url=https%3A%2F%2Ftldef%2Etalentify%2Eio%2Fjob%2Fsocial-media-intern-remote-new-york-tldef-28%3Futm_source%3Dlinkedin_organic%26utm_medium%3DXml%26tdd%3DdDEsaDM1LGo0MXJocyxlcHJvNjA3MTMwZDA3MWI4MzQwMjY4ODEyOQ&urlHash=SLRR&refId=3443377e-5c39-4faa-a682-8ed23a6cc751&trackingId=XPx2mbRJCMUk8%2BbYy37EUw%3D%3D&trk=public_jobs_apply-link-offsite",0.002239971125471589,
72,"Marketing/Social Media Intern","Invest for Better","Oakland, CA","Invest for Better (IFB) is looking for a creative, upbeat and tenacious intern to take its social media and marketing strategy to the next level. Invest for Better is an organization seeking to empower all women to understand the power of their investment assets, learn how to align their investments with their values and activate those resources to make a more just and sustainable world for all.We help courageous women start Invest for Better Circles intimate, peer-to-peer groups of women who help each other activate their investment resources for good and raise awareness about resources and opportunities for women to invest purposefully.Over the summer and fall of 2021, IFB will support the launch of a new book and offer on-line and personal learning curricula, along with scaling the Invest for Better Circle model.Responsibilities:Manage social media platforms (Instagram, LinkedIn, Facebook, Twitter) for Invest for Better and the upcoming book Activate Your Money.Create and execute marketing campaigns to increase IFB Circle participation, book sales, website visits, and curriculum downloadsAssist with event organization and planningManage the email / website / blog/ calendarBusiness development and fundraising supportWhat you gain:Learn about the latest trends and opportunities in the values-aligned and impact investing fieldsAccess to the Invest for Better expanding networks of female leaders in finance and impactCareer and professional development coachingCreative liberty above and beyond what most internships offer and the opportunity to not only grow but shape a brand and imageFlexible schedule (we dont care when or where you work as long as the brand is growing!)","https://www.linkedin.com/jobs/view/externalApply/2494992445?url=http%3A%2F%2F9nl%2Ees%2FVUT7ot%3Fjz%3D4nmxk10035536AYANYAAVAAAQAAAAAAKQ%26tracking-details%3DYmlkPTAuMjEmYmlkdHlwZT1jcGMmc3JjPUxpbmtlZEluXy1fUHViemVlJmpJZD01MjU2NjZkY2ViYzU2YmQ1YmE3ZDI0NzQ3MzM5NzUwZiZlbWQ9MC4wMCZwaElkPW5teGsmZUJpZD0wLjIx&urlHash=1-Ho&refId=b3764ef5-eb9b-46c0-9518-3b47d31c2282&trackingId=5zlt283IR9dl3KTVLcHDJA%3D%3D&trk=public_jobs_apply-link-offsite",0.0056636463551223174,
