Id,Title,Company,Location,Required Qualifications,Link,Page Rank,
69,"Intern — Content Creation","YouNow, Inc.","New York, NY","About YouNow

YouNow, a live streaming community of over 52 million registered users, is looking for an intern to join our Content Management team. We're a fast moving, fast growing team working on a cutting edge social video service that touches millions of users and content creators and is altering the digital media landscape.

Job Description

YouNow is seeking a content creation intern to join our Content Management team. You will be responsible for a range of tasks and initiatives that support Content Managers, broadcasters, and the YouNow community, with a focus on creating stills and videos representing the YouNow platform experience. The individual in this position will engage with every team at YouNow—Content, Product, Finance, etc—and play a critical role in helping us achieve our company-wide goals.

The ideal candidate is creative, curious, independent, energetic, and eager to learn as much as possible. You will be at the forefront of innovation in the media space, with opportunities to expand your role in the future.

Note: This role is remote.

Responsibilities
Product marketing — Design, execute, test and launch in-app features like virtual gifts
Content marketing — Create content that will be used in influencer acquisition efforts, broadcaster education, community training and more
Social media — Ideate, propose, create, and post content to YouNow's social media handles on Twitter, Instagram, Tik Tok, etc. to educate the YouNow community and motivate users to engage with the platform
Campaigns and competitions — Design creative, goal-oriented campaigns to inspire and drive YouNow's community to create great content
Other — You will be pulled into any number of projects by teams across the company to help execute, proof, and build on the latest and greatest initiatives the team's pursuing
Represent and embody the YouNow brand at the highest standard, as this role will be the first point of contact for valuable future community members


Qualifications
Bachelor's Degree preferred
Self-starter with strong organizational skills and the ability to think strategically
Excellent communication skills, both written and oral
Familiar with simple video editing and graphic design
Adobe Suite, Figma, and Canva a plus
Positive attitude and tenacity
Eagerness to learn and bias to build
Receptive to feedback
Give a sh*t","https://www.linkedin.com/jobs/view/externalApply/2483791379?url=https%3A%2F%2Fgrnh%2Ese%2F46cb90381us&urlHash=LZGs&refId=b3764ef5-eb9b-46c0-9518-3b47d31c2282&trackingId=VCVVViQT%2FXHyZJJQVv8JQw%3D%3D&trk=public_jobs_apply-link-offsite",0.006063211322413367,
53,"Social Media Intern","Peridot","Bellevue, WA","Qualifications
Social Media Management: 1 year (Preferred)
Familiarity With Canva (Preferred)

Full Job Description

** This internship is unpaid, but offers college credit. Candidates seeking to build a portfolio or gain experience in social media are welcome to apply! **

Peridot is looking for a social media intern that can assist our marketing team in sourcing, editing, and publishing/scheduling for several of our social media outlets. As we continue to grow and develop our current team is looking to add supporting roles.

In recent months Peridot has really focused on efforts to increase our social media presence. However in the fast moving industry of startups, we are needing to adapt to keep up with the times. As we have begun to find our brand image and voice on social platforms we need your help in increasing and maintaining our online presence.

Intern Responsibilities
Assist in sourcing images for posts
Simple image editing
Increasing followers and presence on all platforms
Scheduling 3-4 posts a week
Research relevant hashtags for different markets
Liking/replying to comments on posts
This would be an ideal opportunity for a current or recent marketing graduate. The intern will report directly to our head of marketing. This will be a part-time internship to begin, with the opportunity to turn into a paid position. The position is fully remote (not restricted to a certain location) and flexible with hours.

Must have a reliable internet connection and computer. Strong creative writing and editing skills are expected.

About The Company

Peridot is a cannabis e-commerce company that provides cannabis shops with an online ordering and website building software. We have been in the industry for about 2 years now headquartered out of Seattle, WA. We took the necessary steps to create an appealing and user friendly software that focused around feedback from within the industry. From the design, ease of use, unique features and every other aspect of our software, it all stems from ideas and input from those within the cannabis industry. We strive to be the industry leading all-in-one e-commerce software for cannabis shops all around the country.

Website: clickperidot.com
Instagram: instagram.com/on_peridot
Facebook: facebook.com/onperidot
LinkedIn: linkedin.com/company/clickperidot","https://www.linkedin.com/jobs/view/externalApply/2487369828?url=https%3A%2F%2Fht-jobs%2Enet%2F5n0oha4%3Fs%3Dlif&urlHash=klAP&refId=d9e619b6-99b2-4b3c-95cc-20e3fa1e4e80&trackingId=%2BFlJmXC%2BzxVi6QBbebGirg%3D%3D&trk=public_jobs_apply-link-offsite",0.006365722255385552,
3,"Social Media Intern","Chegg Inc.","Providence, RI","Social Media Intern
Remote, United States

As our Social Media Intern, you will leverage our social media platforms to build brand awareness and drive engagement amongst our audiences. You’ll work closely with internal teams to uphold our social media customer service experience, act as the face and voice of our business, and infuse our tone throughout our social media platforms. You will interact daily with our social media communities and play a key role in the development of social media strategies and content.

Responsibilities
Work alongside the Social Media Team to help execute monthly social media strategies
Assist in the growth of the brand through existing social media platforms (Instagram, Twitter, Facebook, LinkedIn)
Develop new ideas and strategies for expansion on new social media platforms (Pinterest, Tik Tok, YouTube)
Interact with followers and potential customers by communicating and answering questions through the company's social pages
Provide creative insight into topics to be included in monthly editorial calendars and seek creative ways to spread our message
Deliver feedback on content performance
Collaborate with the Marketing team, attend relevant meetings, and understand how social fits into broader marketing strategy and goals

Requirements
Majoring in business, marketing, journalism, advertising, public relations, or a communications-related field
Some social media management experience
Extremely strong written and verbal communication skills
Strong customer service experience with proven ability to solve problems
High-level understanding of social media analytics
Excellent attention to detail and a high motivation to learn
Comfortable working with Microsoft Office and Slack
Energetic, creative, resilient, and team-oriented
Entry-level understanding of marketing strategy
Ability to work 40 hours per week
Chegg out our intern program!

http://www.chegg.com/jobs/university

See what it’s like to be a Chegg intern!

https://www.youtube.com/watch?v=Cp1m_ZtOT_4

Learn more about Chegg!

https://www.youtube.com/watch?v=YYHnkwiD7Oo

About Chegg

Chegg puts students first. As the leading connected learning platform, the company makes higher education more affordable, more accessible, and more successful for students. Chegg is a publicly-held company based in Santa Clara, California, and trades on the NYSE under the symbol CHGG. For more information, visit www.chegg.com.

Chegg is an equal opportunity employer

United States Remote: This is a remote position which may be performed anywhere in the United States except for within the state of Colorado.

#LI- MI","https://www.linkedin.com/jobs/view/externalApply/2419651964?url=https%3A%2F%2Fjobs%2Echegg%2Ecom%2Fjob%2FCHEGA0056OWZEEFWH%2F&urlHash=WqtJ&refId=936440e2-d108-4b32-9b58-f010848ed9e6&trackingId=%2BGw3wvq2DjEcHZesPPz%2BFg%3D%3D&trk=public_jobs_apply-link-offsite",0.010006770538874818,
32,"Social Media & Influencer Marketing Intern","Barnes & Noble Education, Inc.","New York, NY","JOB TITLE: Social Media & Influencer Marketing Intern, Barnes & Noble Education, Digital Student Solutions

REPORTS TO: Director, Digital Marketing

Job Summary

Barnes & Noble Education (BNED) is a leading provider of higher education and K-12 educational products and solutions with a mission to serve all who work to elevate their lives through education. Our Digital Student Solutions group designs and develops innovative student-facing products and services to support all users through their learning journey.

Bartleby is a direct-to-student digital learning platform focused homework help (visit us at bartleby.com!) and our fast growing team is currently seeking a a Social Media & Influencer Marketing Intern to help support our social media and influencer marketing strategies.

In this role, you’ll provide hands-on marketing and operational support needed by our company’s social media efforts and influencer partnerships. You’ll also assist with the creation and execution of social media campaigns for our suite of product and help with market research to help the bartleby team better understand the needs of our students. PLUS, you’ll help us evaluate our positioning, features and functionality so we can keep improving our offerings for students like you!

Essential Functions
Assist with the day-to-day support of our social media and influencer programs, including maintaining ongoing communication with influencer talent, aid in the management of influencer tracking and invoicing, and assisting with the creation, scheduling, and posting of social media content.
Support efforts to source influencer partnership opportunities across Instagram, TikTok, and YouTube and research emerging platforms such as Clubhouse.
Assist with measuring and reporting performance of all influencer and social initatives.
Keep an eye on the trends that matter most to students in the digital influencer space and on social media platforms.
Engage with users snd monitor social chatter on bartleby’s social channels, including responding to posts and sharing content on social platforms and monitor social chatter.
Assist with the creation of paid social media campaigns.
Brainstorm campaign ideas with the marketing team.
Participate in feedback sessions on marketing and creative positioning as well as product features and functionality.
Other general administrative tasks, as required.


Requirements/Qualifications
Currently enrolled in an undergraduate program.
Excellent communicator who is organized and motivated to succeed.
An ability to take initiative and employ good judgement.
Posess deep passion for all things social media (including TikTok, Instagram, YouTube, and Facebook) and digital content creation.
Detail-oriented, with excellent writing, editing, and verbal communication skills.
Familiarity with digital communication tools (such as Slack and Zoom) and productivity applications (such as Google Drive/Sheets, Microsoft Word, Excel, and PowerPoint) a must.
Basic knowledge of social media tools (LinkTree, Hootsuite, Canva, Adobe Spark) a plus.
Comfortable collaborating with other team members and senior management within a remote workforce.
Positive and up-beat, with a desire to learn!


Key Relationships
Marketing Manager
Assistant Marketing Manager
Digital Marketing Interns
DSS Marketing Team

Barnes & Noble Education, Inc. is an Equal Employment Opportunity and Affirmative Action Employer committed to diversity in the workplace. Qualified applicants will receive consideration for employment without regard to race, color, religion, sex, national origin, sexual orientation, gender identity, disability or protected veteran status.","https://www.linkedin.com/jobs/view/externalApply/2496050676?url=https%3A%2F%2Frecruiting2%2Eultipro%2Ecom%2FBAR1015BNC%2FJobBoard%2F2190940b-03cb-490b-b727-7ac2d66cf332%2520%2F%2FOpportunityDetail%3FopportunityId%3Dc847ccdc-3e72-435c-ab34-b8cd5b8c5b0c%26utm_source%3DLINKEDIN%26utm_medium%3Dreferrer&urlHash=OYFN&refId=a9f1b4b0-bee6-4ed7-b071-478a37d2cb1a&trackingId=2R%2BdmP%2Fh5p23blGKI6RXCA%3D%3D&trk=public_jobs_apply-link-offsite",0.004507131671982029,
14,"Esports Social Media Intern (Remote) - DBLTAP","Minute Media","New York, NY","Company Description

DBLTAP, an affiliate brand of Minute Media, brings to life every aspect of the game, going from the casual game of FIFA to backstage at the Fortnite World Cup and everything in between. DBLTAP provides fans with breaking news, interviews with pros, fan opinion and the inside track on everything gaming and esports. For more information, check out https://www.dbltap.com/.

Program Summary

The Social Media Intern will have the opportunity to create their own shareable content and distribute it to various Facebook and Twitter pages that we own and manage, which reach millions of users per month.

Throughout the duration of the internship, the intern will focus on the following activities that will help them gain knowledge of the sports marketing industry: creatives, social reports, and one-on-ones with key members of our team. We want the intern to point to this experience with pride in what they completed with our company with specific deliverable metrics that establish the success of their efforts.

This is an unpaid internship that will last three months with an expectation to work 12 hours per week and is designed to give young professionals an educational experience in the industry

Requirements

What You Have
Interests in gaming and esports, with knowledge of popular games such as Fortnite, Call of Duty and Overwatch
A keen eye for what’s popular in gaming
Good writing skills and proper use of grammar
Familiarity with social media platforms
Photoshop and photo editing skills are not required, but are a definite plus!

Benefits

What You’ll Get
Develop your social media skills by contributing to highly-engaged social media pages
Work alongside our social media team remotely and receive regular feedback and guidance
Learn about different areas of the digital media landscape, such as social, editorial, SEO, & video production
Networking & career development opportunities
Opportunity to learn from established industry professionals in esports and gaming
Collaborative team environment & fun company events!
100% remote
College credit offered
Free swag!

Minute Media is committed to creating a diverse and inclusive work environment and is proud to be an equal opportunity employer. All qualified applicants will receive consideration for employment without regard to race, color, religion, gender, gender identity or expression, sexual orientation, national origin, genetics, disability, age, or veteran status.

Not sure that you're 100% qualified but are up for the challenge? We want you to apply!","https://www.linkedin.com/jobs/view/externalApply/2497603121?url=https%3A%2F%2Fwww%2Eminutemedia%2Ecom%2Fcareers%3Fcoref%3D1%2E11%2EpFB_D4F&urlHash=ymQb&refId=3443377e-5c39-4faa-a682-8ed23a6cc751&trackingId=M8wS61JzVJHgSvJS%2BzVNaQ%3D%3D&trk=public_jobs_apply-link-offsite",0.00492095574470876,Id,Title,Company,Location,Required Qualifications,Link,Page Rank,
56,"Social Media Internship","AFL","Duncan, SC","AFL provides industry-leading fiber optic products and services across the globe. Our company was founded in 1984 with a single fiber optic cable and now we manufacture over two thousand products, employ over 5,000 associates and consistently generate annual sales in excess of one billion dollars in revenue. With our commitment to professional growth and employee development, let AFL “Connect” you to your next career opportunity!

Social Media Internship

The Social Media Marketing Intern is responsible for content strategy, developing brand awareness, generating inbound traffic and cultivating leads and sales through the various social media channels. The goal is to increase customer engagement and intimacy, website traffic and revenue by strategically utilizing all aspects of our social media marketing strategy.

Responsibilities
Assist with specific writing assignments (press releases, case studies, collateral research and preparation, website research, etc.)
Prepare documents and assist with website content entry
Work closely on various community-related projects, including creative development, event planning, and writing
Support new product launches including email campaigns, web updates, PR and more
Assist with a variety of special projects as needed
Contribute to the overall success of the Marketing Communications team


Requirements
Pursuing a Bachelor’s Degree in Journalism, Marketing, Communications, Business Administration or related field
At least a sophomore at a 4 year accredited university with a minimum 2.75 GPA. In certain instances, other liberal arts majors may be applicable to this internship.
Computer/Technical skills: Proficient in MS Office Suite (particularly Word and PowerPoint).
Available terms- Summer 2021 (June 1st - August 6th)


Competencies For Success
Detail-oriented with strong writing skills
Ability to multi-task
Ability to work independently, but also work as a contributing member of the Marketing Communications team
Ability to adapt and learn quickly
Basic knowledge of Adobe Photoshop and InDesign is advantageous


Personal Profile Attributes
Ability to work effectively under pressure and in time-sensitive situations; aptitude to coordinate multiple tasks and projects simultaneously; tireless attention to detail; customer-focused and quality-driven.

Equal Opportunity Employer/Protected Veterans/Individuals with Disabilities

The contractor will not discharge or in any other manner discriminate against employees or applicants because they have inquired about, discussed, or disclosed their own pay or the pay of another employee or applicant. However, employees who have access to the compensation information of other employees or applicants as a part of their essential job functions cannot disclose the pay of other employees or applicants to individuals who do not otherwise have access to compensation information, unless the disclosure is (a) in response to a formal complaint or charge, (b) in furtherance of an investigation, proceeding, hearing, or action, including an investigation conducted by the employer, or (c) consistent with the contractor’s legal duty to furnish information. 41 CFR 60-1.35(c)","https://www.linkedin.com/jobs/view/externalApply/2454869847?url=https%3A%2F%2Frecruiting%2Eultipro%2Ecom%2FAFL1002%2FJobBoard%2Fd535bad2-e3ea-c8c8-2fb2-63621892e293%2F%2F%2FOpportunityDetail%3FopportunityId%3D7782e28d-8c4c-49db-83e1-5732f7664422%26utm_source%3DLINKEDIN%26utm_medium%3Dreferrer&urlHash=2dj1&refId=b3764ef5-eb9b-46c0-9518-3b47d31c2282&trackingId=5bKkukOMuoKTk7yZoxGLcA%3D%3D&trk=public_jobs_apply-link-offsite",0.002457994194447875,
90,"Digital Marketing Intern","Sharecare","San Diego, CA","Sharecare is the leading digital health company that helps people -- no matter where they are in their health journey -- unify and manage all their health in one place. Our comprehensive and data-driven virtual health platform is designed to help people, providers, employers, health plans, government organizations, and communities optimize individual and population-wide well-being by driving positive behavior change. Driven by our philosophy that we are all together better, at Sharecare, we are committed to supporting each individual through the lens of their personal health and making high-quality care more accessible and affordable for everyone. To learn more, visit www.sharecare.com.

Job Summary

The digital marketing intern will support the various needs of the team including social media management, email marketing, campaign reporting and collecting data. The intern will work under the direction of the Sr. Digital Marketing Specialist on a variety of demand generation campaigns and assist with sales enablement activities. During this internship, s/he will learn fundamental marketing tactics, gain an understanding of the marketing funnel and buyer's journey and how to effectively utilize an omni-channel marketing approach. This position focuses on the digital aspect of marketing. The intern will learn how to work with a variety of platforms from the MarTech stack. This is a paid internship.

Essential Job Functions
Monitors company's social media channels, captures data, coordinates calendar and schedules posts
Assists with company's newsletter, captures data, and keeps the team organized
Assists the team with developing digital marketing campaigns: landing pages, emails, ads
Monitors campaigns and builds reports/ presentations using PowerPoint and Excel
Coordinates some ad-hoc daily tasks and update a variety of stakeholders on progress
Monitors and coordinates requests for new assets and updates in the tracking system
Specific Skills/ Attributes
Familiar with social media marketing platforms and particularly LinkedIn is strongly desired
Ability to work with MS Office: Excel, PowerPoint, Word, etc. is a must
Basic understanding of the concept of digital marketing
Self-motivated, eager to learn, and proactive
Flexible and able to be responsive when priorities change
Basic understanding of advertising targeting
Basic understanding of email marketing
Qualifications
Last year student or recent graduate BA degree in Marketing, Communication, or related fields
Some marketing experience desired or examples of class projects related to marketing
Equal Opportunity Employer Minorities/Women/Protected Veterans/Disabled","https://www.linkedin.com/jobs/view/externalApply/2493620838?url=https%3A%2F%2Frecruiting%2Eadp%2Ecom%2Fsrccsh%2Fpublic%2FRTI%2Ehome%3Fr%3D5000707015306%26c%3D2176007%26d%3DExternalCareerSite%26rb%3DLINKEDIN&urlHash=TTs-&refId=9e3ec3da-ab54-4e91-b94e-836587afa861&trackingId=984m41nkOFNKif4jE%2BZJ%2Bg%3D%3D&trk=public_jobs_apply-link-offsite",0.004100004878582458,
1,"Marketing & Social Media Intern","Farm.One","New York, United States","This is a paid, flexible, part-time role for a talented, visionary intern looking to build experience in marketing and social media in the food scene.

Founded in 2016, Farm.One is a global pioneer of indoor vertical farming. The company’s mission is to surprise and delight our Members with fresh, local, specialty ingredients and amazing experiences. The job of our marketing is to grow our audience of Members and fans of Farm.One around the world.

Role & Responsibilities
Manage the company’s social media accounts and post content
Brainstorms campaign ideas
Monitor various social media platforms such as Facebook, Instagram, and Twitter
Analyze analytics to gauge the success of campaigns and conduct basic reporting
Understand the overall concept of the company, our brand, customer, product goals, and all other aspects of service
Engage with customers or clients and provides service and/or sales
Provide suggestions to management for improving customer experience on social platforms and internal processes
Learns and becomes proficient on internal software systems


Requirements
Ability to create a real, honest and engaging cover letter or a visual presentation that persuades us you're the right person to take Farm.One's social media to the next level

Benefits
This is an hourly position paying $17/hour
May develop into full-time, permanent position, initial engagement is for 3-4 months","https://www.linkedin.com/jobs/view/externalApply/2473692454?url=https%3A%2F%2Fwww%2Ecareershbc%2Ecom%2Fen%2Fjob%2F210001AH%2FSocial_Media_Intern%3Fsrc%3DSNS-102&urlHash=Pl0Z&refId=936440e2-d108-4b32-9b58-f010848ed9e6&trackingId=J5hRcseJZZOEF%2Fi3Uo670w%3D%3D&trk=public_jobs_apply-link-offsite",0.01094812381726909,
