title,company,location,requirements,link
Policy Research Intern,Panasonic North America,"Denver, CO","Panasonic – Policy Research Intern

Does the idea of working at the intersection of next gen software innovation, advanced data analytics, and consumer-experience design excite you? Do you thrive in a team that focuses on solving complex problems in a fast-paced environment? Do you want to build new products focused on democratizing connected vehicle data to improve roadway safety and help save lives? Then apply now and come be a part of the amazing team creating an intelligent digital mesh for the future of the mobility ecosystem!

Click here to learn more about how Panasonic is creating a better life, a better world.

Watch this video to see how our employees are shaping the technologies that move us.

What You’ll Get To Do

As a Strategy and Policy Intern, you will work closely with the Head of Strategy to research and track policy that will help drive our business forward! Activities will include conducting policy research on VMT fees, road usage charging, and relevant topics; drafting briefs, talking points, reports and other materials in collaboration with internal policy and subject matter experts; attending (virtual) meetings, events, and legislative hearings; track daily news reports that are relevant, participating in internal meetings and attending external policy meetings to advance projects and positions.
Conduct policy research, tracking database, and attend (virtual) roundtables and hearings
Collaborate with the RUC team to develop policy positions and business strategy
Consolidate and present findings to internal team stakeholders

What You’ll Bring

Education & Experience:
Proven interest in and understanding of transportation and technology policy
Knowledge or experience in writing, editing, and policy research
Effective organizational and communication skills
Ability to work productively in a team environment as well as under minimal supervision, taking the initiative to ask questions as needed

Bonus
Enrolled in a graduate program in public policy, political science, economics, business, public affairs, or a related field
Previous internship experience in transportation technology, policy research or at a think tank

Competencies
Motivated and hard worker with a desire to support solutions to complex business problems
A true team player – flexible about your role and ready to do what it takes to get things done
Insatiable curiosity and lifelong learner
Building good written, presentation, verbal, and visual communication skills
NOTE: Internship pay rates are $15/hr to $25/hr, based on the class level (Freshman – Senior) of the candidate and whether the candidate is in an undergrad or graduate school program
NOTE: Interns must be currently enrolled in classes through the duration of the Summer 2021 program in order to be eligible to participate
Panasonic is proud to be an Equal Opportunity/Affirmative Action employer. All qualified applicants will receive consideration for employment without regard to race, color, religion, gender identity, sex, sexual orientation, national origin, disability status, protected veteran status, and any other characteristic protected by law or company policy. All qualified individuals are required to perform the essential functions of the job with or without reasonable accommodation. Pre-employment drug testing is required for safety sensitive positions or as may otherwise be required by contract or law. Due to the high volume of responses, we will only be able to respond to candidates of interest. All candidates must have valid authorization to work in the U.S. Thank you for your interest in Panasonic Corporation of North America.

#LDS2",https://www.linkedin.com/jobs/view/externalApply/2458237849?url=http%3A%2F%2Fapp%2Ejobvite%2Ecom%2FCompanyJobs%2FCareers%2Easpx%3Fc%3DqvJaVfw3%26j%3DohKYefwX%26k%3DApply%26su%3DfqqaVfwF%26s%3DLinkedIn&urlHash=qRt1&refId=e1945193-2784-4094-abf4-cf3b079c7a69&trackingId=SFNH1CXkLT4IG0SxtjfcYw%3D%3D&trk=public_jobs_apply-link-offsite
"Policy, Advocacy, and Research Intern",Scenic America,"Washington, DC","Overview:We are seeking interns to assist us with research, analysis, drafting of written materials, and monitoring activities of the executive and legislative branches of government on scenic conservation issues. Scenic America is the only national 501(c)(3) nonprofit organization dedicated solely to preserving and enhancing the visual character of America's communities and countryside. We accomplish this mission through national advocacy efforts and technical assistance services, local and national projects, and the support of our state affiliates.For more information about Scenic Americavisit our website atwww.scenic.org.Responsibilities:Conduct research and track and analyze legislation on scenic conservation topics such as scenic byways and gateways, parks and open spaces, mitigating visual impacts of overhead wires, promoting beautiful highways, preserving community character, state legislation relating to scenic conservation, and relatedappropriationsWork to update and verify inventories of current state laws and local ordinances regarding above scenic conservationtopicsSupport the drafting and compilation of federal legislation, state legislation, and localordinancesSupport the drafting of memoranda, policy briefs, fact sheets, blog articles, and background papers on issues relating to scenicconservationAttend meetings, Congressional hearings, and other events related to scenic conservation policy and subsequently brief Scenic America staffPerform occasional administrative and clerical tasks such as assisting with mailings, processing checks and creating acknowledgment letters, scanning documents into a digital archive and light office cleaningdutiesAdditional tasks as assigned by Scenic America staffQualifications:Strong attention to detailExcellent research skillsExcellent written, oral, and interpersonal communication skillsMotivation to work on substantive scenic conservationtopicsKnowledge of Microsoft Word and ExcelMust possess excellent judgment anddiscretionDemonstrated ability to organize, prioritize, and complete workindependentlyPhysicaldemands:Sittingforextendedperiods atadeskand usingaprovideddesktoporlaptopcomputerOccasionallylifting and carrying upto15poundsAbilitytousepublictransportation toattendvariouseventsaroundWashington.Location:Remoteinternshipcandidates will be consideredand are welcome to apply. Interns who are available to join us in Washington will work in Scenic Americas offices at 727 15thStreet NW.",https://www.linkedin.com/jobs/view/externalApply/2488089383?url=http%3A%2F%2F9nl%2Ees%2FVUT7ot%3Fjz%3D4nmxk41545506AYANYAAVAAAQAAAAAAKQ%26tracking-details%3DYmlkPTAuMjEmYmlkdHlwZT1jcGMmc3JjPUxpbmtlZEluXy1fUHViemVlJmpJZD1kNTY5OTE1ZDMyYzI3NWM0MTIyNDE3NjhkY2VkYTY2YyZlbWQ9MC4wMCZwaElkPW5teGsmZUJpZD0wLjIx&urlHash=pS7O&refId=e1945193-2784-4094-abf4-cf3b079c7a69&trackingId=kpgwfvYcVFdf65egkaRLsA%3D%3D&trk=public_jobs_apply-link-offsite
HBCU Policy & Advocacy Intern - Remote,Mercy Corps,United States,"NOTE: Your application will only be considered if you are a current student or recent graduate of a Historically Black College or University (HBCU).

INTERN WORKSITE LOCATION: Remote
DATES OF INTERNSHIP: May 2021 - August 2021
HOURS PER WEEK: Full-Time: 30 hours/week
INTERN SUPERVISOR & CONTACT INFORMATION: Director of Policy and Advocacy II Senior Policy Advisor II Policy & Research Assistant
FUNDING AVAILABLE FOR THE INTERNSHIP: $2600/month stipend

Mercy Corps Responsibilities

For the duration of this internship assignment the intern will receive:
Training and supervisory support
Access to Mercy Corps online tools
All other tools, materials and communication requirements for this project

Intern Responsibilities

Intern will remain responsible for all costs associated with:
Laptop for working remotely
Accommodation, travel and living expenses

Project Description

Mercy Corps is a leading global organization powered by the belief that a better world is possible. In disaster, in hardship, in more than 40 countries around the world, we partner to put bold solutions into action — helping people triumph over adversity and build stronger communities from within.

We Work To Inform And Shape Policy In a Number Of Ways, Including

The Mercy Corps Policy and Advocacy team serves as the main interface between Mercy Corps and external partners (particularly the US government) on issues of policy. The team seeks to advance Mercy Corps’ values and interests by promoting policies that support our mission.
Congressional Advocacy: direct meetings with key congressional offices, participation in briefings and hearings, review and commenting on draft legislation, active participation in discussions related to the foreign aid budget, and linking Members of Congress who are travelling with our teams in the field.
Administration Advocacy: meetings with Administration officials, ongoing communication with key partner agencies in the USG, participation in joint consultations and briefings together with partner NGOs in DC.
Joint work with NGO partners: active participation in Interaction working groups and other coalition efforts organized in DC on priority issues or countries for Mercy Corps, drafting of joint documents, organizing joint lobby days on Capitol Hill.
Organizing DC visits for visiting Mercy Corps field staff: scheduling meetings for visiting staff and accompanying them to ensure adequate preparation and follow up to these visits.
Publications: preparing and disseminating policy briefs on key issues, circulating information on Mercy Corps programs to key policy makers, participating in joint documents and sign-ons with other NGOs, working with field staff to draft joint articles on policy-related issues for publication.

Areas Of Focus May Include

The intern(s) will support and participate in the work of the Policy and Advocacy through writing and research.
Response to humanitarian crises in Syria, Central African Republic and South Sudan
Support the team’s strategic analysis and advance agency priorities with Congress and the Administration
Improving aid effectiveness in fragile environments, including limiting the securitization of US foreign aid
Promoting effective food security policies and food aid reform, including implementation of the Global Food Security Act and USAID’s resilience agenda
Defending foreign aid budgets in an era of fiscal austerity
Country/region-specific priorities (e.g. Syria, Iraq, the Lake Chad Basin) or other policy team or agency priorities, such as engaging with Mercy Corps’ global team

Learning Objectives
Understanding the linkage between international policy, programming and outcomes in the humanitarian and development field
Understanding core elements of the US policy process, including the roles of Congress, USAID, State, and the White House in development policy-making
Knowledge of key qualitative and quantitative resources related to US development policy
Understanding specific policy issues, as listed above, or according to the interests of the intern

Deliverables

The Intern will support the PA team through the following activities:
Conduct policy and practice research in support of Mercy Corps advocacy initiatives
Assist in drafting advocacy documents such as reports, briefing notes, talking points or factsheets on relevant policy issues
Attend meetings and hearings of interest to Mercy Corps and report back on key issues
Review external and internal reports and publications and summarize relevant findings
Assist in communicating policy and advocacy updates to the broader Mercy Corps community through Mercy Corps’ intranet system, weekly newsletter, and website

The Ideal Candidate

The Policy and Advocacy is seeking an intern to support the breadth of the team’s portfolio. If qualified, the intern may have the opportunity to specialize in one or more areas, though engagement in all areas will be expected.

All Interns Should Have The Following Core Qualifications
University degree in progress or recently completed (within 1 year) in relevant discipline in International Relations, Public Policy or related field
Interest in humanitarian, development, and conflict prevention issues
Excellent writing and editing skills and the ability to summarize and communicate research results clearly
Experience conducting research and analysis from primary and secondary data sources
Ability to multi-task and prioritize in a fast-paced work environment
Solid computer skills: must be able to work effectively and accurately with MS Word, Excel, Google applications, and email
Flexible work attitude: able to work productively in a team environment and independently or with limited supervision

Preferred Qualifications
Previous Capitol Hill experience or knowledge of Congressional processes
Familiarity or experience conducting policy analysis
Working towards a Masters Degree in relevant field
Other specific thematic expertise in any of the areas of focus listed above
Mercy Corps interns represent the agency both during and outside of work hours and are expected to conduct themselves in a professional manner and respect local laws, customs and Mercy Corps policies, procedures, and values at all times and in all in-country venues.

Mercy Corps Diversity Statement

Achieving our mission begins with how we build our team and work together. Through our commitment to enriching our organization with people of different origins, beliefs, backgrounds, and ways of thinking, we are better able to leverage the collective power of our teams and solve the world’s most complex challenges. We strive for a culture of trust and respect, where everyone contributes their perspectives and authentic selves, reaches their potential as individuals and teams, and collaborates to do the best work of their lives.

We recognize that diversity and inclusion is a journey, and we are committed to learning, listening and evolving to become more diverse, equitable and inclusive than we are today.

Equal Employment Opportunity Statement

Mercy Corps is an equal opportunity employer that does not tolerate discrimination on any basis. We actively seek out diverse backgrounds, perspectives, and skills so that we can be collectively stronger and have sustained global impact.

We are committed to providing an environment of respect and psychological safety where equal employment opportunities are available to all. We do not engage in or tolerate discrimination on the basis of race, color, gender identity, gender expression, religion, age, sexual orientation, national or ethnic origin, disability (including HIV/AIDS status), marital status, military veteran status or any other protected group in the locations where we work.

Safeguarding & Ethics

Mercy Corps is committed to ensuring that all individuals we come into contact with through our work, whether team members, community members, program participants or others, are treated with respect and dignity. We are committed to the core principles regarding prevention of sexual exploitation and abuse laid out by the UN Secretary General and IASC. We will not tolerate child abuse, sexual exploitation, abuse, or harassment by or of our team members. As part of our commitment to a safe and inclusive work environment, team members are expected to conduct themselves in a professional manner, respect local laws and customs, and to adhere to Mercy Corps Code of Conduct Policies and values at all times. Team members are required to complete mandatory Code of Conduct elearning courses upon hire and on an annual basis.

Mercy Corps Headquarters: 45 SW Ankeny Street, Portland, Oregon 97204

Mercy Corps: https://www.mercycorps.org/

Students interested in this internship should submit a resume and a cover letter. In your letter, you are encouraged to discuss any experiences related relevant to the projects outlined. You may wish to describe your career interests (specifically as they relate to policy and advocacy, humanitarian aid, or development) and discuss your previous work and educational experiences demonstrating these interests. A short additional writing sample (under five pages) is preferable, but not required.",https://www.linkedin.com/jobs/view/externalApply/2481524103?url=https%3A%2F%2Fapp%2Ejobvite%2Ecom%2FCompanyJobs%2FCareers%2Easpx%3Fk%3DApply%26j%3Do9zJefwp%26s%3DLinkedInLimited&urlHash=TgiZ&refId=e1945193-2784-4094-abf4-cf3b079c7a69&trackingId=Og6ptNbIQFr0oLC%2ByC1%2F5A%3D%3D&trk=public_jobs_apply-link-offsite
"2021 Summer Intern, Advocacy",Consumer Reports,"Washington, DC","The Opportunity

Our interns work with our amazing staff to fight for a fairer, safer, more just marketplace for consumers nationwide. You’ll dive into some of the most crucial policy questions of the day, from sustainability, self-driving cars, and student debt to credit scoring, data privacy, and broadband access. Spend your summer developing skills that will serve your career goals while engaging in work that promotes evidence-based public policy.

As a Consumer Reports intern, you’ll stand with us as we stand alongside consumers. You’ll work with us as we empower consumers with the knowledge they need to make free, informed, confident choices in the face of a complex marketplace. It’s important work and it’s been our thing for more than 80 years.

To get this work done, we are an independent (we take no ads!), nonprofit, social enterprise dedicated to celebrating and supporting our driven and diverse team. We look forward to having you join us in our mission to create a fairer, safer, and healthier world for all consumers.

Internships are available to current full-time law and master degree students with a GPA of 3.0 or higher.
The program runs for 12 weeks between June and August of 2021, with some flexibility to accommodate school schedules
This is a paid internship, based on an hourly rate
Because of the ongoing COVID-19 pandemic, positions will be remote until further notice
Please specify in your application if you are seeking, and your school offers, academic credit for internships. Include the contact information for your academic Institution representative
Also specify if you have particular interest or expertise in one of the issue areas (financial services, telecommunications, etc.) listed below, as you may be assigned to a particular policy expert
Internships are filled on a rolling basis. It is suggested that you apply as soon as possible

What You Will Do
Support campaigns and policy efforts to improve consumer rights in a variety of fields, including financial services, telecommunications, health care, energy, technology, and auto and product safety.
Hone communications and analytic skills through drafting fact sheets, infographics, data analysis, research papers, blogs, and social media communications.
Attend (virtually) hearings, meetings and other events to track the latest legislative and policy developments on Capitol Hill and other government and policy circles.

About You
Law students and public policy majors preferred
Self-starter interested in a variety of policy topics
Ability to multi-task
Strong writer able to turn around projects quickly
Data presentation skills
Commitment to serving the public interest
Social media experience a plus

Diversity, Inclusion, and Belonging at Consumer Reports

At CR, we believe our continued ability to understand and advance the interests of all American consumers is possible only if our staff fully reflects the full cultural, racial, and ethnic diversity of those consumers.

Consumer Reports is committed to equal employment opportunity regardless of race, color, ethnicity, ancestry, religion, national origin, gender, sex, gender identity or expression, sexual orientation, age, citizenship, marital or parental status, disability, veteran status, or other class protected by applicable law. We are proud to be an equal opportunity workplace.",https://www.linkedin.com/jobs/view/externalApply/2464218006?url=https%3A%2F%2Fjobs-consumers%2Eicims%2Ecom%2Fjobs%2F3874%2F2021-summer-intern%252c-advocacy%2Fjob&urlHash=3L9J&refId=e1945193-2784-4094-abf4-cf3b079c7a69&trackingId=yDGR6LzeTRHf0jLfNAs11A%3D%3D&trk=public_jobs_apply-link-offsite
