title,company,location,requirements,link
"International Public Policy, Intern",Amazon,"New York, NY","Description

Work hard, have fun, and make history with Amazon Public Policy. The International Public Policy Intern will join a growing, dynamic team and be able to directly enhance Amazon’s advocacy on a broad range of public policy issues in Europe, the Middle East, India, and Asia Pacific regions . Like our business interests, our policy issues are broad, forward-thinking, and driven by what is best for our customers.

Working with the International Public Policy Central team in Seattle, the International Public Policy Intern will help develop Amazon’s positions on key issues, research policy issues, and build and manage internal tracking and reporting systems.

The International Public Policy Intern will work collaboratively with the team to ensure alignment between business priorities and public policy goals. The International Public Policy Intern will work closely with team members to assess government activities of importance to Amazon, anticipate potential government actions, and develop mitigation or enhancement strategies and positions to assist in our external advocacy efforts, outreach programs, and key initiatives.

The position will be based in Seattle, WA (with work from home flexibility), and will be a part-time position running through the spring 2021 semester.

Focus and Deliverables
Work collaboratively with the International Public Policy team on a wide range of projects to support Amazon’s core business priorities and public policy goals;
Anticipate challenges/obstacles our business could face as the public policy landscape evolves;
Help coordinate external advocacy efforts, outreach programs, and initiatives in concert with business objectives.

Basic Qualifications
BA/BS required
Currently enrolled in a Law degree or relevant Master’s degree program
Work, internship, or other leadership experience in a professional environment, with an emphasis and demonstrated interest in international public policy and government relations work
A keen understanding of legislative and regulatory policy process as well as the technology industry
Strong written and verbal communication skills and experience creating and effectively delivering factual, relevant, and easily understandable talking points and other messaging
Ability to maintain the highest personal levels of ethical conduct, confidentiality, and integrity
Preferred Qualifications
Highly effective oral, written, and interpersonal communication skills; demonstrated ability to effectively and comfortably interact at all corporate and political levels
Self-starter who can take general direction and produce specific results
Ability to identify and understand key technical aspects pertaining to corporate operations in legislative and regulatory proposals, understand business implications, and synthesize policy documents for internal and external customers
Ability to influence, negotiate with, and persuade others, with the ability to intelligently build a course of action, analyze trade-offs, and make recommendations even in ambiguous situations
Amazon is committed to a diverse and inclusive workplace. Amazon is an equal opportunity employer and does not discriminate on the basis of race, national origin, gender, gender identity, sexual orientation, protected veteran status, disability, age, or other legally protected status. For individuals with disabilities who would like to request an accommodation, please visit https://www.amazon.jobs/en/disability/us.


Company - Amazon.com Services LLC
Job ID: A1301379",https://www.linkedin.com/jobs/view/externalApply/2431568298?url=https%3A%2F%2Fwww%2Eamazon%2Ejobs%2Fjobs%2F1301379%2Finternational-public-policy-intern%3Fcmpid%3DSPLICX0248M%26utm_source%3Dlinkedin%2Ecom%26utm_campaign%3Dcxro%26utm_medium%3Dsocial_media%26utm_content%3Djob_posting%26ss%3Dpaid&urlHash=uJEA&refId=e1945193-2784-4094-abf4-cf3b079c7a69&trackingId=Mn0iMc%2FtaI4NnVqnENiFQg%3D%3D&trk=public_jobs_apply-link-offsite
Policy and Thought Leadership Intern,The Economist,New York City Metropolitan Area," The Economist Intelligence Unit’s (EIU) Public Policy Consulting team helps clients create impact on the policy issues that matter most, using evidence-based research and economic methods.
 We work collaboratively with our clients to help them better understand the economic, social and environmental impacts of policy and regulation, behavior change, and other scenarios.

Our work typically involves:
Economic impact analysis
Cost-benefit analysis
Econometrics and other data analytics
Scenario analysis
Qualitative analysis
Country and city benchmarking

Currently, we are seeking a full-time intern for our New York or Washington DC offices.
 As an Intern in the Public Policy Consulting team, you will work closely with experienced individuals from both inside The Economist Intelligence Unit, and our clients, to assist in the delivery of impactful, evidence-based programs that support client goals in policy advocacy, thought leadership, and internal decision-making.

How you will contribute:
Support multiple project activities including literature reviews, data audits, quantitative analysis and expert interviews
Participate in and prepare for client meetings
Develop final deliverables for projects including PowerPoints and reports
Support proposal and other business development activities

The ideal skills for this role are:
Candidates currently enrolled in a master’s degree program or recent graduates with 1-2 years of work experience are preferred
Intellectual curiosity with a strongly developed analytical mindset
An ability to work with designated project plans on set deadlines while demonstrating good time management skills
Quantitative research experience a plus
Strong written and verbal communication skills to effectively interact with clients and internal stakeholders",https://www.linkedin.com/jobs/view/externalApply/2392368787?url=https%3A%2F%2Fcareers-economist%2Eicims%2Ecom%2Fjobs%2F7228%2Fpublic-policy-intern%2Fjob%3Fhub%3D6%26mobile%3Dfalse%26width%3D1200%26height%3D500%26bga%3Dtrue%26needsRedirect%3Dfalse%26jan1offset%3D-300%26jun1offset%3D-240%26mode%3Djob%26iis%3DJob%2BBoard%26iisn%3DLinkedIn&urlHash=j1KK&refId=e1945193-2784-4094-abf4-cf3b079c7a69&trackingId=K5oc3u%2FjVRnnGdIBMgbU7g%3D%3D&trk=public_jobs_apply-link-offsite
Policy Internship,Drug Policy Alliance,"New York, NY","About The Drug Policy Alliance

The Drug Policy Alliance (DPA) is the leading organization in the U.S. promoting alternatives to the war on drugs. We envision a just society in which the use and regulation of drugs are grounded in science, compassion, health, and human rights; in which people are no longer punished for what they put into their own bodies; and in which the fears, prejudices, and punitive prohibitions of today are no more.
DPA has grown to more than 40 staff in New York, California, New Mexico, and Washington, DC; an annual operating budget of approximately $12 million, 12,000 dues-paying members and more than 170,000 online subscribers.  It has a solid track record of success at the local, state, and federal levels and consistent visibility in prominent media and policy circles.
We are an equal opportunity employer and value a diverse workforce and an inclusive culture. We encourage applications from all qualified individuals without regard to race, color, religion, gender, ethnicity, personal appearance, political affiliation, family responsibility, sexual orientation, gender identity or expression, age, national origin, marital status, citizenship, disability, veteran status and record of arrest or conviction.
We are always seeking creative, innovative people to work with us in our fight to end the war on drugs. We are particularly interested in hiring people who have been adversely affected by the war on drugs. Join us!
Summer Internship Program
DPA's summer internship program is designed to provide an integrated and educational experience for those interested in learning about drug policy, and regulatory and governmental practices first-hand. Our organizational ethos is to tackle racism directly and work to address the harms of the drug war that are overwhelmingly affecting low-income communities and people of color.
Over the course of 9-weeks, our interns will join our passionate, diverse, and creative staff in an engaging on-the-job learning experience at a critical time for the drug policy reform movement. In addition, they will spend time with leaders from across the organization to learn about their careers and DPA's programmatic and institutional work.
Below is an overview of the intern opportunities in our in our Policy department.
Policy-- Interns conduct research, draft briefs, fact sheets, and other materials in on a wide range of drug policy reform issues; participate in internal and external meetings; analyze state and/or federal legislation; assist in planning meetings and convenings; conduct outreach to partners and allies; and perform various administrative functions. Internships are available with our California Policy Office, New Mexico Policy Office, and Office of National Affairs (working on federal policy).
Qualifications

Applicants must be enthusiastic about the organization's agenda, mission, and vision with solid written, communication, and interpersonal skills. The ideal candidates are independent, detail-oriented, and highly organized, with a proactive work style. Experience with Microsoft Office Suite is preferred. Candidates must also be open to evolving responsibilities.

Hours

Minimum of 24 to 40 hours per week depending on role.

Compensation
$15/hour for undergraduate students who do not receive school funding, school credit or a fellowship opportunity.
Application Process

Please submit your cover letter, resume, and brief writing sample using the links below. We will only contact candidates who are under consideration. No phone calls, please.
The deadline to apply for summer internships is April 30, 2021. Decisions are made on a rolling basis.",https://www.linkedin.com/jobs/view/externalApply/2488565547?url=http%3A%2F%2Fwww%2Elinkup%2Ecom%2Fdetails%2Ff686edabeccff38e12ec76f6a02dbcee&urlHash=WnQm&refId=e1945193-2784-4094-abf4-cf3b079c7a69&trackingId=P8MH4cj4W3JBT94XRP3PeA%3D%3D&trk=public_jobs_apply-link-offsite
Public Policy Internship (Fall 2021),Tesla,"Washington, DC","Disclaimer: This position is expected to start around August or September 2021 and continue through the entire Fall term (i.e. through December/January) or into early Spring 2022 if available. We ask for a minimum of 12 weeks, full-time, for most internships. Please consider before submitting an application.

International Students: If your work authorization is through CPT, please consult your school before applying. You must be able to work 40 hours per week. Many students will be limited to part-time depending on their academic standing.

Internship Program at Tesla

The Internship Recruiting Team is driven by the passion to recognize emerging talent. Our year around program places the best students in positions that they will grow both technically and personally through their experience working closely with their Manager, Mentor, and team. We are dedicated to providing an experience that allows for the intern to experience life at Tesla by given them projects that are critical to their team’s success.

Instead of going on coffee runs and making copies, you’ll be seated at the table making critical decisions that will influence not only your team, but the overall achievement of Tesla’s mission.

Locations
Washington, D.C. or Palo Alto, CA

About The Team

This internship will provide opportunities to work with the North American Public Policy & Business Development team on policy and business development, market analysis, and strategic engagement. The incumbent will have the opportunity to learn and grow, working across the team to support its full range of efforts, with a particular focus on renewable energy and EV charging policy, public utility regulation, and renewable energy market opportunities.

What To Expect

As the Policy and Business Development Intern, you’ll gain experience in the following areas:

Gain breadth and depth of knowledge of regulatory policy issues facing Tesla, with a focus on EV charging, renewable energy generation, storage, permitting and electricity rates regulations.
Analyze policy initiatives for their impacts on Tesla
Support the development of new policy and business initiatives
Collaborate with internal and external stakeholders

Requirements

Currently pursuing a graduate or undergraduate degree in relevant field such as Political Science, Public Policy, International Studies, Economics or Business Administration
Able to make 3-6 month commitment
Capable of working in a fast paced and always changing environment
Capable of working remotely with a high degree of productivity
Self-starting and solutions oriented
A strong team player",https://www.linkedin.com/jobs/view/externalApply/2369696529?url=https%3A%2F%2Fwww%2Etesla%2Ecom%2Fcareers%2Fsearch%2Fjob%2Fpublic-policy-internship-fall-2021-80322%3Fsource%3DLinkedIn&urlHash=o-2l&refId=e1945193-2784-4094-abf4-cf3b079c7a69&trackingId=1aS7%2FF89tqaCdqWDpzrvIg%3D%3D&trk=public_jobs_apply-link-offsite
Policy Internship (CCAI Fall 2017),Congressional Coalition on Adoption Institute,"Washington, DC","A key component to the success of any non-profit organization is its people. As such, it’s no surprise that interns are essential to the success of the Congressional Coalition on Adoption Institute (CCAI), a leader in adoption and foster care policy on Capitol Hill and across the nation.

Come intern with an organization that makes a national impact and learn about policy and Capitol Hill. Our interns have the opportunity to work with CCAI staff on projects that directly affect the impact of our organization. Whether planning events, fundraising, communicating through social media, engaging Capitol Hill staff and researching legislation and policy, our interns leave CCAI knowing they were able to make a difference in promoting CCAI’s mission of children in families.

Responsibilities
Policy interns research and stay informed of the current adoption and foster care legislation, reports and studies; correspond with and support congressional staff; and assist CCAI’s Director of Policy in planning, outreach, and logistics for policy events and legislative briefings on Capitol Hill.
Recommended Majors: Law, Public Policy",https://www.linkedin.com/jobs/view/externalApply/2487316933?url=https%3A%2F%2Fwww%2Ecollegerecruiter%2Ecom%2Fjob%2F406595170%3Fr%3D1%26source%3D101&urlHash=7hrc&refId=e1945193-2784-4094-abf4-cf3b079c7a69&trackingId=EYXnDIugXhtr%2Fz9kcw%2FeLA%3D%3D&trk=public_jobs_apply-link-offsite
Humanitarian Policy and Advocacy Internships,International Rescue Committee,"New York, NY","Requisition ID: req13749

Job Title: Humanitarian Policy and Advocacy Internships

Sector: Advocacy & Government Affairs

Employment Category: Intern

Employment Type: Part-Time

Open to Expatriates: No

Location: New York, NY HQ USA

Job Description

The International Rescue Committee’s (IRC) Policy and Advocacy Team advocates for protecting and aiding refugees, the displaced, asylum-seekers, and other victims of conflict. The Policy and Advocacy team carries out, coordinates, and provides guidance on a wide variety of domestic and international advocacy initiatives, including expert briefings, public outreach and education, and communication with the media. IRC advocates represent the IRC with legislative and executive branches of the US government, the media, NGO partner agencies and coalitions, the United Nations, and international financial institutions such as the World Bank. Learn more about the IRC’s Policy and Advocacy team here: https://www.rescue.org/policy.

Scope

The Policy and Advocacy team seeks two students for the role of Humanitarian Policy and Advocacy Intern.

One intern is being sought to work with the Humanitarian Aid team; topics that may come up during the internship include solutions to protracted displacement, the Sustainable Development Goals, World Bank financing for refugee hosting nations, and broader humanitarian system and aid reforms.

A second intern is being sought to work with the International team; topics that may come during the internship include a range of humanitarian crises and conflicts, such as those in Yemen, Syria, Venezuela, and the Sahel among others, as well as global trends and themes related to civilian protection, COVID-19 and humanitarian responses.

Due to COVID-19, this internship will be remote. Despite a remote environment, the intern can nonetheless expect to be fully embedded within the P&A team through a close supervisory relationship with regular check-in meetings and participation in team-wide meetings. The IRC will provide a laptop for internship use in the case that interns do not have access to a computer.

Responsibilities
Conduct research on humanitarian issues relevant to the portfolio, such as humanitarian aid effectiveness and reform, ongoing conflicts and crises, and new policy developments and provide written analysis to staff.
Produce a weekly tracker of press articles, reports and upcoming meetings, events and hearings related to select conflicts/crises or humanitarian aid.
Attend meetings and events with and on behalf of senior staff, including NGO coalition meetings and congressional hearings, take detailed notes and report back.
Draft, edit and format policy and advocacy materials such as talking points for meetings, briefs and reports for distribution to key stakeholders.
Other duties and tasks as assigned related to research, writing, analysis, and advocacy.
Learning Outcomes
Will gain experience in policy writing with an advocacy focus.
Will learn about complex system of factors affecting policy at international and national levels.
Will have an opportunity to observe and interact with different NGO partners and IRC staff involved in advocacy and policy decisions.
Will network within the NGO community.
Will gain a deeper understanding of specific humanitarian crises and the NGO, UN and governmental responses.
Will learn about process of coordinating advocacy across an international NGO.
Requirements

Qualifications
Available to work a minimum of 20 hours per week, for a minimum of 14 weeks between June and September.
Currently enrolled in an undergraduate or graduate program.
Ideal Qualifications
Solid writing, editing, and research skills with a focus on details.
Interest in and familiarity with humanitarian aid, refugee issues, and humanitarian crises.
Ability to multi-task and prioritize in a fast-paced work environment.
Solid computer skills: able to work effectively and accurately with MS Outlook, Word, Excel, email, and internet applications.
Flexible work attitude: able to work productively in a team environment as well as under minimal supervision, taking the initiative to ask questions as needed.
Application Requirements

To apply, please submit a cover letter, resume and 2-4 page writing sample, preferably on a topic relating to global refugee issues, humanitarian aid or conflict and crisis. Please clearly indicate if you have a preference for an internship with the Humanitarian Aid team or with the International team in your cover letter.

Applications will be considered on a rolling basis until the position is filled. Due to the high volume of applications, only applicants selected for an interview will be contacted.

Logistics
Please note that this internship is unpaid but includes a reimbursement of up to $25 per day.
The IRC and IRC workers must adhere to the values and principles outlined in IRC Way - Standards for Professional Conduct. These are Integrity, Equality, Service, and Accountability. In accordance with these values, the IRC operates and enforces policies on Beneficiary Protection from Exploitation and Abuse, Child Safeguarding, Anti Workplace Harassment, Fiscal Integrity, and Anti-Retaliation.",https://www.linkedin.com/jobs/view/externalApply/2468073817?url=https%3A%2F%2Frescue%2Ecsod%2Ecom%2Fux%2Fats%2Fcareersite%2F1%2Fhome%2Frequisition%2F13749%3Fc%3Drescue%26source%3DLinkedInA&urlHash=BJBL&refId=e1945193-2784-4094-abf4-cf3b079c7a69&trackingId=37hq3uiBhVWM%2FWPtE6cq1w%3D%3D&trk=public_jobs_apply-link-offsite
Government Relations Graduate Intern,Boston Children's Hospital,"Boston, MA","At Boston Children’s Hospital, the quality of our care – and our inclusive hospital working environment – lies in the diversity of our people. With patients from local communities and 160 countries around the world, we’re committed to reflecting the spectrum of their cultures, while opening doors of opportunity for our team. Here, different talents pursue common goals. Voices are heard and ideas are shared. Join us, and discover how your unique contributions can change lives. Yours included.

The Office of Government Relations works with policy decision-makers at the local, state, and national levels to uphold the hospital’s mission of providing exceptional clinical care, research, and training for pediatric providers. We work with our partners within the legislature and throughout the community to develop and advocate for policy solutions to keep young people safe and healthy.

The Government Relations (Graduate) Intern Will Be Responsible For
Supporting the Government Relations team to advance hospital legislative priorities, through direct lobbying of legislators, grassroots organizing and leading high impact projects to advance bills related to pediatric healthcare access, social determinants of health and health related social needs, racial equality, social justice and behavioral health.
Coordinating advocacy events at the hospital and State House including annual lobby days and full day advocacy boot camp sessions.
Facilitating child health advocacy trainings with support from the State Government Relations Manager, to empower patients, families, and staff to share their stories, advance hospital advocacy priorities to improve child health.
Developing policy briefings, fact sheets, talking points, and written testimony tailored for stakeholders such as state elected officials, legislative staff and hospital leadership (CEO & VP of Government Relations)
Producing Children's Advocacy Network grassroots newsletter and ad hoc communications reaching 3000+ individuals by coordinating with dpt. staff to establish topics, write content, manage CRM platform, and design layout.
Collaborating with staff and interest groups, including RNs, social workers and medical residents across the hospital to support advocacy efforts.
Accompanying Government Relations team to relevant legislative, community and coalition events.
Creating visually appealing infographics for digital media advocacy.

To Qualify, You Must Have
Current enrollment in an graduate program
Demonstrated interest in and passion for child health policy and equity, and demonstrated commitment through practice/advocacy to equity, inclusion, social justice and community engagement.
Previous work experience, ideally in advocacy, customer focused approaches, and time management.
Interpersonal, verbal/written communication and project management skills (multi-tasking)
Ability to work well in team/independently with a commitment towards learning, flexibility, and creative ideas.
This is a paid position with a flexible schedule. A minimum of 24 hours is mandatory. Consecutive days preferred (M-Th)

This Internship is for the 2021-2022 academic year.

Include

This opportunity is best suited for students whose career interests are listed below but we encourage those from other disciplines to apply as well.
Public Health
Political Science
Communications
Public Policy
Macro Social Work Practice
Please note: During a public health emergency, individuals in this role may be expected to take on additional duties to respond to organizational needs.

Boston Children’s Hospital is an Equal Opportunity / Affirmative Action Employer. Qualified applicants will receive consideration for employment without regard to their race, color, religion, national origin, sex, sexual orientation, gender identity, protected veteran status or disability.",https://www.linkedin.com/jobs/view/externalApply/2465483930?url=https%3A%2F%2Fsjobs%2Ebrassring%2Ecom%2FTGnewUI%2FSearch%2Fhome%2FHomeWithPreLoad%3FPageType%3DJobDetails%26partnerid%3D368%26siteid%3D5205%26jobId%3D3127146%26Codes%3DILIN&urlHash=EJA-&refId=e1945193-2784-4094-abf4-cf3b079c7a69&trackingId=OOPXb91WJVj13REDFWY%2B8g%3D%3D&trk=public_jobs_apply-link-offsite
