title,company,location,requirements,link
Social Media Marketing Intern - SPRING 2021,AKIRA/shopAKIRA.com,"Chicago, IL","Social Media Internship
  The Company
Eighteen years ago, AKIRA opened the doors to its first women's clothing boutique in Chicago. Since then, the company has extended its reach to 30+ stores, as well as a thriving eCommerce business (shopAKIRA.com) AKIRA is extremely well-poised for sustained growth as we continue to build a nationally recognized brand.

AKIRA’s culture has one very large, distinct difference from other fast-fashion competitors:
Other-Worldly Customer Service, and Fanatical, Obsessive Attention to the consumer’s needs and desires. The core principle for all employees at AKIRA is to Act and Think Like an Owner, and this belief can be reflected across all areas of the company.

The Position
Social Media Internship

Location
Chicago, IL

Responsibilities:
Work directly alongside shopAKIRA.com's Social Media Associate to create compelling content, take ownership of smaller social channels, assist with photoshoots, and do research on countless, various topics.
Create creative content to post on social media platforms including TikTok, Instagram, Facebook, Twitter, Snapchat and Facebook.
Brainstorm new strategies, campaign ideas, and content.
Own all influencer excel documents and stay on top of deadlines for posting requirements.
Assist with implementing plans to increase followers and awareness on social platforms.
Stay current with fashion and lifestyle trends (duh!)
Other duties as assigned.

Requirements:
Ability to work in-office up to 15 hours each week (typically schedules are 4-6 hours in office, 2-3x per week, for up to 3 months) No remote positions are available at this time.
Must be familiar with all social media platforms.
Excellent knowledge of social media platforms including, TikTok, Instagram, Facebook, Twitter and Pinterest.
Ability to create compelling video/photo content to post across all social platforms.
Must have a genuine passion for fashion and an eye for marketing and social media.
Be reliable. Show up on time. See the internship to completion.
Ability to multitask, meet deadlines, and be accountable for your own work
Prior experience with Adobe Photoshop is a plus.
Must be local to the Chicagoland area

To be considered:
Submit resume, cover letter, and link to your Instagram handle
Ability to start immediately 

Job Type: Internship/Paid",https://www.linkedin.com/jobs/view/externalApply/2475150244?url=https%3A%2F%2Fwebtoon%2Ehrmdirect%2Ecom%2Femployment%2Fjob-opening%2Ephp%3Freq%3D1527338%23job&urlHash=MVBh&refId=4d8e5fd3-96ae-4ac1-a804-000f72102623&trackingId=huAN3QMLNWe0iyX7RHAGiA%3D%3D&trk=public_jobs_apply-link-offsite
Social Media Intern,Peridot,"Bellevue, WA","Qualifications
Social Media Management: 1 year (Preferred)
Familiarity With Canva (Preferred)

Full Job Description

** This internship is unpaid, but offers college credit. Candidates seeking to build a portfolio or gain experience in social media are welcome to apply! **

Peridot is looking for a social media intern that can assist our marketing team in sourcing, editing, and publishing/scheduling for several of our social media outlets. As we continue to grow and develop our current team is looking to add supporting roles.

In recent months Peridot has really focused on efforts to increase our social media presence. However in the fast moving industry of startups, we are needing to adapt to keep up with the times. As we have begun to find our brand image and voice on social platforms we need your help in increasing and maintaining our online presence.

Intern Responsibilities
Assist in sourcing images for posts
Simple image editing
Increasing followers and presence on all platforms
Scheduling 3-4 posts a week
Research relevant hashtags for different markets
Liking/replying to comments on posts
This would be an ideal opportunity for a current or recent marketing graduate. The intern will report directly to our head of marketing. This will be a part-time internship to begin, with the opportunity to turn into a paid position. The position is fully remote (not restricted to a certain location) and flexible with hours.

Must have a reliable internet connection and computer. Strong creative writing and editing skills are expected.

About The Company

Peridot is a cannabis e-commerce company that provides cannabis shops with an online ordering and website building software. We have been in the industry for about 2 years now headquartered out of Seattle, WA. We took the necessary steps to create an appealing and user friendly software that focused around feedback from within the industry. From the design, ease of use, unique features and every other aspect of our software, it all stems from ideas and input from those within the cannabis industry. We strive to be the industry leading all-in-one e-commerce software for cannabis shops all around the country.

Website: clickperidot.com
Instagram: instagram.com/on_peridot
Facebook: facebook.com/onperidot
LinkedIn: linkedin.com/company/clickperidot",https://www.linkedin.com/jobs/view/externalApply/2487369828?url=https%3A%2F%2Fht-jobs%2Enet%2F5n0oha4%3Fs%3Dlif&urlHash=klAP&refId=4d8e5fd3-96ae-4ac1-a804-000f72102623&trackingId=MS57agp4mujmpnJ%2BzjbBlA%3D%3D&trk=public_jobs_apply-link-offsite
Social Media Intern (Summer 2021),Zynga,"Chicago, IL","Description

Position at Zynga

Please note, this role will be virtual for Summer 2021. All interested candidates are encouraged to apply!**

The Zynga marketing team is looking for a Social Media Intern for the Summer of 2021. In this role, you will have the opportunity to create content, collateral and social media strategies that showcase some of our games, and help our team explore new ways of engaging our fans. You’ll highlight our culture of growth, belonging, and fun!

The ideal candidate is comfortable collaborating with many different teams of people, is pro-active, and prides themselves on their creativity.

What We Are Looking For
Currently enrolled in an accredited university, with a major in marketing, social media marketing, or related.
Rising Junior or rising Senior preferred, although all candidates will be considered.
Experience in copy writing
Strong knowledge of social media trends and platforms
Passion for working in gaming or mobile social platforms
Strong knowledge of the world of Harry Potter and/or Game of Thrones is a plus!
Please provide a link to your online portfolio if applicable.

Zynga is an equal opportunity employer. We are proud of our diverse community; we do not discriminate on the basis of race, sex, religion, color, national origin, gender, sexual orientation, age, marital status, veteran status, medical condition, disability, or any other class or characteristic protected by applicable law. We welcome candidates, players, employees, and partners from all backgrounds. Join us!

Zynga will consider for employment all qualified applicants with criminal histories in a manner consistent with applicable law.",https://www.linkedin.com/jobs/view/externalApply/2288328691?url=https%3A%2F%2Fjobs%2Ejobvite%2Ecom%2Fzynga%2Fjob%2Fo83vdfwD%3Fs%3DLinkedIn%26__jvst%3DJob%2BBoard%26__jvsd%3DLinkedIn&urlHash=t9AK&refId=4d8e5fd3-96ae-4ac1-a804-000f72102623&trackingId=ypQu0yQDhSXkALlyxJOFXw%3D%3D&trk=public_jobs_apply-link-offsite
Social Media Intern,Udemy,"San Francisco, CA","ABOUT THE ROLE We’re looking for a Social Media Intern to support Udemy’s organic social media projects. You will help engage with our 8M+ community of followers around the globe. If you’re social media obsessed, creative, results driven, a self-starter, and enthusiastic about connecting with people, we’re looking for you!

Here’s What You’ll Be Doing
Create, schedule, and publish content for Instagram, Facebook, Twitter, and LinkedIn on an ongoing basis: including some original graphics, copy/captions, and reposting relevant UGC
Streamline content creation processes by templatizing and writing campaign briefs.
Help build program to better enable Udemy customers to become brand ambassadors.
Create process for gathering, storing, and sharing user generated content, including stories from our learners around the world.
Use existing social analytics tools to gather insights and create reports to share with broader team.

We’re Excited About You Because You Have
Excellent written and verbal communication skills.
A thorough understanding of social media platforms and trends, with a focus on Instagram and Facebook, and Twitter, Instagram (understanding of TikTok a plus).
A self-starter attitude with readiness for execution and delivery.
A high-level understanding of social media analytics.
Excellent attention to detail and a high motivation to learn.
Familiarity working with Google Suite. Basic graphic design skills a plus.
Ability to work 40 hours per week independently from home.
Ability to work for 90 consecutive days (3 month internship)

About Udemy

We believe anyone can build the life they imagine through online learning. Today, more than 40 million students around the world are advancing their careers and passions by exploring and mastering new skills on Udemy, and expert instructors are able to share their knowledge with the world. Through our global marketplace and our solutions for businesses and governments, we connect people everywhere with the skills they need for success in work and life. We’re a close-knit bunch that enjoys problem-solving and collaboration, and we share a serious belief in the power of learning and teaching to change lives. Udemy’s culture encourages innovation, creativity, passion, and teamwork. We also celebrate our milestones and support each other every day.

Founded in 2010, Udemy is privately owned and headquartered in San Francisco’s SOMA neighborhood with offices in Denver (Colorado), Dublin (Ireland), Ankara (Turkey), Gurugram (India), and São Paulo (Brazil).

Udemy in the News

Udemy Adds More than $1 Billion To Its Valuation in New Funding Round

Udemy’s Workplace Learning Tool Just Surpassed $100M in ARR

Paid Paternity Leave Should be the Norm in the U.S.

Breakdown of Most In-Demand Skills for 2020—Finance, Marketing, Sales and Engineering

How Investing in Yourself Today Will Set You Up for Career Success Tomorrow

Feedback Isn’t the Problem, but the Way That We Deliver It Is Broken",https://www.linkedin.com/jobs/view/externalApply/2478672328?url=https%3A%2F%2Fjobs%2Elever%2Eco%2Fudemy%2Fcaa39edc-b77e-4f6d-b6b5-4dfac33e9c2e&urlHash=zcgi&refId=4d8e5fd3-96ae-4ac1-a804-000f72102623&trackingId=VEv4PakCUSxqnDKHK4B6qQ%3D%3D&trk=public_jobs_apply-link-offsite
Instagram Content Creation Intern,STICKZUS,New York City Metropolitan Area,"Stickzus is a printing brand based in Long Island, New York and is most known for our custom portrait sticker pack. STICKZUS has a growing line of waterproof, glossy sticker products including today’s hottest celebrities. 

Unpaid Internship / School Credits
 We are looking for an intern to help maintain a strong online presence for STICKZUS. Your main role is to closely monitor social media trends and apply them to instagram content, such as Post, Stories and Reels, that will be used to promote the STICKZUS brand. 
 As content creation intern, you will suggest creative ways to attract more customers and promote STICKZUS. Ultimately, you should be able to be comfortable in front of a camera and familiar with how to film, edit, and easily deliver relatable content. 

Responsibilities:
Research audience preferences and discover current trends
Communicate current social media trends with social media coordinator
Help facilitate online conversations with customers and respond to queries
Social listening to understand and report on what our audience is saying 
Report on online feedback from customers and fans
Brainstorm engaging video content
Stay up-to-date with changes in all social platforms ensuring maximum effectiveness
Photograph, edit and deliver Post, Stories & Reels to STICKZUS social platforms

Qualifications:

Optimistic and motivated personality
Comfortable in front of a camera
Superior verbal and written communicator
Organized with the ability to multitask
Quick learner and assumes new responsibilities and priorities change
Strong written and oral communication skills-proficient in the English language
Savvy with beauty and fashion trends as well as pop culture
Expertise in multiple social media platforms
Ability to deliver creative content (text, image and video)
Familiarity with online marketing strategies and marketing channels
Ability to grasp future trends in digital technologies and act proactively
Currently enrolled in college or a recent graduate with a bachelor's degree in digital communications or related field such as advertising, journalism or graphic design
Ability to work quick and effectively
Must Provide ALL personal social media. 
 Benefits:
 Work Remotely (Mostly)
Flexible schedule
Opportunity for growth in the company
Internship school credit
Free Stickers!",https://www.linkedin.com/jobs/view/externalApply/2478672328?url=https%3A%2F%2Fjobs%2Elever%2Eco%2Fudemy%2Fcaa39edc-b77e-4f6d-b6b5-4dfac33e9c2e&urlHash=zcgi&refId=4d8e5fd3-96ae-4ac1-a804-000f72102623&trackingId=VEv4PakCUSxqnDKHK4B6qQ%3D%3D&trk=public_jobs_apply-link-offsite
Social Media Internship (FT/Post-Graduate),Pittsburgh Steelers,"Pittsburgh, PA","Position Overview

The Pittsburgh Steelers are looking for a full-time Social Media Intern who will focus on the creation and execution of timely and compelling content across a variety of social media platforms, including but not limited to, Twitter, Facebook, Instagram, and TikTok. This person must be able to work in a fast-paced environment both independently and as part of a larger team. They should be enthusiastic, creative and possess a strong attention to detail.

Duties & Responsibilities
Assist in the creation and fulfillment of social media calendar
Assist in the ideation, gathering and creation of multiple content types for social syndication, including editorial, photos, videos and static/motion graphics
Assist in monitoring social media channels
Lead the social coverage of the Steelers Youth Football accounts
Lead the social coverage of Steelers community events


Experience
Bachelor’s degree in media, digital, marketing or related field
Experience working with and understanding of social media platforms, their demographics, analytics, etc.
Experience in capturing platform-specific photo and video content, using both cell phone and DSLR camera
Experience covering events and storytelling on social media platforms
Basic knowledge of Adobe Photoshop
Basic knowledge of Adobe After Effects a plus
Basic knowledge of video editing (Adobe Premiere Pro or similar software)
Experience with social media analytics and running performance reports
Ability to work in a high-paced, high-pressure, reactionary environment
Flexible to work nights and weekends (when necessary)
Understanding of NFL and football a plus


We are an equal opportunity employer and all qualified applicants will receive consideration for employment without regard to race, color, religion, national origin, sex, sexual orientation, age, disability, gender identity, marital or veteran status, or any other protected class.

Job originally posted on GrabJobs. If you need to report this job please contact GrabJobs",https://www.linkedin.com/jobs/view/externalApply/2487271512?url=https%3A%2F%2Fgrabjobs%2Eco%2Fsingapore%2Fdetails%3Fid%3D2031322%26utm_source%3DlinkedInXML&urlHash=vxRT&refId=4d8e5fd3-96ae-4ac1-a804-000f72102623&trackingId=14nf%2FrMVVNzoF%2B95j7uCug%3D%3D&trk=public_jobs_apply-link-offsite
Social Media + Marketing Intern,Ground Up PDX,"Portland, OR","Company Description

Nut butters that spread good by providing job skills to women overcoming adversity.

Job Description

We’re looking for a motivated and hardworking intern to help us with social media and marketing this summer! As our marketing intern, your role is to drive awareness for Ground Up PDX through social media, influencer engagement, brand partnerships, PR and more. We are looking for someone who is pursuing a degree in marketing or public relations, and someone is already deeply immersed in social media and can help take Ground Up’s platforms to the next level! Our goal is also to train this individual during their time with us, ensuring that you’re given a true sense of what it’s like to work for a busy start-up and that you get exposed to all of the different parts of the business that interest you!

You’ll Be Responsible For
Managing social media (primarily Instagram)—replying to comments and DMs, creating content including stories and posts, etc.
Influencer outreach and management—create relationships with new influencers and cultivate the relationships we already have created
Create content for us to share on social media and via email, including behind-the-scenes snapshots, new product photos, and mission-oriented storytelling
Focus on growing our social media presence through engaging content and using data and customer insights to guide this process
Work on partnerships and giveaways with other brands
Reach out to potential publications, journalists and podcast hosts to secure PR opportunities
Assist Community Coordinator as needed in managing our Butterbassador (brand ambassador) program
Work on recipe development for our blog and Instagram
Assist with ad hoc projects (e.g. organization, occasional errands)

The Nitty Gritty
Ideally this would be a 10-week internship, starting in June and ending in August. We can be flexible on the exact dates based on your school schedule!
The time commitment is 15-20 hours per week.
We’re based in Portland, Oregon! We prefer that you’re local, but we won’t rule out remote candidates if the skillset is a good fit.
This position is unpaid, but available for college credit.
You would report directly to our Community Coordinator Sarah and Co-Founder Carolyn who currently manage our marketing.
At Ground Up, we maintain an open hiring policy and aim to create and cultivate a community that is diverse across race, gender, sexual orientation, age, religion, identity, experience, and perspective— where every employee feels supported to apply their whole self to our collective mission.
Additional Information

The internship will be 10 weeks long, starting in early June and ending mid-August.",https://www.linkedin.com/jobs/view/externalApply/2487271512?url=https%3A%2F%2Fgrabjobs%2Eco%2Fsingapore%2Fdetails%3Fid%3D2031322%26utm_source%3DlinkedInXML&urlHash=vxRT&refId=4d8e5fd3-96ae-4ac1-a804-000f72102623&trackingId=14nf%2FrMVVNzoF%2B95j7uCug%3D%3D&trk=public_jobs_apply-link-offsite
Social Media Intern,Golden Hippo,"Los Angeles, CA","Who We Are

Golden Hippo is a successful, growing direct to consumer digital marketing company committed to helping everyone live their healthiest life. We create cutting edge health, wellness, and beauty products and work tirelessly to get them into the hands of the people who need them most - our customers. Our e-commerce platform enables us to do so powered by incredible tech talent. We're growing fast, but our core values remain the same as when we were founded in 2010. If you're passionate about cutting edge marketing and technology, design, copywriting and video editing, and the operations behind all this, we want to hear from you. And if you are results driven, ambitious, a creative problem-solver, have a positive energy, collaborative and team oriented, and a continuous learner we might just be the perfect place for you!

THE ROLE

Golden Hippo is currently looking for a [Intern Role] to join us during our 2021 Summer Internship Program. Golden Hippo’s Internship Program will run from June 7th – August 27th. We are planning an internship experience that will provide interns with an experiential experience where the interns can learn new skills that can benefit a long-term career. There will be great opportunities for project work, professional development, networking opportunities as well as social activities. The [insert role description].

WHY YOU SHOULD WORK WITH US

At Golden Hippo you have a chance to make an impact. You will have the opportunity to be innovative, take initiative and grow. You will work among friends every day you will see the results of your work firsthand. We work in a lively, laid back work environment with a fully stocked kitchen for our employees to use. We pride ourselves in our incredibly diverse workforce. We intentionally strive to cultivate, create, and celebrate a rich, vibrant, and inclusive culture of belonging where our employees feel respected and empowered. We also offer:
In-office CrossFit gym with professional coaches
Yoga and meditation breaks
Casual, ""no dress code"" atmosphere and an open, inspiring office space
Ongoing learning and development opportunities
Fun events and regular celebrations
Highly interactive work with a talented, diverse, passionate team
See what it’s like working at Golden Hippo!

What Your Day Will Look Like
Seek out and engage influencers to partner with and coordinate product gifting.
Research and propose social media tactics to deploy across social platforms.
Community management, providing exceptional written customer service support in a timely manner.
Conceptualize, pitch, and create multiple social media posts per week.
Develop graphics for social media posts.
Copywriting for Facebook, Instagram, Twitter, & Pinterest.
Assist in SEO-driving efforts for multiple social media platforms.
Conduct competitor and industry analysis, and report findings to the team.
Report and monitor social media campaign & content effectiveness.

IDEAL CANDIDATES WILL HAVE
Passionate & knowledgeable about social media.
Ability to organize and manage multiple tasks while meeting deadlines.
Excellent verbal and written communication skills.
Strong attention to detail.
Self-starter that enjoys researching best practices/new trends to grow social media communities.
Able to work independently, taking ownership & accountability over your work, while working in collaboration with and having access to team members who will provide advice and guidance.
Strong desire to learn and grow, not afraid to ask questions.
Working knowledge of Adobe Photoshop or Canva is a plus.
Comfortable working in the Google Suite of products: Gmail, Google Sheets, Google Docs.
Golden Hippo is always looking for smart, driven self-starters who are excited to build a place for themselves in one of the most fun, exciting companies in Los Angeles. If you thrive on community and communication, learning from your failures, and embracing the unexpected, Golden Hippo just might be the place for you.

Golden Hippo Company Culture Highlights:
Winner of Comparably's Award for Best Company in Los Angeles 202019
Winner of Comparably's Award for Best Company Happiness 202018
Golden Hippo is ranked in the top 5% of companies for Work Culture on Comparably.
Check us out on Comparably!

Equal Employment Opportunity
Golden Hippo strongly supports equal employment opportunity for all applicants regardless of age (40 and over), ancestry, color, religious creed (including religious dress and grooming practices), family and medical care leave or the denial of family and medical care leave, mental or physical disability (including HIV and AIDS), marital status, domestic partner status, medical condition (including cancer and genetic characteristics), genetic information, military and veteran status, political affiliation, national origin (including language use restrictions), citizenship, race, sex (including pregnancy, childbirth, breastfeeding and medical conditions related to pregnancy, childbirth or breastfeeding), gender, gender identity, and gender expression, sexual orientation, or any other basis protected by applicable federal, state or local law, rule, ordinance or regulation.
We will consider qualified applicants with criminal histories in a manner consistent with the requirements of the Los Angeles Fair Chance Ordinance, for applicants in Los Angeles, California, and consistent with applicable laws in other areas.

Hiring Practices
The preceding job description has been designed to indicate the general nature and level of work performed by employees within this classification. It is not designed to contain or be interpreted as a comprehensive inventory of all duties, responsibilities, and qualifications required of employees assigned to this job. Golden Hippo recruitment policies are designed to place the most highly qualified persons available in a timely and efficient manner. Golden Hippo may pursue all avenues available, including promotion from within, employee referrals, outside advertising, employment agencies, internet recruiting, job fairs, college recruiting and search firms.

Powered by JazzHR

KPZS7Opy2b",https://www.linkedin.com/jobs/view/externalApply/2487271512?url=https%3A%2F%2Fgrabjobs%2Eco%2Fsingapore%2Fdetails%3Fid%3D2031322%26utm_source%3DlinkedInXML&urlHash=vxRT&refId=4d8e5fd3-96ae-4ac1-a804-000f72102623&trackingId=14nf%2FrMVVNzoF%2B95j7uCug%3D%3D&trk=public_jobs_apply-link-offsite
