title,company,location,requirements,link
Pharmacy Intern - Providence,Rhode Island Hospital,"Providence, RI","Summary

Under the supervision of a pharmacist and direction of a technician group leader or technician specialist performs a variety of technical and support tasks designed to assist pharmacists in the formulation preparation dispensing and delivery of medications and pharmaceutical supplies in accordance with established policies and procedures and in keeping with the scope of services provided and in consideration to the age of the patients being served.

Responsibilities

Under the supervision of a pharmacist assists in the formulation and preparation of medications by:
Reviewing Licensed Independent Practitioner medication orders and preparing medications for review and dispensing by a pharmacist.
Performing general operations of electronic drug dispensing system (EDDS; i.e. Omnicell Pyxis) used in the inventory control and distribution of pharmaceuticals and related supplies. Including maintaining assigning refilling and removing medication including controlled substances generating and interpreting reports to perform above.
Maintaining operating room medication inventory including controlled substances.
Preparing intravenous admixtures up to and including chemotherapy and pediatric critical care infusions utilizing aseptic techniques in a controlled environment according to computer-generated and/or pharmacist approved formulation record including proper manipulation labeling and expiration dating. Work in United States Pharmacopoeia clean room environment and in accordance with procedures of the same.
Preparing non-sterile pharmaceutical products according to computer-generated and/or pharmacist approved formulation record including proper labeling and expiration dating.
Performs controlled substance discrepancy resolution in conjunction with other licensed health care professionals.
Participates in controlled substances inventory management in the Pharmacy and the hospital.

Delivers medications to clinic procedural treatment operating room and patient care areas . Retrieves medication orders.

Repackages and labels medications for distribution in accordance with pharmacist approved Packaging and Labeling Records.Prepares various emergency medication kits for pharmacist review and distribution to patient care areas.
Performs routine procurement and inventory management of medications including ordering and receipt of chemotherapy and other pharmaceutical supplies. Completes necessary paperwork for controlled substance procurement and verifies receipt of such.
Processes medication requisitions for departments and laboratories for pharmacist verification.
Reconciles patient and department medication charges.
Performs routine preventive maintenance to all equipment according to standards for same.
Assists in maintaining related Pharmacy records and files performing equipment calibration and maintenance.
Assists in maintaining the Pharmacy and medication supply areas in a neat and orderly fashion ensuring medications are stored under proper conditions for light temperature sanitation and segregation.
Participates in quality assessment and improvement activities and medication safety initiatives of the Pharmacy and the hospital. Utilizes approved process for reporting actual prevented and near miss medication errors.
Answers the telephone and triages as appropriate. Interacts with internal and external customers in accordance to hospital Customer Service Standards.
Assists in orientation and training of other pharmacy technicians and interns.
Other duties as assigned.

Basic Knowledge

Other information:

Current enrollment in no less than the third (3rd) year in an accredited college of pharmacy as a student in good standing.
Maintains current unrestricted licensure as a pharmacy intern in the State of Rhode Island.
One to three months on-the-job training to become familiar with duties and responsibilities and departmental procedures.
Possesses basic computer skills including Microsoft Office Suite.

Experience

None.

Work Environment And Physical Requirements

Possesses physical ability to lift carry and maneuver medication delivery equipment and pharmaceutical related inventories including extended periods of work time spent standing and walking.
Requires the visual and manual dexterity to operate a computer.
New hires into this position must successfully pass a drug screen in conformance with Rhode Island State Law.

SUPERVISORY RESPONSIBILITY: None",https://www.linkedin.com/jobs/view/externalApply/2459323069?url=https%3A%2F%2Fneuvoo%2Ecom%2Fjob%2Ephp%3Fid%3Db0e876f58210%26source%3Dlinkedin%26utm_source%3Dpartner%26utm_medium%3Dlinkedin%26puid%3Dfadeaddg7adbcdd8ddd9fdda8adafddbadd8fdde3defcdcgfec3ddcg3e&urlHash=oN00&refId=5568289d-b40a-47cf-a466-361f3c1d419f&trackingId=u7%2BWRnLm5OftE%2BBzMHfkgA%3D%3D&trk=public_jobs_apply-link-offsite
PHARMACY INTERN,PharMerica,"Warwick, RI","Our Company Overview

Join our PharMerica team! PharMerica is a closed-door pharmacy where you can focus on fulfilling the pharmaceutical needs of our long-term care and senior living clients. We offer a non-retail pharmacy environment. Our organization is in high growth mode , which means advancement opportunities for individuals who are looking for career progression!

We Offer

Flexible schedules

Full-time, part-time and PRN opportunities

Competitive pay

Shift differential

Premium pay for holidays

Health, dental, vision and life insurance benefits

401k

Paid-time off

Tuition reimbursement

Non-retail/Closed-door environment

Our Pharmacy group focuses on providing exceptional customer service and meeting the pharmacy needs for hospitals, rehabilitation hospitals, long-term acute care hospitals, and other specialized care centers nationwide. If your passion is service excellence and top-quality care come join our team and apply today!

Responsibilities
Works under direct supervision of a Registered Pharmacist, fills prescriptions and prepares IV’s
Works with Billing Supervisor to enter data into computer system to fill prescriptions and to obtain reimbursement payment
Works under direct supervision of a Registered Pharmacist in prepackaging medication for dispensing according to standards and government regulations
Assists the Pharmacist in final checking of filled prescriptions, which may include stating the medication for RPh final review and/or packaging of medication post RPh final review and coordinating accurate and timely delivery to the customer
Assists Pharmacy Management in maintaining good inventory practices which may include receiving and rotating incoming medications and supplies, posting lot numbers, expiration dates and assisting in physical inventory
Works with Technician Supervisor in maintaining a clean/safe work environment, checking equipment for calibration, safety and cleanliness

Qualifications
Required: Currently enrolled in Pharmacy school
Required: Ability to use a computer
Required: Detail oriented; goal oriented, team player, oral communication
Licenses/Certifications: As required by state and federal law.

About Our Line Of Business

PharMerica is a full-service pharmacy solution providing value beyond medication. PharMerica is the long-term care pharmacy services provider of choice for senior living communities, skilled nursing facilities, public health organizations and post-acute care organizations. PharMerica is one of the nation's largest pharmacy companies. PharMerica offers unmatched employee development, exceptional company culture, seemingly endless opportunities for advancement and the highest hiring goals in decades. For more information about PharMerica, please visit www.pharmerica.com . Follow us on Facebook , Twitter , and LinkedIn .",https://www.linkedin.com/jobs/view/externalApply/2494930688?url=https%3A%2F%2Fcareers-brightspring%2Eicims%2Ecom%2Fjobs%2F27552%2Fpharmacy-intern%2Fjob&urlHash=aMTj&refId=5568289d-b40a-47cf-a466-361f3c1d419f&trackingId=vJd%2BPknSNAvNWjJ4m9ysJg%3D%3D&trk=public_jobs_apply-link-offsite
Pharmacy Intern,Lifespan,"Providence, RI","Summary

Under the supervision of a pharmacist and direction of a technician group leader or technician specialist performs a variety of technical and support tasks designed to assist pharmacists in the formulation preparation dispensing and delivery of medications and pharmaceutical supplies in accordance with established policies and procedures and in keeping with the scope of services provided and in consideration to the age of the patients being served.

Responsibilities

Under the supervision of a pharmacist assists in the formulation and preparation of medications by:
Reviewing Licensed Independent Practitioner medication orders and preparing medications for review and dispensing by a pharmacist.
Performing general operations of electronic drug dispensing system (EDDS; i.e. Omnicell Pyxis) used in the inventory control and distribution of pharmaceuticals and related supplies. Including maintaining assigning refilling and removing medication including controlled substances generating and interpreting reports to perform above.
Maintaining operating room medication inventory including controlled substances.
Preparing intravenous admixtures up to and including chemotherapy and pediatric critical care infusions utilizing aseptic techniques in a controlled environment according to computer-generated and/or pharmacist approved formulation record including proper manipulation labeling and expiration dating. Work in United States Pharmacopoeia 797 clean room environment and in accordance with procedures of the same.
Preparing non-sterile pharmaceutical products according to computer-generated and/or pharmacist approved formulation record including proper labeling and expiration dating.
Performs controlled substance discrepancy resolution in conjunction with other licensed health care professionals.
Participates in controlled substances inventory management in the Pharmacy and the hospital.

Delivers medications to clinic procedural treatment operating room and patient care areas . Retrieves medication orders.

Repackages and labels medications for distribution in accordance with pharmacist approved Packaging and Labeling Records.Prepares various emergency medication kits for pharmacist review and distribution to patient care areas.
Performs routine procurement and inventory management of medications including ordering and receipt of chemotherapy and other pharmaceutical supplies. Completes necessary paperwork for controlled substance procurement and verifies receipt of such.
Processes medication requisitions for departments and laboratories for pharmacist verification.
Reconciles patient and department medication charges.
Performs routine preventive maintenance to all equipment according to standards for same.
Assists in maintaining related Pharmacy records and files performing equipment calibration and maintenance.
Assists in maintaining the Pharmacy and medication supply areas in a neat and orderly fashion ensuring medications are stored under proper conditions for light temperature sanitation and segregation.
Participates in quality assessment and improvement activities and medication safety initiatives of the Pharmacy and the hospital. Utilizes approved process for reporting actual prevented and near miss medication errors.
Answers the telephone and triages as appropriate. Interacts with internal and external customers in accordance to hospital Customer Service Standards.
Assists in orientation and training of other pharmacy technicians and interns.
Other duties as assigned.

Basic Knowledge

Other information:

Current enrollment in no less than the third (3rd) year in an accredited college of pharmacy as a student in good standing.
Maintains current unrestricted licensure as a pharmacy intern in the State of Rhode Island.
One to three months on-the-job training to become familiar with duties and responsibilities and departmental procedures.
Possesses basic computer skills including Microsoft Office Suite.

Experience

None.

Work Environment And Physical Requirements

Possesses physical ability to lift carry and maneuver medication delivery equipment and pharmaceutical related inventories including extended periods of work time spent standing and walking.
Requires the visual and manual dexterity to operate a computer.
New hires into this position must successfully pass a drug screen in conformance with Rhode Island State Law.

SUPERVISORY RESPONSIBILITY: None

Lifespan is an Equal Opportunity / Affirmative Action employer. All qualified applicants will receive consideration for employment without regard to race color religion sex national origin age ethnicity sexual orientation ancestry genetics gender identity or expression disability protected veteran or marital status. Lifespan is a VEVRAA Federal Contractor.

Location: Rhode Island Hospital USA:RI:Providence

Work Type: Per Diem

Shift: Shift 4

Union: IBT",https://www.linkedin.com/jobs/view/externalApply/2457833648?url=https%3A%2F%2Fjobs%2Elifespan%2Eorg%2Fsearch%2Fjobdetails%2Fpharmacy-intern%2F3e6b3566-02f8-4252-8171-d8e01bea779d%3Futm_source%3Dlinkedin%26utm_campaign%3Dlinkedin_organic%26utm_medium%3Dorganic_job_board&urlHash=7WnQ&refId=5568289d-b40a-47cf-a466-361f3c1d419f&trackingId=WT%2B%2BbC%2BPwuLYl9zeTMS%2Bgg%3D%3D&trk=public_jobs_apply-link-offsite
(USA) Pre-Grad Intern - Wm - Temporary Pharmacy Intern,Walmart,"Swansea, MA","Position Summary... What You'll Do...

Ensures confidentiality of information, documentation, and assigned records as required by Company policies, and local, State, and Federal guidelines.

Provides Pharmacy products and services to Customers in accordance with local, state, and federal laws and Company policies and procedures by assisting with processing prescription and/or over-the-counter (OTC) orders and purchases, stocking and securing Pharmacy supplies and merchandise, entering prescription information and/or filling prescriptions, completing, maintaining, and securing paperwork, forms, and required documentation.

Provides customer service by acknowledging the customer, identifying customer needs, assisting with purchasing decisions, locating merchandise, resolving customer issues and concerns, and promoting products and services, while maintaining a safe shopping environment.

Operates equipment, such as cash registers and related tools, to process customer purchases using appropriate procedures for different payment types and items sold.

Receives and stocks merchandise/supplies from distribution centers and suppliers and organizes and maintains the Pharmacy area by following Company procedures, utilizing equipment appropriately, merchandising, and completing and retaining required paperwork, logs, and other documentation.

Maintains the Pharmacy area in accordance with Company policies and procedures by properly handling claims and returns, zoning the area, arranging and organizing merchandise/supplies, identifying shrink and damages, and ensuring a safe work environment.

Maintains merchandise presentation in the Pharmacy by stocking and rotating merchandise, removing damaged or out-of-date goods, setting up, cleaning, and organizing product displays, signing and pricing merchandise appropriately, and securing fragile and high-shrink merchandise.

Minimum Qualifications...

Outlined below are the required minimum qualifications for this position. If none are listed, there are no minimum qualifications.
Minimum Qualifications: Enrolled in an accredited Pharmacy school Preferred Qualifications...
Outlined below are the optional preferred qualifications for this position. If none are listed, there are no preferred qualifications.
Pharmacy-Based Immunization Delivery Certification - Certification",https://www.linkedin.com/jobs/view/externalApply/2490300215?url=https%3A%2F%2Fclick%2Eappcast%2Eio%2Ftrack%2F7zy5bnf-org%3Fcs%3D4c%26jg%3D1yfx%26bid%3DlUf2CslKyPxm6i440ZgUYA%3D%3D&urlHash=L2v4&refId=5568289d-b40a-47cf-a466-361f3c1d419f&trackingId=j8sJ46E9jsX2VqMtvsOQ6Q%3D%3D&trk=public_jobs_apply-link-offsite
Pharmacy Intern,UMass Memorial Health,"Worcester, MA","Requisition #: 213400
Title: Pharmacy Intern
Department: Pharmacy
Grade: TEC6
Posting Date: April 8, 2021
Status: Non-Exempt
Shift: Per Diem
Union: NONUNION
Hours: PERDIEM
Shift Length: 8
Location: UMass Memorial Medical Center

Position Summary

Under the direct supervision of a pharmacist and technician supervisor, performs medication related tasks such as packaging, preparation of all forms of medications, record keeping, and all aspects of drug distribution. As competency allows, may assist the pharmacist in specific functions requiring judgment based on appropriate pharmacist oversight.

Major Responsibilities
Reviews, evaluates and clarifies physician medication orders.
Processes orders using pharmacy computer system. Delivers patient medications to patient's rooms and medication room areas.
Checks for accuracy of all drugs assembled or prepared by pharmacy technicians, prior to release for distribution.
Assembles, prepares, and delivers, as necessary, drugs to patient care areas.
Reviews physician orders and interacts with physicians and nurses, as necessary, relative to appropriateness of therapeutic regimens with preceptor oversight.
Position Qualifications

License/Certification/Education:

Required
Massachusetts registration as an intern with the Board of Registration in Pharmacy is required. based on
Required

Experience/Skills:
Completion of two years of education within a pharmacist internship program.
OR
Designated status as a student beyond the second professional year, in an approved college/school of pharmacy in which the candidate is currently enrolled.
Familiarity with pharmacy technology and equipment. Ability to troubleshoot technical problems of moderate to high complexity.
All qualified applicants will receive consideration for employment without regard to race, color, religion, sex, sexual orientation, gender identity, national origin, disability or protected veteran status.",https://www.linkedin.com/jobs/view/externalApply/2496448186?url=http%3A%2F%2Fwww%2Elinkup%2Ecom%2Fdetails%2Fbde39f6513fd2e49b3ce24cd5e09fc91&urlHash=iyVI&refId=5568289d-b40a-47cf-a466-361f3c1d419f&trackingId=L4Mu4sVHPXG6eFc0F5DmuA%3D%3D&trk=public_jobs_apply-link-offsite
Pharmacy Intern,Wegmans Food Markets,"Northborough, MA","As a Professional Pharmacy intern, you will be scheduled to work on an as needed, temporary basis to support delivering vaccines and related activities, earning valuable training and knowledge needed to be a successful licensed Pharmacist. Under the guidance of a mentor, you will bring your coursework to life, gain a comprehensive knowledge of the retail pharmacy industry and be an active contributor in the department and learn to provide exceptional care to customers while effectively managing Pharmacy operations.

What will I do?
Deliver immunizations with high standards and incredible customer service
Work with your mentor, members of management, other pharmacists and technicians and team members in the department to learn to better serve customer needs
Answer questions, provide counseling on prescriptions, and relay any pertinent information to customers
Comply with all federal, state, and HIPAA regulations; ensure company guidelines, standards, policies, and procedures are followed

Required Experience, Education, Skills
Pharmacist Intern Permit
Certified Immunizer
In progress towards earning Pharmacy degree in an accredited School of Pharmacy

Preferred Education
Doctor of Pharmacy (PharmD)",https://www.linkedin.com/jobs/view/externalApply/2469461781?url=https%3A%2F%2Fjobs%2Ewegmans%2Ecom%2Fjob%2Fnorthborough%2Fpharmacy-intern%2F1839%2F6467799360&urlHash=d4iO&refId=5568289d-b40a-47cf-a466-361f3c1d419f&trackingId=Rbxo2sTj4i17ibOzQqNpww%3D%3D&trk=public_jobs_apply-link-offsite
Clinical Pharmacy Program Intern - Hyattsville,Giant,"Hyattsville, MD","Job Description

Clinical Pharmacy Program Intern

Key Responsibilities
Impose a new POV on Social network elevations with improved messaging working with our marketing to continue to elevate our pharmacy brand with our customers and communities
Develop and roll out a one stop tracking mechanism for all metrics
Clinical webinar and webisode development in conjunction with our clinical team
work and expand current work on a CPA (Collaborative Practice Agreement) with providers office to send patients to pharmacies and work with tandem with physicians.
Redefine customer service plan providing best in class in service plan and roll out and implement with RPMs and stores.
Provide insight to new virtual platforms with environmental changes due to COVID and racial Injustices as it impacts our pharmacy teams
Key Skills:
Strong analytical mindset and ability
Expert project management skills
Excellent communication skills
Essential Skills

The Giant Food intern program is intended to create a beneficial relationship and growth opportunity for Giant and the collegiate students in our local communities we serve.

As a Giant Food Intern, You Will
Gain real business and professional experience in corporate environment
Deliver work presentation to the Giant Food Operating Committee
Develop leadership and professional skills via Learning & Development offerings
Participate in community and/or company sponsored events
Attend team building, networking events and sporting events and other extracurricular opportunities
Get paired with mentor to help guide professional journey
Receive college credit through their institution
Work full-time, M-F, 8-5 from June 7th to August 13th
Get paid $20/hr with a weekly paycheck!",https://www.linkedin.com/jobs/view/externalApply/2490855561?url=https%3A%2F%2Fneuvoo%2Ecom%2Fjob%2Ephp%3Fid%3Df3c5b821b889%26source%3Dlinkedin%26utm_source%3Dpartner%26utm_medium%3Dlinkedin%26puid%3Dfadaadddbaddeddbgadefdd88ddefddfaadefdd83de8cdc7fec3ddcg3e&urlHash=cFcH&refId=5568289d-b40a-47cf-a466-361f3c1d419f&trackingId=FTT%2BPfviJ1T2mUZKQYsKhg%3D%3D&trk=public_jobs_apply-link-offsite
