title,company,location,requirements,link
Intern: Data Science,Biogen,"Cambridge, MA","Job Description

This is for a 12-week internship position from June – August 2021.

Biogen is looking for an intern to join our Data Science team in the Global Customer Data and Analytics Center of Excellence. As a member of the Data Science team, the intern will be tasked with weaving data together from across Biogen to help answer some of our biggest commercial questions. Utilizing the intern's business knowledge, the intern will help move the company forward in our use of data and advanced applications of emerging technologies.

The intern will be working directly with teams across our Commercial organization, including but not limited to Market Research, Patient Services, Promotional Effectiveness, Digital Excellence and many others at a global and local level. The intern will work with these teams on some of our most complex questions in the organization.

An Ideal Candidate Will Exhibit The Following
An exceptional team player and communicator who is able to remain productive and focused in a global, team-oriented, fast-paced environment
An exceptional analytical thinker who is able to help organize and develop models to drive business initiatives
Comfortable with deep involvement with problem definition, data exploration, data acquisition and visualization, evaluating and comparing metrics, deploying various models and iteratively improving solutions
Able to communicate clearly and exceptionally about complex analytical tasks by producing concise and easily consumable presentations
Excited about developing continuous improvements to push the organization towards new and improved ways to use data to improve business processes.
Able to look for opportunities proactively to improve the business, outside of the specific questions asked

Qualifications

To participate in the Biogen Intern Program, students must meet the following eligibility criteria:
Legal authorization to work in the U.S.
Grade point average of 3.2 or higher preferred
At least 18 years of age prior to the scheduled start date
Be currently enrolled in an accredited college or university

Additional Qualifications
Strong analytical skills for effective problem solving.
Experience with at least one Data Science languages (Python, R, etc.)
Exceptional quantitative, statistical and computational skills
A documented track record of continuous learning and improvement
Ability to generate models that tell a story from complicated data
Strong communication and the ability to clearly convey information both within the group and to external groups
Experience and understanding of Machine Learning techniques
Working knowledge of Relational Databases
Education

Bachelors or Masters student with an analytics or data science background (such as computer science, engineering, or analytical science).

Additional Information

All your information will be kept confidential according to EEO guidelines.",https://www.linkedin.com/jobs/view/externalApply/2494080340?url=https%3A%2F%2Fjobs%2Esmartrecruiters%2Ecom%2FBiogen%2F743999741899743-intern-data-science%3Ftrid%3D2d92f286-613b-4daf-9dfa-6340ffbecf73&urlHash=KnFh&refId=6d29ba9e-d44a-4fdf-8505-d870d4fd3686&trackingId=Vql2HT8KKy%2Fr%2BO1%2FpapQ5A%3D%3D&trk=public_jobs_apply-link-offsite
Data Science Intern,Amazon,"Seattle, WA","Description

We are looking for motivated data scientists with excellent leadership skills, and the ability to develop, automate, and run analytical models of our systems. You will have strong modeling skills and are comfortable owning data and working from concept through to execution. This role will also build tools and support structures needed to analyze data, dive deep into data to resolve root cause of systems errors and changes, and present findings to business partners to drive improvements.

Locations may vary by team, and include regions outside of Seattle.

Applicants have a demonstrated ability to manage medium-scale modeling projects, identify requirements, and build methodology and tools that are statistically grounded. You will have experience collaborating across organizational boundaries.


Basic Qualifications
Enrolled in Master’s or Ph.D. degree in math, statistics, computer science, or related science field.
Experience with regression modeling, forecasting, and time series analysis.
Experience with data scripting languages (e.g. SQL, Python, R etc.) or statistical/mathematical software (e.g. R, SAS, or Matlab)
Experience using one or more programming languages (e.g., Python, Java, C++, C, etc.).
Experience with big data: processing, filtering, and presenting large quantities (100K to Millions of rows) of data.
Preferred Qualifications
Enrolled in Ph.D. degree in math, statistics, computer science, or related science field.
Experience in machine-learning methodologies (e.g., supervised and unsupervised learning, deep learning, etc.)
Experience with clustered data processing (e.g., Hadoop, Spark, Map-reduce, and Hive).
Experience in communicating technically, at a level appropriate for the audience.
Amazon is committed to a diverse and inclusive workforce. Amazon is an equal opportunity employer and does not discriminate on the basis of race, ethnicity, gender, gender identity, sexual orientation, protected veteran status, disability, age, or other legally protected status. For individuals with disabilities who would like to request an accommodation, please visit https://www.amazon.jobs/en/disability/us.


Company - Amazon.com Services LLC
Job ID: A1235288",https://www.linkedin.com/jobs/view/externalApply/2454050853?url=https%3A%2F%2Fwww%2Eamazon%2Ejobs%2Fjobs%2F1235288%2Fdata-science-intern%3Fcmpid%3DSPLICX0248M%26utm_source%3Dlinkedin%2Ecom%26utm_campaign%3Dcxro%26utm_medium%3Dsocial_media%26utm_content%3Djob_posting%26ss%3Dpaid&urlHash=BbZr&refId=6d29ba9e-d44a-4fdf-8505-d870d4fd3686&trackingId=aM%2BsfRZT9MovMVR8dLpMYA%3D%3D&trk=public_jobs_apply-link-offsite
Data Science Summer Internship 2021,Tapad,"New York, NY","Tapad is looking for outstanding data-driven interns to join our Data Science team this summer. Our ideal candidate is passionate about big data and eager to apply Machine Learning techniques to real-world problems.

We are a small, talented team of friendly, pragmatic, productive data scientists. We have created a culture of transparency and accountability, which minimizes bureaucracy and meetings to maximize developer freedom, autonomy, and creative development time. We are looking for interns who are driven, creative, and innovative thinkers. You will experience what it's like to be a data scientist in a fun, technology-first startup atmosphere. You will be paired one-on-one with a data scientist mentor for guidance and advice.

We are looking for a Ph.D. candidate who meets some of the following qualifications:
Experience in applied Machine Learning techniques, advanced analytics, and statistical modeling.
Understanding of programming concepts and experience with programming languages, such as Python,, R, Java, Scala, Matlab Experience manipulating large data sets, using SQL, Hadoop, or MapReduceHas a background in a Quantitative Discipline (e.g. Physics, Mathematics, Statistics, Engineering, etc.)

A day in the life as a Data Science Intern:
Design experiments and create case studies demonstrating the effectiveness of our research and development.
Employ predictive modeling, data mining, graph algorithms, and other data science techniques to your internship project
You will work towards increasing our platform's ability to drive customer value while sustaining healthy margins.
Communicate your results with your mentor, along with appropriate engineering and business units to deploy research into production.

In this role, you will be using (don't worry, we'll teach you):
Python, SQL, Scala
Spark, SparkML, SciKit Learn, AutoML, BigQuery ML, TensorFlow Extended (TFX)
Google Cloud Platform (GCP), BigQuery, Apache Airflow


Tapad Intern Perks
Gain valuable experience working in a cutting edge and data-driven environment using state of the art technologies
Dynamic and fast-paced well-established start-up
A designated mentor to help guide you through the 10-week internship program
Ongoing training, which will include Scala School, peer-led professional development, and an abundance of resources to help guide you through your internship
Catered lunches and unlimited in-office snacks and beverages
Leadership lunches - sit with the CEO, CTO, and CPO, and ask them anything your heart desires
Foosball, ping pong, diversity and inclusion group, book club, and tons of other extra-curricular activities that will make you feel like part of the Tapad family


Remote Internship Perks
Virtual game nights, diversity and inclusion group, book club, and other extra-curricular activities that will make you feel like part of the Tapad family
Leadership lunches over zoom. We'll deliver food to your doorstep!


About Tapad

Founded in 2010, Tapad cracked the code on cross-device marketing technology. Our groundbreaking, proprietary technology assimilates trillions of data points to find the relationship between smartphones, desktops, laptops, tablets, connected TVs, and gaming consoles. Ten years later, we are processing data at petabyte scale, with an engineering team that comprises roughly half of our entire organization. When you work with us, you matter, and your work matters.

We use Scala, in combination with large-scale data processing and open-source technologies, to build our device graph. Across our engineering teams, we also use Scala, GCP, Spark, Kubernetes, Python, TypeScript, Angular, and anything else that helps us get the job done. We're open-minded about new technologies, we're passionate about what we do, and we make time for everyone to learn and grow as the industry changes. Engineers at Tapad are approachable and ambitious people who think outside the box and solve big problems collaboratively. Are you up for the challenge?

Tapad is proud to be an equal opportunity employer and will consider all qualified applicants regardless of age, sex, race, religion, national origin, sexual orientation, gender identity, marital or family status, disability, or any other legally protected status. Tapad does not accept resumes from unsolicited search firms nor recruiters. In no event shall fees be paid to any unsolicited search firms nor recruiters, regardless of whether the candidate is made an offer or accepts a placement at Tapad. All resumes received through any channels will be considered the sole property of Tapad.",https://www.linkedin.com/jobs/view/externalApply/2495180251?url=https%3A%2F%2Fgrnh%2Ese%2Fb1b8c6261us&urlHash=qTgf&refId=6d29ba9e-d44a-4fdf-8505-d870d4fd3686&trackingId=xgVute5ALA021QTX%2ByvqWA%3D%3D&trk=public_jobs_apply-link-offsite
Data Science Intern,Chegg Inc.,"Providence, RI","DATA SCIENCE INTERNSHIP
Remote, United States

Organization: Chegg Skills Data Science & Analytics

The Chegg Skills Data Science & Analytics team is composed of data scientists and business analysts. The team influences strategy and works closely with the product, engineering, marketing, and business leaders and is responsible for generating insights and reporting for the new careers products and services at Chegg.

Role: Data Science Internship

We’re looking for highly motivated interns to join our team and work on a number of applied data science and analytics problems within the education and career space. Interns on our Data Science team will apply data mining and analytical skills to help make critical business decisions and drive key business metrics.

Responsibilities
Work closely with others on the Data Science & Analytics team, as well as cross-functionally with product, marketing, engineering, and business teams to understand project goals.
Identify, gather and transform data from a variety of sources.
Perform rigorous statistical analysis, including significance testing, forecasting, and modeling.
Build dashboards, slide decks, reports, and presentations to share analytical insights with stakeholders and business leaders.

Requirements
Pursuing a Bachelor/MS Degree in a quantitative field (computer science, statistics, engineering, economics, or a related field)
A strong interest in using data mining and statistical models to understand user needs, drive business metrics and improve product efficiencies
Strong data extraction skills using SQL
Experience with advanced analytical and data visualization methods
Experience with a scripting language, preferably Python or R
Self-motivated; independent, organized, and proactive; highly responsive, flexible, and adaptable when working across multiple product teams
Comfort working in a fast-paced environment with real-world data that may be ambiguous or incomplete
Strong creative and critical thinking skills. Attention to details.
Buy-in to Chegg’s mission of providing support for students undertaking their next big challenge
Be legally allowed to work in the US (US citizen, green card, or F1 student visa holder)
Have the ability to work for a continuous 10 weeks in the summer of 2021

Nice To Have
Experience with Databricks
Experience using Amazon Web Services
Experience building dashboards through platforms like Tableau
Chegg out our intern program!

http://www.chegg.com/jobs/university

See what it’s like to be a Chegg intern!

https://www.youtube.com/watch?v=Cp1m_ZtOT_4

Learn more about Chegg!

https://www.youtube.com/watch?v=YYHnkwiD7Oo

About Chegg

Chegg puts students first. As the leading connected learning platform, the company makes higher education more affordable, more accessible, and more successful for students. Chegg is a publicly-held company based in Santa Clara, California, and trades on the NYSE under the symbol CHGG. For more information, visit www.chegg.com.

Chegg is an equal opportunity employer

United States Remote: This is a remote position which may be performed anywhere in the United States except for within the state of Colorado.

#LI- MI",https://www.linkedin.com/jobs/view/externalApply/2419654465?url=https%3A%2F%2Fjobs%2Echegg%2Ecom%2Fjob%2FCHEGA0056OYHQEFWD%2F&urlHash=CHM7&refId=6d29ba9e-d44a-4fdf-8505-d870d4fd3686&trackingId=ucB3LJN%2B3STsii4nNad6QQ%3D%3D&trk=public_jobs_apply-link-offsite
Data Science Intern,The Clorox Company,"Pleasanton, CA","Make your mark

At Clorox, we build big brands that make everyday life better, every day. We value our differences, and challenge each other to think and act boldly. We try new things, succeed, fail and keep learning. We work hard, and have busy personal lives. And we’re all able to make a positive impact – at Clorox, in our communities, and in the lives of millions of people who invite us into their homes. Make your mark and help us drive Good Growth – growth that is profitable, sustainable and responsible.

Job Overview/Summary



The Clorox Company Internship Program is a 10-week summer experience that runs from June through August. Interns are provided meaningful work assignments designed to provide perspective and practical work experience highlighting what you would do in a similar role following completion of your degree and working at the company on a regular, fulltime basis. Through the course of the summer, interns participate in:

Formal, three-day orientation and program kick off with interns from all functions in California
Peer-level mentorship and connection points with functional and company executives
Community Engagement activity
Soft-skills training and development exercises Key Responsibilities
The Global Insights Data Scientist Intern (GIDSI) is responsible for translating structured and unstructured consumer data into clear and compelling insights that lead to actionable recommendations and drive business results. The scope of these recommendations will span both tactical and strategic goals of the Marketing organization.

The GIDSI will work closely with multiple cross-functional business partners to uncover new opportunities / hypotheses, structure experiments around these ideas, and using results from the experiments to continually optimize actions and new ideas for the business. This will lead to robust analysis by the GIDSI which will deliver visual presentations that turn complex data into a clear story allowing business partners to drive action/decisions quickly and effectively. The GIDSI will also be involved with machine learning, and help with data extraction, featurization, model development and deployment of our ML algorithms.

Key Skills, Abilities And Experience Required

Key Job Responsibilities of the Global Insights Data Scientist Intern

Assess and Scope Consumer Data Sources & Business Needs to Effectively Develop Priorities
Assess and understand all key structured and unstructured data sources
Work with cross-functional business partners on their business hypotheses and to help scope data science work appropriately to drive their objectives
Recommend, design and execute projects that deliver both tactical and strategic marketing insights
Communicate complex information in a way that is easily understood
Build/Code/Analyze Appropriate Data in order to Drive to Actionable and Clear Business Recommendations
Build complex data sets from multiple data sources
Build learning systems to analyze and filter continuous data flows and offline data analysis.
Conduct advanced statistical analysis to determine trends and significant data relationships.
Identify opportunities for data to opportunistically inform marketing decisions & optimization
Leverage data science tools and techniques to analyze large data sets and develop custom models/algorithms to uncover trends, patterns and insights in the data
Leverage data visualization tools & techniques to deliver insights that drive business recommendations, innovative business solutions and enable real-time marketing and optimization

POSITION REQUIREMENTS:

Preferred Location: Remote (Pleasanton, CA post Covid)

Secondary Location: Remote (Oakland, CA post Covid)

Education And Experience

Currently pursuing a MS or PhD in a quantitative discipline (e.g. statistics, biostatistics, computer science, applied mathematics, operations research, economics) or another discipline involving experimental design and quantitative analysis of data.
Experience using technology to work with datasets such as Scripting, Python, statistical software (R, SAS or similar).
Experience with statistical data analysis such as linear models, multivariate analysis, stochastic models, and sampling methods.

Core Skill Set

Apart from the Quantitative skills captured in Education and Experience, the candidate needs to demonstrate strong core skills in the following areas:
Analytical/Critical Problem-Solving
Project Management Skills
Results Orientation
Attention to details
Planning and Organizing with ability to multi-task and work on multiple projects simultaneously with emphasis on agility
Interpersonal and Collaborative Team Skills
Effective and Persuasive Communication
Thought Leadership

Required Education

More about Marketing
Marketing is a powerful growth engine for Clorox. We create winning ideas that drive consumer value and energize our brands and businesses around the world. Consumers are at the center of everything we do, and our brand teams translate passion for the consumer into business results. We use consumer insights to develop and implement marketing plans, create and evaluate business-building projects, and inspire new product development opportunities. Join our team to help us develop human-centered, technology-enabled, purpose-driven brands.

More About Clorox
The Clorox Company (NYSE: CLX) is a leading multinational manufacturer and marketer of consumer and professional products with approximately 8,800 employees worldwide and fiscal year 2020 sales of $6.7 billion. Clorox markets some of the most trusted and recognized consumer brand names, including its namesake bleach and cleaning products;
Pine-Sol® cleaners
Liquid-Plumr® clog removers
Poett® home care products
Fresh Step® cat litter
Glad® bags, wraps and containers
Kingsford® charcoal
Hidden Valley® dressings and sauces
Brita® water-filtration products; Burt's Bees® natural personal care products
RenewLife® digestive health products
Rainbow Light®, Natural Vitality™ and NeoCell® dietary supplements.

The company also markets industry-leading products and technologies for professional customers, including those sold under the CloroxPro™ and Clorox Healthcare® brand names. Nearly 80% of the company's sales are generated from brands that hold the No. 1 or No. 2 market share positions in their categories.

Please apply directly to our job postings and do not submit your resume to any person via text message. Clorox does not conduct text-based interviews and encourages you to be cautious of anyone posing as a Clorox recruiters via unsolicited texts during these uncertain times.",https://www.linkedin.com/jobs/view/externalApply/2444849564?url=https%3A%2F%2Fwd1%2Emyworkdaysite%2Ecom%2Fen-US%2Frecruiting%2Fclorox%2FClorox%2Fjob%2FPleasanton-CA---USA%2FData-Science-Intern_4762-1%3FSID%3D122&urlHash=9tyo&refId=6d29ba9e-d44a-4fdf-8505-d870d4fd3686&trackingId=vFX7gE09dc%2F%2BN5YMGmUEhA%3D%3D&trk=public_jobs_apply-link-offsite
Summer 2021 Data Science Intern,"Take-Two Interactive Software, Inc.","New York, NY","Who We Are

Take-Two Interactive Software, Inc. is a leading developer, publisher, and marketer of interactive entertainment for consumers around the globe. For more than 25 years, our development teams have created some of the most critically acclaimed and commercially successful entertainment experiences, captivating and engaging audiences around the world. We are incredibly proud of our ability to deliver consistently the highest-quality titles, as well as our colleagues who help to create our unique culture and work environment that is inclusive, diverse, and dynamic.

While our offices are casual and inviting, we are deeply committed to our core tenets of creativity, innovation and efficiency, and individual and team development opportunities. Our industry and business are continually evolving and fast-paced, providing numerous opportunities to learn and hone your skills. We work hard, but we also like to have fun, and believe that we provide a great place to come to work each day to pursue your passions.

The Challenge

In this internship, you will experience the full cycle of model development from conception to production. This role is structured around designing and delivering a demand forecasting model for Take-Two’s video game products. You will learn about corporate data practices, the interactive entertainment business, and what it takes to deliver a model into production. You will work with a data scientist who will serve as your mentor and supervisor to guide you through this project. The model you build will ultimately be used to help inform strategy decisions for the Commercial team as well as fiscal guidance and planning decisions for Take-Two and its labels.

What You’ll Take On
Learn about Take-Two’s data systems
Gain understanding of current body of forecasting methodologies
Work with your mentor to propose a new forecasting methodology
Develop a plan to execute your methodology and build the model in Python
Work with your mentor to interface with the data engineering team to bring your model to production


What You Bring
Python, SQL, probability/statistics
BA/BS in a quantitative discipline
Current or recently graduated Masters/PhD student


What We Offer You
Great Company Culture. Ranked as one of the most creative and innovative places to work, creativity, innovation, efficiency, diversity and philanthropy are among the core tenets of our organization and are integral drivers of our continued success.
Growth: As a global entertainment company, we pride ourselves on creating environments where employees are encouraged to be themselves, inquisitive, collaborative and to grow within and around the company.
Work Hard, Play Hard. Our employees bond, blow-off steam, and flex some creative muscles – through corporate boot camp classes, company parties, game release events, monthly socials, and team challenges.


Take-Two Interactive Software, Inc. (“T2”) is proud to be an equal opportunity employer, which means we are committed to creating and celebrating diverse thoughts, cultures, and backgrounds throughout our organization. Employment at T2 is based on substantive ability, objective qualifications, and work ethic – not an individual’s race, creed, color, religion, sex or gender, gender identity or expression, sexual orientation, national origin or ancestry, alienage or citizenship status, physical or mental disability, pregnancy, age, genetic information, veteran status, marital status, status as a victim of domestic violence or sex offenses, reproductive health decision, or any other characteristics protected by applicable law.",https://www.linkedin.com/jobs/view/externalApply/2431505333?url=https%3A%2F%2Fcareers%2Etake2games%2Ecom%2Fjob%2F2948956%3Fgh_jid%3D2948956%3Fgh_src%3Dbac1e34c1us&urlHash=FT9-&refId=6d29ba9e-d44a-4fdf-8505-d870d4fd3686&trackingId=KVkR2Jyjs08xnZc%2FN28OEg%3D%3D&trk=public_jobs_apply-link-offsite
