title,company,location,requirements,link
Campaign Management Intern,AARP,"Washington, DC","Business Unit Description

AARP is a nonprofit, nonpartisan organization, with a membership of nearly 38 million that helps people turn their goals and dreams into 'Real Possibilities' by changing the way America defines aging. With staffed offices in all 50 states, the District of Columbia, Puerto Rico, and the U.S. Virgin Islands, AARP works to strengthen communities and promote the issues that matter most to families such as healthcare security, financial security and personal fulfillment. AARP also advocates for individuals in the marketplace by selecting products and services of high quality and value to carry the AARP name. As a trusted source for news and information, AARP produces the world’s largest circulation magazine, AARP The Magazine and AARP Bulletin.

The Community, State and National Affairs (CSNA) team is a key contributor to AARP's mission of social change for Americans 50+ and their families. CSNA drives social change through our advocacy work by giving our members a voice—at the federal, state, local levels and community levels—on issues important to them such as Financial Resilience, Health Security, and Personal Fulfillment.

With a network of 53 offices in each state, the US Virgin Islands, Puerto Rico and the District of Columbia, we live where we work. This allows us to do what we do best…meet the people and directly engage in our communities to find out what they need and want, enabling us to educate our members with programs and information that is relevant to them.

Our state offices work hand-in-glove with AARP’s national office in Washington, DC. This reach—from community to state to federal - enables CSNA to better empower people 50+ to enjoy the way they live and work today, while reaching their goals for tomorrow…their life - their way.

Summary

AARP's Government Affairs Team is looking for an intern to work on the Campaigns team. You will develop your business skills while working for the largest social mission organization in the country. This internship will begin in May/June and end in December.

Responsibilities

You will work under the close supervision of Campaign management staff. Self-motivation and the ability to work independently as part of a team and collaboratively are required. You will have opportunities to work closely with the Manager and other members of the Campaigns team as necessary, to support the goals of AARP Campaigns. Your primary duties will include
Preparing materials related to AARP’s multi-state campaigns by utilizing PowerPoint, Word documents, and Excel spreadsheets.
Gathering research and compiling information and recommendations regarding priority advocacy issues. This could include online searches, reviewing publications, and accessing library materials.
Collaborating with other organizations around AARP's priorities.
Requirements

Prospective interns must be currently enrolled in a degree program at an accredited college or university; be considered rising undergraduate juniors or seniors, graduate students, or post-doctoral students; and remain academically enrolled throughout the internship.

AARP also considers non-traditional interns who are looking to re-enter the workforce or change careers. This may include those who have previously graduated from college and enrolled in a continuing education program.

Compensation And Benefits

Internships are non-exempt positions and are not eligible for employee benefits.

As a result of the COVID pandemic, all interviews will be held virtually and all non-essential employees will continue to work remotely until further notice.
Equal Employment Opportunity

AARP is an equal opportunity employer committed to hiring a diverse workforce and sustaining an inclusive culture. AARP does not discriminate on the basis of race, ethnicity, religion, sex, color, national origin, age, sexual orientation, gender identity or expression, mental or physical disability, genetic information, veteran status, or on any other basis prohibited by applicable law.",https://www.linkedin.com/jobs/view/externalApply/2481174618?url=https%3A%2F%2Fwww%2Eapplytracking%2Ecom%2Fx%2Easpx%3Fmethod%3Ddirect%26type%3Dapply%26board%3DD92FCD45-1292-4AE2-B555-D7A273418B42%26Job%3D12461162%26ClientCode%3D11778&urlHash=HM7S&refId=fcfe4187-0e8a-4171-b345-d7d946130238&trackingId=XM6iXoZ5GNioS%2FixcNYOyQ%3D%3D&trk=public_jobs_apply-link-offsite
Volunteer: Executive Intern - Outreach,VolunteerMatch,"Chicago, IL","AWOFINC is a community initiative that is designed to meet the needs of families who do not have the resources that are to attain the supplemental educational services that are needed to enhance the possibility of success for their children. For over two decades AWOFINC has addressed the critical educational, financial, and social needs of the families in Illinois.
Community Outreach Intern is a person who wants to improve his or her community. The Intern lives in the community where he or she will help the residents. Their responsibilities include the overseeing of Community Resources and all kinds of activities. The Intern gets involved with community affairs and helps residents who are in need. Being a community outreach worker gives the Intern the opportunity to reach out to the grassroots level of people and make a difference in their lives. The residents interact with each other and socialize with the Intern. Educational programs are organized for the benefit of the residents.

The Intern has the power to influence choices and behavior in the community. Relationships are developed through one-on-one interaction. It is important for the Intern to be able to plan, develop, implement, and evaluate community programs. With the many fields that an Outreach Intern can engage in, it is the Community & Faith-Based nonprofit organizations, and local businesses, schools and political offices including health departments that are most well known. In this kind of work, flexible work hours are needed and hard work is required of the community outreach worker.

Since the Intern adapts to the lifestyle of the community that is served, the candidate needs to be open-minded about other people’s way of life. Depending on the duration that the Intern needs to spend in a certain community, the candidate has to be prepared physically and emotionally in dealing with a new group of people. It is important for the community members to trust the Intern. With trust as the foundation, the community members can open up about their need for programs that can improve their lives.

This is a volunteer opportunity provided by VolunteerMatch, in partnership with LinkedIn for Good.",https://www.linkedin.com/jobs/view/externalApply/2410574876?url=http%3A%2F%2Fwww%2Evolunteermatch%2Eorg%2Fsearch%2Fopp2851479%2Ejsp%3Futm_source%3Dlinkedin%26utm_medium%3Ddirect%26utm_campaign%3Dlfg%26_sid%3Dlinkedinforgood&urlHash=HpPj&refId=fcfe4187-0e8a-4171-b345-d7d946130238&trackingId=dpphzC4LTpVLyEgIL0fR%2BQ%3D%3D&trk=public_jobs_apply-link-offsite
Volunteer: Executive Intern - Outreach,BLACK,"Evanston, IL","We Organize for Knowledge and Empowerment #WOKE

Community Outreach Intern is a person who wants to improve his or her community. The Intern lives in the community where he or she will help the residents. Their responsibilities include the overseeing of Community Resources and all kinds of activities. The Intern gets involved with community affairs and helps residents who are in need. Being a community outreach worker gives the Intern the opportunity to reach out to the grassroots level of people and make a difference in their lives. The residents interact with each other and socialize with the Intern. Educational programs are organized for the benefit of the residents.

The Intern has the power to influence choices and behavior in the community. Relationships are developed through one-on-one interaction. It is important for the Intern to be able to plan, develop, implement, and evaluate community programs. With the many fields that an Outreach Intern can engage in, it is the Community & Faith-Based nonprofit organizations, and local businesses, schools and political offices including health departments that are most well known. In this kind of work, flexible work hours are needed and hard work is required of the community outreach worker.

Since the Intern adapts to the lifestyle of the community that is served, the candidate needs to be open-minded about other people’s way of life. Depending on the duration that the Intern needs to spend in a certain community, the candidate has to be prepared physically and emotionally in dealing with a new group of people. It is important for the community members to trust the Intern. With trust as the foundation, the community members can open up about their need for programs that can improve their lives.

This is a volunteer opportunity provided by VolunteerMatch, in partnership with LinkedIn for Good.",https://www.linkedin.com/jobs/view/externalApply/2475060416?url=http%3A%2F%2Fwww%2Evolunteermatch%2Eorg%2Fsearch%2Fopp3308002%2Ejsp%3Futm_source%3Dlinkedin%26utm_medium%3Ddirect%26utm_campaign%3Dlfg%26_sid%3Dlinkedinforgood&urlHash=M6uh&refId=fcfe4187-0e8a-4171-b345-d7d946130238&trackingId=DSE0gdf9yKAXV3YlgdaB9Q%3D%3D&trk=public_jobs_apply-link-offsite
Oregon Public Affairs Communications Intern,Intel Corporation,"Hillsboro, OR","Job Description

Join Intel-and build a better tomorrow. Intel is in the midst of an exciting transformation, with a vision to create and extend computing technology to connect and enrich the lives of every person on Earth. So join us-and help us create the next generation of technologies that will shape the future for decades to come.

Corporate Services (CS) touches the lives of every Intel employee every day. CS creates an environment where employees can prosper while creating the innovative technologies that make amazing possible. Our scope is vast and includes operating and maintaining all Intel sites, offices, labs and factories globally as well as onsite services and experiences that help employees stay safe and productive. CS also helps to make Intel and our community a greener place by supporting Intel's commitment to environmental sustainability, including investing in conservation projects, setting company-wide environmental targets and driving reductions in greenhouse emissions, energy use, water use and waste generation.

Intel relies on its community affairs and community engagement programs to enable its License to Operate within its site communities. Student/interns will be part of a small team responsible for building the company's reputation within the local community.

We're seeking an undergraduate intern to support Intel Oregon's community outreach programs.

This will be a virtual internship during Intel's COVID restrictions; expected to be on-site or at community events once Intel's COVID restrictions are removed.

Responsibilities Will Include But Are Not Limited To
Engaging with internal and external stakeholders to help create communication copy, including but not limited to social media, newsletters, and blogs.
Contributing to Oregon Public Affairs' communication strategy.
Helping communicate Intel Oregon philanthropy, community engagement and sustainability activities across Oregon.
Supporting the Oregon Public Affairs team with other tasks related to neighbor, community engagement and government relations.

The Successful Candidate Should Exhibit The Following Behavioral Traits
Verbal and written communication skills.
Attention to detail.
Interpersonal skills to build relationships with a diverse range of people in a virtual environment.
Tolerance of ambiguity.
Data management.
Willing to work under tight deadlines and within flexible hours.

Qualifications

You must possess the below minimum qualifications to be initially considered for this position. Preferred qualifications are in addition to the minimum requirements and are considered a plus factor in identifying top candidates. Experience would be obtained through a combination of prior education level classes, and current level school classes, projects, research, and relevant previous job and/or internship experience.

This position is not eligible for employment-based visa/immigration sponsorship. Intel sponsors individuals for employment-based visas for positions where we experience a shortage of US Workers. These skills shortage roles are typically STEM contributing positions requiring a Master's or Ph.D. degree, or a Bachelor’s degree with three years’ related job experience. This position does not qualify for Intel Sponsorship because it is either (1) a non-STEM contributing position, or (2) a STEM position that only requires a Bachelor’s degree and less than three years’ experience.

Minimum Qualifications
The candidate must be pursuing a Bachelor's degree in Public Relations or Communications or Business or Marketing or Journalism or English.

Preferred Qualifications
Understanding of Corporate Social Responsibility and/or Social Equity concepts.
Intermediate to advanced MS Office skills (Excel, Word, PowerPoint, Teams, Yammer, and SharePoint).
Inside this Business Group

As the world's largest chip manufacturer, Intel strives to make every facet of semiconductor manufacturing state-of-the-art -- from semiconductor process development and manufacturing, through yield improvement to packaging, final test and optimization, and world class Supply Chain and facilities support. Employees in the Technology and Manufacturing Group are part of a worldwide network of design, development, manufacturing, and assembly/test facilities, all focused on utilizing the power of Moore’s Law to bring smart, connected devices to every person on Earth

Posting Statement

All qualified applicants will receive consideration for employment without regard to race, color, religion, religious creed, sex, national origin, ancestry, age, physical or mental disability, medical condition, genetic information, military and veteran status, marital status, pregnancy, gender, gender expression, gender identity, sexual orientation, or any other characteristic protected by local law, regulation, or ordinance.",https://www.linkedin.com/jobs/view/externalApply/2463059225?url=https%3A%2F%2Fwww%2Eapplytracking%2Ecom%2Fx%2Easpx%3Fmethod%3Ddirect%26type%3Dapply%26board%3DD92FCD45-1292-4AE2-B555-D7A273418B42%26Job%3DJR0162261%26ClientCode%3D11143&urlHash=cWYm&refId=fcfe4187-0e8a-4171-b345-d7d946130238&trackingId=VCwUQfDixojRoRDdf%2FuOIA%3D%3D&trk=public_jobs_apply-link-offsite
Community Benefit and Economic Stability Intern,Community Catalyst,"Boston, MA (+1 other)","The Community Benefit and Economic Stability project at Community Catalyst is seeking a 2021 graduate-level, summer intern to assist with research on non-profit hospitals’ efforts to address health inequities in their communities through community benefit activities. This will be a 20-hour per week internship for 10 weeks, with a stipend of $3,000. Due to restrictions related to the COVID-19 pandemic, the intern will work remotely, reporting to the Program Director of Community Benefit and Economic Stability project.

Intern responsibilities
• Conduct research on non-profit hospital community health needs assessments, implementation strategies, financial assistance/billing/collection policies, IRS filings, and community benefit activities.
• Interview key informants including hospital representatives, policymakers, staff at community-based organizations, consumer advocates, and community residents.
• Compile hospital data gathered through research efforts into database or spreadsheets...",https://cssh.northeastern.edu/policyschool/job/community-benefit-and-economic-stability-intern/?utm_campaign=google_jobs_apply&utm_source=google_jobs_apply&utm_medium=organic
,Community Catalyst,"Boston, MA (+1 other)","The Community Benefit and Economic Stability project at Community Catalyst is seeking a 2021 graduate-level, summer intern to assist with research on non-profit hospitals’ efforts to address health inequities in their communities through community benefit activities. This will be a 20-hour per week internship for 10 weeks, with a stipend of $3,000. Due to restrictions related to the COVID-19 pandemic, the intern will work remotely, reporting to the Program Director of Community Benefit and Economic Stability project.

Intern responsibilities
• Conduct research on non-profit hospital community health needs assessments, implementation strategies, financial assistance/billing/collection policies, IRS filings, and community benefit activities.
• Interview key informants including hospital representatives, policymakers, staff at community-based organizations, consumer advocates, and community residents.
• Compile hospital data gathered through research efforts into database or spreadsheets...",https://cssh.northeastern.edu/policyschool/job/community-benefit-and-economic-stability-intern/?utm_campaign=google_jobs_apply&utm_source=google_jobs_apply&utm_medium=organic
,Community Catalyst,"Boston, MA (+1 other)","The Community Benefit and Economic Stability project at Community Catalyst is seeking a 2021 graduate-level, summer intern to assist with research on non-profit hospitals’ efforts to address health inequities in their communities through community benefit activities. This will be a 20-hour per week internship for 10 weeks, with a stipend of $3,000. Due to restrictions related to the COVID-19 pandemic, the intern will work remotely, reporting to the Program Director of Community Benefit and Economic Stability project.

Intern responsibilities
• Conduct research on non-profit hospital community health needs assessments, implementation strategies, financial assistance/billing/collection policies, IRS filings, and community benefit activities.
• Interview key informants including hospital representatives, policymakers, staff at community-based organizations, consumer advocates, and community residents.
• Compile hospital data gathered through research efforts into database or spreadsheets...",https://cssh.northeastern.edu/policyschool/job/community-benefit-and-economic-stability-intern/?utm_campaign=google_jobs_apply&utm_source=google_jobs_apply&utm_medium=organic
,Community Catalyst,"Boston, MA (+1 other)","The Community Benefit and Economic Stability project at Community Catalyst is seeking a 2021 graduate-level, summer intern to assist with research on non-profit hospitals’ efforts to address health inequities in their communities through community benefit activities. This will be a 20-hour per week internship for 10 weeks, with a stipend of $3,000. Due to restrictions related to the COVID-19 pandemic, the intern will work remotely, reporting to the Program Director of Community Benefit and Economic Stability project.

Intern responsibilities
• Conduct research on non-profit hospital community health needs assessments, implementation strategies, financial assistance/billing/collection policies, IRS filings, and community benefit activities.
• Interview key informants including hospital representatives, policymakers, staff at community-based organizations, consumer advocates, and community residents.
• Compile hospital data gathered through research efforts into database or spreadsheets...",https://cssh.northeastern.edu/policyschool/job/community-benefit-and-economic-stability-intern/?utm_campaign=google_jobs_apply&utm_source=google_jobs_apply&utm_medium=organic
,Community Catalyst,"Boston, MA (+1 other)","The Community Benefit and Economic Stability project at Community Catalyst is seeking a 2021 graduate-level, summer intern to assist with research on non-profit hospitals’ efforts to address health inequities in their communities through community benefit activities. This will be a 20-hour per week internship for 10 weeks, with a stipend of $3,000. Due to restrictions related to the COVID-19 pandemic, the intern will work remotely, reporting to the Program Director of Community Benefit and Economic Stability project.

Intern responsibilities
• Conduct research on non-profit hospital community health needs assessments, implementation strategies, financial assistance/billing/collection policies, IRS filings, and community benefit activities.
• Interview key informants including hospital representatives, policymakers, staff at community-based organizations, consumer advocates, and community residents.
• Compile hospital data gathered through research efforts into database or spreadsheets...",https://cssh.northeastern.edu/policyschool/job/community-benefit-and-economic-stability-intern/?utm_campaign=google_jobs_apply&utm_source=google_jobs_apply&utm_medium=organic
,Community Catalyst,"Boston, MA (+1 other)","The Community Benefit and Economic Stability project at Community Catalyst is seeking a 2021 graduate-level, summer intern to assist with research on non-profit hospitals’ efforts to address health inequities in their communities through community benefit activities. This will be a 20-hour per week internship for 10 weeks, with a stipend of $3,000. Due to restrictions related to the COVID-19 pandemic, the intern will work remotely, reporting to the Program Director of Community Benefit and Economic Stability project.

Intern responsibilities
• Conduct research on non-profit hospital community health needs assessments, implementation strategies, financial assistance/billing/collection policies, IRS filings, and community benefit activities.
• Interview key informants including hospital representatives, policymakers, staff at community-based organizations, consumer advocates, and community residents.
• Compile hospital data gathered through research efforts into database or spreadsheets...",https://cssh.northeastern.edu/policyschool/job/community-benefit-and-economic-stability-intern/?utm_campaign=google_jobs_apply&utm_source=google_jobs_apply&utm_medium=organic
,Community Catalyst,"Boston, MA (+1 other)","The Community Benefit and Economic Stability project at Community Catalyst is seeking a 2021 graduate-level, summer intern to assist with research on non-profit hospitals’ efforts to address health inequities in their communities through community benefit activities. This will be a 20-hour per week internship for 10 weeks, with a stipend of $3,000. Due to restrictions related to the COVID-19 pandemic, the intern will work remotely, reporting to the Program Director of Community Benefit and Economic Stability project.

Intern responsibilities
• Conduct research on non-profit hospital community health needs assessments, implementation strategies, financial assistance/billing/collection policies, IRS filings, and community benefit activities.
• Interview key informants including hospital representatives, policymakers, staff at community-based organizations, consumer advocates, and community residents.
• Compile hospital data gathered through research efforts into database or spreadsheets...",https://cssh.northeastern.edu/policyschool/job/community-benefit-and-economic-stability-intern/?utm_campaign=google_jobs_apply&utm_source=google_jobs_apply&utm_medium=organic
,Community Catalyst,"Boston, MA (+1 other)","The Community Benefit and Economic Stability project at Community Catalyst is seeking a 2021 graduate-level, summer intern to assist with research on non-profit hospitals’ efforts to address health inequities in their communities through community benefit activities. This will be a 20-hour per week internship for 10 weeks, with a stipend of $3,000. Due to restrictions related to the COVID-19 pandemic, the intern will work remotely, reporting to the Program Director of Community Benefit and Economic Stability project.

Intern responsibilities
• Conduct research on non-profit hospital community health needs assessments, implementation strategies, financial assistance/billing/collection policies, IRS filings, and community benefit activities.
• Interview key informants including hospital representatives, policymakers, staff at community-based organizations, consumer advocates, and community residents.
• Compile hospital data gathered through research efforts into database or spreadsheets...",https://cssh.northeastern.edu/policyschool/job/community-benefit-and-economic-stability-intern/?utm_campaign=google_jobs_apply&utm_source=google_jobs_apply&utm_medium=organic
,Community Catalyst,"Boston, MA (+1 other)","The Community Benefit and Economic Stability project at Community Catalyst is seeking a 2021 graduate-level, summer intern to assist with research on non-profit hospitals’ efforts to address health inequities in their communities through community benefit activities. This will be a 20-hour per week internship for 10 weeks, with a stipend of $3,000. Due to restrictions related to the COVID-19 pandemic, the intern will work remotely, reporting to the Program Director of Community Benefit and Economic Stability project.

Intern responsibilities
• Conduct research on non-profit hospital community health needs assessments, implementation strategies, financial assistance/billing/collection policies, IRS filings, and community benefit activities.
• Interview key informants including hospital representatives, policymakers, staff at community-based organizations, consumer advocates, and community residents.
• Compile hospital data gathered through research efforts into database or spreadsheets...",https://cssh.northeastern.edu/policyschool/job/community-benefit-and-economic-stability-intern/?utm_campaign=google_jobs_apply&utm_source=google_jobs_apply&utm_medium=organic
