title,company,location,requirements,link
2021 Summer Graduate Intern - Oncology - Data Science,Novartis Oncology,"East Hanover, NJ","Sourcing Statement

You are applying to be part of the Novartis Talent Pool. We are not currently recruiting for this role but we are building a pipeline for future opportunities. If you would like to be considered for a similar position in future, then please submit your CV.

Job Description

799 million. That’s how many lives our products touched in 2019. And while we’re proud of that fact, in this world of digital and technological transformation, we must also ask ourselves this: how can we continue to improve and extend even more people’s lives?

We believe the answers are found when curious, courageous and collaborative people like you are brought together in an inspiring environment. Where you’re given opportunities to explore the power of digital and data. Where you’re empowered to risk failure by taking smart risks, and where you’re surrounded by people who share your determination to tackle the world’s toughest medical challenges.

Imagine what you could do at Novartis!

Building new capabilities and automation of existing capabilities in Enterprise Analytics and Data Science is a priority for SDD. Enterprise Analytics is how we measure, track, monitor, draw insights from existing data assets as well as account based information to define the resource allocation and optimization strategy for various Oncology Brands by providing analytical support via data science.

This job will work closely with the Data Science within Novartis Oncology Strategic Insights and Analytics team as well as Data Science & AI team. In addition to conducting data science, this position will also work closely with the market access teams to conduct account affiliation analysis.

Major Accountabilities

Assist in creation of new capabilities and automation of existing capabilities working with brand Analysts, and external vendors to support KPI metrics and dashboards
Support the problem solving on Metrics and KPIs- Especially as these relate to existing projects. Develop appropriate communications (e.g., presentation documents) to share with broader organization. Also identify data needs, and set up back-end models to understand impact of channels/tactics.
Work on Data Science and AI related questions utilizing existing data assets.
Collaborate with brand analysts on creation of NPP target Lists, segmentation, and response models. Identify areas for the application of big data predictive analytics applications in NPP efforts.
Challenge the status quo, and bring academic insights.
Collaborate cross-functionally in a matrix organization that consists of Digital team, Brand Teams, Brand Analysts, DS and AI team; share best practices across the organization


EEO Statement
The Novartis Group of Companies are Equal Opportunity Employers and take pride in maintaining a diverse environment. We do not discriminate in recruitment, hiring, training, promotion or other employment practices for reasons of race, color, religion, gender, national origin, age, sexual orientation, gender identity or expression, marital or veteran status, disability, or any other legally protected status. We are committed to building diverse teams, representative of the patients and communities we serve, and we strive to create an inclusive workplace that cultivates bold innovation through collaboration and empowers our people to unleash their full potential.

Minimum Requirements

Candidate should be in an accredited degree-granting college or university pursuing a graduate degree

Pursuing Graduate Degree in Quantitative Disciple (e.g. Mathematics, Statistics, Engineering, Operations Research or Business).

Experience:
Ability to synthesize complex and diverse set of information; influence without authority various stakeholders to steer towards a solution
Strong written and oral communication skills, including the ability to translate a complex analysis into simple ‘business speak’ and present analytical results to internal clients up to the executive level
Ability to work under pressure, demonstrating initiative and flexibility through effective and innovative leadership ability
Ability to understand new data sources in a short timeframe and incorporate them into standard analyses. Attention to detail and quality focused.
Good organizational, planning, resource and project management skills
Good interpersonal and communication skills,
Experience in data visualization and dashboard tools like Tableau a plus
Learning agility - ability to pick up new trends and learn quickly


Strong interpersonal skills and ability to influence without authority

Commitment to Diversity & Inclusion
Novartis embraces diversity, equal opportunity and inclusion. We are committed to building diverse teams, representative of the patients and communities we serve, and we strive to create an inclusion workplace that cultivates bold innovation through collaboration, and empowers our people to unleash their full potential. Novartis is an equal opportunities employer and welcomes applications from all suitably qualified persons.

Join our Novartis Network
If this role is not suitable to your experience or career goals but you wish to stay connected to learn more about Novartis and our career opportunities, join the Novartis Network here: https://talentnetwork.novartis.com/network

Division
ONCOLOGY

Business Unit
ONCOLOGY BU

Country
USA

Work Location
East Hanover, NJ

Company/Legal Entity

Novartis Pharmaceuticals

Functional Area
Data Science

Job Type
Full Time

Employment Type
Internship

Shift Work
No

#NovOn",https://www.linkedin.com/jobs/view/externalApply/2499534869?url=https%3A%2F%2Fsjobs%2Ebrassring%2Ecom%2FTGnewUI%2FSearch%2Fhome%2FHomeWithPreLoad%3Fpartnerid%3D13617%26siteid%3D5268%26PageType%3DJobDetails%26jobid%3D2725128%26frmSiteId%3D5260%26codes%3DLIIN-W&urlHash=M2Ji&refId=b94a0010-964d-4a63-8843-84f492c877d9&trackingId=1QqCuVF7KuqYfybYvK95mQ%3D%3D&trk=public_jobs_apply-link-offsite
Data Science Intern,"Sovrn Holdings, Inc.","Boulder, CO","We are looking for a Data Science Intern for May 6, 2021 - August 6, 2021 who will support the Data Science team by developing and delivering projects that fulfill immediate business needs. You’ll gain solid exposure to the digital advertising ecosystem as part of our dynamic internship program and expand upon your professional skill set in a unique and fun environment.

About The Job

As a Data Science intern you will be responsible for assisting the Data Science team in projects that span Sovrn’s multiple business lines, and your assignments will involve a mix of data engineering, data science and machine learning tasks. The anticipated project involves incorporating web site category data into Sovrn’s Ad Exchange, employing this data for auction optimization, and assessing its resulting monetary impact.

What You’ll Be Doing
Developing a method of mapping content category data from one taxonomy to another
Automating ETL of re-mapped data into Sovrn’s Ad Exchange
Analysis of subsequent yield impacts resulting from category data
Training of a machine learning model to use this category data as a feature
Analysis of resulting machine learning model performance
Learning many new skills and data science techniques


About You

You’re driven, thoughtful, and curious. You can break down your work into steps, and can sequence deliveries for maximum velocity and impact. You assess risks, but are not afraid to act. Above all, you’re open to learning.

The Successful Candidate Will Have
Undergraduate coursework in pursuit of a bachelor's degree in Data Science, Computer Science or a related field.
Facility with Python and SQL.
Familiarity with one or more of: AWS, GCP, Bash, or Git.
Experience with Google Drive programs such as Docs, Sheets and Slides.
Excellent oral and written communication skills.
Strong organizational skills and capable of prioritizing and managing daily duties.
Ability to efficiently multi-task and to work cooperatively and collaboratively with all levels of employees to maximize performance, creativity, problem-solving and results.
Desire for professional growth opportunities and to be in a dynamic learning environment.
Excitement about being part of a fast-paced Data Science team.
Ability to work 40 hours a week.
Ability to commit to a term of no less than 3 months.

Bonus Points
Familiarity with one or more of Java, Scala, JavaScript, and C/C++.

This position reports to: Director, Data Science

Location: Boulder, Colorado

We understand that no candidate is perfectly qualified for any job. Experience comes in different forms; many skills are transferable; and passion goes a long way. Even more important than your resume is a clear demonstration of accountability impact, and the ability to thrive in a fluid and collaborative environment. We expect you to learn new things in this role, and we encourage you to apply if your experience is close to what we're looking for.

About Sovrn

Publishers create the content the world depends on for education, entertainment, and commerce. Sovrn provides products and services to tens of thousands of online publishers to help them grow, operate their business, understand their readership, and manage consumer data. Sovrn is headquartered in Boulder, Colorado with offices in San Francisco, New York, and London.

With 10,000 customers deploying one or more products across 30,000 websites, Sovrn reaches 200M consumers across more than 3.5B pageviews everyday. Sovrn has been a leader in online publisher technology since its founding, and has been recognized by IAB, JICWEBS, and TAG for its role in combating advertising fraud and promoting pro-transparency initiatives. Sovrn is dedicated to helping content creators do more of what they love, and less of what they don’t.

Sovrn Core Values: Candid, Customer Empathy, Learning, Scrappy, Second Order Thinking

Compensation And Benefits

In accordance with the Colorado Equal Pay for Equal Work Act, the compensation range for this role in Boulder, Colorado is $20.00 - $25.00 an hour. Final compensation for this role will be determined by various factors such as a candidate's relevant work experience, skills and certifications.

Equal Opportunity Employer

Sovrn is proud to be an Equal Opportunity Employer and provides equal employment opportunities to all employees and applicants regardless of race, color, religion, gender, gender identity, age, national origin, disability, parental or pregnancy status, marriage and civil partnership, sexual orientation, veteran status, or any other characteristic protected by law. Reasonable accommodations will be made to meet the requirements of the Americans with Disabilities Act and will be provided as requested by candidates taking part in all aspects of the selection process.",https://www.linkedin.com/jobs/view/externalApply/2485018698?url=https%3A%2F%2Fboards%2Egreenhouse%2Eio%2Fsovrn%2Fjobs%2F3033274&urlHash=dDQ1&refId=b94a0010-964d-4a63-8843-84f492c877d9&trackingId=rnrXIR1PJeTDoCFbvryO%2FA%3D%3D&trk=public_jobs_apply-link-offsite
The 2021 Launch Program: Data Science Intern,Red Ventures,"Charlotte, NC","Launch Your Career: As a Launch cohort member, you will skip the ""entry-level"" ""grunt-work,"" and start making a real impact on Day 1. As part of the Red Ventures Launch program, you'll find unparalleled opportunities to make a real impact and advance your career – fast.

Already know where you want your career to go? Looking to explore some options first? (""All of the above"" is a perfectly valid answer.)

Red Ventures offers the unique opportunity to gain valuable experience across a multitude of roles, teams, and even industries. Our business leaders and mentors are hyper-focused on defining personalized career paths for our talent – setting you up to unlock enormous potential within the first few years of your career.

What You'll Do
Data Science Associates transform millions of impressions and unstructured data from our digital properties into powerful insights that help us deepen connections between brands and consumers.
Use advanced machine learning, statistical modeling and optimization techniques to build real-world solutions for online and offline decision-making
Own data science projects from start to finish with limited guidance
Collect and mine data from disparate data sources, digging deeper to understand the process behind the data
Communicate effectively with business and data science leaders on project status, timeline and technical results
Translate business opportunities into data science problems, clearly defining project scope + performance metrics to measure success
We don't believe in busywork, and we definitely don't believe in wasting time or talent on ""getting coffee."" As a Red Ventures Intern, you'll be expected to contribute new ideas, take ownership of meaningful projects, and make a real impact on our business.
Typically, RV Interns receive an in-depth onboarding experience and participate in 1-2 large projects over the summer. With guidance from your mentors, you'll drive strategy, build tests, pivot, improve, and iterate until finally presenting results to your business team and RV senior leadership at the end of the summer.
Our culture is built on feedback, and our Interns are no different. You'll receive two structured performance reviews over the summer, where your manager will work with you to identify key strengths, opportunities, and goals. Top-performing interns will be eligible for full-time offers at the end of the summer.


What We're Looking For
Graduating Winter 2021 or Summer 2022 with a relevant PhD or Masters equivalent
Experience solving complex problems through the use of predictive modeling
Extensive experience in querying and processing data from complex relational databases
Extensive training and knowledge in machine learning, statistical modeling and/or optimization.
Expertise in deep learning, NLP, reinforcement learning, recommend systems preferred
Demonstrated ability to synthesize data into actionable insights and communicate recommendations to leadership
Solid interpersonal and communication skills, with a track record of working well with business stakeholders
Knowledge of digital attribution and digital data investigation and testing skills is preferred
Statistical programming knowledge (e.g., R or Python) is required
Work Perks:
Subsidized meals at our onsite cafes, smoothie bars and coffee bars
Free onsite fitness classes, premier wellness center, spin studio, basketball court, bowling alley, and yoga studio
Casual dress code


Who We Are

Founded in 2000, Red Ventures is a portfolio of growing digital businesses that bring consumers and brands together through integrated e-commerce, strategic partnerships and many proprietary brands including Bankrate, AllConnect.com and Reviews.com. Headquartered south of Charlotte, NC, Red Ventures has over 3000 employees in offices across the US, as well as London and Sao Paulo. For more information, visit www.redventures.com.

We offer competitive salaries and a comprehensive benefits program for full-time employees, including medical, dental and vision coverage, paid time off, life insurance, disability coverage, employee assistance program, 401(k) plan and a paid parental leave program.

Red Ventures is an equal opportunity employer that does not discriminate against any employee or applicant because of race, creed, color, religion, gender, sexual orientation, gender identity/expression, national origin, disability, age, genetic information, veteran status, marital status, pregnancy or any other basis protected by law. Employment at Red Ventures is based solely on a person's merit and qualifications.

We are committed to providing equal employment opportunities to qualified individuals with disabilities. This includes providing reasonable accommodation where appropriate. Should you require a reasonable accommodation to apply or participate in the job application or interview process, please contact accommodation@redventures.com.",https://www.linkedin.com/jobs/view/externalApply/2495176323?url=https%3A%2F%2Fgrnh%2Ese%2F524e4bd41us&urlHash=Pni1&refId=b94a0010-964d-4a63-8843-84f492c877d9&trackingId=unuETeG5cc35cwBmkNGaug%3D%3D&trk=public_jobs_apply-link-offsite
Intern - Data Science - Machine Learning,GM Financial,"Arlington, TX","Overview

START YOUR JOURNEY AT GM FINANCIAL'S SUMMER INTERNSHIP PROGRAM

GM Financial was founded as Americredit in September 1992 and opened its first branch office in Fort Worth, Texas. On October 10, 2010, Americredit Corp. was acquired by General Motors Company and renamed General Motors Financial Company, Inc. (GM Financial). GM Financial is the captive auto finance company and subsidiary of General Motors and is headquartered in Fort Worth, U.S. We are a global provider of auto finance solutions, with operations in North America, South America and Asia.GM Financial offers many unique opportunities to talented emerging professionals in our Summer Internship Program. As an intern at our company, you'll gain hands-on, real-world experience alongside industry-leading professionals during the 10-week program. You will have the opportunity to develop your skills in a professional environment and build a strong foundation for your future career.

Responsibilities

We are looking for students who are ready to take on stimulating projects and gain exposure to a variety of industry initiatives.

During This Internship You Will Gain

GM Financial is looking to hire a Data scientist intern to join our Emerging Data Technologies team looking for experience with coding needed for model deployment or a developer with an understanding of machine learning that is looking for experience with deploying models into production. This engineer will join a senior team of engineers to learn how to research and analyze academic and open source frameworks that are suited for large amounts of data and extract meaningful business information which can be deployed both in on-prem and cloud environments. The Engineer will have an opportunity to develop proof of concept on state of art Machine learning platform using Python.
10 weeks of work experience
Competitive salary
Executive and peer networking opportunities
Independent and team project experiences
Philanthropic activities
Career development
Opportunity to apply for full-time career positions

Qualifications
Must be a current student pursuing a Bachelor’s degree or higher from an accredited college or university in Computer Science, Data Science, Math or Statistics with at least one semester remaining upon start of the internship.
Must possess a minimum of a 3.0 (out of a 4 point scale) overall GPA.
Junior or Senior classification preferred.
Strong written and verbal communication skills required. This incumbent will be required to give presentations and communicate with business leaders.
Experience with Programming languages (Python)
Experience with Algorithms and Data structures
Exposure to ML frameworks (Tensorflow, PyTorch, scikit-learn)
Strong analytical, quantitative, problem solving and conceptual skills required.
Must be detail oriented and able to prioritize tasks to meet deadlines.
Must be able to work independently or in a team setting.
Previous internships considered a plus.

Working Conditions
Must be able to commit to work 40 hours for 10 consecutive weeks during the summer (First week of June through 2nd week in August)
Must participate in all GMF sponsored events for interns.
GM Financial does not provide sponsorship for a work visa status for this position.

If you are interested in any of the areas listed above, please apply here!",https://www.linkedin.com/jobs/view/externalApply/2436097622?url=https%3A%2F%2Fcareers-gmfinancial%2Eicims%2Ecom%2Fjobs%2F38720%2Fintern---data-science---machine-learning%2Fjob%3Fmode%3Djob%26iis%3DJob%2BBoard%26iisn%3DLinkedIn&urlHash=khXO&refId=b94a0010-964d-4a63-8843-84f492c877d9&trackingId=Vrd7fCY693l8tY6tcQDLFg%3D%3D&trk=public_jobs_apply-link-offsite
MMS Internship Program - Data Scientist Intern (REMOTE),BD,"San Diego, CA","MMS Internship Program - Data Scientist Intern (REMOTE)

Job Description

Job Description Summary

The BD Medication Management Solutions (MMS) division proudly offers a Virtual Summer Internship Program for undergraduate or graduate students. Through this program, the student will have the chance to gain real-world experience in solving data science problems that help improve healthcare. The student will work with a data science organization that is developing machine learning algorithms to tackle challenging healthcare problems such as Opioid Diversion, Inventory Optimization and Diagnosing medical device failures.

Key Responsibilities
Work with data science team to develop new algorithms and improve existing algorithms
Develop automation tools to improve the efficiency of data science team
Write unit tests and improve the test coverage of existing code
Create new production monitoring metrics and monitoring mechanisms

Required

Qualifications
Senior level candidates (graduating on or before Summer 2022) in STEM or Graduate student in STEM (ideally in Statistics, Computer Science or Math)
Good R or Python programming skills
Good understanding of ML methods
Familiarity working with version control software
The candidate must be legally authorized to work in the United States without limitations and require no sponsorship for visa status now or in the future (e.g. H1-B status)

Preferred
GPA minimum of 3.5
Experience with building docker containers
Experience with software development

Primary Work Location
USA CA - San Diego Bldg A&B

Additional Locations

Work Shift",https://www.linkedin.com/jobs/view/externalApply/2494041411?url=https%3A%2F%2Fjobs%2Ebd%2Ecom%2Fjob%2Fsan-diego%2Fmms-internship-program-data-scientist-intern-remote%2F159%2F19006272&urlHash=C6f0&refId=b94a0010-964d-4a63-8843-84f492c877d9&trackingId=aRV98qmqdq5uG7owr2Hplw%3D%3D&trk=public_jobs_apply-link-offsite
