title,company,location,requirements,link
Student Paid Internship - Healthcare,RN Services Private Duty Care,"St Louis, MO","Student Paid Internship - Healthcare

RN Services Private Duty Care - St. Louis, MO

Part-Time

RN Services Private Duty Care is a locally owned home health care company in the St Louis area. For over 20 years, we have serviced high-end clients in St Louis and surrounding areas. We are currently staffing healthcare students in need of clinical hours including but not limited to Health Science majors - OT, PT, MA, RT.; This position allows for hands on experience working one-on-one with our clients, developing practical skillsets in real life environments. We provide the opportunity for credit hours toward CNA, PCT; Non-certified applicants are eligible.

Qualifications
High School Diploma
Must be a licensed driver with a clean driving record and adhere to RNS vehicle safety.
Has a vehicle that is currently insured
Must own a cellphone with internet and texting capabilities
Must have daily access to RNS email
Knowledge of the English language
Must complete all physical and mental demands for described position.
Has corrected vision and hearing within normal range.


Responsibilities
Provides care agreed upon by client, client's family and RN Services
Follows directions as provided by the client, clients family and RN Services
Communicate effectively with above stated
Agrees to variable work schedule
Is responsible for working assigned shifts and/or finding coverage
Ability to connect with geriatric clients
Monitoring vitals, ADL's, transfers using a gait belt or assistive devices
TB test (required within 90 days of hire)
CPR (required within 90 days of hire)

Job Type: part time

Work Authorization: United States (required)

Shifts: All - must have some weekend availability

Minimum shift - 4 hours Maximum shift - 12 hours",https://www.linkedin.com/jobs/view/externalApply/2470328750?url=http%3A%2F%2Fwww%2Estlprivatedutycare%2Ecom%2Fnwemppg%2Ehtml%3Fgnk%3Djob%26gni%3D8a7883a9784b99f0017851027dd857e3%26gns%3DLinkedIn%252BLimited&urlHash=gMjr&refId=ea1a068b-5316-4294-8fd1-a2a41f023085&trackingId=xCmGRhrFeosF5jr59tj3dg%3D%3D&trk=public_jobs_apply-link-offsite
