title,company,location,requirements,link
Healthcare Policy Intern,The Economist,New York City Metropolitan Area," The Economist Group's Client Solutions division specialises in delivering bespoke research, thought leadership and consulting that leverage both The Economist and The Economist Intelligence Unit's expertise and reach. We deliver research and engagement programmes that use evidence and data to drive change on the critical economic and public policy issues facing our world. Our clients include government bodies, international organisations and corporations, and we provide evidence, insights and advice to shape their policies and programmes.
 The Client Solutions division is looking for a highly motivated intern to to augment our dynamic, influential global team and to deliver an expanding range of products and services. The intern will principally deliver projects around evidence-based clinical research and health policy analyses that drive high-quality effective organisational decisions, impactful external engagement to improve health and healthcare. The position will entail working with clients in both the public and the private sector.
 This is a 3-6 month paid internship based in our Washington, DC or New York, NY office. Please submit a resume and cover letter outlining your skills and capabilities as they relate to this internship.

How will you contribute:
Participate in project teams with healthcare analysts on multi-country engagements for government / NGO / industry clients
Assist with evidence-based analyses such as literature reviews, disease burden studies, health policy analysis and international benchmarking
Use diverse project methodologies, including primary research, literature searches, data analysis, all supporting compelling deliverables and relevant conclusions
Increase your exposure to key therapeutic areas, policy developments and global health systems
Learn from our business development executives about how to develop ""winning"" proposals from leads and RFPs generated by interpreting client needs, conceptualizing the project framework, defining clear project approaches and output, and demonstrating EIU Healthcare knowledge
Learn about the public and private health sector landscape on a local, regional and global level
Learn about EIU Healthcare policy solutions and broader organizational capabilities

The ideal skills for this role are:
Demonstrated experience and/or exposure to health (either in public or private sector), preferably with a policy focus
A Bachelor’s degree in a related field (i.e. science, health policy); current enrollment in a Master’s programme is a plus
Proven experience in evidence-based, health related analyses with qualitative and quantitative components
Exposure to health policy / system trends and issues; ideal candidate would have exposure to international markets
Exceptional command of written and spoken English; additional fluency in Spanish preferred
Intellectual curiosity, with highly analytical, organized and meticulous research skills
An ability to utilize a variety of evidence-based approaches
Capacity to learn unfamiliar topics quickly and produce deliverables with occasionally ambiguous input
Good teamwork through transparent and effective communications, the ability to work well with people at all levels of an organization
Versatility, and an ability to think both inside and outside of the box

The Economist Group values diversity. We are committed to equal opportunities and creating an inclusive environment for all our employees. We welcome applicants regardless of ethnic origin, national origin, gender, gender identity, race, colour, religious beliefs, disability, sexual orientation, age or marital status.",https://www.linkedin.com/jobs/view/externalApply/2455978757?url=https%3A%2F%2Fcareers-economist%2Eicims%2Ecom%2Fjobs%2F7220%2Fhealthcare-policy-intern%2Fjob%3Fhub%3D6%26mode%3Djob%26iis%3DJob%2BBoard%26iisn%3DLinkedIn&urlHash=PEtz&refId=ea1a068b-5316-4294-8fd1-a2a41f023085&trackingId=CTkctqt2iggoCGY%2B8Xcoyw%3D%3D&trk=public_jobs_apply-link-offsite
Healthcare Summer Intern,Zeno Group,"New York, NY","Healthcare summer interns will have the opportunity to work on a variety of projects and Healthcare clients.

In order to be considered, you must submit the following with your application:

A resume of any relevant work, education and extra-curricular experiences AND a completed Zeno Group Healthcare Intern Writing Assessment.pdf

save completed assessment as First Name_Last Name_Healthcare and email to interns@zenogroup.com

DISCLAIMER: If you have trouble opening the assessment please right-click and select open in a new tab.

Incomplete applications will not be considered

About The Job
Responsibilities include but are not limited to the following:
Work closely with account team members to develop and deliver key client deliverables, learning the basics of the clients’ business
Manage the day-to-day admin activities for 1-3 accounts
Monitoring client and competitor media coverage and drafting coverage recaps for the team
Draft media materials, including but not limited to press releases, fact sheets, briefing sheets and pitches
Conduct research to aid in the strategy development process for current clients and new business pitches
Participate in brainstorm sessions and program ideation
Create and distribute mailers, press kits, and briefing kits

About You
The ideal candidate will have an understanding of the ever-changing healthcare realm and will be connected to the pulse of these changes.
Passion for and understanding of public relations and media landscape as it relates to Healthcare
Excellent written, verbal communication, and interpersonal skills
Strong organizational skills
Collaborative spirit, results driven with the ability to manage multiple priorities and work against deadlines
Must be pro-active and able to operate effectively both independently and within a team
Basic understanding of social media platforms
MS Office proficiency is a must
Familiar with the public relations, marketing, or communications discipline through past coursework, internships, or personal experiences

About Us

Zeno Group is the fiercely independent and global integrated communications agency, born from PR. We bring together the boldest and brightest talent to help clients across industries and sectors unleash the power of strategic communications. Guided by our ‘Fearless Pursuit of the Unexpected,’ we push the boundaries to achieve real business value and societal impact for clients.

Zeno Group is a place where careers are built and lives are lived. We cultivate our fearless culture to ensure greater diversity, equity and inclusion across the entire agency and the industry. Zeno is for everyone. Winner of our industry’s most coveted awards including the 2021 PRWeek Agency of the Year and a two-time winner of PRWeek’s Best Places to Work, Zeno has been previously named Creative Agency of the Year by PRovoke and recognized twice by the Cannes Lions International Festival of Creativity. Zeno is a DJE Holdings Company.

About Our Benefits

Zeno Group offers a creative and differentiating benefits package including a variety of medical and dental choices, vacation, and sick time. We also offer a 401(k) plan, pretax flexible spending accounts, tuition assistance, a prescription drug benefit plan, a vision plan, long-term and short-term disability, life insurance and programs that support flexibility and promote work/life balance. In addition, our unique ZenoFit wellness program offers financial support to pursue the wellness activity of your choice.",https://www.linkedin.com/jobs/view/externalApply/2446347838?url=https%3A%2F%2Fjobs%2Elever%2Eco%2Fzenogroup%2F473965ea-d019-4bbd-9350-1fa1bf5369f9%3Flever-source%3DLinkedInJobs&urlHash=DagO&refId=ea1a068b-5316-4294-8fd1-a2a41f023085&trackingId=DaIY%2B8NXTOU3LJoQQsF0ng%3D%3D&trk=public_jobs_apply-link-offsite
Healthcare Cost Intern (Summer 2021),"Anthem, Inc.","Atlanta, GA","Description

SHIFT: Day Job

SCHEDULE: Full-time

Your Talent. Our Vision. At Anthem, Inc., it’s a powerful combination, and the foundation upon which we’re creating greater access to care for our members, greater value for our customers, and greater health for our communities. Join us and together we will drive the future of health care.

This is an exceptional opportunity to do innovative work that means more to you and those we serve at one of America's leading health care companies and a Fortune Top 50 Company.

Provides support to the members of the Cost of Care Team within GA Commercial. Under the direction of HealthCare Cost Outcomes Director assists with other employees throughout the enterprise on cost of care activities related to the local health plan. Completes assignments related to data extraction, manipulation and tabulation of results. Assists with data analysis to support active projects within Cost of Care Team. Help with meetings and provide project support through recording action items/takeaways

Qualifications
You must be currently enrolled in an accredited college or university with a preferred August/December 2021 / spring 2022 graduation date. Rising Juniors and Seniors
Currently enrolled in a one of the following degree programs: Finance, Information Systems, Computer Science, Business Majors, Project Management, and Healthcare Management
Have an overall cumulative GPA of 3.0 or higher.
Be motivated and willing to learn with strong communication, organizational, and leadership skills.
Skilled at working collaboratively, developing creative solutions, and accomplishing team goals.


We provide benefits to intern and Co-Op students that include 401(k) + Match and access to Anthem’s associate resource groups. Additionally, students receive work related experience, opportunities to grow their professional network, learn new & practical skills, explore a wide range of career paths, mentoring, and the potential to secure a fulltime job following graduation.

Anthem, Inc. is ranked as one of America’s Most Admired Companies among health insurers by Fortune magazine and has been named a 2019 Best Employers for Diversity by Forbes. To learn more about our company and apply, please visit us at careers.antheminc.com. An Equal Opportunity Employer/Disability/Veteran. Anthem promotes the delivery of services in a culturally competent manner and considers cultural competency when evaluating applicants for all Anthem positions.",https://www.linkedin.com/jobs/view/externalApply/2467364897?url=https%3A%2F%2Fanthemcareers%2Ettcportals%2Ecom%2Fjobs%2F6462521-healthcare-cost-intern-summer-2021%3Ftm_job%3DPS47007%26tm_event%3Dview%26tm_company%3D2522%26bid%3D56&urlHash=CYko&refId=ea1a068b-5316-4294-8fd1-a2a41f023085&trackingId=IRlMpeEqPUSKXrmoNVov3g%3D%3D&trk=public_jobs_apply-link-offsite
Healthcare Intern (9514),"InGenesis, Inc.","Dallas, TX","InGenesis is currently seeking a Healthcare Intern to work with our client located in Dallas, TX. In this role, you will provide assistants to a facility that provides care to Unaccompanied Children (UC) in accordance with all local and federal standards/regulations.

Apply today and we'll reach out to answer any questions you may have!

Job Duties
Conduct interviews.
Conduct orientation and training.
Assist with onboarding new hires.
Assist in coordinating supplies.
Conduct intake services for incoming UC.
Provide basic needs and supplies to UC upon arrival.
Monitor behavioral management and therapeutic activities.
Perform crisis intervention as needed.
Provide safe, clean living space.
Conduct regular and consistent headcounts of UC under care.
Assist in social and recreational activities.
Assist in evacuation of UC as needed due to inclement weather conditions, natural disasters, or other unforeseen occurrences.
Ensure program operations, goals, and objectives are being met and UC are receiving the highest quality of services and support.
Perform other duties as assigned.


Minimum Qualifications
High school diploma or equivalent.
Enrolled in a college or university's healthcare program.
Must be at least 21 years of age.
Preferred: Bilingual in English and Spanish.
Excellent communication skills (verbal/written).
Strong organizational and task prioritization skills.
Proficient with basic computer skills, Microsoft Office, and documentation programs/databases.
Must be able to work extended shifts during periods of influx, including 12-hr shifts at least once a week. Weekend rotations may be required.


About InGenesis

InGenesis is dedicated to placing people in positions that preserve life, improve lives and inspire others. This does not happen without passionate people, skilled colleagues who are motivated to create innovative solutions and deliver superior service to our clients. Founded in 1998, InGenesis manages thousands of employees, including pioneering healthcare, science, technology and pharma professionals. The workforce solutions company includes almost half of the Fortune 500 in its nearly 300 clients. It is recognized as one of the largest healthcare staffing firms, and InGenesis is the largest minority/women owned healthcare staffing firm in North America.

EEOC Statement

InGenesis is proud to be an affirmative action employer and is committed to providing equal employment opportunity regardless of race, color, ancestry, religion, sex, national origin, sexual orientation, age, citizenship, marital status, disability, gender identity, or Veteran status. If you have a disability or special need that requires accommodation, please let us know by visiting our website at https://www.ingenesis.com/careers/site-accommodations.",https://www.linkedin.com/jobs/view/externalApply/2476725187?url=https%3A%2F%2Fjsco%2Ere%2F9m7wh&urlHash=JUxh&refId=ea1a068b-5316-4294-8fd1-a2a41f023085&trackingId=OGkM67hhRF%2FYSWiiL535Eg%3D%3D&trk=public_jobs_apply-link-offsite
"Intern, Client Experience, Healthcare (remote)",Inmar Intelligence,"Winston-Salem, NC","The Intern, Client Experience, Healthcare will support the Healthcare Client Experience team in effectively meeting Service Level Agreements (SLAs) with Inmar’s clients, identifying and resolving operational challenges that could potentially impact client deliverables, and leading client onboarding and process improvement projects. Additionally, the Client Experience Intern will assist Client Account Managers, Client Account Supervisors, and other stakeholders with managing client relationships.

This internship is remote and you will need to be available for the full 10 weeks.

Client Engagement
Participate in client calls, project plans, day-to-day correspondence, and collaborative client strategy meetings as appropriate
Collect client feedback as it relates to service delivery, products, and overall client experience to gain insights into areas of opportunity and potential process improvements
Internal Alignment Strategy
Create recommendations for greater alignment between Inmar’s cross functional teams by job shadowing and conducting internal interviews
Compile and maintain a repository of internal resources such key documents, file shares, etc.
Develop strategies to drive adoption of new tools and internal process changes
Process Improvement
Assist the Client Experience team in developing and maintaining tools, metrics, and reporting to monitor compliance, success, and sustainability of new or enhanced business processes and standards
Support operations and cross-functional teams in developing procedures, training programs, and metrics to support business and system changes
Assist in the development of a program to collect internal feedback, ideas, and suggestions related to potential process improvements

Competencies

Curious: A desire to inquire and learn, to seek new knowledge and wisdom, and to listen to the contributions of others with a genuine interest to better self, the team, and the organization.

Critical Thinking: Ability to tackle a problem by using a logical, systematic, sequential approach.

Adaptable: Responds to change with a willingness to learn new ways to accomplish goals with a positive attitude.

Problem Solving: Gathers and studies information to generate and evaluate potential solutions to problems, issues and challenges while weighing the accuracy and relevance of the facts, data and information.

Effective Execution: Translates broad conceptual understanding of the company's strategy into a tactical plan of how it will happen

Urgency: Transfers mission to action by acting clearly and conclusively to investigate and implement solutions regardless of pressure or uncertainty and maintains a sense of urgency to complete tasks, accomplish goals, and act in ambiguous and complex situations.

Communication: Giving and receiving messages and information in written, oral, and visual formats in a clear and concise way for a complete understanding of meaning and intent.

Integrity: Gains the trust of others by taking responsibility for own actions and telling the truth.

Personal Credibility: Demonstrates concern that one be perceived as responsible, reliable, and trustworthy.

Business Acumen: Understands and is aware of how to think about and successfully make the right business decisions through the utilization of industry-specific knowledge and skills and strategic thinking tools and skills.

Required Qualifications
Currently enrolled university student with a graduation date after August 2021
Interest in the healthcare industry (specifically logistics, data, and patient engagement)
Self-starter and demonstrate the ability to work independently on multiple projects and teams
Strong analytical and organizational skills
Excellent verbal and written communication skills
Proficiency in G-Suite (Google) and Microsoft Office Suite
Salesforce.com experience preferred but not required",https://www.linkedin.com/jobs/view/externalApply/2418481160?url=https%3A%2F%2Finmar%2Ewd1%2Emyworkdayjobs%2Ecom%2Fen-US%2Finmarcareers%2Fjob%2FHeadquarters-Winston-Salem-NC%2FIntern--Client-Experience--Healthcare--remote-_JY2115296%3Fsource%3DLinkedIn&urlHash=Tv_q&refId=ea1a068b-5316-4294-8fd1-a2a41f023085&trackingId=BolQ9JwTZqaLVqhVs%2FQiTA%3D%3D&trk=public_jobs_apply-link-offsite
Healthcare Administration Intern,CareerStaff Unlimited,"Schaumburg, IL","Healthcare Administration Internship 
 CareerStaff Unlimited, a division of Genesis HealthCare, is currently looking for an Intern to work 32-40 hours per week for a 13-week period in our Schaumburg, IL office starting immediately. This is a paid internship and the schedule can be somewhat flexible based on the needs of a qualified intern. 
 We are certified as a Great Place to Work and we value having a fun workplace culture, so our ideal candidate must have a personable and positive attitude!
 What We Offer:

Unparalleled company culture
Free parking
Full benefits including medical, dental, vision, 401(k) for full-time employees
Paid time off, vacation days, sick leave for full-time employees
Leadership training and advancement opportunities 
On-site training
 Responsibilities:
 Compiles weekly payroll and submits it to the corporate office for processing 
Performs monthly billing administration to all accounts at specifically defined billing cycles 
Provides maintenance of all payroll records and is responsible for the completion and submission of all on-boarding documentation for all new employees 
Creates local personnel files for all new hires and ensures new employees receive appropriate orientation materials including employee handbook, benefit enrollment materials, etc 
Prepares weekly accounts payable request to the corporate accounts payable department and maintains all accounts payable records for the division and or location 
Ensures proper inventory levels of office supplies and equipment are maintained 
Ensures equipment is in good order and secures necessary repairs or replacement as directed
Prepares various operational reports as directed by the Area Manager or Director
Works independently on special projects and assignments, as assigned 
 Requirements: 
 Candidates should currently be pursuing an applicable higher education degree 
Positive attitude 
Motivated to learn",https://www.linkedin.com/jobs/view/externalApply/2418481160?url=https%3A%2F%2Finmar%2Ewd1%2Emyworkdayjobs%2Ecom%2Fen-US%2Finmarcareers%2Fjob%2FHeadquarters-Winston-Salem-NC%2FIntern--Client-Experience--Healthcare--remote-_JY2115296%3Fsource%3DLinkedIn&urlHash=Tv_q&refId=ea1a068b-5316-4294-8fd1-a2a41f023085&trackingId=BolQ9JwTZqaLVqhVs%2FQiTA%3D%3D&trk=public_jobs_apply-link-offsite
"University Intern, Healthcare Disputes",Ankura,"Chicago, IL","Ankura is a team of excellence founded on innovation and growth.

This position supports the Ankura Disputes & Economics Business Group - one of seven practices focused on client delivery services across the Firm.

Practice Summary

The Healthcare Disputes, Compliance and Forensics practice focuses on assisting healthcare and life science clients and their counsel in addressing the issues associated with complex disputes, investigations, regulatory and compliance, and technology services. Our practice professionals have a thorough understanding of the issues facing a broad range of clients in the healthcare industry including but not limited to provider, payer, and pharmacy clients. We bring the deep industry knowledge and experience necessary to assist these clients with their most pressing and sensitive matters.
Ankura’s provider team has experience assisting hospitals, long term care centers, outpatient and diagnostic centers, DME providers, home health agencies, hospice centers and their legal counsel to provide effective solutions for their most complex litigation and compliance issues.
Ankura’s payer team brings a combination of compliance, operations, audit, clinical coding, data analytics, financial, valuation, and systems professionals to support payer executives and their counsel with regulatory compliance, operations, disputes, investigations, and transaction support and due diligence.
Ankura’s pharmacy team assists counsel across the entire spectrum of pharmacy benefits, including retail, hospital, and specialty pharmacies; distributors; pharmacy benefit managers; and plan sponsors. Our expertise includes: the quantification of financial exposure through analytic and statistical methods; prescription drug claims submission and payment; pharmacy benefit administration; Medicare Part D compliance; and the preparation of expert and consultative reports shared with prosecutors or used in commercial litigation.

Essential Duties & Responsibilities

Summer Interns, working as part of a project team, perform critical, value-added work that directly impact a client’s bottom line. Responsibilities may include developing and performing financial, accounting, economic, and statistical analyses; providing detailed fact finding, research and analysis; developing computer models including detailed and complex spreadsheet analyses; assisting with data gathering activities including document review, research, and quality control of data entry activities and preparation of expert reports and exhibits; demonstrating proper documentation of analysis; and providing excellent client service.

Basic Qualifications

Candidates should be top academic performers, be interested in the consulting industry, and meet the following criteria:
Pursuing a Bachelor’s Degree with an expected graduation date between December 2021 to August 2022, with a major in accounting, finance, economics, statistics or public Policy
A cumulative GPA of 3.2 or better.
Interest in healthcare industry.
Interested in working with large data sets and developing analytical models.
Excellent verbal and written communication skills.
Creative problem-solving ability and a collaborative, consultancy mindset.
Ability to multi-task and effectively prioritize tasks.
Highly motivated, driven, and dynamic attitude towards work and career.
Ability to excel within a team environment.
Proficient in Microsoft Excel, Word, and PowerPoint; familiarity with Microsoft Access, SQL, or statistical packages such as R, SAS, SPSS.
Ability to work overtime or travel as requested.
Ankura is an equal employment opportunity employer. Employment Opportunities at Ankura are based upon one’s qualifications and capabilities to perform the essential function of a particular job. All employment opportunities are provided without regard to race, color, religion, sex, pregnancy, childbirth or related medical conditions, national origin, age, veteran status, disability, genetic information, or any other characteristic protected by law.

This Equal Employment opportunity governs all aspects of employment, including, but not limited to, recruitment, hiring, selection, job assignment, promotions, transfers, compensation, discipline, termination, layoff, access to benefits and training, and all other conditions and privileges of employment.

Ankura is proud to be an equal opportunity employer committed to fostering a diverse and inclusive environment where mutual respect and collaboration is paramount. All qualified applicants will receive consideration for employment without regard to age, race, color, religion, sex, sexual orientation, gender identity and expression, disability, protected veteran status, national origin, or any other legally protected status.",https://www.linkedin.com/jobs/view/externalApply/2449040681?url=https%3A%2F%2Fankura%2Ewd5%2Emyworkdayjobs%2Ecom%2Fen-US%2FAnkura%2Fjob%2FChicago-IL%2FUniversity-Intern--Healthcare-Disputes_R101070&urlHash=HUUu&refId=ea1a068b-5316-4294-8fd1-a2a41f023085&trackingId=cQ73KYjJ5ci%2B8%2Fev%2Ba2JVg%3D%3D&trk=public_jobs_apply-link-offsite
