title,company,location,requirements,link
Data Science Intern,SOVRN - A creative agency,"Boulder, CO","We are looking for a Data Science Intern for May 6, 2021 - August 6, 2021 who will support the Data Science team by developing and delivering projects that fulfill immediate business needs. You'll gain solid exposure to the digital advertising ecosystem as part of our dynamic internship program and expand upon your professional skill set in a unique and fun environment.

About The Job

As a Data Science intern you will be responsible for assisting the Data Science team in projects that span Sovrn's multiple business lines, and your assignments will involve a mix of data engineering, data science and machine learning tasks. The anticipated project involves incorporating web site category data into Sovrn's Ad Exchange, employing this data for auction optimization, and assessing its resulting monetary impact.

What You'll Be Doing
Developing a method of mapping content category data from one taxonomy to another
Automating ETL of re-mapped data into Sovrn's Ad Exchange
Analysis of subsequent yield impacts resulting from category data
Training of a machine learning model to use this category data as a feature
Analysis of resulting machine learning model performance
Learning many new skills and data science techniques


About You

You're driven, thoughtful, and curious. You can break down your work into steps, and can sequence deliveries for maximum velocity and impact. You assess risks, but are not afraid to act. Above all, you're open to learning.

The Successful Candidate Will Have
Undergraduate coursework in pursuit of a bachelor's degree in Data Science, Computer Science or a related field.
Facility with Python and SQL.
Familiarity with one or more of: AWS, GCP, Bash, or Git.
Experience with Google Drive programs such as Docs, Sheets and Slides.
Excellent oral and written communication skills.
Strong organizational skills and capable of prioritizing and managing daily duties.
Ability to efficiently multi-task and to work cooperatively and collaboratively with all levels of employees to maximize performance, creativity, problem-solving and results.
Desire for professional growth opportunities and to be in a dynamic learning environment.
Excitement about being part of a fast-paced Data Science team.
Ability to work 40 hours a week.
Ability to commit to a term of no less than 3 months.

Bonus Points
Familiarity with one or more of Java, Scala, JavaScript, and C/C++.

This position reports to: Director, Data Science

Location: Boulder, Colorado

We understand that no candidate is perfectly qualified for any job. Experience comes in different forms; many skills are transferable; and passion goes a long way. Even more important than your resume is a clear demonstration of accountability impact, and the ability to thrive in a fluid and collaborative environment. We expect you to learn new things in this role, and we encourage you to apply if your experience is close to what we're looking for.

About Sovrn

Publishers create the content the world depends on for education, entertainment, and commerce. Sovrn provides products and services to tens of thousands of online publishers to help them grow, operate their business, understand their readership, and manage consumer data. Sovrn is headquartered in Boulder, Colorado with offices in San Francisco, New York, and London.

With 10,000 customers deploying one or more products across 30,000 websites, Sovrn reaches 200M consumers across more than 3.5B pageviews everyday. Sovrn has been a leader in online publisher technology since its founding, and has been recognized by IAB, JICWEBS, and TAG for its role in combating advertising fraud and promoting pro-transparency initiatives. Sovrn is dedicated to helping content creators do more of what they love, and less of what they don't.

Sovrn Core Values: Candid, Customer Empathy, Learning, Scrappy, Second Order Thinking

Compensation And Benefits

In accordance with the Colorado Equal Pay for Equal Work Act, the compensation range for this role in Boulder, Colorado is $20.00 - $25.00 an hour. Final compensation for this role will be determined by various factors such as a candidate's relevant work experience, skills and certifications.

Equal Opportunity Employer

Sovrn is proud to be an Equal Opportunity Employer and provides equal employment opportunities to all employees and applicants regardless of race, color, religion, gender, gender identity, age, national origin, disability, parental or pregnancy status, marriage and civil partnership, sexual orientation, veteran status, or any other characteristic protected by law. Reasonable accommodations will be made to meet the requirements of the Americans with Disabilities Act and will be provided as requested by candidates taking part in all aspects of the selection process.",https://www.linkedin.com/jobs/view/externalApply/2495187436?url=https%3A%2F%2Fgrnh%2Ese%2F8e17817b1us&urlHash=FUyB&refId=9f9e2bd4-3b29-41ff-b438-d33d763d2b73&trackingId=pOwPgLbM5ZL9l76R0R%2BcYg%3D%3D&trk=public_jobs_apply-link-offsite
Data Science/Analytics Internship,ManTech,"Remote, OR","Secure our Nation, Ignite your Future

Due to the ongoing pandemic, the health and safety of our employees, interns, and their families remains our highest priority. T he ManTech 2021 Summer Internship will be a virtual experience. The ManTech College Recruiting & Student Programs Team is honored to present a robust virtual summer program for 2021

Job Description

Become an integral part of a diverse team while working at an Industry Leading Organization, where our employees come first. At ManTech International Corporation, you’ll help protect our national security while working on innovative projects that offer opportunities for advancement.

Currently, ManTech is seeking a motivated, career and customer-oriented Data Science/Analytics Intern to join our team. Locations vary depending on business needs.

Responsibilities Include, But Are Not Limited To

Demonstrate your skills that you learned in and out of school with the within ManTech. ManTech is seeking a motivated, mission-oriented Data Science/Analytics Intern to join our Internship Program to be exposed to exciting hands on technical work to grow your skills and obtain a better understanding of the Data Science/Analytics Field. At ManTech, you will work on innovative projects that offer great technical challenges. Interns work on guided projects over the summer that can directly flow back to real contracts. At the end of the summer, all of our interns brief their projects success across ManTech.

Basic Qualifications
Currently pursuing a Bachelors Degree in Mathematics, Statistics, Computer Science, Physical Science, Engineering or a related field
Coursework related and/or prior internship related to data science/analytics
Working knowledge of statistical modeling
Working knowledge of Python, R, Scala, or JavaScript
Strong written and verbal communication skills

Preferred Qualifications
A passion for low-level / embedded data/science analytics
Working knowledge or cloud computing/cloud storage
Working knowledge of SQL

Clearance Requirements
Individuals must be a U.S. Citizen and either hold an active US Security Clearance or must be eligible to obtain a US Security Clearance.
Applicants with the appropriate skills but without a security clearance are still encouraged to apply.

Physical Requirements
Must be able to remain in a stationary position 50%
What does an Internship at ManTech look like?
10-12 week long internship
Real responsibilities working alongside experienced professionals
Develop skills with hands-on projects and mentorship
Team engagements
Group activities and outings

For all positions requiring access to technology/software source code that is subject to export control laws, employment with the company is contingent on either verifying U.S.-person status or obtaining any necessary license. The applicant will be required to answer certain questions for export control purposes, and that information will be reviewed by compliance personnel to ensure compliance with federal law. ManTech may choose not to apply for a license for such individuals whose access to export-controlled technology or software source code may require authorization and may decline to proceed with an applicant on that basis alone.

ManTech International Corporation, as well as its subsidiaries proactively fulfills its role as an equal opportunity employer. We do not discriminate against any employee or applicant for employment because of race, color, sex, religion, age, sexual orientation, gender identity and expression, national origin, marital status, physical or mental disability, status as a Disabled Veteran, Recently Separated Veteran, Active Duty Wartime or Campaign Badge Veteran, Armed Forces Services Medal, or any other characteristic protected by law.

If you require a reasonable accommodation to apply for a position with ManTech through its online applicant system, please contact ManTech's Corporate EEO Department at (703) 218-6000. ManTech is an affirmative action/equal opportunity employer - minorities, females, disabled and protected veterans are urged to apply. ManTech's utilization of any external recruitment or job placement agency is predicated upon its full compliance with our equal opportunity/affirmative action policies. ManTech does not accept resumes from unsolicited recruiting firms. We pay no fees for unsolicited services.

If you are a qualified individual with a disability or a disabled veteran, you have the right to request an accommodation if you are unable or limited in your ability to use or access http://www.mantech.com/careers/Pages/careers.aspx as a result of your disability. To request an accommodation please click careers@mantech.com and provide your name and contact information.",https://www.linkedin.com/jobs/view/externalApply/2443249246?url=https%3A%2F%2Fmantech%2Ewd1%2Emyworkdayjobs%2Ecom%2Fen-US%2FExternal%2Fjob%2FUSA-Remote-Work%2FData-Science-Analytics-Internship_R14916%3Fsource%3DLinkedIn&urlHash=kMxs&refId=9f9e2bd4-3b29-41ff-b438-d33d763d2b73&trackingId=%2Fmm1%2Bl8tWrF1QZAh5ShdXw%3D%3D&trk=public_jobs_apply-link-offsite
Data Science - Intern,"Sonde Health, Inc.","Boston, MA","Sonde Health, a Boston based digital health company, is seeking an outstanding Data Science and Engineering interns to join Sonde Health team as we pioneer an entirely new platform for health analytics and monitoring based on the human voice.

As a Data Scientist, you will work independently and in collaboration with senior leadership in our research and development team. You will make a meaningful contribution to our ongoing projects within an environment of intellectual curiosity and entrepreneurial spirit. We are looking for someone who is driven to transform complex and novel health data into real-world products.

Responsibilities:
Work closely with team members to plan, execute, and analyze data models
Test model performance and propose a strategy for improvement
Support product deployment and testing

Basic Qualifications
3+ years of college majoring in informatics, data science, statistics, math, or computer science, and engineering
Knowledge of Python/ SQL / R for data analysis
Knowledge of databases, data analysis, statistics, and data science
Previous machine learning or data science experience in industry or product development is a plus
Strong English writing and communication skills
Strong academic record
Reliable, highly motivated, detail-oriented, and independent
About Sonde Health:

Sonde Health is a three-year-old post-revenue company offering clinical-grade measures of health and wellness based on voice biomarkers. The technology is a combination of acoustic signal processing, machine learning, and artificial intelligence exclusively licensed from MIT and developed at Sonde. Sonde is targeting $10+ billion medical markets (e.g. depression, Alzheimer’s, Parkinson’s, COPD, asthma) and wellness markets (e.g. maternal health, healthy aging in place, cognitive or speech impairment, childhood development). Our screening and monitoring service executes on mobile phones and requires only a few seconds of voice sample. www.sondehealth.com.

Powered by JazzHR

xfTdc5qxDX",https://www.linkedin.com/jobs/view/externalApply/2443249246?url=https%3A%2F%2Fmantech%2Ewd1%2Emyworkdayjobs%2Ecom%2Fen-US%2FExternal%2Fjob%2FUSA-Remote-Work%2FData-Science-Analytics-Internship_R14916%3Fsource%3DLinkedIn&urlHash=kMxs&refId=9f9e2bd4-3b29-41ff-b438-d33d763d2b73&trackingId=%2Fmm1%2Bl8tWrF1QZAh5ShdXw%3D%3D&trk=public_jobs_apply-link-offsite
Data Science Intern,Omnitracs,"Dallas, TX","Omnitracs, LLC is the source for private and for-hire fleets seeking fleet management solutions, including software applications, platforms, and information services. Our intuitive technologies, including solutions for safety and compliance, driver retention, GPS fleet tracking, and fleet maintenance software, can help you solve common fleet problems and achieve your fleet management objectives. With thousands of trucking customers across the Americas, Omnitracs leads the way for fleet management solutions.

Position Overview

In this role the intern will support data scientist in identifying relevant data sets, build repeatable methods to enhance the data sets, including when applicable researching external 3 rd party data

Essential Responsibilities
Utilize statistical techniques to develop analysis on correlations, trend with telematics and location data
Develop and identify predictors for forecasting and predictive modeling related to safety metrics and trucking activity
Develop and present visualizations in support of the analysis

Minimum Qualifications
Rising Junior, Senior, Master's or PhD student pursuing a degree in Data Science, Applied Mathematics, Electrical Engineering or other related discipline
Experience with R/Python and SQL
Experience with data visualization via python and/or excel

Preferred Qualifications
Statistical analysis either via course work or via projects
Experience with Athena(AWS) or other cloud
Knowledge of trucking industry

Our Program
Personal and professional development
1:1 Mentorship Opportunities
Executive Speaker Series
Fun and engaging social events
Rated the “Standout Virtual Internship Program of 2020” by WayUp

Program Duration

May 2021 – August 2021 (9 weeks-Remote)

Disclaimer: This Job Description indicates the general nature and level of work expected of the incumbent(s). It is not designed to cover or contain a comprehensive listing of activities, duties or responsibilities required of the incumbent. Incumbent(s) may be asked to perform other duties in addition to those described above.

Omnitracs LLC, is an Equal Opportunity Employer and does not unlawfully discriminate on the basis of any status or condition protected by applicable federal, provincial, or local municipal law.",https://www.linkedin.com/jobs/view/externalApply/2443249246?url=https%3A%2F%2Fmantech%2Ewd1%2Emyworkdayjobs%2Ecom%2Fen-US%2FExternal%2Fjob%2FUSA-Remote-Work%2FData-Science-Analytics-Internship_R14916%3Fsource%3DLinkedIn&urlHash=kMxs&refId=9f9e2bd4-3b29-41ff-b438-d33d763d2b73&trackingId=%2Fmm1%2Bl8tWrF1QZAh5ShdXw%3D%3D&trk=public_jobs_apply-link-offsite
"Intern - Data Science, Service Analytics",Teradata,"San Diego, CA","Our Company

Teradata, the world’s largest company solely focused on enterprise data warehousing and analytic solutions, provides powerful solutions for companies of all sizes. Through innovation, consulting services, technology, and industry-specific applications, our customers are outpacing their competition with enterprise agility. It's no secret our people make Teradata great. The world’s business leaders have trusted Teradata for decades as the key to their competitive edge with business intelligence. Why? Because we provide them the agility to adapt and move with confidence – just like we do. We are more than 10,000 passionate professionals in more than 42 countries and we are relentless in our pursuit of excellence.

Our Team

The Teradata Service Analytics team is dedicated to automating customer support and transforming customer support from reactive to proactive by leveraging data and analytics. Our vision is to optimize customers' Teradata solution performance and availability, through automated analytics-driven predictive/proactive issue resolution while enabling Customer self-service. Specifically, to develop an analytics software system for customer support, which will

Utilize data and analytics to predict Customer operational issues
Proactively provide solutions to avoid impact to Customer operations
Enable Customers to quickly and easily resolve their own problems
Assist Customer Support Associates to quickly resolve customer issues
What You'll Do

You will work with data scientists on our team to develop tools to parse text data and extract information from it. The data in question may consist of computer generated logs or natural language work notes. The techniques used may include automated log parsing, natural language processing (NLP), named entity recognition, relation extraction, event extraction, part of speech tagging, sequence modeling, or text clustering. You will have some room to tailor your project to your interests, but the objective is to help automated systems understand and utilize text data, which will in turn make our customer support processes more automated and efficient. You will also collaborate with business analysts, software engineers, product owners, and support engineers to ensure your work provides concrete business value.

Your Background

Pursuing a bachelor's degree or higher in data science or machine learning, or in a related field (like statistics or computer science) with coursework in these areas
Experience (possibly from coursework) in working with large data sets, data manipulation, data cleaning, exploratory data analysis (EDA), data visualization, and data modeling
Experience with text data, natural language data, or natural language processing (NLP) preferred
Programming experience, preferably in Python and SQL
Excellent verbal and written communication skills
Ability to collaborate on an interdisciplinary team to solve problems in a fast-paced environment
Self-starter with a positive attitude, intellectual curiosity, and a passion for analytics and solving real world problems.
We’re conducting virtual interviews to keep our candidates and employees safe. Many roles will be temporarily remote or work from home, while others will remain remote. Read more on our response here Teradata Response to COVID-19.

Teradata helps businesses unlock value by turning data into their greatest asset. We’re the cloud data analytics platform company, built for a hybrid multi-cloud reality, solving the world's most complex data challenges at scale. Collectively, we endeavor to serve equal parts innovator and contributor. Because our mission isn’t just about the collection of data – it’s about revolutionizing the future of transportation to save lives, optimizing energy costs to make the planet a cleaner place, and using data to predict and identify cancer risks.",https://www.linkedin.com/jobs/view/externalApply/2478348374?url=https%3A%2F%2Fcareers%2Eteradata%2Ecom%2Fjobs%2F209814%2Fintern-data-science-service-analytics%3Fsid%3D773%26utm_source%3Dlinkedin%26utm_medium%3Djobslots%26utm_campaign%3Dlinkedin_jobslots%26source%3D773&urlHash=4yk7&refId=9f9e2bd4-3b29-41ff-b438-d33d763d2b73&trackingId=tD1%2F%2Fn0A4y1%2Fx9WVPZDOcg%3D%3D&trk=public_jobs_apply-link-offsite
Data Science Intern (Women in Technology) - Summer 2021,William Blair,"Chicago, IL","Company Description

William Blair is a premier global boutique with expertise in investment banking, investment management, and private wealth management. We are committed to building enduring relationships with our clients and providing expertise and solutions to meet their evolving needs. An independent and employee-owned firm, William Blair is headquartered in Chicago and, together with its strategic partners, operates in more than 20 offices worldwide.

About The Team

William Blair is seeking female data science interns to join the innovative Advanced Technology team for a 12 week internship program during the summer of 2021. This program is designed to promote technology careers among young women and will provide a unique opportunity to explore areas of statistical analysis, machine learning, deep learning, data science, data visualization, and data engineering to support mission critical business use cases. The summer program also includes training, community service, and social events.

Job Summary & Responsibilities
Work on multiple data science, machine learning and data engineering projects in Azure cloud and SPARK environment
Assemble large, complex data sets that meet functional / non-functional business requirements
Work with large, complex data sources to derive actionable business insights with an aim of increased ROI
Develop, test and deploy predictive models using various machine learning algorithms and translate results into business recommendations
Communicate results to business audience through reports, dashboards and presentation
Collaborate cross-functionally with business and technical stakeholders to identify & prioritize project requirements
Work with data and analytics experts to strive for greater functionality in our data systems

Qualifications

Required Technical Skills:
Currently pursuing a Master’s Degree in Statistics, Business Analytics, Data Science or Computer Science with anticipated graduation between December 2021 and June 2022
Experience using statistical programming languages (R, Python) to manipulate data and draw insights from large data sets
Working SQL knowledge and experience working with relational databases as well as NoSQL databases
Knowledge and experience in statistical and data mining techniques
Experience working with various machine learning / deep learning algorithms and frameworks
Text Mining, NLP and Social Network Analysis
Experience with data discovery and visualization tools
Hands-on data engineering experience using structured and unstructured data


Preferred Technical Skills
A successful history of manipulating, processing and extracting value from large disconnected datasets
Experience with big data tools: Hadoop, Spark, Kafka, etc.
Experience with data pipeline and workflow management tools: Airflow, Azure Data Factory etc.
Experience with building processes supporting data transformation, data structures, metadata, dependency and workload management
Experience with cloud cognitive eco-system like Azure, AWS",https://www.linkedin.com/jobs/view/externalApply/2473975845?url=https%3A%2F%2Fwilliamblair%2Eavature%2Enet%2Fcareers%2FJobDetail%2FData-Science-Intern-Women-in-Technology-Summer-2021%2F3371%3Fsource%3DLinkedIn&urlHash=mQv5&refId=9f9e2bd4-3b29-41ff-b438-d33d763d2b73&trackingId=KrkY9mpNFvh57SB6ziqVEQ%3D%3D&trk=public_jobs_apply-link-offsite
