title,company,location,requirements,link
Data Science Intern,Faraday,"Burlington, VT","About Faraday

Faraday helps consumer brands find, convert, engage, and retain more customers using AI. Located in the historic Maltex Building in beautiful Burlington, Vermont, we're a fast-growing venture-backed startup founded in 2012.

Our values

We believe in privacy and are committed to ending the widespread proliferation of consumer data. We believe in science and the power of statistically significant conclusions. We believe in equality and reject all forms of algorithmic prejudice. We believe in health and fun and encourage a positive work/life balance.

Our dedication to diversity

We are an equal opportunity employer and value diversity at our company. We do not discriminate on the basis of race, religion, color, national origin, gender, sexual orientation, age, marital status, veteran status, or disability status.

About Our Data Science Team

At the heart of the Faraday AI platform is a shared machine learning pipeline framework built from the ground up. Our data scientists work with clients and their Faraday account managers to carefully define one or more business goals for deployment on the platform. The pipeline uses these ""outcome"" definitions to perform ETL/ELT, training data formation, feature engineering, model building, validation, scoring, and deployment.

Your team is also responsible for curating the Faraday Identity Graph (FIG) from upstream data sources, preparing interpretive analysis for clients, and nurturing Faraday’s quantitative culture.

About Your Role

We're looking for a data science intern to join us at Faraday. You will pursue a variety of challenges, including:
Determining the best predictive approaches to meet clients’ business outcomes.
Assisting with research and development of new algorithms, tools, and methods
Communicating and providing context to clients.
Being curious—there’s so much we don’t know in the world of data science, and our only guaranteed driver of innovation is the collaborative work of open minds.

You Have Good Interpersonal Abilities Which You Will Employ Regularly, Including

You are a methodical, self-motivated individual, capable of keeping your eye on the finish line amidst competing priorities.
Weekly team meetings
Transparent project tracking
Following security protocols to keep sensitive data safe

Your credentials

This position would be best filled by someone who has finished - or is in pursuit of - a relevant degree in data science, statistics, natural science, mathematics, computer science, or other related field.

Your Experience
You have experience with statistical inference
You have experimented with the practical applications of data science

Your technical background
You’ve used Python and SQL
You’re familiar with data visualization best practices",https://www.linkedin.com/jobs/view/externalApply/2487375315?url=https%3A%2F%2Fht-jobs%2Enet%2Fvqmhqjm%3Fs%3Dlif&urlHash=74bw&refId=6d29ba9e-d44a-4fdf-8505-d870d4fd3686&trackingId=8jkhY0mOpBfNq8EECqT7IQ%3D%3D&trk=public_jobs_apply-link-offsite
"Data Science Intern, Summer 2021",Samsung Electronics America,"Bellevue, WA","Position Summary

Samsung has been on the cutting-edge of innovation for decades. We believe that technology can, and should, make the world a better place, so we create new connections for people everywhere. The US Mobile B2B division is responsible for developing and marketing Samsung’s mobility platform in the US in close collaboration with headquarters. Samsung Mobility products include smartphones, tablets, wearables, accessories, and software and services, such as the Knox platform. The US Mobile B2B business is growing rapidly in a challenging and demanding market. If you’re looking to join an innovative and dynamic team, Samsung Mobile B2B is the right place for you. Join #LifeatSamsung.

Role and Responsibilities



Position Summary and Project Details:



This summer you will have the exciting opportunity to work in our Data Science team as Data Science Intern. You will:

Develop machine-learning solutions for business needs.
Develop and enhance DS deployment framework.
Get hands on with Deep learning.

General Duties include but are not limited to:



Data Scientists are responsible for managing the successful design and production of major data initiatives across all customer-facing channels. They provide a critical link between the most technical areas of the organization and our business partners who use data science products to personalize customer experiences. Balancing a deep technical understanding with excellent business acumen is needed to 1) successfully build never-been-done-before solutions in a Big Data environment and 2) interface with Product Management and Engineering teams.



By the end of the summer you should be able to:

Handle vast amount of data and perform EDA, PCA, data massaging and cleaning.
Extract insights from data that helps in model building.
Feature engineer for machine learning problems. Train and test ML algorithms on real Samsung data.
Get hands on with Deep learning – RNN, CNN.
Build deep learning framework for model deployment.
Communicate to senior management about the awesome work you performed.

If you are interested in a career in:



In today’s fast evolving technology world, one aspect remains common – reliance on data to drive the next wave of innovation. The Data Science team’s core focus is developing best-in-class solutions that provide Samsung’s marketing and service organizations with a 360 degree view of the Samsung customers. We are looking for highly technical team members who are passionate about data, have the rigor needed to solve billion dollar problems, and possess an innate entrepreneurial spirit to explore the uncharted. Our organization combines the engineering backbone of a best-in-class Big Data Platform with the analytic expertise of predictive and prescriptive modeling. If you want to work among the very best talent in the industry, working on the most innovative products in the world, Samsung is the place to be.



Skills and Qualifications



Qualifications:

Programming experience: Python, Spark, R, SQL, Hive, JavaScript, Visual Basic, C++
Machine learning expertise: GLM Regression (Linear, Logit, Multinomial), Decision Tree (including Boosted Trees, Random Forest), kMeans/Hierarchical Clustering, Principle Component Analysis, Neural Network, Bayesian Regression, & Times Series
Experience using data with high-volume (1TB+) & high-dimensionality (500+ variables per schema), especially within a Hadoop framework
Strong interest in supporting consumer-facing functions for consumer products, retail, tech, or telecom industries
Self-starter.  Self-motivated. Wanting to learn. Can work alone, as well as being a member of a team. Result-Driven person
Good verbal and written communication skills or reasonable communications skills for Bi-Lingual speakers

Internship Eligibility:

Must be enrolled in an accredited University
Maintain a 3.0 or higher GPA
Provide proper work authorization to University Relations
Attend New Hire Orientation on first day

* Please visit Samsung membership to see Privacy Policy, which defaults according to your location. You can change Country/Language at the bottom of the page. If you are European Economic Resident, please click here .



* Samsung Electronics America, Inc. and its subsidiaries are committed to employing a diverse workforce, and  provide Equal Employment Opportunity for all individuals regardless of race, color, religion, gender, age, national origin, marital status, sexual orientation, gender identity, status as a protected veteran, genetic information, status as a qualified individual with a disability, or any other characteristic protected by law.",https://www.linkedin.com/jobs/view/externalApply/2474877435?url=https%3A%2F%2Fsec%2Ewd3%2Emyworkdayjobs%2Ecom%2Fen-US%2FSamsung_Careers%2Fjob%2F10400-NE-4th-St-Bellevue-WA-USA%2FData-Science-Intern--Summer-2021_R38001&urlHash=EXa3&refId=6d29ba9e-d44a-4fdf-8505-d870d4fd3686&trackingId=ofDJkeNnHNZTpzAoNuQtmg%3D%3D&trk=public_jobs_apply-link-offsite
Data Science Intern,Riffyn,"Oakland, CA","Oakland, CA or Remote

Mission to reshape science

At Riffyn, we think beyond the conventional. We dream big. Our mission is to help accelerate the science that improves all of our lives and our planet’s quality and sustainability.

Riffyn believes there is a better way to approach research and development. And that is to empower scientists to make better decisions and faster discoveries by unlocking the power of data. Our technology and people change lives by driving advancements in biological research, medicines, sustainability, and more. If that inspires you, join us.

Life at Riffyn

Life at Riffyn is about working with teammates who are deeply passionate about what we do because we know that our work has the power to change lives. We approach our work with trust and honesty. And we’ve built a diverse team and culture fuelled by collaboration and openness.

Our employees developed our five core values — our ethos, and these extend beyond the work we do and into how we support each other. We are continually evolving to ensure that every employee feels appreciated and encouraged to do what matters for themselves, the company, and each other.

Riffyn’s core values

Get there honestly – have the courage to take the right path
Do what matters – own the why of the work we do
Make it fun – humor separates us from the machines
Work well together – trust builds the strongest teams
Keep evolving – challenge the status quo
The role

You will work directly with Riffyn’s Scientific Solutions and engineering teams to re-engineer core data processing algorithms into a high-quality Python-based software development kit. The kit will be made available to Riffyn customers as a free and open-source extension of the Riffyn Nexus platform.

This project is expected to require 3 months at a full-time commitment. The position is remote.

You will learn and apply fundamental data science skills including vectorized data processing, data-frame manipulation, parallelized processing, and memory management. In addition, you will have the opportunity to learn the Riffyn Nexus software application and its use in a range of scientific experimental cases.

If mutually desirable, the position can be extended to a full-time role continuing to build out functionality in the Python-based software development kit, as well as supporting Riffyn customers in their implementation of Nexus, as well as ecosystem components, such as integrations and customer-specific reporting capabilities. More details about the longer-term role can be found here (note: work is similar, the role is in the USA).

Experience and education

Candidate for BS, MS, or Ph.D. in engineering, mathematics, economics, or other quantitative fields
1+ years of Python development experience and a solid understanding of core computer science and data science and methods principles
Familiarity with statistical/machine learning methods and statistical software like R, JMP, or scikit-learn is a plus
Exposure or practice in good software engineering practices is a plus
Accomplishments and knowledge

Demonstrated excellence in academics
Examples of prior work including software projects and writing, web pages copy, or technical documentation
Participation in group projects, extracurricular organizations, or prior research experience is a plus
Personal/professional competencies

Self-starter, able to distill and execute actionable work plans
Voracious learner, systematic problem solver
Organized, detail-oriented, driven, and accountable
Unyielding personal and professional ethics and integrity
Apply

If you thrive in a fast-paced, down-to-earth, collaborative, and mission-driven environment, Riffyn is the place for you. Join the journey of a lifetime and be at the forefront of the next revolution of scientific discovery. Apply with your CV, cover letter, and any portfolio of materials that illustrate your skills (presentations, websites, data analysis, etc.).",https://www.linkedin.com/jobs/view/externalApply/2495169501?url=https%3A%2F%2Fneuvoo%2Ecom%2Fjob%2Ephp%3Fid%3Dedceb5fa466f%26source%3Dlinkedin%26utm_source%3Dpartner%26utm_medium%3Dlinkedin%26puid%3Dfadbaadc7addcadbdadefddb8adafadfaddcfdda3deacacafec3ddcg3e&urlHash=Yfa7&refId=6d29ba9e-d44a-4fdf-8505-d870d4fd3686&trackingId=DqgQZ5uohuYnBb0lPno2HA%3D%3D&trk=public_jobs_apply-link-offsite
Data Science Intern (June 2021- May 2022),Bristol Myers Squibb,"Tampa, FL","At Bristol Myers Squibb, we are inspired by a single vision – transforming patients’ lives through science. In oncology, hematology, immunology and cardiovascular disease – and one of the most diverse and promising pipelines in the industry – each of our passionate colleagues contribute to innovations that drive meaningful change. We bring a human touch to every treatment we pioneer. Join us and make a difference.

The intern in the Data Science group will utilize various software including SAS, R, Python, Spotfire and UNIX to develop a script or macro to automate various tasks in the pharmacometric programming process. The candidate will be given basic training in these software to accommodate the requirements of the project. The tool developed will be incorporated into the Data Science workflow.

Key Responsibilities

Apply expert knowledge of SAS to integrate clinical and pharmacokinetic data for pharmacometric analysis, implement sophisticated algorithms to derive complex data sets and address data issues.
Demonstrate very strong attention to quality and detail and the ability to detect data anomalies
Employ Spotfire visualization software and act as an expert resource in order to optimize the effective utilization and benefits of Spotfire
Attain and apply solid knowledge of pharmacokinetics, pharmacodynamics and other scientific areas to partner with experts in order to integrate data sources efficiently and effectively
Develop and maintain competence in UNIX, Spotfire, R and various Linux//Unix tools including bash
Interact with internal partners utilizing excellent interpersonal and communication skills

Key Qualifications

Knowledge of the Software Development Lifecycle (SDLC)
Familiarity with content management systems (CMS), especially SharePoint or Vitalize
Self-directed learner who is able to learn new processes and software programs quickly
Familiarity with ticket management systems (e.g. Vitalize)
Ability to communicate with key stakeholders and clients

Additional Requirements
Candidates must be available for an internship that will run from June 2021- May 2022
Candidates must be available to be onsite at the BMS- Tampa, FL location for the year internship (Up to 40 hours per week in summer and up to 20 hours per week in fall & spring)
Candidates must be actively enrolled in school during the internship with a graduation date of May 2022 or later

Around the world, we are passionate about making an impact on the lives of patients with serious diseases. Empowered to apply our individual talents and diverse perspectives in an inclusive culture, our shared values of passion, innovation, urgency, accountability, inclusion and integrity bring out the highest potential of each of our colleagues.

Bristol Myers Squibb recognizes the importance of balance and flexibility in our work environment. We offer a wide variety of competitive benefits, services and programs that provide our employees with the resources to pursue their goals, both at work and in their personal lives.",https://www.linkedin.com/jobs/view/externalApply/2495739072?url=https%3A%2F%2Fhttpslink%2Ecom%2FYjk85M%3Fjz%3D4tptp12495305AQADOAIAAABQ%26tracking-details%3DYmlkPTAuMDAmYmlkdHlwZT1vcmcmc3JjPUxpbmtlZEluX09yZ2FuaWMmaklkPTM3NzBkZWM0ZDVhZGYyZjYzMWFkYzQzMGIyMGI0OThkJmVtZD0wLjAwJnBoSWQ9dHB0cCZlQmlkPTAuMA%26source%3DLinkedIn_Slots&urlHash=0bxx&refId=6d29ba9e-d44a-4fdf-8505-d870d4fd3686&trackingId=pjB0B%2F%2FtMwtPMdMYh45EmA%3D%3D&trk=public_jobs_apply-link-offsite
Summer 2021 Data Science Intern – Enterprise Analytics,Healthfirst,"New York, NY","Healthfirst’s Summer 2021 Internship program will be an entirely Virtual, 10-week paid internship. Similar to our past years programs, we will provide an immersive and interactive learning experience that lays a foundation for continued leadership development. Interns will do impactful work, working together with other Interns, Employees, and Business Leaders to solve current business problems and deliver solutions tied to our digital acceleration and other key initiatives.

Position Summary

At Healthfirst, the Data Science team is on a mission to discover insights hidden in data that can help improve the care of thousands of vulnerable New Yorkers. We use advanced analytical techniques to generate insights and drive transformation in business processes and outcomes at Healthfirst across the Clinical, Operations, and Growth domains.

We’re looking for a data enthusiast who thrives on searching for answers and extracting meaningful insights from a sea of data. As an intern, you will research and develop an analytical solution to a real business problem and help expand the data capabilities of Healthfirst.

Highlights Of The Data Science Internship Will Include
The opportunity to complete an individual and group project using large data sets and advanced technical tools
Building relationships with experts in the field
Seeing the impact of your work and meeting leaders in our company
Opportunities to work directly with our Chief Analytics Officer (CAO)

Duties And Responsibilities
Solve complex analytical problems to aid business leaders in making better informed, data-driven decisions
Explore, manipulate, and interpret large volumes of data using statistical and machine learning techniques, such as regression analysis, clustering, or natural language processing
Write code to analyze, describe, and visualize complex health care behavior
Communicate findings to senior audiences
Additional duties as assigned

Minimum Qualifications
Must be currently enrolled in an undergraduate or graduate program at an accredited institution OR be less than 1 year post-graduation
Ability to write and interpret code in R or Python and SQL
Experience applying core statistical techniques, model building and interpretation

Preferred Qualifications
Working towards a degree in computer science, mathematics or economics, biostatistics, public health or other quantitative discipline
A high level of interest in the healthcare industry
Knowledge of data visualization tools (Tableau, Qlik, etc.)
If you’ve published a scientific paper or contributed to an open source analytical project, send us a link! We’d love to see your work.

Healthfirst Internship Program Requirements
Eligible to work in the U.S.
Undergraduate students must be a junior or senior at an accredited institution or have graduated within 12 months of the program. Graduate students must be enrolled at an accredited institution or have graduated within 12 months of the program.

WE ARE AN EQUAL OPPORTUNITY EMPLOYER. Applicants and employees are considered for positions and are evaluated without regard to race, color, religion, gender, gender identity, sexual orientation, national origin, age, genetic information, military or veteran status, marital status, mental or physical disability or any other protected Federal, State/Province or Local status unrelated to the performance of the work involved.

If you have a disability under the Americans with Disability Act or a similar law and want a reasonable accommodation to assist with your job search or application for employment, please contact us by sending an email to careers@Healthfirst.org or calling 212-519-1798 . In your email please include a description of the accommodation you are requesting and a description of the position for which you are applying. Only reasonable accommodation requests related to applying for a position within Healthfirst Management Services will be reviewed at the e-mail address and phone number supplied. Thank you for considering a career with Healthfirst Management Services.

EEO Law Poster and Supplement

All hiring and recruitment at Healthfirst is transacted with a valid “@healthfirst.org” email address only or from a recruitment firm representing our Company. Any recruitment firm representing Healthfirst will readily provide you with the name and contact information of the recruiting professional representing the opportunity you are inquiring about. If you receive a communication from a sender whose domain is not @healthfirst.org, or not one of our recruitment partners, please be aware that those communications are not coming from or authorized by Healthfirst. Healthfirst will never ask you for money during the recruitment or onboarding process.",https://www.linkedin.com/jobs/view/externalApply/2494848304?url=https%3A%2F%2Fcareers%2Ehealthfirst%2Eorg%2Fus%2Fen%2Fjob%2FHEALUSR009383EXTERNALENUS%2FSummer-2021-Data-Science-Intern-Enterprise-Analytics%3Futm_source%3Dlinkedin%26utm_medium%3Dphenom-feeds%26source%3DLinkedIn&urlHash=ETDd&refId=9f9e2bd4-3b29-41ff-b438-d33d763d2b73&trackingId=JBJVVcynXyvbyUPiV7n5Bw%3D%3D&trk=public_jobs_apply-link-offsite
Data Science Intern - Engagement Optimization,Stitch Fix,"Remote, OR","About The Team

On the Engagement Optimization team, we focus on leveraging quantitative models and machine learning algorithms to solve client-related business problems. By personalizing client interactions across multiple marketing platforms, we are able to increase our understanding of individual preferences, improve brand loyalty, develop promotion strategies, and maximize client long term value.

About The Role

We are looking for someone to join us over the summer for a 10 week duration. As an intern, you will utilize our rich datasets, and gain experience as a full stack end-to-end data scientist. You will work closely with marketing stakeholders on some interesting projects, such as personalizing client-facing imagery using image processing or developing sequential marketing strategies. Then, you will have the opportunity to get your prototype into production, and launch an A/B test on the real business problem.

You're Excited About This Opportunity Because You Will…
Apply modern machine learning techniques to real business problems with high impact
Work as a full stack data scientist to not only build the model, but also bring it into production and testing
Develop your applied machine learning and software engineering skills
Effectively communicate and share results with both technical and non-technical cross-functional partners


We're Excited About You Because You...
You are a graduate student or higher in Computer Science, Statistics, Mathematics, Operations Research, Engineering or related field
You have experience implementing/designing machine learning algorithms
You are familiar with programming languages (preferably python), and able to adapt to new technologies
You have a creative, problem-solving mindset
You work well with others and have strong communication skills

Why you'll love working at Stitch Fix...
We are a group of bright, kind and goal-oriented people. You can be your authentic self here, and are empowered to encourage others to do the same!
We are a successful, fast-growing company at the forefront of tech and fashion, redefining retail for the next generation
We are a technologically and data-driven business
We are committed to our clients and connected through our vision of “Transforming the way people find what they love”
We love solving problems, thinking creatively and trying new things
We believe in autonomy & taking initiative
We are challenged, developed and have meaningful impact
We take what we do seriously. We don’t take ourselves seriously
We have a smart, experienced leadership team that wants to do it right & is open to new ideas
You will be proud to say that you work for Stitch Fix and will know that the work you do brings joy to our clients every day


About Stitch Fix

Stitch Fix is an online personal style service for men and women combining art and science to disrupt and redefine the retail industry. We’re the first fashion retailer to blend expert styling, proprietary technology, and unique product to deliver a refined and deeply personalized shopping experience. We leverage vast amounts of client data to make decisions throughout the company. All of this results in a simple, powerful offering to our customers and a successful, growing business. We believe we are only scratching the surface of our opportunity, and we’re looking for incredible people to contribute! We’d love for you to help us carry on the trend.

Please Review Stitch Fix's Recruiting Privacy Policy Here

https://www.stitchfix.com/privacy/usrecruitingprivacy",https://www.linkedin.com/jobs/view/externalApply/2437352413?url=https%3A%2F%2Fwww%2Estitchfix%2Ecom%2Fcareers%2Fjobs%3Fgh_jid%3D2964638%26gh_jid%3D2964638%26gh_src%3D03b9fde41%2509&urlHash=qEfZ&refId=9f9e2bd4-3b29-41ff-b438-d33d763d2b73&trackingId=PsKyarWYfjoFbQnjDm09dg%3D%3D&trk=public_jobs_apply-link-offsite
