title,company,location,requirements,link
Real Estate Development Intern,Carmel Partners,"Washington, DC","Carmel Partners is a well-capitalized private real estate firm with expertise in the investment and development of multi-family real estate. Our mission is to build and enhance high quality communities using innovative ideas and solutions that create value for our investors, residents and associates. 

The Development Intern will be responsible for supporting the Development and structured finance teams in providing financial modeling, deal underwriting and analysis, market research, transaction due diligence, and approval memoranda for development and acquisitions. This position offers an excellent opportunity to learn and experience the real estate development business. 

Who you are

You’re productive in collaborative team settings as well as on your own, and either way you deliver quality work. You’re a pro at communicating on and off the page, and understand the importance of building great relationships. You keep a cool head while managing multiple projects in a fast-paced environment. Above all, you always demonstrate impeccable judgement and integrity.

What you’ll do:

Conducts long term market research, and rent studies
Performs financial analysis
Assists with due diligence
Writes memoranda
Produces reports, including cash flow projections, excel modeling, and associated sensitivity analyses
Prepare development pro forma and perform financial feasibility and sensitivity analysis
Works closely with NY Development team members
Attend meetings with architects, sellers, brokers, site visits, etc.
Create and maintain routine and ad hoc reporting
Assist with closings
What you’ll bring

Currently pursuing an undergraduate or graduate degree in Architecture, Real Estate, Finance, Computer Science, or Business with a strong record of academic achievement
Familiarity with ESRI
General understanding of real estate and development industry
Strong Excel skills and financial modeling experience
General understanding of financial statement.
Excellent written communication skills
Location: Washington, D.C.

Key Program Components:

Internships last 8 - 12 weeks
Candidates must be authorized to work in the United States
Carmel Partners will not sponsor visas for this position
This is a paid internship program. Compensation is based on company guidelines. No additional benefits are offered with this position 
Carmel Partners, Inc. is an equal opportunity employer and affords equal opportunity to all applicants for all positions without regard to race, color, religion, gender (including pregnancy), national origin, age, disability, veteran status, sexual orientation, or any other status protected under local, state, or federal laws.",https://www.linkedin.com/jobs/view/externalApply/2466467270?url=https%3A%2F%2Frecruiting%2Eultipro%2Ecom%2FCAR1041%2FJobBoard%2Ff19a3aa9-abdb-1b6d-46ec-d3e4716019ec%2FOpportunity%2FOpportunityDetail%3FopportunityId%3D12354210-d5f8-4f60-bee7-cf41cd5c4e70%26utm_source%3DLINKEDIN&urlHash=iJKk&refId=9c41e111-a795-4d6f-b886-19ee165253de&trackingId=mqdUxwClLydRbIuCVtAXtA%3D%3D&trk=public_jobs_apply-link-offsite
Real Estate Intern (Summer 2021),Rivian,"Los Angeles, CA","Rivian is on a mission to keep the world adventurous forever. This goes for the emissions-free Electric Adventure Vehicles we build, and the curious, courageous souls we seek to attract.

As a company, we constantly challenge what’s possible, never simply accepting what has always been done. We reframe old problems, seek new solutions and operate comfortably in areas that are unknown. Our backgrounds are diverse, but our team shares a love of the outdoors and a desire to protect it for future generations.

We operate development centers in Plymouth, Michigan; Southern California (Irvine, Carson & LA); Silicon Valley (San Jose and Palo Alto); Vancouver, British Columbia; and Surrey, England; as well as a manufacturing facility in Normal, Illinois.

Internship Term: Summer 2021
Rivian internships are experiences optimized for student candidates. To be eligible, you must be an undergraduate or graduate student in an accredited program during the internship term. If you are not pursuing a degree, please see our full time positions at Rivian.com/careers

Note that if your university has specific requirements for internship programs, it is your responsibility to fulfill those requirements.

Role Summary

In this position you will support a Regional Manager with the execution of new charging sites in target service areas for DCFC and L2 charging.

Responsibilities
Be the boots on the ground gathering market intelligence, identifying strategic sites and surveying key local partners.
Collaborate with data science team to build suggested travel stops including, but not limited to: SoC (State of Charge) needed when departing, necessary stops en route and charging time at each stop
Support Regional Manager with any documentation related to the transaction process flow and critical dates, such as notices to exercise lease options.
Monitor and maintain internal project tracking system to ensure timely transaction completion .
Preparing presentations to relevant cross functional teams including Legal, Environmental Health & Safety and Executive Leadership.
Autonomy to run full cycle real estate charging process from initial outreach to charger deployment and activation, with support from Regional Manager.
Exposure to all critical charging teams: Site Development (Real Estate), Deployment (Construction), Data Science and Vendor Partners.


Qualifications
Currently pursuing a Bachelor’s or Masters in Real Estate Management, Business, Sustainability or other relevant degrees
Requires strong PowerPoint or Keynote skills
Requires intermediate to advanced Excel skills
Requires a very organized and motivated personality
Requires curiosity, and a desire to learn real estate and the Electric Vehicle charging market.
Requires good communication, writing and presentation skills.


Equal Opportunity

Rivian is an Equal Opportunity Employer and Prohibits Discrimination and Harassment of Any Kind: Rivian is committed to the principle of equal employment opportunity for all employees and to providing employees with a work environment free of discrimination and harassment. All employment decisions at Rivian are based on business needs, job requirements and individual qualifications, without regard to race, color, religion or belief, family or parental status, or any other status protected by the laws or regulations in the locations where we operate. Rivian will not tolerate discrimination or harassment based on any of these characteristics. Rivian encourages applicants of all ages.

Privacy

We take your privacy seriously. For details please see our Candidate Privacy Notice.",https://www.linkedin.com/jobs/view/externalApply/2479941397?url=https%3A%2F%2Fboards%2Egreenhouse%2Eio%2Frivian%2Fjobs%2F4391694003%3Fs%3DLinkedIn%26source%3DLinkedIn&urlHash=D4xE&refId=9c41e111-a795-4d6f-b886-19ee165253de&trackingId=OMJR3VkQnatrnAPCHnyJLw%3D%3D&trk=public_jobs_apply-link-offsite
"Intern, Real Estate Development",Enterprise Community Partners,"Silver Spring, MD","Enterprise is a national nonprofit on a mission to make home and community places of pride, power and belonging for all. To make that possible, we operate the only organization designed to address America’s affordable housing crisis from every angle: we develop and deploy programs and support community organizations on the ground; we advocate for policy on a nonpartisan basis at every level of government; we invest capital to build and preserve rental homes people can afford; and we own, operate and provide resident services for affordable communities. All so that people not only make rent, they build futures. With this end-to-end approach, 40 years of experience and thousands of local partners, Enterprise has built and preserved 793,000 affordable homes, invested $61 billion in communities and changed millions of lives.

Enterprise offers career opportunities in our offices across the country with an exceptional benefits package .

Job Description Summary

Enterprise Community Development, Inc. (“ECD”) is the leading Mid-Atlantic nonprofit developer, owner, and operator of a $1 billion portfolio of 110+ apartment communities and 16,000+ homes. As part of the Enterprise family, ECD has access to a full suite of capital resources, housing solutions, and public policy support. Formed from two legacy organizations, Enterprise Homes, Inc., and Community Preservation and Development Corporation (CPDC), ECD has a combined 60 years of experience building and preserving affordable housing to uplift communities for economic stability and mobility.

The Intern will work with the Real Estate Development team to build and refine complicated Microsoft Excel models regarding the financing of affordable and mixed income housing projects, while providing support for project specific tasks that may include non-financial areas of the development process

Responsibilities

Job Description
Collect existing financial proformas from real estate development staff and create a consolidated Excel spreadsheet that integrates the presentation and functionality of existing models while making enhancement under direction of supervisor.
Develop a “feasibility” model in Microsoft Excel that builds off existing examples within ECD but integrates financial feasibility with zoning and construction inputs.
Work closely with one ongoing project in one of these key areas; prospective project, predevelopment project, or construction. Assist and shadow the development associate or officer on the project to help with daily needs and learn about this stage of the development process. Examples of tasks will be creating spreadsheets, looking at market research, mapping, creating presentations, and attending onsite meetings.

Qualifications
College graduate student with coursework and/or experience in real estate development, finance or urban planning is required.
Awareness of underlying formulas of real estate finance is essential.
Basic and advanced Excel modeling skills are a requirement including the ability to program Look Up and If Than functions.
Knowledge of land use and neighborhood planning and real estate development concepts are a plus
Training and Support
Orientation to ECD and its communities. Development of initial work plan and timeline with supervisor related to above tasks. Weekly meetings to review, plan, and provide coaching around various aspects of the internship experience. Participate in staff meetings, external meetings, and trainings as available and relevant to the scope of the position. Participate in an intern program feedback process.
Learning Opportunities
Witness the affordable housing development process from project selection to construction to asset management and resident engagement.
Experience the day to day operations of a real estate development in an affordable housing corporation and understand the federal, state, and local policies and programs used in this industry and how they influence operations of a nonprofit developer.
Gain exposure to the financing tools used in the industry, including Low-Income Housing Tax Credits (LIHTC), HUD financing products, and programs (e.g. Section 8), GSE products (e.g.’ Fannie Mae) and typical local government programs.
Develop a working knowledge of the policies and tools that local governments use in urban planning, land use, and real property development (e.g. comprehensive plans, small area plans and affordable housing policies.
Learn to function in a team environment and experience how the work develops through team meetings on a project, with staff, lenders, government stakeholders, and development consultants (e.g. architects and civil engineers).
Remote and virtual work available.",https://www.linkedin.com/jobs/view/externalApply/2441695877?url=https%3A%2F%2Fwd5%2Emyworkdaysite%2Ecom%2Fen-US%2Frecruiting%2Fenterprisecommunity%2FEnterpriseCareers%2Fjob%2FSilver-Spring-MD%2FIntern--Real-Estate-Development_REQ199&urlHash=kZPz&refId=bd438bec-e676-4d08-b664-dfbd9b7a0af1&trackingId=YmAiLm0kJ9NFD6f0GgFTGw%3D%3D&trk=public_jobs_apply-link-offsite
Summer Real Estate Intern,Wedgewood LLC,"Dallas, TX","What began as a very small team more than three decades ago has grown into a nationally recognized leader in the real estate investment industry, and Wedgewood is ready for our next class of interns who share our drive to innovate, take risks, and grow. If you’re looking for a company that empowers their team and a chance to learn more than just data entry, you’ve found it. Our summer interns will specialize in their preferred fields, gaining hands-on real-world experience. You won’t just learn about Real Estate - you’ll learn about investment strategy, acquisitions, real estate brokerage, design and flips, asset management, and more, all in a competitive and fun environment.

Up for the challenge? We are looking for well-rounded, hardworking students who are eager to learn alongside successful professionals in a fast-paced team setting. Our program is designed so that you can gain a meaningful, consolidated and in-depth view of our business, giving you the tools you need to succeed long-term. 40% of our interns in the past received full-time offers - will you be next?

What You’ll Do
Assist FLIP and Acquisition teams on regular projects, including market analysis and investment analysis on existing and potential real estate acquisitions
Work collaboratively with other departments on special intern projects
Perform additional duties as needed, including data entry, filing, and maintaining organizational systems

What You’ll Need
Junior or Senior class standing at your University or College
Coursework experience in Real Estate
Strong communication, organization, and time management skills
The ability to work collaboratively
Drive to learn, and willingness to take on challenges

What's In It For You
Direct exposure to high profile, successful entrepreneurs
Insight into the real estate industry and Wedgewood’s multiple lines of business including:
Acquisition & Rehab
Real Estate Brokerage: Asset Sales
Asset Management
Accounting & Finance
Private Money Lending
Legal
IT
The potential for full-time employment after graduation
If you are hired as a full-time employee after your internship, you will enjoy the subsequent benefits and perks.",https://www.linkedin.com/jobs/view/externalApply/2484931556?url=https%3A%2F%2Fapp%2Ejobvite%2Ecom%2FCompanyJobs%2FCareers%2Easpx%3Fk%3DApply%26j%3Dob76efwm%26s%3DLinkedInLimited&urlHash=jey-&refId=bd438bec-e676-4d08-b664-dfbd9b7a0af1&trackingId=gMtnoCKBjbWZ7%2BsS0uwO6A%3D%3D&trk=public_jobs_apply-link-offsite
Dallas Real Estate / Acquisitions Intern,Xite Realty,"Austin, TX","Xite Realty, LLC is a Texas-based commercial real estate company focused on representing the needs of Healthcare professionals and organizations. Our growing, entrepreneurial firm seeks an intern for our Dallas/Fort Worth, TX office whose role will be to assist brokers in the day-to-day operations of the company.

Responsibilities
To provide administrative support as required
Handle communication of clients and others in an effective manner (i.e. gathering of building information for market studies)
Organize and coordinate client/visitor/property tours
Assist brokers in the preparation of real estate documents such as letters of intent, market studies, contracts, etc.
Assist brokers in preparation for meetings
Prepare (type, revise, add graphics, etc.) marketing materials
Provide database management (adding, updating, deleting, quality control) incorporating client-specific information into a CRM to manage clients and lead distribution
Social media experience is a plus
Marketing and Advertising experience is a plus
Organize company networking events


Requirements
Proficiency in Microsoft Word, Excel & Outlook, PowerPoint, SalesForce, Costar, and Loopnet is a plus
Experience as an administrative assistant and/or in commercial real estate is a plus
Possess good organization, communication and follow-up skills
Be tactful and diplomatic through accurate verbal, written, and interpersonal skills
Be mature, reliable, dependable and professional
Be detail-oriented and possess critical thinking skills
Ability to work independently yet also thrive working as a team member
Willingness to learn
This is not a remote position, only local resumes will be considered


Benefits

This position pays $10 per hour and is flexible to adapt to your schedule.

Schedule M-Th 10 00am-3 00pm | Flexible

Please email your resume’ to afox@xiterealty.com or visit our website at www.xiterealty.com",https://www.linkedin.com/jobs/view/externalApply/2484931556?url=https%3A%2F%2Fapp%2Ejobvite%2Ecom%2FCompanyJobs%2FCareers%2Easpx%3Fk%3DApply%26j%3Dob76efwm%26s%3DLinkedInLimited&urlHash=jey-&refId=bd438bec-e676-4d08-b664-dfbd9b7a0af1&trackingId=gMtnoCKBjbWZ7%2BsS0uwO6A%3D%3D&trk=public_jobs_apply-link-offsite
"Real Estate Intern - Onalaska, WI",Altra Federal Credit Union,"Onalaska, WI","Are you a current college student looking for a paid internship? Are you looking for experience in a back-office setting, learning about real estate processes and what it entails to complete a real estate loan? Do you have the proven ability to prioritize, multi-task, and to work independently in order to meet strict deadlines? If so, the Real Estate Intern position at Altra Federal Credit Union may be a great fit for you!
Altras Real Estate Department is seeking a Real Estate Intern to provide support and gain exposure to our core Real Estate functions: Closing, Origination, Processing, Servicing, Support, and Underwriting to ensure a timely, accurate, and efficient mortgage loan process. Experience will include the following:
Work directly with Real Estate Closers, Originators, Processors, Servicers, Support and Underwriters to ensure timely, accurate and efficient processes have been met.
Learn Altras policies, investor guidelines, NCUA rules and regulations, and any other laws effecting mortgage lending.
Perform duties and responsibilities in the core real estate functions areas of:
Processing assist with the incoming emails, uploading documents, ordering services, calling on employment verifications and mailing out adverse actions.
Closing help manage the department inbox, send prepared closing packages for electronic signatures, and obtain any outstanding documentation from the parties involved with the transactions.
Servicing service the mortgages post-closing. This includes scanning and loading documents into member files, mailing payments to third part vendors, processing paid loan files, tracking and dispersing property tax and insurance escrows, and handle member transactions on their mortgages. To be considered for the Real Estate Intern position, you are required to have a High School diploma, GED/HSED and must be a current college student pursuing an advanced degree for consideration into the internship position. Altra would prefer you have a minimum one (1) year of office, financial institution, or customer service experience.
The Real Estate Intern position is a part-time temporary position; 20-25 hours per week during the school semester and 40 hours per week during the summer months and will be Monday through Friday with hours and days based on the candidates schedule of availability.
The internship will run for twelve (12) months; there is potential to renew the internship for an additional year with mutual consent, as long as there is a need and the intern is still a current college student. This internship will take place at Altras Operations Center in Onalaska, WI.
At Altra, we invest in each other and work together to make a difference in the community and help people live their best life! Altra is a Great Place to Work certified organization; we support diversity in the workplace and an Equal Opportunity Employer; bilingual abilities area a plus. Come join our team, its where YOU belong!

Required

Experience

A High School diploma, GED/HSED and must be a current college student pursuing an advanced degree for consideration into the internship position.

Preferred

Altra would prefer you have a minimum one (1) year of office, financial institution, or customer service experience. Education

Required

Enrolled in College or better
High School or GED or better",https://www.linkedin.com/jobs/view/externalApply/2495105331?url=http%3A%2F%2F9nl%2Ees%2FVUT7ot%3Fjz%3D4nmxk41690614AYANYAAVAAAQAAAAAAKQ%26tracking-details%3DYmlkPTAuMjEmYmlkdHlwZT1jcGMmc3JjPUxpbmtlZEluXy1fUHViemVlJmpJZD0xNTJiMzAyNjQxMjgyNTlmMDRjNmExYTNkMzc5MTViMSZlbWQ9MC4wMCZwaElkPW5teGsmZUJpZD0wLjIx&urlHash=y28v&refId=bd438bec-e676-4d08-b664-dfbd9b7a0af1&trackingId=tLXwKz7PYFuAKM6pa9l9NQ%3D%3D&trk=public_jobs_apply-link-offsite
Marketing Intern - Lange Real Estate,RedGuard,"Wichita, KS","About The Company

Rooted in real estate, an industry the company has been involved in since 1986, LANGE has constantly evolved to continue to meet the growing needs of those it serves. Today, the company has branches in portable storage, blast-resistant buildings, asset-based financial solutions and diversified leasing programs. However, through it all, LANGE has remained true to its guiding purpose of providing unique, industry-leading products and services while doing so with integrity and a commitment to its growing family of employees.

For more information, visit https://lange.us.com/companies/
What You Can Expect Working in the “Summer Marketing Intern” Position
Department/Division: Lange Real Estate

Reports to: Marketing Coordinator

Location: Wichita, KS

Position Type/Hours: Full-time | M-F | Hybrid Schedule of Remote/In-Person

Shift: 1st

Overtime: Approved Time Only

Travel Requirement: Less than 5%; Local Travel

FLSA Status: Non-Exempt

As a Marketing Intern, you will focus on Lange Branding and marketing support for Lange Real Estate Agents. This position requires someone who is creative, self-motivated, professional, and capable of prioritizing tasks. Duties will include planning and executing marketing campaigns, maintaining social media, developing engaging content, and creating property marketing material.

Responsibilities
Assist with digital presence for social media platforms including Facebook, Instagram, Adwerx, etc.
Develop and execute marketing campaigns.
Assist in creating property flyers and marketing packages.
Coordinate with Vendors on signage and newspaper publications.
Adapt with market trends and generate creative content.
Minimum Qualification
Must be enrolled in a marketing or related field university degree program.
Proficient in MS Office Suite (Word, Excel, Outlook).
Ability to quickly learn real estate specific marketing techniques.
Preferred Qualifications
Experience with Adobe Photoshop and Illustrator.
Supervisor Responsibilities
There are no supervisory responsibilities at this time.
Work Environment
The physical demands and work environment characteristics described here are representative of those an employee encounters while performing the essential functions of this job. Reasonable accommodations may be made to enable individuals with disabilities to perform the essential functions.
Sedentary work. Exerting up to 10 pounds of force occasionally and/or negligible amount of force frequently or constantly to lift, carry, push, pull or otherwise move objects, including the human body. Sedentary work involves sitting most of the time. Jobs are sedentary if walking and standing are required only occasionally and all other sedentary criteria are met.
The worker is not substantially exposed to adverse environmental conditions (such as in typical office or administrative work.)
Legal Jargon

We are an Equal Opportunity Employer. All qualified applicants will receive consideration for employment without regard to race, color, religion, sex, sexual orientation, gender identity, national origin, disability or protected veteran status. Except where prohibited by state law, all offers of employment are conditioned upon successfully passing a drug test. This employer uses E-Verify.

SDL2019-128",https://www.linkedin.com/jobs/view/externalApply/2481616468?url=https%3A%2F%2Fwww%2Estartwire%2Ecom%2Fjobs%2Fwichita-ks%2Fmarketing-intern-lange-real-estate-2737053273%3Fcampaign%3D129%26source%3DLI&urlHash=cP74&refId=bd438bec-e676-4d08-b664-dfbd9b7a0af1&trackingId=2A2STwjg9YCTmE3p0U6chw%3D%3D&trk=public_jobs_apply-link-offsite
