title,company,location,requirements,link
Abandoned Property Intern,"Ameriprise Financial Services, LLC","Boston, MA","Job Description

The role includes a variety of responsibilities under the Global Operations & Investor Services Department. During this internship, you will have the opportunity to support both the Tax Oversight Team and the Abandoned Property department to provide a range of experience and exposure to colleagues and assignments.

Responsibilities

Abandoned Property Intern Responsibilities:
Web research, call, email and mail targeted shareholders in an attempt to reunite them with abandoned property and prevent escheatment; document and report actions; escalate issues.
Interact with key stakeholders which include shareholders with abandoned property, vendors, and colleagues
Support efforts to identify opportunities for earlier outreach to prevent abandoned property status
Review and compare system settings to industry interpretation of state law based on established matrix
Support the Tax Oversight team in providing tax compliance for the Columbia mutual funds.

Tax Oversight Responsibilities
Provide ongoing mutual fund tax compliance, review and file federal and state tax returns for complex funds; develop and monitor fund tax policies; and determine and monitor dividend and capital gains tax distribution requirements for complex funds and products.
Calculate tax adjustments and determine fiscal distributions to shareholders. Prepare and files all required tax returns and related schedules with the IRS.
Provide project leadership with ad hoc requests and or projects from within team, other departments, portfolio managers and external auditors. Potential merger analysis, fund liquidations, launching of new products, etc.
Provide ongoing oversight on complex mutual funds for tax compliance through establishing and managing relationships with internal and external business partners.
Provide information to portfolio managers for capital gain tax management.
Required Qualifications
Sophomore or Junior status enrolled at a 4-year College or University
Strong written and verbal communication skills.
Organized, reliable, detail-orientated and self-motivated.
Ability to work both independently and with a team.
Time management skills and ability to prioritize tasks.
Willingness to learn.
Proficiency in Microsoft Office applications, especially Excel
About Our Company

Millions of people around the world rely on Columbia Threadneedle Investments to manage their money. We're intentionally built to help our clients succeed, backed by a global team of 2,000 people including more than 450 investment professionals sharing global perspectives across all major asset classes and markets. At Columbia Threadneedle, you’ll find the promise we make to our clients is the same one we make to our employees: Your success is our priority. In addition to our competitive total rewards package, employees stay with us because of our culture and commitment to their development. And, backed by the strength of our parent company, Ameriprise Financial, we are committed to providing you with the tools, resources, recognition and rewards to help you shape the career you want.

Ameriprise Financial is an equal opportunity employer. We consider all qualified applicants without regard to race, color, religion, sex, national origin, genetic information, age, sexual orientation, citizenship, gender identity, disability, veteran status, marital status, family status or any other basis prohibited by law.

Full-Time / Part-Time

Full time

Exempt/Non-Exempt

Non-exempt

Job Family Group

Human Capital

Line of Business

US Asset Management",https://www.linkedin.com/jobs/view/externalApply/2503462555?url=https%3A%2F%2Fsjobs%2Ebrassring%2Ecom%2FTGnewUI%2FSearch%2Fhome%2FHomeWithPreLoad%3FPageType%3DJobDetails%26partnerid%3D25678%26siteid%3D5275%26jobId%3D1641841&urlHash=R88Q&refId=2de4f147-afaf-41fb-afd7-c9940e3e6246&trackingId=Im93689Nm8TNekWRtesfXg%3D%3D&trk=public_jobs_apply-link-offsite
Abandoned Property Intern,Professional Diversity Network,"Boston, MA","Job DescriptionThe role includes a variety of responsibilities under the Global Operations & Investor Services Department. During this internship, you will have the opportunity to support both the Tax Oversight Team and the Abandoned Property department to provide a range of experience and exposure to colleagues and assignments.ResponsibilitiesAbandoned Property Intern Responsibilities:* Web research, call, email and mail targeted shareholders in an attempt to reunite them with abandoned property and prevent escheatment; document and report actions; escalate issues.* Interact with key stakeholders which include shareholders with abandoned property, vendors, and colleagues
Support efforts to identify opportunities for earlier outreach to prevent abandoned property status
Review and compare system settings to industry interpretation of state law based on established matrixSupport the Tax Oversight team in providing tax compliance for the Columbia mutual funds. Tax Oversight Responsibilities :* Provide ongoing mutual fund tax compliance, review and file federal and state tax returns for complex funds; develop and monitor fund tax policies; and determine and monitor dividend and capital gains tax distribution requirements for complex funds and products.* Calculate tax adjustments and determine fiscal distributions to shareholders. Prepare and files all required tax returns and related schedules with the IRS.* Provide project leadership with ad hoc requests and or projects from within team, other departments, portfolio managers and external auditors. Potential merger analysis, fund liquidations, launching of new products, etc.* Provide ongoing oversight on complex mutual funds for tax compliance through establishing and managing relationships with internal and external business partners.* Provide information to portfolio managers for capital gain tax management.Required Qualifications* Sophomore or Junior status enrolled at a 4-year College or University* Strong written and verbal communication skills.* Organized, reliable, detail-orientated and self-motivated.* Ability to work both independently and with a team.
Time management skills and ability to prioritize tasks.* Willingness to learn.
Proficiency in Microsoft Office applications, especially Excel About Our CompanyMillions of people around the world rely on Columbia Threadneedle Investments to manage their money. We're intentionally built to help our clients succeed, backed by a global team of 2,000 people including more than 450 investment professionals sharing global perspectives across all major asset classes and markets. At Columbia Threadneedle, you'll find the promise we make to our clients is the same one we make to our employees: Your success is our priority. In addition to our competitive total rewards package, employees stay with us because of our culture and commitment to their development. And, backed by the strength of our parent company, Ameriprise Financial, we are committed to providing you with the tools, resources, recognition and rewards to help you shape the career you want.Ameriprise Financial is an equal opportunity employer. We consider all qualified applicants without regard to race, color, religion, sex, national origin, genetic information, age, sexual orientation, citizenship, gender identity, disability, veteran status, marital status, family status or any other basis prohibited by law.We are an equal opportunity employer. We evaluate qualified applicants without regard to race, color, religion, sex, sexual orientation, gender identity, national origin, disability, veteran status, or any other protected characteristic. The EEO is the Law poster is available here.VEVRAA Federal ContractorWe request Priority Protected Veteran & Disabled Referrals for all of our locations within the state.PDN-93304e56-d9d2-4c9b-a5be-f288f73c75fd",https://www.linkedin.com/jobs/view/externalApply/2505535629?url=https%3A%2F%2Fjsv3%2Erecruitics%2Ecom%2Fredirect%3Frx_cid%3D475%26rx_jobId%3D4603340%26rx_url%3Dhttps%253A%252F%252Fwww%2Eprodivnet%2Ecom%252Fapply-for-job%252Fpost_id%252F4603340%253Fsig%253D2ef3c58eea3f3adde4079c1a5acfe185%2526utm_source%253DRecruitics%2526utm_medium%253Djobboard%2526utm_campaign%253DEnterprise%2526utm_campaign%253Dlinkedin%2526utm_medium%253Dpost%2526utm_source%253Dlinkedin%2526rx_medium%253Dpost%2526rx_paid%253D0%2526rx_r%253Dnone%2526rx_source%253Dlinkedin%2526rx_ts%253D20210415T151825Z&urlHash=dd4T&refId=2de4f147-afaf-41fb-afd7-c9940e3e6246&trackingId=l%2BqjSlFvWidAwnhZ4v9YEA%3D%3D&trk=public_jobs_apply-link-offsite
Abandoned Property Intern,Jobs via eFinancialCareers,"Boston, MA","Job Description

The role includes a variety of responsibilities under the Global Operations & Investor Services Department. During this internship, you will have the opportunity to support both the Tax Oversight Team and the Abandoned Property department to provide a range of experience and exposure to colleagues and assignments.

Responsibilities

Abandoned Property Intern Responsibilities:
Web research, call, email and mail targeted shareholders in an attempt to reunite them with abandoned property and prevent escheatment; document and report actions; escalate issues.
Interact with key stakeholders which include shareholders with abandoned property, vendors, and colleagues
Support efforts to identify opportunities for earlier outreach to prevent abandoned property status
Review and compare system settings to industry interpretation of state law based on established matrix
Support the Tax Oversight team in providing tax compliance for the Columbia mutual funds.

Tax Oversight Responsibilities
Provide ongoing mutual fund tax compliance, review and file federal and state tax returns for complex funds; develop and monitor fund tax policies; and determine and monitor dividend and capital gains tax distribution requirements for complex funds and products.
Calculate tax adjustments and determine fiscal distributions to shareholders. Prepare and files all required tax returns and related schedules with the IRS.
Provide project leadership with ad hoc requests and or projects from within team, other departments, portfolio managers and external auditors. Potential merger analysis, fund liquidations, launching of new products, etc.
Provide ongoing oversight on complex mutual funds for tax compliance through establishing and managing relationships with internal and external business partners.
Provide information to portfolio managers for capital gain tax management.
Required Qualifications
Sophomore or Junior status enrolled at a 4-year College or University
Strong written and verbal communication skills.
Organized, reliable, detail-orientated and self-motivated.
Ability to work both independently and with a team.
Time management skills and ability to prioritize tasks.
Willingness to learn.
Proficiency in Microsoft Office applications, especially Excel",https://www.linkedin.com/jobs/view/externalApply/2505877224?url=https%3A%2F%2Fclick%2Eappcast%2Eio%2Ftrack%2F8q9la28%3Fcs%3Dfli%26jg%3D30zv%26bid%3DlUf2CslKyPxm6i440ZgUYA%3D%3D&urlHash=QH4p&refId=2de4f147-afaf-41fb-afd7-c9940e3e6246&trackingId=T8kDNZsGvrjmK65QsqZ9pQ%3D%3D&trk=public_jobs_apply-link-offsite
Intern - Property,UDR - Opening Doors to your future,"New York, NY","GENERAL SUMMARY OF DUTIES: Assists with and learns about the efficient operation of the assigned community or communities under the direction of their Community Director(s). On a daily basis, the Intern is flexible and may perform the tasks associated with the operation of the community including leasing, resident services, maintenance and actions to ensure compliance with all applicable laws and company policies.

The program is designed to provide the college student a positive learning and/or practical work experience providing them the opportunity to grow and sharpen their practical work skills, and contribute toward the successful achievement of the Company. This is an hourly position based in numerous locations located throughout the United States.

SUPERVISION RECEIVED: Reports directly to one or more Community Directors, Senior Community Directors, or General Manager

SUPERVISION EXERCISED: N/A

TIME COMMITMENT: Part-time or Full-time (approximately 29 hours per week minimum not to exceed 40 hours in a given work week) for three months, typically starting in June. The start and end dates and hourly commitment of the internship are flexible and can be adjusted based on managements needs.

Essential Functions
Renew and lease apartments using effective selling techniques to close each sale and obtain the required deposit(s).
Meet with and show the prospects the community and all of the amenities.
Complete administrative tasks associated with community operations, including accounting and financial reporting, processing invoices, making bank deposits, reconciling resident accounts, and performing other clerical tasks assigned.
Responsible to complete customer applications, to ensure all background checks, deposits, and lease paperwork is completed in accordance with all legal requirements and company policy to guarantee a timely move-in.
Notify the new resident upon approval of the application, prepare resident move-in or renewal paperwork, ensure the new resident signs all necessary paperwork (leases, addenda, notices, etc.), and pays applicable deposits. Prepare new residents file according to company requirements for the Community Director’s approval.
Enter data into the community database.
Explain the “Move-In Inventory” form to new residents and ensure that the form is returned.
Answer prospect, resident, and customer inquiries which may include questions about the community, the company, lease details, and amenities and takes prompt action to solve/address issues and/or enter resident service requests into the system if needed.
Assist in gathering and compiling current market and economic information, and prepare competitive market analyses and trends if requested.
Answer the telephone and receive and greet visitors to the community in the absence of a Concierge.
Provide superior customer service to internal and external customers.
Enter, update, and maintain the guest card data base.
Produce timely and accurate administrative, accounting, and other reports.
Conduct routine site inspections to ensure that the physical aspects of the community meet established standards regarding the grounds, market tour trail, curb appeal, risk management/safety requirements, cleanliness, and general appearance and implements corrective measures as necessary.
Assist residents who call or come to the office to make a service request by entering that service request into the system for them.
Assist in sponsoring functions and programs that promote resident satisfaction.
Perform other duties as assigned or as necessary.

PERFORMANCE REQUIREMENTS: Become familiar with organizational policies and procedures. Appreciation of business concepts and requirements.

TAbility to define problems, collect data, establish facts, and draw valid conclusions. Ability to apply concepts of basic algebra, geometry, and statistics. Ability to exercise initiative, problem solving and decision making skills.

The individual must be energetic, enthusiastic, detail-oriented, and have the ability to multi-task. Ability to learn the principles and methods for showing, and promoting property and knowledge of demographics surrounding assigned community. Ability to effectively present information to prospective or current residents. Ability to respond to common inquiries or complaints. Ability to quickly develop strong internal working relationships. Ability to travel, when applicable.

Must be a self-starter and have strong organizational and analytical skills, effective oral and written communication skills. Ability to professionally work well with others and to maintain positive relationships with co-workers, Company managers, clients, and customers both internal and external.

Proficiency with Microsoft Office, Word, Excel, and Power Point and an ability to learn and utilize other software products needed. Ability to perform numerous administrative duties and to create, compose, and edit written materials. Knowledge of basic office practices and procedures.

TYPICAL PHYSICAL DEMANDS: Some bending, stooping and stretching. Occasionally lifting items weighing up to 30 lbs. Requires eye-hand coordination and manual dexterity sufficient to operate a keyboard, photocopier, telephone, calculator, and other office equipment. Requires normal range of hearing and eyesight to record, prepare, and communicate appropriate reports. Regular and consistent attendance on the job is an essential function.

TYPICAL WORKING CONDITIONS: Normal office environment. Incumbents must be able to physically access all exterior and interior parts of the community and amenities. Regular exposure to outside elements, weather, and unpleasant odors. Flexible schedules with occasional evening and regular weekend work.

Education And Experience

In order to apply, applicants must be:
Currently enrolled college students with an interest in Real Estate and/or general business.
U.S. citizens or legal permanent resident.
Able to demonstrate leadership abilities and excellent oral and written communication skills.
Be in good academic standing and have a minimum grade point average of 3.0 on a 4.0 scale.",https://www.linkedin.com/jobs/view/externalApply/2458230880?url=https%3A%2F%2Frecruiting2%2Eultipro%2Ecom%2FUNI1027UDRT%2FJobBoard%2F6ccb8fd4-4950-43e4-9978-4bcc85c6f5e1%2F%2FOpportunityDetail%3FopportunityId%3D2027f75c-6bc8-4b06-9b99-1fc400df9cec%26utm_source%3DLINKEDIN%26utm_medium%3Dreferrer&urlHash=sMEu&refId=2de4f147-afaf-41fb-afd7-c9940e3e6246&trackingId=cWhR5eCFlU%2F3W4AfAOUGgg%3D%3D&trk=public_jobs_apply-link-offsite
Property Intern,Yulista Holding LLC,"Huntsville, AL","Property Intern - Inventory Control

Huntsville, AL Triana, AL Redstone Arsenal, AL
Temporary

The Property Intern is responsible for ensuring that company inventory is properly and securely stored and recorded, from time of receipt until use or shipment.

Essential Functions
Adhere to Security and Safety policies
Perform task in accordance with property, quality, and regulatory requirements
Perform various daily housekeeping tasks, responsible for maintaining work and storage areas in a neat and orderly fashion
Perform other various administrative duties as needed, assigned and/or required to meet the ongoing needs of the organization
Communicate and coordinate material status information to designated personnel.
Conduct inventory cycle counts, verifying item storage, location, quantity, etc. Responsible for control and accuracy of material and records using both manual and electronics inventory control systems.
Load and unload inventory as necessary. Utilize hand trucks, forklifts, hoists, conveyors, or other handling equipment to move material to and from aircraft, trucks, trains, etc. within the storage facility.
Perform kitting operations for shipment to manufacturing locations, including but not limited to, pulling, packing, delivering, staging inventory to and from production floor and order picking.


Knowledge, Skills & Abilities
Ability to enter data accurately into databases, follow processes, perform basic mathematical computations, and write routine reports and correspondence.
Ability to learn and understand corporate policies and procedures and how they relate to Yulista’s goals.
Ability to operate general office equipment such as fax, phone, scanner, printer, etc.
Ability to read and interpret documents such as safety rules, operating and maintenance instructions, and procedure manuals.
Ability to detect unobvious facts and issues, and exercise resourcefulness in resolving problems.
Ability to multi-task and perform duties with minimal supervision.
High degree of self-motivation, independent work skills, excellent interpersonal skills, customer service skills, trustworthy, and effective oral and written communication skills.
Analytical skills with the ability to evaluate data and consider decision impact across multiple areas.
Strong decision analysis and problem solving skills; ability to draw conclusions and justify decisions.
Basic to Intermediate computer skills, specifically using Microsoft Office Suite and Deltek CostPoint, with an ability to learn additional skills and software programs.
JOB REQUIREMENTS
High School Diploma or Equivalent
Ability to deal with physical demands to include warehouse environment, walking, bending, stooping, and lifting inventory items up to and at times exceeding 50 pounds with appropriate safety requirements.
Detail oriented with excellent verbal and written communication skills, analytical skills, ability to apply logic with good follow through, and leadership skills.
Must be reliable and responsible with abilities to work independently and commitment to work weekends and any overtime as needed.
Strong academic performance if a current student.
Ability to pass a drug and background screening.


Property Intern Essential Functions
Responsible for conducting a full physical inventory of piece part material line items against inventory reports.
Verifying part number, description, location, lot number, quantity, inventory abbreviation, check-off report, and affix identifying marker.
Responsible for conducting a full physical inventory accounting for equipment asset items verifying property tag number, location, check-off report, and affix identifying marker.
Report discrepancies to Inventory Control Personnel.
Verify Clerical Computations against physical counts and identifying / noting any adjustments.

Yulista offers an excellent compensation and benefits package. We are an Equal Opportunity / Affirmative Action Employer. All qualified applications will receive consideration for employment without regard to race, color, religion, sex, sexual orientation, gender identity, national origin, disabilities, protected military or veteran status. To apply for this position, or view all of our job openings, visit us online at www.yulista.com , click on career opportunities.

PREFERENCE STATEMENT

Preference will be given to Calista shareholders and their descendants and to spouses of Calista shareholders, and to shareholders of other corporations created pursuant to the Alaska Native Claims Settlement Act, in accordance with Title 43 U.S. Code 1626(g).

EEO STATEMENT

Additionally, it is our policy to select, place, train and promote the most qualified individuals based upon relevant factors such as work quality, attitude and experience, so as to provide equal employment opportunity for all employees in compliance with applicable local, state and federal laws and without regard to non-work related factors such as race, color, religion/creed, sex, national origin, age, disability, marital status, veteran status, pregnancy, sexual orientation, gender identity, citizenship, genetic information, or other protected status. When applicable, our policy of non-discrimination applies to all terms and conditions of employment, including but not limited to, recruiting, hiring, training, transfer, promotion, placement, layoff, compensation, termination, reduction in force and benefits.

REASONABLE ACCOMMODATION

It is Calista and Subsidiaries' business philosophy and practice to provide reasonable accommodations, according to applicable state and federal laws, to all qualified individuals with physical or mental disabilities.

The statements contained in this job description are intended to describe the general content and requirements for performance of this job. It is not intended to be an exhaustive list of all job duties, responsibilities, and requirements.

This job description is not an employment agreement or contract. Management has the exclusive right to alter the scope of work within the framework of this job description at any time without prior notice.

Posted 2 Days Ago Part time JR100227

As a subsidiary of Calista Corp., Yulista is committed to being the best-equipped Alaska Native Corporation (ANC) in the world, performing rapid response aerospace and defense solutions for foreign and domestic customers. A trusted partner since 2002, Yulista has grown to become the preferred partner for mission-ready clients like the Department of Defense, the Armed Forces, and NASA. We offer innovative expertise that makes a difference every day and we do whatever it takes to leave no doubt with our customers, our Alaskan shareholders, and our Yulista team members. Our greatest assets are the men and women who give their all to make the impossible possible for our customers. At Yulista, we work together to create a dynamic and inspiring culture where all are welcome and every team member is celebrated. We are looking for individuals who are motivated to contribute to our mission and will add to our incredible culture.",https://www.linkedin.com/jobs/view/externalApply/2506224213?url=https%3A%2F%2Fcalistacorp%2Ewd1%2Emyworkdayjobs%2Ecom%2FYulista%2Fjob%2FHuntsville-AL%2FProperty-Intern---Inventory-Control_JR100227%3Fsource%3DLinkedin&urlHash=MWUc&refId=2de4f147-afaf-41fb-afd7-c9940e3e6246&trackingId=pP%2BE7fYVqRKrPjxSmsckkw%3D%3D&trk=public_jobs_apply-link-offsite
