title,company,location,requirements,link
Early Careers-Sales Representative Intern,Mondelēz International,"Atlanta, GA","Job Description

Are You Ready to Make It Happen at Mondelēz International?

Join our Mission to Lead the Future of Snacking. Make It Matter.

As an organization we are committed to developing the next generation of Makers and Bakers. Joining us at an early career stage in our fast paced and ever changing environment will enable you to do more, learn more and grow more. You will be encouraged to step outside your comfort zone– you may even surprise yourself! We will ensure you are given the support you need to be at your best and enable you to be yourself and bring passion and personality. Here you can lean in and speak up and bring your own flavor.

Early Careers Intern – (USA – Sales Representative Intern)

Hourly Fixed Compensation $16/hr

Primary Location: Atlanta, Ga.

An internship within Mondelēz International Sales & Customer Logistics organization is generally a 10-12 week assignment. The assignment, which closely mirrors experiences of a Nabisco Sales Representative, will provide a realistic preview of the Sales Representative's responsibilities and is geared towards developing knowledge of the Mondelēz International Field Sales & Customer Logistics organization. Individuals are exposed to sales (selling and merchandising), logistics, account teams, and human resources while growing the necessary skills to work independently and also function successfully as part of a team. Each intern is assigned a supervisor who designates projects, answers questions and provides guidance. Throughout the summer, the intern will be assessed on overall performance, including project management, and personal leadership skills.

Primary Responsibilities

Develop a knowledge of Mondelez products, sales systems and procedures including proper merchandising, sources of product and distribution, space management programs and uses, sales campaigns and promotions, sales brochures and order guides, and sales presentations.
Positively influence the sale of Mondelez products by exploiting selling opportunities at the store level consistent with company programs and strategies.
Maintain a timely and accurate call schedule.
Secure store-level support on special promotions, seasonal items, special product bookings and new items.
Meet or exceed all shelving standards and ensure inventory needs are met.
Develop strong business relationships with store management.
Monitor and report on competitive activity and document all pricing activities.
Provide order writing support on territories for Sales Representatives absent due to vacation or other reasons.
Complete administrative reporting responsibilities.
Provide specific feedback to Mondelez personnel while covering a Sales Representatives territory.
Professionally represent the Mondelez organization, acting in accordance with company business standards and managing financial activities in an ethical manner.
Present a project on customer or industry topics to senior management at end of summer.
Identify and communicate individual store problems and opportunities to the appropriate Mondelez personnel.

Benefits and Compensation:

This position is a paid internship, but does not offer a benefit package, bonus incentives, or company provided vehicles/ housing.

Key Competencies:
Learning on the Fly - Adaptable to new environments, quick learner, open to change
Intellectual Horsepower – Deals with concepts and complexity comfortably, intellectually sharp, capable and agile
Interpersonal Savvy – Relates well to all kinds of people, builds appropriate rapport and effective relationships
Peer Relationships – Team player, cooperative, easily gains trust and support of peers, encourages collaboration
Problem Solving – Looks beyond the obvious and doesn’t stop at the first answers, can see hidden problems, excellent at honest analysis
Perseverance - Pursues everything with energy, drive, and a need to finish; Seldom gives up before finishing, especially in the face of resistance or setbacks
Action Oriented - Enjoys working hard; Is action oriented and full of energy for the things he/she sees as challenging; Not fearful of acting with a minimum of planning; Seizes more opportunities than others
Personal Learning - Picks up on the need to change personal, interpersonal, and managerial behavior quickly; Watches others for their reactions to his/her attempts to influence and perform, and adjusts; Seeks feedback

Requirements:
You must be at least 18 years of age, have a valid driver's license, proof of auto insurance, and have access to the internet with a personal email account
Must be currently enrolled in a post-secondary degree program
A flexible work schedule is required, including being available to work weekends and holidays
Previous grocery, retail, sales, and/or customer service experience a plus
Must be open to performing Merchandiser responsibilities, as needed
Must be willing to relocate self for this position, if not a local applicant
Successful completion of drug test, MVR check, and general background check
No Relocation support available Business Unit Summary The United States is the largest market in the Mondelēz International family with a significant employee and manufacturing footprint. Here, weproduce our well-loved household favorites to provide our consumers with the right snack, at the right moment, made the right way. We have corporate offices, sales, manufacturing and distribution locations throughout the U.S. to ensure our iconic brands—including Oreo and Chips Ahoy! cookies, Ritz, Wheat Thins and Triscuit crackers, and Swedish Fish and Sour Patch Kids confectionery products —are close at hand for our consumers across the country.
Mondelēz Global LLC is an Equal Opportunity/Affirmative Action employer. All qualified applicants will receive consideration for employment without regard to race, color, religion, sex, national origin, disability, protected Veteran status, sexual orientation, gender identity, gender expression, genetic information, or any other characteristic protected by law. Applicants who require accommodation to participate in the job application process may contact 847-943-5460 for assistance.
Job Type Intern (Fixed Term)InternsEarly Careers",https://www.linkedin.com/jobs/view/externalApply/2435773121?url=https%3A%2F%2Fwd3%2Emyworkdaysite%2Ecom%2Fen-US%2Frecruiting%2Fmdlz%2FExternal%2Fjob%2FAtlanta-Georgia-United-States%2FEarly-Careers-Sales-Representative-Intern_R-16835%3Fsrc%3DSNS-12680&urlHash=ZAXU&refId=607ecde4-6e20-4d90-b570-2def4c9451e4&trackingId=7PTicmz%2FYAnheEnTNNUOBg%3D%3D&trk=public_jobs_apply-link-offsite
Site Merchant Intern - Summer 2021,Ashley Furniture Industries,"Tampa, FL","Description

The Site Merchandising intern will work with the assistant and site manager to deliver an outstanding online shopping experience by ensuring customers easily find and buy the desired products through the development of merchandising strategies that drive sales and maximize conversion. They will assist with managing and reviewing the online assortment to ensure the categorization, imagery, copy, pricing, site placement and promotional tags are accurate and meet brand standards. They will also interact cross-functionally with Buying, Marketing and IT to identify business opportunities and help the team take advantage of those opportunities.

What Do You Need
Pursuing a degree in Business Administration, Marketing, Merchandising or related field or equivalent work experience
A positive, can-do attitude
Excellent verbal and written communication skills
Working knowledge of Google Suite and Microsoft Office programs specifically excel
Project management and communication skills, analytical skills and problem-solving skills
Attention to detail and accuracy
A passion for online shopping",https://www.linkedin.com/jobs/view/externalApply/2438139987?url=https%3A%2F%2Fashleycareers%2Ettcportals%2Ecom%2Fjobs%2F6411977-site-merchant-intern-summer-2021&urlHash=cqVw&refId=607ecde4-6e20-4d90-b570-2def4c9451e4&trackingId=l95afLwrgggcNR7BBbXx2Q%3D%3D&trk=public_jobs_apply-link-offsite
M&A Sales Associate Intern (summer 2021),Bainbridge,"San Diego, CA","About This Position

M&A Sales Associate Internship - BC Capital Group, LLC

Job Type: Internship (paid or academic credit)

Position Location: Remote, location agnostic, U.S. preference

Position Type/Expected Hours of Work: Part- time, 15-30 hours per week (Flexible)

Start date: Immediately

How to Apply: Please submit resume and cover letter, briefly describing your interest in the position. Resumes without a cover letter will not be reviewed.

BC Capital Group is seeking highly motivated candidates interested in expanding their professional opportunities in Private Equity where their business acumen, sales experience and analytical skills can be leveraged in the rewarding sectors of private equity, investment banking and M&A advisory. Associate Interns will participate in many aspects of acquisitions and divestitures, such as secondary source research, development of industry and company profiles, and other quantitative and qualitative analysis. Although BC Capital Group seeks Associates with diverse backgrounds, candidates with a degree in finance or economics are preferred.

A BC Capital Group Associate should demonstrate maturity and initiative, excellent analytical ability, and strong communication (written and verbal) and teamwork skills. Also needed is an understanding of corporate financial analysis and financial statements, and the ability to adapt to varied assignments and situations.

Responsibilities for Mergers & Acquisitions Associate Intern:

The Associate Intern will assist with all aspects of generating deal flow on behalf of their clients.

This will include:
Assist with the BC Capital Group team to develop a pipeline of companies that meets their clients’ investment criteria
Calling and emailing with business owners of middle market companies in a diverse array of industries to build relationships with them on behalf of your clients
Qualifying businesses to identify their divestiture posture, ownership structure, revenue, EBITDA, actionability and growth strategy
Assist Team in communicating our clients’ interest and provide feedback to business owners
Data gathering via secondary and primary source research
Training Includes:
Education on the alternatives markets, including investments by private equity groups, family offices, institutional investors, and corporate strategic acquirers
Consultative sales training
Client account management
To qualify for this excellent opportunity, candidates must demonstrate:
Top percentile Business Development Skills
Proven research and analytical skills
Committed to meeting and exceeding client needs
Excellent written and verbal communication skills
Ability to work independently and interdependently within a team environment
Adept at managing multiple projects and completing deliverables on schedule
Education/Experience:

Junior/ Senior or recent graduate of accredited college or university, majoring in Business, Finance or related field required.

To perform this job successfully, the individual must be able to perform each essential duty satisfactorily. The requirements listed above are representative of the knowledge, skill, and/or ability required. Reasonable accommodations may be made to enable individuals with disabilities to perform the essential functions.

Why Work Here?

Forbes rated award winning professional consultancy with exceptional growth in new technology, meritocracy, expanding management team.

BC Capital Group is a separately-owned affiliate to Bainbridge, a global strategic consulting firm, delivering high value advisory services to the Fortune 1000. Founded out of MIT, our main goal is to help clients achieve their strategic objectives while our team members achieve their highest professional goals. The company was recently ranked by Forbes Magazine among the 99th percentile of national management consulting firms and by Vault Magazine as a top 50 national management consulting firm. Our culture is one of teamwork, achievement, and excellence in customer service. From 2016-2020, Bainbridge was recognized by Forbes ranking of America's Best Management Consulting Firms across 14 industries of expertise. In 2016 Bainbridge was ranked in the Top 50 Most Prestigious Consulting Firms in North America by Vault. In 2007, Bainbridge Consulting was recognized as an employer of choice by the San Diego Business Journal, reflecting the values of teamwork, scholarship, excellence, and impactful value.

Work Authorization/Security Clearance:

Must be authorized to work in the US.

AAP/EEO Statement:

Bainbridge, Inc is an equal opportunity employer and all employees are responsible for maintaining a discrimination and harassment free environment.

Ethics:

All employees are accountable for conducting their daily business responsibilities in an ethical and moral manner.

Powered by JazzHR

p9z9twE9lB",https://www.linkedin.com/jobs/view/externalApply/2411702159?url=https%3A%2F%2Fbainbridgeinc%2Eapplytojob%2Ecom%2Fapply%2Fp9z9twE9lB%2FMA-Sales-Associate-Intern-summer-2021%3Fsource%3DLILI%23p9z9twE9lB&urlHash=yf0D&refId=607ecde4-6e20-4d90-b570-2def4c9451e4&trackingId=2%2B7YnljX8U68X6PTGesw3A%3D%3D&trk=public_jobs_apply-link-offsite
Paid Internship – Miami,Marcus & Millichap,"Miami, FL","Marcus & Millichap’s Internship program

Our Internship Program is designed to provide a hands-on opportunity to learn both the commercial real estate industry and our proven principles of investment sales brokerage, all within a structured environment that provides constant coaching and feedback.

This hourly-paid position is an excellent opportunity to learn the commercial real estate brokerage industry. The Internship Program helps qualified, licensed new recruits train for a career in investment brokerage while earning an hourly wage for up to 12 months as he/she supports the business of, and learns from, a productive mentoring agent.

The main responsibility of the intern will be assisting Senior Agents with client proposals and pricing analysis. Assist in making introductory relationship calls. Additionally the intern will assist the current office staff with other administrative duties. Most importantly, they will be provided the opportunity to eventually enter our Sales Agent Training Program, learn the investment real estate industry from the best, and become an Investment Associate in our Miami office. It is anticipated that the intern will work in this position for at least 12 months and then begin the Sales Agent Training Program.

Applicants should be ambitious, have an entrepreneurial spirit, a college degree, a Florida real estate license, and possess strong analytical and business development skills.

Through Partnership With a Successful Senior Agent, Our Program Participants Complete Marketing, Analytical, And Administrative Tasks While Gaining Expertise In The Following Areas
Applying Marcus & Millichap’s value proposition at all stages of the brokerage continuum
Achieving fluency in Marcus & Millichap’s proprietary software and industry programs
Developing and building client databases and referral networks
Performing underwriting and analysis on commercial properties in order to create effective marketing proposals
Successfully communicating with clients, attorneys, lenders, and all other parties involved in a commercial real estate transaction
Developing confidence in cold calling, networking, and building productive relationships
Sharpening negotiation, strategy, and transactional management skill sets
Preparing a personal financial plan, budget, and goals
Understanding the benefits of financing with Marcus & Millichap Capital Corporation

Our mission is to help our clients create and preserve wealth by providing the best real estate investment sales, financing, research, and advisory services available.

Founded in 1971, Marcus & Millichap (NYSE: MMI) is a leading commercial real estate brokerage firm focusing exclusively on investment sales, financing, research, and advisory services, with nearly 2,100 investment sales and financing professionals in 80+ offices throughout the United States and Canada.

Marcus & Millichap closes 4.5 transactions every business hour – more than any other real estate investment brokerage firm in the nation. In 2020, the firm closed 8,954 transactions with a sales volume of approximately $43.4 billion.

The firm has perfected a powerful property marketing system that integrates broker specialization by property type and market area; the industry’s most comprehensive investment research; a long-standing culture of information sharing; relationships with the largest pool of qualified investors; and state-of-the-art technology that matches buyers and sellers.",https://www.linkedin.com/jobs/view/externalApply/2473614283?url=https%3A%2F%2Fjobs%2Elever%2Eco%2Fmarcusmillichap%2Fa01987d7-f70c-4d85-a2ba-397fd9327388&urlHash=cz8X&refId=607ecde4-6e20-4d90-b570-2def4c9451e4&trackingId=9PQlmfdGJZ1AQoBK8UsBtg%3D%3D&trk=public_jobs_apply-link-offsite
Sales Intern,United Rentals,"Braintree, MA","Great company. Great people. Great opportunities.

We Believe In

At United Rentals, the largest equipment rental company, we believe that it takes great employees to build a great organization – and we’re passionate about helping our people grow professionally and embrace teamwork in everything they do. Our culture is based on our corporate values and centers on mutual respect, job satisfaction, diversity and a shared responsibility to build a better future.

Hiring and retaining exceptional employees at every level

Providing training, development and career planning

Instilling the belief that our customers are key to our long-term success

Encouraging a strong sense of responsibility, involvement and commitment

Recognizing and rewarding both individual and team efforts

United Rentals, the largest equipment rental company in the world, is offering an excellent opportunity for a branch Intern who is ready to grow their career with the leading company in the industry. To continue our tremendous success and unparalleled growth, we are searching for qualified and ambitious individuals to learn the various types of equipment and their applications, while providing superior customer service. This position will also learn the sales process by spending time in both inside and outside sales with a continuous focus on customer service excellence. The intern will leave this position with invaluable skills and industry knowledge of United Rentals, with the goal of becoming a Sales Associate upon receipt of degree.

The duties of the branch Intern will vary by department and may include:
Participation in safety training to ensure proper personal protective equipment is worn, safe handling of equipment, safety policies and procedures are adhered to, etc.
Participation in the operational efficiency of the branch work flow in the yard. This will include equipment check-in, washing of equipment, assisting customers, etc.
Shadowing of inside sales and outside sales positions to learn the roles and responsibilities of each and the importance United Rentals places on the focus of the customers.
Training on systems: RentalMan, Salesforce.com, etc.
Participation in departmental and cross-functional meetings, ride-alongs, work sessions, conference calls and webex meetings
Other duties assigned as needed

Job Requirements
Prior relevant work experience preferred
Strong organizational and interpersonal skills
Excellent oral and written communication skills; strong presentation skills.
Strong analytical and financial analysis skills
High proficiency in Microsoft Office: Word, Excel, PowerPoint and Access
Ability to effectively handle multiple assignments/project components simultaneously
Ability to work independently and also as part of a team
Self-motivated with a strong drive and sense of urgency
Must be currently pursuing a BA/BS degree in sales or related major
What's in it for you?

U.S. Full Time roles: Best in class benefits offering includes medical, dental, vision, flex spending and health savings accounts; 401(k) retirement with company match; life and disability insurance; and paid time off including sick, vacation, holidays, and paid parental leave. Comprehensive training and development and career growth opportunities.

U.S. Part Time roles: Benefits offering includes 401(k) retirement with company match/RRSP; paid time off including sick, vacation and holidays; and comprehensive training and development and career growth opportunities.

Canada: Best in class benefits package which includes medical, dental & vision, RRSP/DPSP*, paid time off, comprehensive training and development, and career growth opportunities.

Offered for full time roles, part time eligibility in select provinces

United Rentals, Inc. is an Equal Opportunity Employer of women, minorities, protected veterans and individuals with disabilities.

Apply",https://www.linkedin.com/jobs/view/externalApply/2427405723?url=https%3A%2F%2Fjobs%2Eunitedrentals%2Ecom%2Fsearch%2Fjobdetails%2Fsales%2520intern%2F45680f70-f196-46e5-a8c0-2b8cea415e06&urlHash=9WgI&refId=607ecde4-6e20-4d90-b570-2def4c9451e4&trackingId=dPu6euv%2BJhdwK6RgwPHuMg%3D%3D&trk=public_jobs_apply-link-offsite
2021 Summer Undergraduate Intern - GDD - Vendor Operations,Novartis,"East Hanover, NJ","Sourcing Statement

You are applying to be part of the Novartis Talent Pool. We are not currently recruiting for this role but we are building a pipeline for future opportunities. If you would like to be considered for a similar position in future, then please submit your CV.

Job Description

799 million. That’s how many lives our products touched in 2019. And while we’re proud of that fact, in this world of digital and technological transformation, we must also ask ourselves this: how can we continue to improve and extend even more people’s lives?

We believe the answers are found when curious, courageous and collaborative people like you are brought together in an inspiring environment. Where you’re given opportunities to explore the power of digital and data. Where you’re empowered to risk failure by taking smart risks, and where you’re surrounded by people who share your determination to tackle the world’s toughest medical challenges.

Imagine what you could do at Novartis!

Support compliance of the External Development Operations (EDO) group by performing independent quality checks of EDO documentation as it may relate to supplier qualification data, governance, metrics, and systems. Work across EDO members to develop supplier approval roadmaps to show history of supplier and service status with Novartis. Where necessary, identify gaps in approval or documentation of suppliers.

Objectives & Key Deliverables:
Supplier qualification roadmap development for Governance Level 1 & 2 suppliers to enhance current data from External Service Provider Information Repository (ESPIR). Roadmaps will be developed with collaboration with EDO Relationship Leads for key services and support inspection readiness.

Business Impact:
Intern will be a valuable resource to assess Novartis supplier compliance and documentation, and convert disconnected data into a holistic supplier quality roadmap. Expected impact is to enhance EDO inspection readiness and identify gaps in documentation. Goal is to understand all data and attachments in our current supplier qualification repository for potential migration into a future validated system.

EEO Statement
The Novartis Group of Companies are Equal Opportunity Employers and take pride in maintaining a diverse environment. We do not discriminate in recruitment, hiring, training, promotion or other employment practices for reasons of race, color, religion, gender, national origin, age, sexual orientation, gender identity or expression, marital or veteran status, disability, or any other legally protected status. We are committed to building diverse teams, representative of the patients and communities we serve, and we strive to create an inclusive workplace that cultivates bold innovation through collaboration and empowers our people to unleash their full potential.

Minimum Requirements

Candidate should be in an accredited degree-granting college or university pursuing an undergraduate degree

Fluent in English (verbal and written). Able to comfortably work across a diverse global team in EDO, Quality, and Procurement. Problem solving skills and ability to detect missing data or compliance risks. Strong MS Excel skills (sort, filter, pivot, graphs) and familiar with PowerPoint

Preferred Competencies/Experiences: Experience in creating SharePoint sites. Background or knowledge of health authority/regulatory

Division
Global Drug Development

Business Unit
GDO GDD

Country
USA

Work Location
East Hanover, NJ

Company/Legal Entity

Novartis Pharmaceuticals

Functional Area
Research & Development

Job Type
Full Time

Employment Type
Internship

Shift Work
No",https://www.linkedin.com/jobs/view/externalApply/2497926603?url=https%3A%2F%2Fsjobs%2Ebrassring%2Ecom%2FTGnewUI%2FSearch%2Fhome%2FHomeWithPreLoad%3Fpartnerid%3D13617%26siteid%3D5268%26PageType%3DJobDetails%26jobid%3D2727971%26frmSiteId%3D5260%26codes%3DLIIN-W&urlHash=m4Av&refId=607ecde4-6e20-4d90-b570-2def4c9451e4&trackingId=qwO6yIx3BJEaZ3BHHta%2Fxg%3D%3D&trk=public_jobs_apply-link-offsite
