title,company,location,requirements,link
Research Intern - Research Assistant,Microsoft,"Redmond, WA","Virtual Internship

Participation in the Research Internship Program requires that you are physically located in the United States or Canada for the duration of the internship

Research Internships at Microsoft provide a dynamic environment for research careers with a network of world-class research labs led by globally-recognized scientists and engineers. Our researchers and engineers pursue innovation in a range of scientific and technical disciplines to help solve complex challenges in diverse fields, including computing, healthcare, economics, and the environment.

Many physicists have wondered how the universe chooses its basic laws. One idea is that the laws-or the parameters that characterize them, such as the masses of the different quarks and leptons, can evolve in time. Several mechanisms have been proposed, which can be visualized as a point representing the universe moving on a vast landscape of possible laws. This turns out to be a process that can be efficiently simulated by a deep neural network. We continue our work started in 2020 building and running models to investigate this and other ideas about how the universe chose or learnt its laws. Project co-led by Microsoft researcher Jaron Lanier, Lee Smolin of the Perimeter Institute for Theoretical Physics, and Stephon Alexander of Brown University.

Responsibilities

Interns put inquiry and theory into practice. Alongside fellow doctoral candidates and some of the world’s best researchers, interns learn, collaborate, and network for life. Interns not only advance their own careers, but they also contribute to exciting research and development strides. During the 12-week internship, students are paired with mentors and expected to collaborate with other interns and researchers, present findings, and contribute to the vibrant life of the community. Research internships are available in all areas of research, and are offered year-round, though they typically begin in the summe

Qualifications

In addition to the qualifications below, you’ll need to submit a minimum of two reference letters for this position. After you submit your application, a request for letters may be sent to your list of references on your behalf. Note that reference letters cannot be requested until after you have submitted your application, and furthermore, that they might not be automatically requested for all candidates. You may wish to alert your letter writers in advance, so they will be ready to submit your letter.

Required Qualifications
Must have at least 1 year of experience in research related to machine learning or closely related topics and physics.”
Must currently be a PhD candidate in math, physics, computer science, or closely related fields
Participation in the Research Internship Program requires that you are physically located in the United States or Canada for the duration of the internship

Preferred Qualifications
Has demonstrated a broad understanding of varied approaches to machine learning in theoretical physics by having been a TA, participated in a review paper, organized meetings or conferences, or similar.
Has been noted for creativity and originality in research.
Is able to self-discipline and function well in physical isolation from collaborators, in light of the likely requirement that work will still be done remotely.

Microsoft is an equal opportunity employer. All qualified applicants will receive consideration for employment without regard to age, ancestry, color, family or medical care leave, gender identity or expression, genetic information, marital status, medical condition, national origin, physical or mental disability, political affiliation, protected veteran status, race, religion, sex (including pregnancy), sexual orientation, or any other characteristic protected by applicable laws, regulations and ordinances. We also consider qualified applicants regardless of criminal histories, consistent with legal requirements. If you need assistance and/or a reasonable accommodation due to a disability during the application or the recruiting process, please send a request via the Accommodation request form.

Benefits/perks listed below may vary depending on the nature of your employment with Microsoft and the country where you work.",https://www.linkedin.com/jobs/view/externalApply/2468024026?url=https%3A%2F%2Fcareers%2Emicrosoft%2Ecom%2Fus%2Fen%2Fjob%2F1006606%2FResearch-Intern-Research-Assistant%3Fjobsource%3Dlinkedin%26utm_source%3Dlinkedin%26utm_medium%3Dlinkedin%26utm_campaign%3Dlinkedin-feed&urlHash=oB_d&refId=3a2f5c14-4e23-46be-880c-aa894b458bd5&trackingId=dIsj6oZ1Z2zR%2BEAGHMbUyw%3D%3D&trk=public_jobs_apply-link-offsite
Research Intern,Adobe,"New York, NY","Our Company

Changing the world through digital experiences is what Adobe’s all about. We give everyone—from emerging artists to global brands—everything they need to design and deliver exceptional digital experiences! We’re passionate about empowering people to create beautiful and powerful images, videos, and apps, and transform how companies interact with customers across every screen.

We’re on a mission to hire the very best and are committed to creating exceptional employee experiences where everyone is respected and has access to equal opportunity. We realize that new ideas can come from everywhere in the organization, and we know the next big idea could be yours!

Our Company

Changing the world through digital experiences is what Adobe’s all about. We give everyone—from emerging artists to global brands—everything they need to design and deliver exceptional digital experiences! We’re passionate about empowering people to create beautiful and powerful images, videos, and apps, and transform how companies interact with customers across every screen.

We’re on a mission to hire the very best and are committed to creating exceptional employee experiences where everyone is respected and has access to equal opportunity. We realize that new ideas can come from everywhere in the organization, and we know the next big idea could be yours!

Adobe Research is looking for forward-thinking minds who are excited about pushing the state of the art in research areas that impact Adobe’s products and future endeavors. Research and Engineering internships for Spring, Summer and Fall of 2021 are now open to applicants pursuing PhD and master's degrees. To protect your health and ours, all internships will be remote.

Working directly with one or more researchers, you will have access to robust computational resources and elite product and design teams, empowering you to see your work touch millions of screens across the globe.

The Opportunity Adobe Research creates new algorithms and interfaces to extract, analyze, model, animate, and render 2D and 3D geometry, material, lighting, and appearance for a variety of applications. Our efforts include new forms of 3D drawing and painting, 3D computational capture and imaging, physical simulation, synthesis and editing of vector graphics, animation and motion design, as well as advanced photorealistic rendering algorithms using machine learning.

Our research labs actively publish in leading journals and conferences, invent new products, and create compelling creative tools. We are especially interested in fostering ongoing collaborations that last beyond the internship and become part of your PhD thesis.

What you will do
Under the direction of an Adobe Research mentor, pursue a research problem that pushes the boundaries of the field
Develop new algorithms, run experiments, and produce demonstration prototypes
Document and present your work, both verbally and in writing
What you will need
Current PhD or master's student in computer science, or related field
Sufficient research skills and background in your chosen subject area",https://www.linkedin.com/jobs/view/externalApply/2427888377?url=https%3A%2F%2Fadobe%2Ewd5%2Emyworkdayjobs%2Ecom%2Fexternal_university%2Fjob%2FSeattle%2FResearch-Intern_R103084%2Fapply%3Fsource%3DLinkedIn&urlHash=uJZC&refId=3a2f5c14-4e23-46be-880c-aa894b458bd5&trackingId=LfPXfnUbFvRXRraUyq97ig%3D%3D&trk=public_jobs_apply-link-offsite
Intern - Research Undergrad 2021,IBM,"New York, NY","Introduction
At IBM, work is more than a job - it's a calling: To build. To design. To code. To consult. To think along with clients and sell. To make markets. To invent. To collaborate. Not just to do something better, but to attempt things you've never thought possible. Are you ready to lead in this new era of technology and solve some of the world's most challenging problems? If so, lets talk.

Your Role and Responsibilities
Start and end dates for this Internship are during Summer 2021 (3 months).

At IBM Research, we invent things that matter to the world. Today, we are pioneering the most promising and disruptive technologies that will transform industries and society, including the future of AI, Blockchain and Quantum Computing. We are driven to discover. With more than 3,000 researchers in 12 labs located across six continents, IBM Research is one of the world’s largest and most influential corporate research labs.

We are seeking candidates with proven interest and experience in implementing innovative software solutions and applications. You will work in close collaboration with other researchers and engineers to create, maintain and support world-class applications and/or infrastructure. You will also deliver production level-code to support the commercialization of the resulting assets. Demonstrated communication skills are essential.

Candidates should have basic knowledge in one or more of the following skills:

Programming skills (C/C++, Java, Python, Javascript, Node.js, etc.)
Software engineering practices including agile techniques
Building cloud applications using APIs and services
System building/debugging/testing skills
Machine learning techniques and machine learning toolkits such as R, scikit-learn, Theano, Caffe, Torch
Programming on GPUs
Scale-out programming (e.g. MPI)

Candidates must be willing to work in any of the following locations: Albany, NY; Almaden, CA; Austin, TX; Cambridge, MA;
Yorktown Heights, NY. Pursuing a Bachelor's degree in Computer Science, Computer Engineering or a related area is required.

The World is Our Laboratory: No matter where discovery takes place, IBM researchers push the boundaries of science, technology and business to make the world work better. IBM Research is a global community of forward-thinkers working towards a common goal: progress.

Required Technical and Professional Expertise
Programming skills (C/C++, Java, Python, Javascript, Node.js, etc.)
Software engineering practices including agile techniques
Building cloud applications using APIs and services
System building/debugging/testing skills

Preferred Technical And Professional Expertise
Machine learning techniques and machine learning toolkits such as R, scikit-learn, Theano, Caffe, Torch
Programming on GPUs
Demonstrated written and verbal communication skills
None

About Business Unit

With more than 3,000 researchers in 12 labs located across six continents, IBM Research brings together hundreds of researchers who possess unparalleled industry expertise to address some of the world's most challenging problems. Join us as we do pioneering work in areas such as cognitive computing, augmented intelligence, quantum computing, and blockchain, to name a few.

Your Life @ IBM
What matters to you when you’re looking for your next career challenge?

Maybe you want to get involved in work that really changes the world? What about somewhere with incredible and diverse career and development opportunities – where you can truly discover your passion? Are you looking for a culture of openness, collaboration and trust – where everyone has a voice? What about all of these? If so, then IBM could be your next career challenge. Join us, not to do something better, but to attempt things you never thought possible.

Impact. Inclusion. Infinite Experiences. Do your best work ever.

About IBM

IBM’s greatest invention is the IBMer. We believe that progress is made through progressive thinking, progressive leadership, progressive policy and progressive action. IBMers believe that the application of intelligence, reason and science can improve business, society and the human condition. Restlessly reinventing since 1911, we are the largest technology and consulting employer in the world, with more than 380,000 IBMers serving clients in 170 countries.

Location Statement
For additional information about location requirements, please discuss with the recruiter following submission of your application.

IBM intends this job to be performed entirely outside of Colorado.

Being You @ IBM
IBM is committed to creating a diverse environment and is proud to be an equal opportunity employer. All qualified applicants will receive consideration for employment without regard to race, color, religion, gender, gender identity or expression, sexual orientation, national origin, genetics, disability, age, or veteran status. IBM is also committed to compliance with all fair employment practices regarding citizenship and immigration status.",https://www.linkedin.com/jobs/view/externalApply/2470841507?url=https%3A%2F%2Fibm%2Econtacthr%2Ecom%2F81922401%3FCodes%3DSN_LinkedIn&urlHash=8V-Z&refId=3a2f5c14-4e23-46be-880c-aa894b458bd5&trackingId=Jb1eS23DehxS%2F%2B0PqDetiQ%3D%3D&trk=public_jobs_apply-link-offsite
Research Intern,Boston Medical Center (BMC),"Boston, MA","Research Intern - Psychiatry

Boston Medical Center (BMC) is more than a hospital. It's a network of support and care that touches the lives of hundreds of thousands of people in need each year. It is the largest and busiest provider of trauma and emergency services in New England. Emphasizing community-based care, BMC is committed to providing consistently excellent and accessible health services to all-and is the largest safety-net hospital in New England. The hospital is also the primary teaching affiliate of the nationally ranked Boston University School of Medicine (BUSM) and a founding partner of Boston HealthNet - an integrated health care delivery systems that includes many community health centers. Join BMC today and help us achieve our Vision 2030 which is a long-term goal to make Boston the healthiest urban population in the world.

Position: Research Intern

Department: Psychiatry

Schedule: Per Diem, Part Time, Day,

Position Summary

Under the general supervision of the department director or manager, provides analytical and administrative assistance to the BEST Partnership for Behavioral Health, Racial, and Social Justice. Responsible for participating in project meetings as necessary, data collection & analysis, and other duties as necessary to support the successful completion of project / initiative work. Duties may vary based on the department's need but may include projects such as updating content on the website, updating and maintaining databases and links, and providing general support to the department. Must learn and understand the basic principles and methods used in the department, always following established protocols.

Essential Responsibilities / Duties
Duties may include some or more of the following:
Recruit subjects to participate in studies by using approved methodologies, such as reviewing EMRs, contacting healthcare providers for referrals, using approved advertisements, posters, flyers, etc.
Screen and enroll study participants, including educating participants about the research protocol, informing participants of the rights and responsibilities, and obtaining informed consent.
Schedule and confirm appointments and ensure participants are prepared for the study visits.
Conduct telephone or in-person interviews to complete questionnaires, as needed.
Make notations of participant contact information and other relevant data to optimize care and retention.
Provide general clerical support, such as handling forms, preparing study materials, researching information, scheduling meetings, filing, faxing, and photocopying.
Adhere to legal, professional and ethical codes with respect to confidentiality and privacy. Responsible for obtaining and maintaining all study certifications, including Human Subjects Certification and Good Clinical Practice.
Participates in special projects, as assigned.
Must adhere to all of BMC's RESPECT behavioral standards.

Education

Recent college graduate or student enrolled in a related graduate or undergraduate degree program, preferably beyond a second semester junior.

Experience

Research experience preferred but not required.

Knowledge And Skills
Must have the ability to perform multiple tasks and prioritize duties
Ability to work independently
Must possess excellent interpersonal, verbal and written communication skills
Must have an interest in performing new and varied work assignments, and be flexible with regard to work assignments
Extensive knowledge of Microsoft Excel, Access, PowerPoint and Word is required. Knowledge or ability to learn Minitab.
Must have the ability to maintain confidentiality
Req id: 18452",https://www.linkedin.com/jobs/view/externalApply/2497849669?url=https%3A%2F%2Fjobs%2Ebmc%2Eorg%2Fjobs%2F18452%2Fbmcrms%2Fboston%2Fresearch%2Fresearch-intern%2F%3Futm_source%3DLinkedIn&urlHash=iHPj&refId=3a2f5c14-4e23-46be-880c-aa894b458bd5&trackingId=0RzwEvTX%2Fr6Jp07cUDRXrw%3D%3D&trk=public_jobs_apply-link-offsite
Research Scientist Intern-Talent Assessment,Amazon,"Seattle, WA","Description

Do you enjoy working in an entrepreneurial environment solving complex problems and delivering innovative assessment solutions? Does the challenge of solving hard, complex problems alongside smart, fun applied scientists sound like the perfect way to spend your summer?

Amazon is currently recruiting for a 3-month summer internship on our Talent Assessment team. You will work closely with teams across Amazon to assist in the development of innovative assessment strategies for selection. You will work with I-O psychology staff and business leaders to perform job analyses, competency modeling, assessment development activities and assessment validation. Successful candidates will have experience in assessment development and statistical analysis, be detail-driven, and have excellent problem-solving abilities.

You Will
Be responsible for all aspects of one major project with mentorship from a Talent Assessment team member; you will also contribute to additional projects and research
Interact with senior-level project sponsors and multiple business teams
Conduct job analysis activities including focus groups and survey development and analysis
Conduct statistical analysis including descriptive statistics, validation analyses and adverse impact analysis
Develop assessment content with subject matter experts
Analyze complex datasets and write reports of study results; Effectively communicate results to stakeholders
Provide project management support including scheduling and conducting meetings, coordinating focus groups, and managing project timelines
Maintain and update various databases

Basic Qualifications
Experience investigating the feasibility of applying scientific principals and concepts to business problems and products
MS degree with at least 1 year of research experience in a quantitative field or PHD in a quantitative field
Master’s degree in Industrial-Organizational Psychology or related field; To be eligible you must be currently enrolled in an accredited doctoral degree program in Industrial-Organizational Psychology or related field.
Relevant experience in applied selection practices, research, or talent acquisition strategies
Experience in the selection assessment development cycle: job analysis, content creation, validation, and/or scoring
Proficiency in at least one statistics program (SPSS, R, SAS, etc)
Preferred Qualifications
Proficiency and experience in applying machine learning and natural language processing techniques to solve I-O problems
Previous work experience in recruiting or assessment strategies
Excellent written and oral communication skills
Quantitative analytical abilities
Proven problem-solving skills
Strong organizational skills
Amazon is committed to a diverse and inclusive workforce. Amazon is an equal opportunity employer and does not discriminate on the basis of race, ethnicity, gender, gender identity, sexual orientation, protected veteran status, disability, age, or other legally protected status. For individuals with disabilities who would like to request an accommodation, please visit https://www.amazon.jobs/en/disability/us.


Company - Amazon.com Services LLC
Job ID: A1341188",https://www.linkedin.com/jobs/view/externalApply/2473921255?url=https%3A%2F%2Fwww%2Eamazon%2Ejobs%2Fjobs%2F1341188%2Fresearch-scientist-intern-talent-assessment%3Fcmpid%3DSPLICX0248M%26utm_source%3Dlinkedin%2Ecom%26utm_campaign%3Dcxro%26utm_medium%3Dsocial_media%26utm_content%3Djob_posting%26ss%3Dpaid&urlHash=A190&refId=3a2f5c14-4e23-46be-880c-aa894b458bd5&trackingId=ec47as4EN9W%2FiZ7%2F%2FskMcg%3D%3D&trk=public_jobs_apply-link-offsite
