title,company,location,requirements,link
Equity Research Intern,Ariel Investments,"New York, NY","Ariel Investments is a premier, boutique, asset management firm. Our primary goal is to drive exceptional investment returns by bringing diverse perspectives together. The only way to beat a benchmark is to not look like one. As value investors, our thinking is deliberate and unconventional. We offer an independent, patient investing approach and aim to deliver excellence in any environment. We uphold our fiduciary responsibility to every shareholder, no matter how big or small.

At Ariel, we strongly believe that teamwork yields results—which is why we have Co-CEOs. John Rogers and Mellody Hobson share a desire to cultivate leaders who are curious, focused and disciplined. We are nimble and efficient. Our drive is fanatical and intentional. Everyone plays their position and each contribution is critical to our firm's success. We seek subject matter experts who are unapologetically themselves. We encourage our employees to reach their full potential and we give them the runway to do so.

After nearly four decades of active investing, we remain committed to our clients, our teammates and our community. We strive to be best-in-class investors and pioneer a path for those who entrust us with their financial future.

The international and global team located in New York City is made up of a group of non-consensus intrinsic value oriented investment professionals. We offer an independent, patient investing approach and aim to deliver excellence in any environment.

Ariel celebrates diversity and practices inclusion as a way to get work done – it's in our DNA. As an equal opportunity employer, our employment decisions are based on business needs, job requirements and individual qualifications without regard to race, color, religion, age, sex (including pregnancy), sexual orientation, gender identity, national origin, ancestry, marital status, parental status, mental or physical disability, military or veteran status, or any other basis protected by federal, state, or local law. Ariel is committed to recruiting and retaining talented applicants, and to providing all employees with a workplace free from discrimination and/or harassment.

We are looking for an equity research intern to work with our global equities team based in New York City. Due to Covid-19 restrictions, the internship is expected to occur remotely until further notice but no sooner than local restrictions allow. The duration of this internship is expected to last 3 months, but based on business needs, performance, and personal conduct it can be extended further

This internship is an excellent opportunity for first year MBA students or recent MBA graduates who are looking to develop skills in conducting deep and differentiated fundamental research alongside a small, high-performing team of experienced and talented investment professionals using a well-established and institutionally oriented intrinsic value investment process with a long-term investment horizon.

Responsibilities Will Include
Conducting industry studies, competitive benchmarking, and fundamental analyses of companies globally.
Analyzing business strategy, industry structure, financial metrics, and evaluating other relevant information for companies.
Detailed bottom up financial modeling including TAM analysis, revenue segments, IS/BS/CF statements, DCF and multiples-based analysis.
Compiling and/or presenting qualitative and quantitative analyses and insights.
Executing research related projects at the request of the Portfolio Manager and/or Director of Research.


Experience
First year MBA students or recent MBA graduates (0-1 years) with strong academic credentials from leading MBA (or equivalent) programs, preferably with pre-MBA experience.
Prior experience working in international developed or developing markets is highly desirable, but not required.
Ability to identify factors such as competitive advantage, strategic inflection points or disruptive developments as well as the ability to synthesize and articulate these fundamental characteristics both qualitatively in a thesis write-up and quantitatively in a detailed financial/valuation model.
The role will involve significant bottom-up financial modeling and prior experience in financial modeling in excel is highly desirable. Experience with one or more programming languages (VBA, Python etc.) is also desirable.
Strong understanding of accounting and valuation concepts, preferably with advanced graduate level course work in accounting and valuation (or equivalent work experience).
Effective oral and written communication skills to comprehensively yet succinctly articulate research findings and investment theses.
Ability to work remotely in a digital and paperless environment with minimal supervision.

Education
Bachelor or Master's degree
MBA and/or CFA preferred
Proficient in MS Word, Excel, PowerPoint

Be sure to include whether you currently hold an Optional Practical Training Card (""OPT""), and if you are eligible for extension of your OPT, in your resume and cover letter. In the cover letter, please summarize your experiences and expertise that highlight the ways in which you meet the qualifications for this role.

Ariel celebrates diversity and practices inclusion as a way to get work done – it's in our DNA. As an equal opportunity employer, our employment decisions are based on business needs, job requirements and individual qualifications without regard to race, color, religion, age, sex (including pregnancy), sexual orientation, gender identity, national origin, ancestry, marital status, parental status, mental or physical disability, military or veteran status, or any other basis protected by federal, state, or local law. Ariel is committed to recruiting and retaining talented applicants, and to providing all employees with a workplace free from discrimination and/or harassment.",https://www.linkedin.com/jobs/view/externalApply/2483783602?url=https%3A%2F%2Fgrnh%2Ese%2F1fdc99ad3us&urlHash=Oejh&refId=5d4a0e17-1ff2-4b6a-b673-385629ee04e3&trackingId=SXe0Qkuqehn7ZLrtnGrNLw%3D%3D&trk=public_jobs_apply-link-offsite
Research Intern (National Journal),The Atlantic,"Washington, DC","National Journal is a premier research and insights company committed to helping organizations effectively navigate Washington. Best known as one of Washington’s most trusted media brands for nearly 50 years, our expertise is unmatched with teams of specialists dedicated to government affairs, communications, and political research, in addition to exceptional journalism. Our mission is to equip the thousands of government and business leaders in the nation’s capital with the intelligence, insights, and connections they need to save time, increase efficiency, and deliver success.

National Journal is looking for dynamic researchers to help build its Vignette research platform

What is Vignette?

We are Washington’s go-to resource for research on the most influential people in policy and politics, producing content exclusively for senior public policy practitioners and government affairs executives. Our diverse membership includes policy practitioners and senior professionals from the world’s leading companies, nonprofits, and associations.

Vignette serves as an unparalleled repository of knowledge and insight on the people shaping policy discussions and political discourse and serves thousands of professionals across Washington. The team building the product researches the most influential individuals, from public officials to policy professionals, researchers, advocates, media voices, and beyond. Using this baseline knowledge and our expertise, we also create content tailored to members’ needs, delivering customized profiles, executive briefings, and programming to top tier Washington advocates.

Intern Characteristics
You are excited about helping National Journal continue to build its newest offering and contributing to a new product model
You are a meticulous researcher and apply a high level of analytic rigor to all phases of work
You know when to shift gears, balancing deep dives into data exploration and distilling the information gathered to produce actionable insights
You listen and quickly adapt when requirements change, exhibiting a willingness to go above and beyond in service to others
You are a policy wonk or politics guru and while you may be deep on one topic, you are conversant and knowledgeable across a diverse range of subjects

Intern Responsibilities
Conducts intensive and thorough research on the people shaping policy and politics at the federal and state level
Synthesizes and analyzes qualitative data into a professional product, contextualizing and interpreting findings to provide a holistic and nuanced characterization of an individual

Qualifications Of The Ideal Candidate
Experience conducting qualitative research; an excellent academic record
Meticulous researcher with unflagging commitment to objective, thorough work
Ability to distill large amounts of information into concise summaries and takeaways
Excellent time management and judgment
Interest in public policy and politics, with an appetite for unpacking diverse or niche policy topics
Atlantic Media, Inc. and its affiliates (""Atlantic Media"") are Equal Opportunity Employers. We do not discriminate against our applicants because of race, color, religion, sex (including gender identity, sexual orientation, and pregnancy), national origin, age, disability, veteran status, genetic information, or any other status protected by applicable law.",https://www.linkedin.com/jobs/view/externalApply/2394845293?url=https%3A%2F%2Fatlanticmedia%2Ewd1%2Emyworkdayjobs%2Ecom%2Fen-US%2FCareers%2Fjob%2FWashington-DC%2FResearch-Intern--National-Journal-_R125&urlHash=RTIB&refId=5d4a0e17-1ff2-4b6a-b673-385629ee04e3&trackingId=1%2FXEabw3R6II0KQhCiM9IA%3D%3D&trk=public_jobs_apply-link-offsite
"Research Intern, Multimodal Machine Learning",Deliberate AI,"New York, NY","At Deliberate, we are building technology that brings more objectivity and precision to the diagnosis and monitoring of mental well-being. We leverage the predictive capability of modern inference models, coupled with thoughtfully acquired and expertly annotated datasets, to reduce subjectivity in psychotherapy and psychiatry.

By joining us, you will help with R&D that brings a level of precision to mental health that is more on par with that seen in other medical areas.

We look for technically skilled individuals who are just as thoughtful about the domain to which they apply their knowledge. Scientists and engineers who realize the power of the tools they deal with, seeking to have a positive impact while at the same time working to mitigate biases and unintended consequences.

We value the unique perspectives provided by individuals with diverse backgrounds and are committed to hiring without bias against age, race, gender, disability, religion, sexual orientation, military service, or other protected status. We strongly encourage minorities, women, individuals with disabilities or other protected status to apply.

The role

In this role, the research intern will develop machine learning regression models based on multiple input modalities — primarily audio and video, but potentially text and others, such as physiological signals. The intern will be advised by and collaborate with an experienced team of applied machine learning scientists and clinicians “in the field,” pursuing all aspects of a designated research project, from literature review, to development strategy and model implementation, to statistical comparison between methods, to report/paper writing.

Must-have
Prior experience developing ML models from scratch using PyTorch and/or TensorFlow/Keras, preferably related to regression problems on sequential inputs.
Experience with the Python Data Science stack (scikit-learn, numpy, etc).
Pursuing a degree (undergrad, masters, PhD) in ML, Data Science, or related area.
Nice-to-have
Prior work on feature extraction from audio and video — e.g. spectrogram, MFCC, pitch, facial features, action units.
Peer-reviewed publication(s) in ML, Data Science, or related area.
Software development maturity in Unix-like, GPU-powered environments.
The internship can be done remotely. The position is available immediately, for the duration of 3 months.

About Us

Our team

Deliberate is an early stage, venture-backed, technology startup still operating largely in stealth mode. We believe in the power of diverse teams; not in superheroes. Our team contains a mix of clinical, data science, research and business skills and hails from Latin America, Europe and the US. Most of us have current or past affiliations with leading institutions including Stanford GSB, Stanford CS, Harvard Medical School, Carnegie Mellon CS, Oxford University and Google AI.

Our mission

We provide objective measurement for behavioral and mental health, serving both healthcare providers and clinical trials. Disorder classification and the subjectivity of their assessment are cornerstone problems in behavioral and mental health, which require solutions urgently. Behavioral health problems are highly prevalent and continue to rise, especially during COVID, with at least 1 in 5 people dealing with some kind of mental health problem. Deliberate exists to identify and improve the condition of affected individuals, and reduce the enormous burden that mental health problems place on society.

Our approach to work and compensation

Deliberate provides competitive compensation and excellent benefits. We believe that a hybrid working model is foundational to both team and individual performance and wellbeing. We are remote-friendly with sufficient time spent in the office to build strong relationship with your colleagues.",https://www.linkedin.com/jobs/view/externalApply/2497424944?url=https%3A%2F%2Fjobs%2Elever%2Eco%2FDeliberateSolutions%2Ffc218a81-317e-43f3-8e2a-221d8ae555b1%2Fapply%3Flever-source%3DLinkedIn&urlHash=hjfK&refId=5d4a0e17-1ff2-4b6a-b673-385629ee04e3&trackingId=sL95ivWyyAJy3GsjOW4XEA%3D%3D&trk=public_jobs_apply-link-offsite
Research Interns – Summer 2021,"Voloridge Investment Management, LLC","Jupiter, FL","Voloridge Investment Management implements bleeding edge machine learning techniques to solve the extremely challenging problems of modeling and predicting financial markets. We build predictive models using propriety software as well as open source tools, which we use to drive and execute trade decisions. We are seeking enthusiastic, mathematically gifted, intellectually curious, highly analytical and detail-oriented students to work collaboratively with data scientists to analyze and build data pipelines to meet the Voloridge mission of delivering superior risk-adjusted returns using proprietary modeling techniques.

Summary Of Job Functions
Analyzing real-world datasets using the latest in statistical and machine-learning techniques
Collecting and cleaning unconventional datasets
Work on projects that could lead to large impacts
Present findings to a large group of researchers

Required Skills
Exceptional aptitude in Math and Statistics
Extremely detail-oriented and self-motivated
Highly curious with a deep problem-solving attitude
Proficiency with at least one programming language

Additional Information

Voloridge Investment Management is an SEC registered investment advisor. A private investment company founded in 2009, our mission is to deliver superior risk-adjusted returns for qualified investors, using advanced proprietary modeling technology, conservative investment tactics and sophisticated risk management.

Voloridge Investment Management is an Equal Opportunity Employer. All qualified applicants are encouraged to apply and will receive consideration for employment without regard to race, color, religion, sex, sexual orientation, gender identity, national origin, disability, protected veteran status, or any other legally protected characteristic or status.",https://www.linkedin.com/jobs/view/externalApply/2476690750?url=https%3A%2F%2Fht-jobs%2Enet%2F399j3z6%3Fs%3Dlif&urlHash=1Lzc&refId=5d4a0e17-1ff2-4b6a-b673-385629ee04e3&trackingId=HVLDQKUeQZg%2F0sLANf3XqQ%3D%3D&trk=public_jobs_apply-link-offsite
Research Intern,Jones Lang LaSalle,"New York, NY","About JLL -

We're JLL-a leading professional services and investment management firm specializing in real estate. We shape the future of real estate for a better world by using the most advanced technology to create rewarding opportunities, amazing spaces and sustainable real estate solutions for our clients, our people and our communities. As a Fortune 500 company, we help real estate owners, occupiers and investors achieve their business ambitions. We have nearly 300 corporate offices across 80 countries, with a team of more than 93,000 individuals and believe a diverse and inclusive culture is one where everyone succeeds. That's why we're committed to creating an environment where we all feel welcomed, valued and empowered to achieve our full potential.
With us, you'll have a chance to innovate with the world's leading businesses, put that expertise into action on landmark projects, and work on game-changing real estate initiatives. You'll also make long-lasting professional connections and be inspired by the best. We're focused on opportunity and want to help you make the most of yours. Achieve your ambitions-join us at JLL.
What this job involves

Summer Intern, Research - New York / Tri-State Market

Take the opportunity to start your career early in the commercial real estate field! Spend time learning what it's like to work in the fast-paced, entrepreneurial, team-oriented environment at JLL.

Interns are an important part of what makes JLL a great place to work. Within our program, interns are an integral part of our team working alongside real estate analysts, transaction professionals and other associates. You will gain valuable insight into the commercial real estate industry while being exposed to multiple lines of business over the course of your internship.

JLL is looking for qualified interns to join our 2021 summer internship program. The ideal candidate should be prepared to work in a fast-paced team environment and will finish the internship having gained broad experience in various aspects of Commercial Real Estate.

The Research Intern will work collaborate with analysts to support ad-hoc projects such as researching economic trends as well as support the salesforce with requests from clients such as employment statistics, market trends, demographics and property intel. Successful candidates are passionate about what drives their city, economics and commercial real estate.

Program Details

Beginning June 2021
Length of program runs 8-10 weeks
Full time (40 hours per week)
Located in New York City, NY

Qualifications

Current undergraduate students majoring in: Real Estate, Urban Planning, Economics, Finance, Business Administration, or a related field
Desire to work in the Commercial Real Estate industry
Rising seniors and 2021 graduates highly preferred

Skills & Abilities

Highly energetic with ability to work independently and with minimal direction
Must be outgoing and can connect with individuals on the phone
Written and verbal communicative skills
Detail-oriented, highly organized and creative
Proven record of providing excellent customer service
Ability to develop and maintain positive customer relationships
Comfortable presenting ideas and solutions to leadership and key stakeholders
Strong financial and analytical skills
General business experience

Technical Qualifications

Strong analytical skills interest in analyzing data
Strong excel skills
Customer service mindset
Able to think critically and problem solve
Strong written and oral communication skills
Strong knowledge of PC, Windows, Internet applications, Microsoft Word, Excel and PowerPoint a must
Adept at learning new programs. Position may require one to learn a variety of real estate related software applications

Please only apply to one internship posting.

About JLL Research

JLL Rese",https://www.linkedin.com/jobs/view/externalApply/2470212261?url=https%3A%2F%2Fde%2Ejobsyn%2Eorg%2F2bfd8e55e8e644acb06fccf6280eb5cc5073&urlHash=5tI_&refId=5d4a0e17-1ff2-4b6a-b673-385629ee04e3&trackingId=5j6oovnogzlJLsYzaA9uZQ%3D%3D&trk=public_jobs_apply-link-offsite
Intern: Data Science,Biogen,"Cambridge, MA","Job Description

This is for a 12-week internship position from June – August 2021.

Biogen is looking for an intern to join our Data Science team in the Global Customer Data and Analytics Center of Excellence. As a member of the Data Science team, the intern will be tasked with weaving data together from across Biogen to help answer some of our biggest commercial questions. Utilizing the intern's business knowledge, the intern will help move the company forward in our use of data and advanced applications of emerging technologies.

The intern will be working directly with teams across our Commercial organization, including but not limited to Market Research, Patient Services, Promotional Effectiveness, Digital Excellence and many others at a global and local level. The intern will work with these teams on some of our most complex questions in the organization.

An Ideal Candidate Will Exhibit The Following
An exceptional team player and communicator who is able to remain productive and focused in a global, team-oriented, fast-paced environment
An exceptional analytical thinker who is able to help organize and develop models to drive business initiatives
Comfortable with deep involvement with problem definition, data exploration, data acquisition and visualization, evaluating and comparing metrics, deploying various models and iteratively improving solutions
Able to communicate clearly and exceptionally about complex analytical tasks by producing concise and easily consumable presentations
Excited about developing continuous improvements to push the organization towards new and improved ways to use data to improve business processes.
Able to look for opportunities proactively to improve the business, outside of the specific questions asked

Qualifications

To participate in the Biogen Intern Program, students must meet the following eligibility criteria:
Legal authorization to work in the U.S.
Grade point average of 3.2 or higher preferred
At least 18 years of age prior to the scheduled start date
Be currently enrolled in an accredited college or university

Additional Qualifications
Strong analytical skills for effective problem solving.
Experience with at least one Data Science languages (Python, R, etc.)
Exceptional quantitative, statistical and computational skills
A documented track record of continuous learning and improvement
Ability to generate models that tell a story from complicated data
Strong communication and the ability to clearly convey information both within the group and to external groups
Experience and understanding of Machine Learning techniques
Working knowledge of Relational Databases
Education

Bachelors or Masters student with an analytics or data science background (such as computer science, engineering, or analytical science).

Additional Information

All your information will be kept confidential according to EEO guidelines.",https://www.linkedin.com/jobs/view/externalApply/2494080340?url=https%3A%2F%2Fjobs%2Esmartrecruiters%2Ecom%2FBiogen%2F743999741899743-intern-data-science%3Ftrid%3D2d92f286-613b-4daf-9dfa-6340ffbecf73&urlHash=KnFh&refId=5d4a0e17-1ff2-4b6a-b673-385629ee04e3&trackingId=OSDmW7jvbuGOabCbjgyBSQ%3D%3D&trk=public_jobs_apply-link-offsite
