title,company,location,requirements,link
"Intern, Merchant Strategy, Summer FIS University Program 2021",FIS,"Denver, CO","Position Type

Full time

Type Of Hire

Associate Development Program (Internship)

Education Desired

High School Diploma

Travel Percentage

0%

Job Description

Are you curious, motivated, and forward-thinking? At FIS you’ll have the opportunity to work on some of the most challenging and relevant issues in financial services and technology. Our talented people empower us, and we believe in being part of a team that is open, collaborative, entrepreneurial, passionate and above all fun.

Join the 2021 FIS University Summer Internship Program!

As a 2021 FIS University Program Summer Intern, you will have the opportunity to participate in team projects, community service activities, social events, professional development seminars and work alongside team mentors. This is a full time (40hrs/week) paid internship that will begin on June 7, 2021 and conclude on August 13, 2021.

About The Team

You will be a vital member of our internal consulting team within the Merchant Strategy Group in FIS’ beautiful Denver, CO office. Our Merchant Strategy team is responsible for crafting the overall strategic direction of FIS’ multi-billion dollar payment processing business. The Merchant Strategy team works with our various revenue-generating functions to identify opportunities for sustained growth over a medium-term time horizon. In addition to supporting our line of business partners, the Strategy team also serves as a key leader in advancing the business’ M&A and competitive alliance activities.

What You Will Be Doing

Interns going through the program will leave the summer with a strong foundational skillset in consulting-related data analytics techniques, presentation formation, executive communication, and project management. You will do the following:
Diagnose & evaluate complex business problems using a hypothesis-driven framework
Effectively interview key stakeholders to unearth vital information necessary to execute on projects
Leverage key stakeholders to perform analysis & solve key business problems
Offer recommendations for problem improvement & prepare presentations to share findings
Work w/ stakeholders and leaders on developing an action/implementation plan
Present your overall findings and project learnings to senior leaders within the FIS Merchant Solutions team

What You Bring
Rising Senior (graduating December 2021 through May 2022)
Proficiency in Microsoft Office Suite
Self-motivated and willingness to learn
Excellent communication and interpersonal skills
Strong Excel & PowerPoint skills
Preferred: comfort w/ using advanced analytics tools such as Tableau & Alteryx

What We Offer You
Competitive full-time paid summer internship
Opportunity to participate in projects that directly impact business value
The chance to work on some of the most challenging, relevant issues in financial services & technology
Time to support charities and give back in your community
A work environment built on collaboration, flexibility and respect

Current and future sponsorship are not available for this position**
View our benefits here: https://cdn.phenompeople.com/CareerConnectResources/FIGLUS/documents/2021BenefitsSnapshot-1611561721803.pdf The posted salary range describes the minimum to maximum range for this job description in the state of Colorado. The salary range is posted in accordance with the Colorado Equal Pay For Equal Work Act. The salary range for this same position may be lower or higher in markets outside of Colorado.$14 - 22

Privacy Statement

FIS is committed to protecting the privacy and security of all personal information that we process in order to provide services to our clients. For specific information on how FIS protects personal information online, please see the Online Privacy Notice.

EEOC Statement

FIS is an equal opportunity employer. We evaluate qualified applicants without regard to race, color, religion, sex, sexual orientation, gender identity, marital status, genetic information, national origin, disability, veteran status, and other protected characteristics. The EEO is the Law poster is available here supplement document available here

For positions located in the US, the following conditions apply. If you are made a conditional offer of employment, you will be required to undergo a drug test. ADA Disclaimer: In developing this job description care was taken to include all competencies needed to successfully perform in this position. However, for Americans with Disabilities Act (ADA) purposes, the essential functions of the job may or may not have been described for purposes of ADA reasonable accommodation. All reasonable accommodation requests will be reviewed and evaluated on a case-by-case basis.

Sourcing Model

Recruitment at FIS works primarily on a direct sourcing model; a relatively small portion of our hiring is through recruitment agencies. FIS does not accept resumes from recruitment agencies which are not on the preferred supplier list and is not responsible for any related fees for resumes submitted to job postings, our employees, or any other part of our company.

#pridepass",https://www.linkedin.com/jobs/view/externalApply/2439685492?url=https%3A%2F%2Fcareers%2Efisglobal%2Ecom%2Fus%2Fen%2Fjob%2FFIGLUSJR0133171EXTERNAL%2FIntern-Merchant-Strategy-Summer-FIS-University-Program-2021%3Futm_source%3Dlinkedin%26utm_medium%3Dphenom-feeds&urlHash=XNbU&refId=607ecde4-6e20-4d90-b570-2def4c9451e4&trackingId=ssP4OYnfHKD8%2F%2BeIiVqc0A%3D%3D&trk=public_jobs_apply-link-offsite
PT JR. SALES ASSOCIATE INTERN-Tapes,"Berry Global, Inc.","Charlotte, NC","Overview

Berry Global , headquartered in Evansville, Indiana, is committed to its mission of ‘Always Advancing to Protect What’s Important.’ With $13 billion in revenue for fiscal year 2019 on a combined pro forma basis from operations, Berry is a leading global supplier of a broad range of innovative nonwoven, flexible, and rigid products used every day within consumer and industrial end markets. Berry operates over 290 manufacturing facilities worldwide, on six continents, and employs over 48,000 individuals.

At Berry, we pursue excellence in all that we do and are always advancing to improve the way we work along with the products and services we provide. Our culture fosters trust and partnerships through appreciation, acknowledgement, and inclusion. At Berry, we are continuously improving to support our mission and exemplify our values of partnerships, excellence, growth, and safety. To learn more about Berry, visit berryglobal.com.

Responsibilities
Compilation of comprehensive ACTIVE customer database – account name, primary contact, phone, email, address by segment – which could be maintained going forward. Needed for customer communications (business updates, price notifications, marketing communications).
Sales Analysis – Retail deep dive into POS data supplied by The Home Depot. Analysis by product, region, time frame looking for trends.
Sales Analysis – Industrial Tapes Territory and customer sales data analysis looking for trends in regions, brands, market segments, product types.
Intern will perform detailed sales analysis of our Industrial tapes and retail segments to uncover trends in product, brand, market, and regional purchasing over the past 3-5 years and will be able to present their findings and conclusions.
Industrial Tapes – provide a detailed territory analysis by sales rep showing sales trends by top customer, brand, and product type
Retail – provide detailed THD POS analysis by product, season, and region

Qualifications
Shows initiative and learning curiosity.
Works well within teams across functions.
Excellent oral and written communication skills.
Excellent problem solving aptitude.
Safe work habits.
Strong personal accountability to achieve goals.
Enrolled in a BS/MS degree program in Business/Business Analytics/Business Administration/Marketing",https://www.linkedin.com/jobs/view/externalApply/2492164559?url=https%3A%2F%2Fcareers-berryglobal%2Eicims%2Ecom%2Fjobs%2F9302%2Fpt-jr%2E-sales-associate-intern-tapes%2Fjob%3Fhub%3D10%26in_iframe%3D1&urlHash=nasf&refId=607ecde4-6e20-4d90-b570-2def4c9451e4&trackingId=rFpU%2ByDEivQO7FBBbrl7dQ%3D%3D&trk=public_jobs_apply-link-offsite
Merchant Success Analyst Intern,Sezzle,"Minneapolis, MN","About The Role

The Merchant Success Analyst Intern will help support the team’s data needs, while also communicating with and supporting merchant partners when necessary. They will be responsible for fulfilling data requests from account managers through creating dashboards, pulling, analyzing, and interpreting data.

Additionally, they will be expected to utilize their findings to help create curated outreach plans to optimally communicate with merchants and improve team metrics. This can also extend to being directly involved with merchant outreach. In order to properly support the team, you are expected to work over 20 hours per week, and up to 40 hours.

About Sezzle

Sezzle is a cutting-edge fintech company whose mission is to financially empower the next generation. Only one in three millennials own a credit card, and the vast majority of millennials possess a subprime credit score or no score at all. To address these problems, Sezzle has built a payment platform that increases purchasing power for consumers by offering interest-free installment plans at online stores.

What Makes Working at Sezzle Awesome?

At Sezzle, we are more than just brilliant engineers, passionate data enthusiasts, out-of-the-box thinkers, and determined innovators; we are skilled musicians, yogis, cyclists, chefs, golfers, dog-lovers, and rock-climbers. We believe in surrounding ourselves with not only the best and the brightest individuals, but those that are unique and purpose-driven in all that they do. Our culture is not defined by a certain set of perks designed to give the illusion of the traditional startup culture, but rather, it is the visible example living in every employee that we hire.

Responsibilities
Fulfill team requests by compiling data and helping teammates understand and use information properly
Identify trends by analyzing merchant data
Perform weekly audits to ensure data accuracy and upkeep of data hygiene
Assist with daily and long-term data hygiene initiatives using Salesforce, Salesloft, and other CRM based tools to ensure merchant account information and data is accurately updated
Build out customized dashboards


Minimum Requirements
Background in statistics, math, or related quantitative discipline
Proven experience in:
Analyzing data and using database query language (e.g. SQL, etc)
Data processing and analytics tools such as R/ Python/ SAS.
Attention to detail and ability to multitask
Excellent problem-solving and analytical skills
Strong communication and rapport building ability- comfortable sending clear emails
Ability and desire to work in a team
Salesforce experience preferred


About You
A+ character. We are team-first here at Sezzle.
A hard-working mentality. It’s early and there is still a lot to build.
An excellent communicator.
Ownership. You aren’t afraid to take on new responsibilities and you act like an owner in everything you do.
A fun attitude. Life’s too short. We can have fun while we work hard on cool things.
Smarts. We need people that are smart enough to make decisions on their own and also smart enough to know when they need input from others.


Perks & Benefits
Competitive salary
Collaborative fun workspace
The opportunity to join Minneapolis’s fastest growing startup alongside a team of motivated and driven individuals

Sezzle provides equal employment opportunities (EEO) to all employees and applicants for employment without regard to race, color, religion, creed, gender, sex (including pregnancy, childbirth, and related medical conditions), sexual orientation, gender identity, national origin, age, disability, genetic information or characteristics, marital status, familial status, veteran or military status, status regarding public assistance, membership or activity in a local commission, or any other protected status in accordance with applicable federal, state and local laws.",https://www.linkedin.com/jobs/view/externalApply/2479118643?url=https%3A%2F%2Frecruiting2%2Eultipro%2Ecom%2FSEZ1000SEZZ%2FJobBoard%2F0ac45433-f40b-41a0-8347-6cd9efa88dfd%2F%2FOpportunityDetail%3FopportunityId%3D39b74337-7dad-4681-90e0-5b759383004d%26utm_source%3DLINKEDIN%26utm_medium%3Dreferrer&urlHash=B25P&refId=607ecde4-6e20-4d90-b570-2def4c9451e4&trackingId=h5cSJqp9n%2FLYOJ%2BxVvaz5w%3D%3D&trk=public_jobs_apply-link-offsite
