title,company,location,requirements,link
Embedded Engineer Intern,Sloan,"Andover, MA","Req ID: 8377

Sloan is the world’s leading manufacturer of commercial plumbing systems and has been in operation since 1906. We are at the forefront of the green building movement and provide sustainable restroom solutions. We manufacture water-efficient products including flush valves, electronic faucets, soap dispensing and sink systems along with vitreous china fixtures for commercial, industrial and institutional markets worldwide.

Sloan is looking for an Embedded Engineer Intern to join our Andover, MA office for the summer. The intern will learn microcontroller base embedded hardware and firmware design for Sloan sensor product testers.

Responsibilities
Thermal sensor array data processing for occupancy detection ---Thermal image data collection and processing
Optical noise tester --- wide band optic light generation and measurement
True feedback Flushometer bathroom test platform --- People activity analysis and auto report generation
True feedback cycle tester --- Sloan sensor reliability testing and auto report generation
Over air bootloader system (option)---IoT firmware update tool


Requirements
Pursuing at least a Bachelor’s Degree in Electrical or Computer Engineering
Knowledge with Altium software
Knowledge with analog and digital circuit
Knowledge with Microcontroller
Programming language C, C++, Python

We offer a highly competitive compensation and benefits package, including:
Medical, dental, vision, Rx coverage for employee plus eligible dependents
Life and AD & D insurance, dependent life insurance, long term disability, and HSA, FSA
Employer matching 401K, PTO, holidays, EAP, wellness programs, on-site medical staff and fitness center


We Are Proud Partners With The Chicago Cubs

We are a Legacy Partner of the Chicago Cubs and we are proud to be the organization’s official water efficiency partner! Through this relationship, which includes the naming rights to Sloan Park, the Cubs’ Spring Training facility in Mesa, Arizona, we have had the opportunity to promote our brand and continue our water conservation efforts in the city of Chicago and around the world

JOIN AN INDUSTRY LEADER!

For additional company information please visit our website at www.sloan.com .

We Are An Equal Opportunity Employer.",https://www.linkedin.com/jobs/view/externalApply/2443037574?url=https%3A%2F%2Fjobs%2Esloan%2Ecom%2Fjob%2FAndover-Embedded-Engineer-Intern-MA-01810%2F718849500%2F%3Flocale%3Den_US&urlHash=t4i3&refId=7c86b547-b6fd-41ac-a164-4b2574d9b8ae&trackingId=UDVnHID1RfFnThEMkXxXsg%3D%3D&trk=public_jobs_apply-link-offsite
"Systems Integration Engineering Intern (Remote, Summer 2021)",Virgin Hyperloop,"Los Angeles, CA","Virgin Hyperloop is hosting a remote internship program this summer!
Internship length & time frame: 10-12 weeks during the summer of 2021
Two available start dates: 5/31/21 & 6/21/21
Availability: interns must be available for 40 hours/week (sorry, no overtime!)
Compensation: all internship positions have a fixed hourly rate of $19.00/hour
Eligible applicants: applicants must have current work authorization for the United States (U.S.-based student visas are eligible). Applicants without current work authorization unfortunately cannot be considered.
**Location: this is a completely remote program; due to economic constraints related to tax implications, we are only accepting applicants residing in the states of California or Nevada.

To connect the world, we must reflect the world. At Virgin Hyperloop, we’re bringing together unique perspectives, empowering our community to celebrate all voices, and creating equal opportunities to build, grow, and thrive.

WHY WE NEED YOU

The System Integration Team is responsible for organizing the final delivery of the hyperloop pod from Design to Manufacturing teams. This involves regular communication and alignment with all sub-systems design teams, ensuring their designs are prepared and ready to deliver to final assembly. The role focuses on the development of a broad skillset including but not limited to, Mechanical Design, Manufacturing, Assembly, Project Management, Testing/Research, and Electrical System Modeling. We are seeking candidates with curiosity, initiative, and the willingness to learn to join our team of skilled, diverse individuals to deliver one of the most challenging transportation applications on Earth!

What You'll Do
Create, update, and maintain computer-aided design (CAD) models of components, assemblies, and corresponding engineering drawings in Siemens Unigraphics NX.
Provide updates and report on vehicle-level clash, mass, and vehicle dynamic properties.
Regularly communicate with Responsible Engineers (REs) about design updates and revisions.
Investigating use-cases for expanding advanced manufacturing methods (3D printing, laser cutting, etc.) for future development.
Support assembly team in various activities such as: Generating installation requirements, Standard Operating Procedures (SOPs), Tooling design, Virtual build visualization.


What You've Done
Enrolled in or recently graduated from an accredited undergraduate or graduate degree program of study in mechanical engineering or related field.
Some experience with the detailed mechanical design of systems that require Geometric Dimensioning & Tolerancing (GD&T) to ensure form, fit, and function.
Strong understanding of engineering design fundamentals (problem statements, requirements, constraints, objectives, evaluating design alternatives, etc.)
Familiarity with manufacturing, assembly, and fabrication methods.
Experience designing, building, and testing mechanical assemblies through personal, extracurricular, or individual projects.
Skilled in 3D CAD software (NX preferred, SolidWorks, or Catia)
In addition, the candidate must possess the following characteristics:
Excellent problem-identification and problem-solving skills.
Team oriented: you are comfortable and energized by working in a team with a wide variety of backgrounds and skillsets. You welcome constructive feedback and different perspectives. You desire to truly understand the goals and needs of your teammates.
Dynamic and creative: you thrive in a fast-paced environment where several interdependent technologies are being developed simultaneously.
You welcome the challenge of generating ideas and performing analysis based on inputs and requirements that are subject to change.
Ability to learn quickly, make decisions, and effectively work independently to meet challenging deadlines.
Excellent written and verbal communication skills
Ability to understand and interpret a variety of abstract and concrete variables and provide solutions to difficult problems.


For full information on how your personal information will be stored and processed, please click here.",https://www.linkedin.com/jobs/view/externalApply/2484834891?url=https%3A%2F%2Fboards%2Egreenhouse%2Eio%2Fhyperlooptechnologies%2Fjobs%2F3032267%3Fgh_jid%3D3032267&urlHash=GziH&refId=7c86b547-b6fd-41ac-a164-4b2574d9b8ae&trackingId=ge%2Bse%2BWMqLDKbf4VMH%2F%2BFA%3D%3D&trk=public_jobs_apply-link-offsite
Systems Engineering Intern- Summer 2021,Johnson & Johnson,"Redwood City, CA","At Johnson & Johnson, we use technology and the power of teamwork to discover new ways to prevent and overcome the world’s the most significant healthcare challenges. Our Corporate, Consumer Health, Medical Devices, and Pharmaceutical teams leverage data, real-world insights, and creative minds to make life-changing healthcare products and medicines. We're disrupting outdated healthcare ecosystems and infusing them with transformative ideas to help people thrive throughout every stage of their lives. With a reach of more than a billion people every day, there’s no limit to the impact you can make here. Are you ready to reimagine healthcare?

Here, your career breakthroughs will change the future of health, in all the best ways. And you’ll change, too. You’ll be inspired, and you’ll inspire people across the world to change how they care for themselves and those they love. Amplify your impact. Join us!

We are currently hiring for a Systems Engineering Intern to work in our Redwood City, CA location! We are a technology company defining the future of medical intervention. By combining advancements in medical robotics, instrumentation, navigation and data science, we are building a platform technology capable of expanding the applicability of robotics to a spectrum of medical procedures! You will understand the system from both a technical perspective and the user’s viewpoint, and drive definition and development of the Monarch system. We are looking for a candidate who can work independently and function well within a team. The candidate is flexible, self-motivated, curious and passionate about revolutionizing the world of medical robotics.

Job Responsibilities:
- Serve as a liaison between clinical/marketing, program management, and the engineering design teams
- Translate clinical and business needs to system requirements for engineering definition of the system
- Generate use cases, trade studies, and risk assessments to facilitate systematic trade-off decisions and robust engineering solutions
- Develop test methods to accurately characterize, and verify the system design against performance requirements
- Build prototypes and fixtures for data acquisition and analysis
- Work cross-disciplinarily to provide hands-on system troubleshooting and debugging
- Utilize sound engineering methods and documentation processes to perform design reviews and failure mode analyses",https://www.linkedin.com/jobs/view/externalApply/2440248341?url=https%3A%2F%2Fjnjc%2Etaleo%2Enet%2Fcareersection%2Fjobdetail%2Eftl%3Fjob%3D2105893721W&urlHash=x5_z&refId=7c86b547-b6fd-41ac-a164-4b2574d9b8ae&trackingId=%2FPfm9VZv45vm9R8Z7x5bcg%3D%3D&trk=public_jobs_apply-link-offsite
Systems Engineer - Intern,Orbital Sidekick,"San Francisco, CA","Space is in our DNA. Satellites are ideal platforms to monitor the planet, be it discovering new resources, protecting and monitoring vital infrastructure assets or providing solutions to improve industrial efficiencies. Orbital Sidekick combines and harnesses the power of hardware and software platforms to deliver the ultimate monitoring solution.

Responsibilities
Optimize never-before tested camera and optical systems to extract high-bandwidth image data
Develop detailed understanding of onboard flight software hardware and software interfaces
Work with OSK’s algorithm team to implement onboard algorithms to high-bandwidth data-streams
Develop OSK’s data ingestion and processing capabilities for satellite as well as aerial hyperspectral images
Incorporate payload and spacecraft bus command and control schemes
Work on an efficient Concept of Operations (CONOPs) for tasking and downlinking imagery across the globe

Requirements
Working on a computer/astronautical/aerospace/mechanical engineering field
Some skills in C++, MATLAB, Python, and Linux Operating Systems
Knowledge of aerospace engineering principles, some guidance and navigation knowledge
Willingness to learn and communicate with other disciplines and engineers on the Orbital Sidekick team

Preferred
Familiarity with multispectral or hyperspectral data capture
Experience with hardware development and testing
Experience with remote sensing data
ITAR Requirements: U.S. Government space technologies export/ITAR regulations apply here, applicant must be a U.S. citizen or a lawful permanent resident of the U.S., or eligible to obtain the required authorizations from the U.S. Department of State.

Orbital Sidekick is proud to be an Equal Employment Opportunity and Affirmative Action employer. We do not discriminate based upon race, religion, color, national origin, gender (including pregnancy, childbirth, or related medical conditions), sexual orientation, gender identity, gender expression, age, status as a protected veteran, status as an individual with a disability, or other applicable legally protected characteristics. Orbital Sidekick is committed to working with and providing reasonable accommodations to applicants with physical and mental disabilities. Please see the United States Department of Labor's EEO poster and EEO poster supplement for additional information.",https://www.linkedin.com/jobs/view/externalApply/2494466500?url=https%3A%2F%2Fjobs%2Elever%2Eco%2Forbitalsidekick%2F40a1cffb-f07b-475e-acb8-49f9492bba24%2Fapply%3Flever-source%3DLinkedIn&urlHash=B2is&refId=7c86b547-b6fd-41ac-a164-4b2574d9b8ae&trackingId=O8vKtm1r%2BE4Yve2hb9HYbw%3D%3D&trk=public_jobs_apply-link-offsite
Systems Engineer (Intern),Nevro,"Redwood City, CA","Engineering R&D Intern (Systems Engineering)

The Engineering R&D (Systems Engineering) Intern shall participate in product development activities across the spectrum from concept generation to verification and validation testing of Nevro’s various neuromodulation products. This position involves applying diversified knowledge of engineering principles and practices, and an active role in working with internal and external stakeholders towards executing on project milestones. 

Contribute to the design and development of an implantable medical device and associated external components.
Work with key stakeholders across the organization to understand user needs and define system architecture and requirements. Generate and evaluate concepts to support user need and system architecture development.
Create user interface test methods and drive usability evaluation of multiple aspects of the system.
Able to work in a regulated environment in accordance with internal operating procedures and external standards and regulations.
Able to do hands-on work remotely or in the R&D lab and help in the assembly, characterization and documentation of Nevro’s products.
Other duties as assigned.
 

Working towards an M.S. or B.S. in Biomedical Engineering, Electrical Engineering, Computer Engineering, Computer Science or similar degree.
Equivalent work experience may be substituted for education requirement
 

Have at least two years completed as part of a BS Engineering or equivalent degree.
Candidates with 3 years completed preferred.
Ability to provide creativity while solving complex problems without known solutions.
Ability to communicate clearly in a cross-functional setting.",https://www.linkedin.com/jobs/view/externalApply/2461157293?url=https%3A%2F%2Fcareers-nevro%2Eicims%2Ecom%2Fjobs%2F3127%2Fjob&urlHash=YCBn&refId=7c86b547-b6fd-41ac-a164-4b2574d9b8ae&trackingId=PfjFm4v2RwcYMviQaS%2BufQ%3D%3D&trk=public_jobs_apply-link-offsite
Systems Engineering Intern,Sound Transit,"Seattle, WA","GENERAL PURPOSE: Sound Transit has an exciting virtual paid internship available for the summer of 2021! This is a great opportunity for currently enrolled undergraduate or graduate students who want to observe and participate in real world application of their current field of study. This opportunity will allow the intern to gain valuable experience within the Systems Engineering and Integration division under our Portfolio Services Office department.

The Systems Engineering intern will support the Systems Engineering department by researching and developing tools for better understanding maintenance data to inform engineering designs and decisions.

Primary Duties And Responsibilities

The following duties ARE NOT intended to serve as a comprehensive list of all duties performed by all employees in this classification, only a representative summary of the primary duties and responsibilities. Incumbent(s) may not be required to perform all duties listed and may be required to perform additional, position-specific duties.

An undergraduate student entering their junior or senior year with the following:
Familiarity with data science and analysis tools.


Potential Projects
Work with train control systems engineers to develop a tool that examines maintenance data for critical failures, categorizes data, and make recommendations for design changes for re-occurring failures.
Work with communications and SCADA systems engineers to analyze IOT data to develop monitoring metrics and data visualization tools for failure mode predication and analysis.
Work with construction management teams to develop a tool that examines construction data, categorizes, trends, develops metrics and provides a visualization tool that can be used for design improvements


Minimum Qualifications

Applicants must be a current college student in good academic standing, enrolled in an accredited associate, Bachelor’s or Master's degree program in Computer Science or Electrical Engineering, or a graduate degree in Computer Science.

Physical Demands/ Work Environment
Work is performed remotely, ST offices are closed temporarily.
Subject to standing, walking, bending, reaching, stooping, and lifting of objects up to 25 pounds; may occasionally be exposed to dangerous machinery when visiting job sites during construction and when working in the field.
The Agency promotes a safe and healthy work environment and provides appropriate safety and equipment training for all personnel as required.


Sound Transit is an equal employment opportunity employer. No person is unlawfully excluded from employment action based on race, color, religion, national origin, sex (including gender identity, sexual orientation and pregnancy), age, genetic information, disability, veteran status or other protected class.",https://www.linkedin.com/jobs/view/externalApply/2402781177?url=https%3A%2F%2Frecruiting%2Eultipro%2Ecom%2FSOU1036SOUND%2FJobBoard%2Fdcc5dbea-875e-4cd1-bfd2-8e046cecc54f%2F%2FOpportunityDetail%3FopportunityId%3D72984f51-7bac-440f-8214-5788ffddfa4e%26utm_source%3DLINKEDIN%26utm_medium%3Dreferrer&urlHash=yRBv&refId=7c86b547-b6fd-41ac-a164-4b2574d9b8ae&trackingId=xTDWU%2FL08YMUe%2FwR2IXQpg%3D%3D&trk=public_jobs_apply-link-offsite
Systems Engineer Intern,Infineon Technologies,"San Jose, CA","Systems Engineer Intern In Your New Role You Will
Developing and customizing firmware for reference designs
Validation of firmware and hardware against customer requirements
Creation or review of reference schematics for customers
Perform Interoperability and compliance tests on reference and customer designs
Writing Application notes for Type-C and USB-PD Applications
This is a great opportunity to work on a cutting-edge technology like Type-C and USB-PD
You are best equipped for this task if you have:
Bachelors/Masters in Embedded System, Electrical, Electronics or Computer Science preferred
Hands on debugging of Interface products and Microcontroller products
RTL Design and FPGA synthesis knowledge is desirable
Experience with lab equipment such as oscilloscope, protocol analyzers
Understanding of various host interfaces: USB, I2C, UART, SPI, etc
Knowledge of analog design, power management circuits like switching regulator/LDO/DC-DC converters
Experience in embedded system design or applications
Hands on lab experience for board bring-up and debugging of analog circuits, voltage regulators, and power distribution circuits
Part of your life. Part of tomorrow.

We make life easier, safer and greener – with technology that achieves more, consumes less and is accessible to everyone. Microelectronics from Infineon is the key to a better future. Efficient use of energy, environmentally-friendly mobility and security in a connected world – we solve some of the most critical challenges that our society faces while taking a conscientious approach to the use of natural resources.

Cypress Semiconductor Corporation is an equal opportunity employer. All qualified applicants will receive consideration for employment without regard to race, color, religion, sex (including pregnancy, childbirth, or related medical conditions), gender identity, national origin, ancestry, citizenship, age, physical or mental disability, legally protected medical condition, family care status, military or veteran status, marital status, domestic partner status, sexual orientation, or any other basis protected by local, state, or federal laws. Applicants with questions about access or requiring a reasonable accommodation for any part of the application or hiring process should contact the Talent Network by phone at (408) 503-2194.

Employment at Infineon is contingent upon proof of your legal right to work in the United States under applicable law, verification of satisfactory references and successful completion of a background check and drug test, and signing all your on-boarding documents .

In some instances, if applicable, U.S. export control laws require that Infineon obtain a U.S. government export license prior to releasing technologies to certain persons. This offer is contingent upon Infineon's ability to satisfy these export control laws as related to your employment and anticipated job activities. The decision whether or not to submit and/or pursue an export license to satisfy this contingency, if applicable, shall be at Infineon's sole discretion.

Important Notice

Infineon Technologies takes data privacy and identity theft very seriously. As such, we do not request personally-identifiable information (PII) from applicants over the internet or electronically. Please kindly refrain from disclosing your PII electronically during the application process or to unauthorized websites that may purport to be Infineon or any of our affiliates.",https://www.linkedin.com/jobs/view/externalApply/2479962890?url=https%3A%2F%2Fwww%2Einfineon%2Ecom%2Fcms%2Fen%2Fcareers%2Fjobsearch%2Fjobsearch%2F316258-Systems-Engineer-Intern%2F%23%21source%3D400&urlHash=Glm7&refId=7c86b547-b6fd-41ac-a164-4b2574d9b8ae&trackingId=4ohpGu1U%2FHyM%2FakO7GhL0w%3D%3D&trk=public_jobs_apply-link-offsite
