title,company,location,requirements,link
"Intern, Property Tax Commercial - Arlington, VA",Ryan,"Arlington, VA","We are looking for interns interested in state, local, federal, and international taxation. As an Intern you will work side by side with subject matter experts in a team-based environment to identify tax savings opportunities for Fortune 500 and 1,000 clients. Interns will receive training and development to become the most seasoned state, local, federal, and international tax professionals in the industry.

Duties And Responsibilities
Provide exceptional client service to multi-state companies by to identify tax savings opportunities
Assist multi-state companies with state and local tax controversies, which includes preparing clients for discussions with auditors, representing the client at hearings and at appeal meetings, and preparing protests
Research and draft technical memoranda regarding state and local tax questions or issues
Respond to client inquiries and requests from tax authorities
Review documentation and research issues
Work with raw data to complete detailed calculations

Education And Experience
Working toward a Bachelor’s or Master’s degree in Accounting, Finance, Real Estate or Economics.
Anticipated graduation date within one year of internship
Minimum Overall and Major GPA of 3.0
Minimum of 6 – 12 Accounting hours depending on practice

Professional Skills Requirements
Work effectively in a fast pace, high-energy environment.
Strong problem solving, attention to detail, and communication skills.
Ability to prioritize tasks, work on multiple assignments, and manage ambiguity.
Ability to work both independently and as part of a team with professionals at all levels.
Intermediate knowledge of all Microsoft Office applications, Outlook, and etc.

Computer Skills

To perform this job successfully, an individual must have intermediate knowledge of Microsoft® Word, Access, Excel, PowerPoint, Outlook, and Internet navigation and research.

Certificates And Licenses

Valid driver's license required.

Supervisory Responsibilities

This position has no supervisory responsibilities.

Equal Opportunity Employer: disability/veteran",https://www.linkedin.com/jobs/view/externalApply/2482658559?url=https%3A%2F%2Fryan%2Ewd1%2Emyworkdayjobs%2Ecom%2Fen-US%2FRyanCareers%2Fjob%2FArlington-VA%2FIntern--Property-Tax-Commercial---Arlington--VA_R0006722&urlHash=-l8c&refId=2de4f147-afaf-41fb-afd7-c9940e3e6246&trackingId=o9h5ujkarjYH25v6bhza8g%3D%3D&trk=public_jobs_apply-link-offsite
