title,company,location,requirements,link
Research Intern,JLL,"New York, NY","About JLL –

We’re JLL—a leading professional services and investment management firm specializing in real estate. We shape the future of real estate for a better world by using the most advanced technology to create rewarding opportunities, amazing spaces and sustainable real estate solutions for our clients, our people and our communities. As a Fortune 500 company, we help real estate owners, occupiers and investors achieve their business ambitions. We have nearly 300 corporate offices across 80 countries, with a team of more than 93,000 individuals and believe a diverse and inclusive culture is one where everyone succeeds. That’s why we’re committed to creating an environment where we all feel welcomed, valued and empowered to achieve our full potential.

With us, you’ll have a chance to innovate with the world’s leading businesses, put that expertise into action on landmark projects, and work on game-changing real estate initiatives. You’ll also make long-lasting professional connections and be inspired by the best. We’re focused on opportunity and want to help you make the most of yours. Achieve your ambitions—join us at JLL.

What This Job Involves

Summer Intern, Research – New York / Tri-State Market

Take the opportunity to start your career early in the commercial real estate field! Spend time learning what it’s like to work in the fast-paced, entrepreneurial, team-oriented environment at JLL.

Interns are an important part of what makes JLL a great place to work. Within our program, interns are an integral part of our team working alongside real estate analysts, transaction professionals and other associates. You will gain valuable insight into the commercial real estate industry while being exposed to multiple lines of business over the course of your internship.

JLL is looking for qualified interns to join our 2021 summer internship program. The ideal candidate should be prepared to work in a fast-paced team environment and will finish the internship having gained broad experience in various aspects of Commercial Real Estate.

The Research Intern will work collaborate with analysts to support ad-hoc projects such as researching economic trends as well as support the salesforce with requests from clients such as employment statistics, market trends, demographics and property intel. Successful candidates are passionate about what drives their city, economics and commercial real estate.

Program Details-
Beginning June 2021
Length of program runs 8-10 weeks
Full time (40 hours per week)
Located in New York City, NY

Qualifications-
Current undergraduate students majoring in- Real Estate, Urban Planning, Economics, Finance, Business Administration, or a related field
Desire to work in the Commercial Real Estate industry
Rising seniors and 2021 graduates highly preferred

Skills & Abilities-
Highly energetic with ability to work independently and with minimal direction
Must be outgoing and can connect with individuals on the phone
Written and verbal communicative skills
Detail-oriented, highly organized and creative
Proven record of providing excellent customer service
Ability to develop and maintain positive customer relationships
Comfortable presenting ideas and solutions to leadership and key stakeholders
Strong financial and analytical skills
General business experience

Technical Qualifications-
Strong analytical skills interest in analyzing data
Strong excel skills
Customer service mindset
Able to think critically and problem solve
Strong written and oral communication skills
Strong knowledge of PC, Windows, Internet applications, Microsoft Word, Excel and PowerPoint a must
Adept at learning new programs. Position may require one to learn a variety of real estate related software applications
Please only apply to one internship posting.

About JLL Research-

JLL Research consists of 570+ full-time professionals globally and is the largest research group in the real estate industry and among the best of any world-wide professional services firm. Our mission is ""To create clear business advantage for our clients through the strategic use of accurate data, market intelligence and innovative thinking from around the world."" Our research activities include maintaining comprehensive property market databases; analyzing current market conditions and future trends; recognizing the factors that drive property performance and occupancy trends; and providing research-led strategy and advice to investors, developers and occupiers around the world. We are focused no developing new metrics and methodological tools to capture and recognizing he factors driving office, retail and warehousing/logistics real estate markets across the world and bring insight to the future for our clients.

What You Can Expect From Us

We succeed together—across the desk and around the globe and believe the best inspire the best, so we invest in supporting each other, learning together and celebrating our success.

We can’t wait to see where your ambitions take you at JLL.

Apply today!

JLL Privacy Notice

Jones Lang LaSalle (JLL), together with its subsidiaries and affiliates, is a leading global provider of real estate and investment management services. We take our responsibility to protect the personal information provided to us seriously. Generally the personal information we collect from you are for the purposes of processing in connection with JLL’s recruitment process. We endeavour to keep your personal information secure with appropriate level of security and keep for as long as we need it for legitimate business or legal reasons. We will then delete it safely and securely.

For more information about how JLL processes your personal data, please view our Candidate Privacy Statement .

For additional details please see our career site pages for each country.

For employees in the United States, please see a fully copy of our Equal Employment Opportunity and Affirmative Action policy here .

Jones Lang LaSalle (“JLL”) is an Equal Opportunity Employer and is committed to working with and providing reasonable accommodations to individuals with disabilities. If you need a reasonable accommodation because of a disability for any part of the employment process – including the online application and/or overall selection process – you may email us at Accommodation.Reques@am.jll.com . This email is only to request an accommodation. Please direct any other general recruiting inquiries to our Contact Us page > I want to work for JLL.",https://www.linkedin.com/jobs/view/externalApply/2465364363?url=https%3A%2F%2Fjll%2Ewd1%2Emyworkdayjobs%2Ecom%2Fen-US%2Fjllcareers%2Fjob%2FNew-York-NY%2FResearch-Intern_REQ136208%3Fsource%3DAPPLICANT_SOURCE-6-42&urlHash=SX9u&refId=3a2f5c14-4e23-46be-880c-aa894b458bd5&trackingId=KGK6fhpQX%2FSW%2FAYW94cQAg%3D%3D&trk=public_jobs_apply-link-offsite
Research Intern,Weber Shandwick,"Washington, DC","An internship at KRC Research in Washington, DC is a perfect opportunity to become immersed in the field of opinion research and gain invaluable hands-on business experience. KRC interns work directly with project teams assisting with research design, execution, and analysis. All KRC Research internships are paid and include extensive training opportunities. We highly value our interns and their contributions. In fact, the vast majority of our entry level staff started their career at KRC as interns.

For more details from previous interns, take a look at the following blog posts, and please review our website for information about the qualitative, quantitative, and analytics research.
An Intern Answers the Questions that She Asked in Her Own KRC Interview
The KRC Internship Experience: An Insider's Perspective


About KRC Research

KRC Research is a leading global strategic market research firm and a member of the Interpublic Group of companies (NYSE: IPG), a global leader in modern marketing solutions. KRC specializes in qualitative and quantitative public opinion research and analytics to drive strategy, start conversations, and measure success. Our work spans the healthcare, corporate, consumer, technology, and financial industries as well as non-profit and government sectors. We work with both our sister agencies (including Weber Shandwick, Golin, and FutureBrand) and direct-to-KRC clients. KRC is headquartered in Washington, DC, and also has offices in New York and Cologne.

Qualifications
Strong preference for those who are a graduate student, recent college graduate or current/rising college senior.
Must be able to work a minimum of 30+ hours per week, with a strong preference for those who can work full-time (40 hours per week).
Must have superior analytical and writing skills, be a proactive communicator, and possess a keen eye for detail.
Strong preference for those with previous internship/work experience. (Experience in opinion research is not required.)
Should have an interest in market research including work with data, analytics, or data visualization.

To Apply

We are currently accepting applications for openings in Washington, DC. Please submit each of the following: the online application, a resume, and a cover letter. Applications will be considered until positions are filled, but we encourage you to apply early.

Weber Shandwick is proud to be an Equal Opportunity/Affirmative Action employer. Weber Shandwick recruits qualified applicants without regard to race, color, religion, gender, age, ethnic or national origin, protected veteran status, physical or mental disability, sexual orientation, gender identity, marital status or citizenship status.

#internship

We make our careers website accessible to any and all users. If you need an accommodation to participate in the application process, please contact us at JobAppAccommodation@ipgdxtra.com. This email address is not for general employment inquiries or vendors; rather it is strictly for applicants who require special assistance accessing our employment website. Due to volume, messages sent to this email address that are not related to an accommodation cannot be answered.",https://www.linkedin.com/jobs/view/externalApply/2495223193?url=https%3A%2F%2Fgrnh%2Ese%2F2db3cc472us&urlHash=hP64&refId=3a2f5c14-4e23-46be-880c-aa894b458bd5&trackingId=cO6EWr48HfRIdIGF2kESVQ%3D%3D&trk=public_jobs_apply-link-offsite
Research Intern,Perceptive Automata,"Boston, MA","At Perceptive Automata, we use our understanding of human behavior, computer vision, and machine learning to make autonomous vehicles safer for people on and near the road.

We offer summer internships to qualified graduate students. As a member of our small team, you will have the opportunity to develop and use a wide range of skills while helping to analyze our experiments and data sets. Your contributions will have an out-sized effect on our research efforts.

Strongly Preferred Skills & Background
Background in a quantitative field (Machine Learning, Computer Science, Mathematics, Physics, or equivalent field) or track record of related work experience
Strong programming skills in Python
Experience working with broad datasets in variable format
Comfortable operating and developing in a Linux environment
High degree of self-motivation and initiative
Strong communication skills (both written and verbal)
Eagerness to learn and master new skills
Also Helpful:
Experience with human annotator data
Experience with active learning
Experience with Bayesian statistics
Previous work in a team on large-scale Python projects
Perks:
Competitive Compensation
Modern urban office space with natural light and greenery
Lunch provided daily by local restaurants
Unlimited healthy snacks & beverages
Journal clubs, guest speakers & learning opportunities
In-office gaming, board games & books
Office lending library
Company outings
Diverse events organized by team members on an ad-hoc basis
Company Overview:
Perceptive Automata is a machine learning and computer vision company started by Harvard and MIT scientists that is developing a novel approach to help make autonomous vehicles safer for others on (or near) the road. We are supported by top Silicon Valley investors and global car makers and are growing rapidly in response to increasing demand for this technology.

By submitting your interest in this job, you agree to receive text notifications with additional steps to complete your job application. You will receive up to 6 messages from the number ""63879"". Message & data rates may apply. Please refer to our privacy policy for more information.",https://www.linkedin.com/jobs/view/externalApply/2483990327?url=https%3A%2F%2Fperceptive-automata%2Etalentify%2Eio%2Fjob%2Fresearch-intern-boston-massachusetts-perceptive-automata-4590439002%3Futm_source%3Dlinkedin_organic%26utm_medium%3DXml%26tdd%3DdDEsaDM1LGozc202YixlcHJvNjA3MTMwZDA3MWI4MzQwMjY4ODEyOQ&urlHash=c4c_&refId=3a2f5c14-4e23-46be-880c-aa894b458bd5&trackingId=%2B87LAYrMt1UD083wgdJsdA%3D%3D&trk=public_jobs_apply-link-offsite
Research Intern - FLA,Fujitsu,"Sunnyvale, CA","Description

Fujitsu Laboratories of America (FLA) is a wholly owned subsidiary of Fujitsu Laboratories Ltd., Fujitsu's Research and Development Division. Our corporate headquarters is in Sunnyvale, California. We innovate and develop real-world technologies that impact a broad range of industries, and our visionary scientists work to create and unfold new and improved technologies.

Globally, Fujitsu Laboratories has a rich history spanning over 50 years in cutting-edge innovation and research, supporting the global Fujitsu Group’s brand promise, “Shaping tomorrow with you.” From the first relay-based mainframe to the prototype of Fugaku, one of the fastest supercomputers (developed with RIKEN), Fujitsu has led the way in advanced information and communications technology (ICT) research. Our future R&D strategy and vision center around co-creation with our customers to solve their Digital Transformation (DX) challenges by applying our ground-breaking digital technologies.

At FLA, our research areas cover a range of topics including artificial intelligence, software engineering, cyber security, blockchain, and next-generation computer systems. We leverage our presence in the Silicon Valley” to collaborate closely with universities and other research institutes.

We are looking for a summer intern with backgroud in large scale optimization problems - specifically Vehicle routing problems with constraints.

Qualifications

Candidate should be Masters or PhD student is Computer Science or Mathematics with good programming skills in Python language.

Job Type Internship

Job Engineering

Primary Location CA-Sunnyvale

Travel No",https://www.linkedin.com/jobs/view/externalApply/2438745016?url=https%3A%2F%2Ffujitsujobs%2Etaleo%2Enet%2Fcareersection%2F10120%2Fjobdetail%2Eftl%3Fjob%3DFLA00520%26lang%3Den%26source%3DJB-12360%26src%3DLinkedIn&urlHash=lncO&refId=3a2f5c14-4e23-46be-880c-aa894b458bd5&trackingId=oBLPPh7EdGGxCxz1OEMSgw%3D%3D&trk=public_jobs_apply-link-offsite
Research Intern,Skydio,"Redwood City, CA","Skydio is the leading US drone manufacturer and world leader in autonomous flight, the key technology for the future of drones and aerial transportation. The Skydio team combines deep expertise in artificial intelligence, best-in-class hardware and software product development, and operational excellence to empower a broader, more diverse audience of drone users - from action sports enthusiasts to first responders.

About The Role

The core of our system is the computer vision algorithms that allow drones to understand the world around them. You will architect and implement the algorithms that run on every drone powered by Skydio as part of a world class computer vision team with researchers who have pushed the state of the art in academia and industry.

As a Research Intern, you will be paired up with one or more members of our core software development team, assuming direct ownership of a project that meaningfully advances the capabilities of our team and products.

How You'll Make An Impact
Enable rapid research and development of intelligent systems with advanced autonomous capabilities beyond anything that exists in the world today
Research, prototype, and generally assess the feasibility of new approaches
Imagine and then implement new features that unlock magic for our users
Characterize and quantify the performance of core components of the software and hardware stack


What Makes You a Strong Fit
High proficiency in C++ and/or Python
Demonstrated enthusiasm for one or more of the following: computer vision, deep learning, motion planning, dynamics and controls, 3D graphics, embedded software/firmware, distributed systems, tools/infrastructure, mobile
Solid software engineering foundation and a commitment to writing clean, well-architected code
Ability to thrive in a fast-paced, collaborative, small team environment


At Skydio we believe that diversity drives innovation. We have created a multi-disciplinary environment that embraces the power of diverse perspectives to create elegant solutions for complex problems. We are committed to growing our network of people, programs, and resources to nurture an inclusive culture.

As such, we do not make hiring or other employment-related decisions on the basis of an applicant or employee's race, color, ethnicity, national origin, citizenship, sex (including pregnancy, childbirth, breastfeeding and related medical conditions), pregnancy, gender, gender identity or expression, age, religion, disability status, sexual orientation, marital status, medical condition, generic information or characteristics, veteran, military or family status, or other classifications protected by applicable federal, state or local anti-discrimination laws.",https://www.linkedin.com/jobs/view/externalApply/2495157615?url=https%3A%2F%2Fgrnh%2Ese%2Fc7747f9c3us&urlHash=bG6A&refId=3a2f5c14-4e23-46be-880c-aa894b458bd5&trackingId=9AF7xRXsFCL2hAB%2FQTV3NQ%3D%3D&trk=public_jobs_apply-link-offsite
Research Intern (Summer 2021),The International Foundation for Electoral Systems,"Arlington, VA","IFES is an Equal Opportunity and Affirmative Action Employer.


All qualified applicants/employees will receive consideration for employment/promotions and will not be discriminated against on the basis of disability, sex, sexual orientation, gender identity, age, race, color, religion, national origin, veteran status, or any other legally protected characteristic. IFES takes affirmative action with respect to the employment and promotion of women, minorities, individuals with disabilities, and covered veterans. IFES will also take affirmative action on the basis of sexual orientation and gender identity.

Already have a profile?

Research Intern (Summer 2021)

Location: *United States

Division: The Center

Status: Internship

Position Number: 21:069

About the International Foundation for Election Systems (IFES) : IFES advances democracy for a better future. We collaborate with civil society, public institutions and the private sector to build resilient democracies that deliver for everyone. As the global leader in the promotion and protection of democracy, our technical assistance and applied research develops trusted electoral bodies capable of conducting credible elections; effective and accountable governing institutions; civic and political processes in which all people can safely and equally participate; and innovative ways in which technology and data can positively serve elections and democracy. Since1987, IFES has worked in more than 145 countries, from developing to mature democracies.

Job Responsibilities

Position Description:

More Specifically, The Research Intern Will

The Research Intern will support the IFES Electoral Operations and Research teams through substantive research, compilation, and processing of relevant information, and drafting of reports.
Conduct desk research on innovative solutions for optimizing voting procedures, with a focus on time-motion analysis applied to elections and other data-driven tools
Conduct desk research on mechanisms and tools used by election management bodies (EMBs) globally to evaluate institutional performance
In coordination with IFES’ experts, reach out to EMB representatives to collect firsthand data on the use of data-driven tools for improving electoral procedures
Produce summary reports based on desk research and data collection and develop recommendations for introducing or expanding such innovations to different EMBs
Develop and update internal databases to record relevant information (disaggregated, e.g., by country/region, type of EMB, level of economic development, democratic experience);
Support IFES experts in the writing of reports and guidelines to support EMBs adopt such tools where appropriate.
Undertake other duties as assigned.

Qualifications
Bachelor’s Degree in political science, global studies, international affairs, or other relevant area
Extensive research and writing experience
Experience in the area of elections and political processes is a plus; and
Foreign language skills a plus.
Successful candidate will be able to demonstrate the following attributes:
Be self-motivated and proactive
Be detail-oriented and organized
Can prioritize and meet deadlines
Be a strong communicator, both verbally and in writing
Be collaborative, team-oriented individual.

Applying



Please apply with your resume, cover letter, and a writing sample.",https://www.linkedin.com/jobs/view/externalApply/2475167134?url=https%3A%2F%2Fwww%2Evs4%2Evscyberhosting%2Ecom%2Fifes%2FCareers%2Easpx%3Freq%3D21%253a069%26type%3DJOBDESCR&urlHash=rxsW&refId=3a2f5c14-4e23-46be-880c-aa894b458bd5&trackingId=oCXDE8%2BMwUbDghtte%2F63MQ%3D%3D&trk=public_jobs_apply-link-offsite
Research & Development Intern at a TED-Featured Startup,Circle World Arts,"Norfolk County, MA","Circle World Arts is a global network for arts and cultures. We organize and curate programs and workshops that aim to connect artists, audiences, and cultural institutions together across continents, languages, and traditions.

Our mission is to make the world arts accessible to as many people as possible through a global, branded, impactful network for arts and cultures. Our vision is to become the number one organization for people to learn about world arts and to create a world of cultural citizens. Circle World Arts has been selected by TED as one of the breakthrough ideas worth spreading to join its incubator.

At Circle World Arts, we believe that by learning about the arts and different cultures that we bring people together and expand imaginations—that arts are the window to cultural learning.

In order to be committed to our mission and vision, we know we cannot just stop at workshops. Our goal is to establish the largest database for learning about world arts and cultures. That’s where you come in. Circle World Arts is seeking an individual who is creative and passionate about world arts, culture, and expanding minds. We are looking for someone who can find the most engaging content and then present it to our audience in creative ways, whether that be through Instagram stories and posts, Facebook, our website, and more. We also need your help as we begin to design a database and grow our platform as a place for all forms of cultural learning.

Responsibilities
Research engaging content to educate our audiences about world arts and cultures
Create appealing posts and other social media content to convey this information
Cultivate a sense of curiosity and excitement in doing so
Show people why the world arts is important and meaningful—give our audiences something of value",https://www.linkedin.com/jobs/view/externalApply/2499653733?url=https%3A%2F%2Fwww%2Ewhatjobs%2Ecom%2Fcoopof__cpl__236650258__35%3Futm_source%3Dlinkedin%26utm_medium%3Dfeed&urlHash=ZqAc&refId=3a2f5c14-4e23-46be-880c-aa894b458bd5&trackingId=7oDCSrPq4zNPFdQWOeZpGA%3D%3D&trk=public_jobs_apply-link-offsite
