title,company,location,requirements,link
Systems Engineering Intern,KLA,"Milpitas, CA","Company Overview

KLA is a global leader in diversified electronics for the semiconductor manufacturing ecosystem. Virtually every electronic device in the world is produced using our technologies. No laptop, smartphone, wearable device, voice-controlled gadget, flexible screen, VR device or smart car would have made it into your hands without us. KLA invents systems and solutions for the manufacturing of wafers and reticles, integrated circuits, packaging, printed circuit boards and flat panel displays. The innovative ideas and devices that are advancing humanity all begin with inspiration, research and development. KLA focuses more than average on innovation and in 2019 we invested 15% of sales back into R&D. Our expert teams of physicists, engineers, data scientists and problem-solvers work together with the world’s leading technology providers to accelerate the delivery of tomorrow’s electronic devices. Life here is exciting and our teams thrive on tackling really hard problems. There is never a dull moment with us.
Group/Division
With over 40 years of semiconductor process control experience, chipmakers around the globe rely on KLA to ensure that their fabs ramp next-generation devices to volume production quickly and cost-effectively. Enabling the movement towards advanced chip design, KLA's Global Products Group (GPG), which is responsible for creating all of KLA’s metrology and inspection products, is looking for the best and the brightest research scientist, software engineers, application development engineers, and senior product technology process engineers. First to deliver the best imaging and classification data for every defect or point on any layer at any time. EBeam’s mission encapsulates its role as the “eyes” of KLA’s product line, providing timely information on defects and critical locations on the wafer at the highest spatial resolution possible. Customers use EBeam products alongside KLA patterned and bare wafer inspectors to quickly understand the nature of defects and other imperfections on product wafers and take action to correct the manufacturing process.
This position will work with the eBeam system engineering team to help prototype engineering charged particle beam platforms and build test stands to evaluate key subsystems. The individual will participate in tool integration, building test stands, data analysis and reliability evaluation.
Adaptability, Collaborates, Communication, Customer Focus, Decision Quality, Drives Results, Innovation, KLA Values, Problem Solving, Work Processes

Minimum Qualifications
Graduate degree candidates in Physics, Mechanical Engineering, Materials Science, Electrical Engineering;
Experience with instrumentation prototyping;
Skills in python, and Labview.
Statistics SW such as JUMP.
We offer a competitive, family friendly total rewards package. We design our programs to reflect our commitment to an inclusive environment, while ensuring we provide benefits that meet the diverse needs of our employees.

KLA is proud to be an Equal Opportunity Employer. We do not discriminate on the basis of race, religion, color, national origin, sex, gender identity, gender expression, sexual orientation, age, marital status, veteran status, disability status or any other status protected by applicable law. We will ensure that qualified individuals with disabilities are provided reasonable accommodation to participate in the job application or interview process, to perform essential job functions, and to receive other benefits and privileges of employment. Please contact us at talent.acquisition@kla.com to request accommodation.",https://www.linkedin.com/jobs/view/externalApply/2403701703?url=https%3A%2F%2Fkla%2Ewd1%2Emyworkdayjobs%2Ecom%2Fen-US%2FSearch%2Fjob%2FMilpitas-CA%2FSummer-Intern-for-System-Engineering_2101612%3Fbid%3D370%26source%3DJob_Board_LinkedIn&urlHash=nTEv&refId=7c86b547-b6fd-41ac-a164-4b2574d9b8ae&trackingId=1oiukEO%2BwwdzWAfxyYKXng%3D%3D&trk=public_jobs_apply-link-offsite
Engineering Intern,Crane Co.,"Lynnwood, WA","Crane Aerospace & Electronics has a unique and exciting career opportunity for an Electrical Engineer, Power Electronics Intern on the Sensing & Power Systems Engineering Team at our Lynnwood, WA campus.

Students enrolled in accredited Universities with specific Power Electronics Programs are highly desired and will be given top consideration.

Electrical Engineer Intern Position Overview

The EE Intern will perform engineering duties in researching, planning, designing, documenting and developing electronic or electrical products and systems used for a manufactured product or transmission. Electrical engineers carry out extensive analyses on new product designs to ensure efficiency, reliability and quality. The EE Intern will use computer-assisted engineering, design and analysis software and equipment to perform daily assignments. Electrical engineering principles and techniques will be applied to develop economical solutions to technical problems.

Electrical Engineer Intern Responsibilities
Performs engineering work in basic and applied research, development/design of new or sustaining products.
Work includes the design, fabrication, modification and evaluation of electronic apparatus, components, or circuits for use within electronics and/or aerospace equipment, devices, and systems.
Perform detailed circuit analysis to verify design compliance to specific performance targets. Analysis to include computer aided modeling and the generation of schematics.
Prepare and review technical reports/documentation necessary to satisfy customer, internal and program requirements, including specifications, design documents, test plans/procedures, reports, correspondence, etc.
Provide diagnostic support to manufacturing on new and existing products.


Likely Projects
Motor Controller:
Analysis & documentation of Modularity Concept
Simulating and modelling of controller, motor, and pump dynamics
Model Based Systems Engineering (MBSE) case studies for applying MBSE to Crane systems and products including writing & validating requirements using models
Reliability Improvements
Research fielded performance versus predicted performance
Common failure modes for fielded products based on field returns
Environmental Stress Screening (ESS) profiles vs. infant mortalities of products


Minimum Qualifications
Must be actively pursuing a Bachelor's degree from four-year college or university in Electrical Engineering.
Must provide GPA, minimum accepted 3.1 on a 4.0 scale
Possess excellent verbal and written communication skills
Possess effective interpersonal skills in a team environment
Must be project-oriented and be able to multi-task
Knowledge/proficiency with Microsoft Office applications, including Microsoft PowerPoint
Ability to fulfill a one quarter or semester internship commitment, 40 hours per week
Available to work full-time during the agreed upon semester session


Employment Eligibility Requirement
This position requires access to controlled data or information and therefore only US persons will be considered. As a US Department of Defense contractor we are bound by the International Traffic in Arms Regulations ( ITAR ).


About Crane

Crane Aerospace & Electronics supplies critical systems and components to the aerospace and defense markets. You’ll find Crane Aerospace & Electronics in some of the toughest environments: from engines to landing gear; from satellites to medical implants and from missiles to unmanned aerial systems (UAS).

We are committed to operational excellence and world class processes. We employ Lean manufacturing techniques to optimize manufacturing efficiency and accuracy on all product lines. Our products are known for their technical strength, proven reliability and overall value.

As an intern at Crane Aerospace & Electronics, you will develop knowledge about the business through exposure to a functional area (such as manufacturing, engineering, and lean principles). You will focus on developing the skills necessary for success by assisting employees with day-to-day job assignments. You may be assigned to additional training or project work. The Company's internship program is intended to provide students from diverse backgrounds with the opportunity to practice business skills learned in school while gaining work experience.

The intern will have a unique experience of interacting directly with senior level engineers working on products in various stages of their life cycle. The intern will get exposure to research, design, development, and production. Responsibilities and tasks will be tailored to the applicant’s abilities.

Crane Aerospace & Electronics offers competitive salaries and outstanding opportunities for career growth and development.

In our efforts to maintain a safe and drug-free workplace, Crane Aerospace & Electronics requires that candidates complete a satisfactory background check prior to employment.

This description has been designed to indicate the general nature and level of work being performed by employees within this classification. It is not designed to contain or be interpreted as a comprehensive inventory of all duties, responsibilities, and qualifications required of employees assigned to this job.

Crane Co. is an Equal Opportunity Employer and does not discriminate on the basis of race, color, creed, religion, sex, national origin, marital status, age, sexual orientation, gender identity characteristics or expression, physical or mental disability, pregnancy, medical condition, genetic information, or U.S. military or veteran status or any other characteristic protected under federal, state, or applicable local law, in recruiting, hiring, training and promoting.",https://www.linkedin.com/jobs/view/externalApply/2477287887?url=https%3A%2F%2Fphf%2Etbe%2Etaleo%2Enet%2Fphf01%2Fats%2Fcareers%2Fv2%2FviewRequisition%3Forg%3DCRANEAE%26cws%3D53%26rid%3D9643&urlHash=fTx7&refId=7c86b547-b6fd-41ac-a164-4b2574d9b8ae&trackingId=rgdXJDo7iKphnulWXlCuaQ%3D%3D&trk=public_jobs_apply-link-offsite
Engineer - Internship,Atkore,"New Bedford, MA","Atkore is forging a future where all Atkore brands, suppliers, employees, customers, partners and communities are building better together - a future focused on serving the customer and powering and protecting the world.

Atkore is a leading manufacturer and distributor of electrical, mechanical, and safety infrastructure solutions to power and protect the world. With approximately 3,900 employees and 65 manufacturing and distribution facilities worldwide, Atkore manufactures electrical conduit, cable management systems, armored cable, metal framing, and security products and solutions. Atkore’s commitment to quality, delivery and value helps customers realize their vision. Atkore forges relationships and shapes the future with breakthrough results, enhanced technology, and innovative product offerings.

The Engineer Intern will have a unique opportunity to contribute to the overall success of the manufacturing operations, product innovation, as well as personal leadership development. The ideal candidate must be able to work in a team-based environment, have strong leadership capabilities, and contribute to strategic objectives.

Additional Responsibilities Will Include, But Are Not Limited To
Support value stream action plans and countermeasures to ensure Key Performance Indicators (KPIs) are met, including those related to safety, quality, delivery, cost, and productivity.
Assist continuous improvement teams in the development and implementation of continuous improvement project plans, including helping the team to determine the objective, scope, target, timeline, budget, milestones, and allocation of resources
Help develop standard work for all processes and positions, along with working with other teams to share best practices with respect to following & modifying standard work
Maintain a detailed project schedule for engineering development, tooling, and product launch activities
Fully understand customer requirements to develop suitable products
Write protocols and perform validations of new/improved materials and processes
Prepare and present results of internship project


Requirements
Bachelor of Science degree in Mechanical, Electrical or Industrial Engineering in process; required
Ability to work within the manufacturing methods and procedures
Ability to troubleshoot and resolve technical problems
Strong written & verbal communication skills
Excellent teaming and interpersonal skills
Self-starter and highly self-motivated
Problem-solving and troubleshooting skills within a process, mechanical or electrical
Strong skills with Microsoft Office are required
SolidWorks or related 3D design software desirable
All associates must embrace and foster and environment that supports our core values of Integrity, Respect, Excellence, Teamwork and Accountability.

Our Culture Drives Value

Atkore’s culture is created from the disciplined use of the Atkore Business System (ABS), which is a critical part of our mission and a foundational system based on excellence in People, Strategy, and Processes, tied together with Lean Daily Management (LDM) to manage and sustain the business we have today, and Strategy Deployment Process (SDP) to create the business we aspire to become.

Having the right talent in the right roles enables successful ABS execution, improves our customer’s experience, and delivers breakthrough results. Said another way, that’s how we win!

Great Leaders Drive Value

Atkore is committed to creating an engaged and aligned workplace that helps drive an accountable and performance-based culture. Our team possesses a willingness to strive for breakthrough results, stays focused on being standout leaders, and fully supports decisions of the Company after robust debate. We consistently live the Atkore mission, learn our strategic priorities and link behaviors to those priorities, all in a way that’s consistent with our core values. Together, we build stronger leaders and improve customer satisfaction which positively increases the overall value of the enterprise.

Atkore Delivers Value to You

By joining Atkore, you can expect to receive a competitive salary in addition to a comprehensive benefits package including medical, dental, vision, 401(k) with company match, a generous maternity/paternity leave, flexible spending accounts, tuition reimbursement, as well as life, accident and disability insurance. In addition, Atkore offers wellness programs and employee assistance resources to help employees achieve a healthy work-life balance.

Our dedicated employees are recognized for their commitment to our customers and making our company better than it was the day before.

Atkore is an Equal Opportunity Employer and does not discriminate because of age, color, disability, ethnicity, marital or family status, national origin, race, religion, sex, sexual orientation, gender identity, military veteran status, or any other characteristic protected by law.

Atkore is a diverse company that believes its employees are the foundation for investing in its future, through the understanding that awareness and acceptance of our individual difference enhance inclusion and promote engagement and alignment. Diversity and inclusion are keys to growing our business and providing a work environment that fosters contributions by all employees.

Join our team and align yourself with an industry leader",https://www.linkedin.com/jobs/view/externalApply/2323453952?url=https%3A%2F%2Frecruiting2%2Eultipro%2Ecom%2FATK1000ATKOR%2FJobBoard%2F18eec16a-a1ec-458b-82c9-cb3af8866255%2F%2FOpportunityDetail%3FopportunityId%3D7595fdc6-0c55-4eb7-b6b5-423f46143dc6%26utm_source%3DLINKEDIN%26utm_medium%3Dreferrer&urlHash=Ad87&refId=7c86b547-b6fd-41ac-a164-4b2574d9b8ae&trackingId=264lSTgT67X8gil6b57cRQ%3D%3D&trk=public_jobs_apply-link-offsite
