title,company,location,requirements,link
Corporate Real Estate Intern,Thermo Fisher Scientific,"Waltham, MA","Job Title

Corporate Real Estate Intern

When you’re part of the team at Thermo Fisher Scientific, you’ll do important work. You’ll have the opportunity to grow and learn in a culture that empowers your development. We have created an inclusive, global environment that values the power of diverse talent, backgrounds, and experiences to drive speed, productivity, innovation, and growth.

Our internship program will give you a chance to get real world business experience and build your network before graduation. We are seeking an energetic, responsible intern to join our growing organization. In this position, you will be expected to learn the ins-and-outs of our daily routines and procedures. You will focus on learning how our organization runs, and can be expected to gain valuable insight that can further your interest in your chosen career field.

Thermo Fisher Scientific Inc. (NYSE: TMO) is the world leader in serving science. With revenues of $25 billion and the largest investment in R&D in the industry, we give our 80,000 employees the resources and opportunities to make significant contributions to the world. The customers we serve fall within pharmaceutical and biotech companies, hospitals and clinical diagnostic labs, universities, research institutions and government agencies. Our products and services help accelerate the pace of scientific discovery, and solve challenges ranging from complex research to routine testing to field applications.

Summary Of Internship

The Corporate Real Estate Internship position provides an opportunity for students who are currently pursuing a management, real estate, facilities, construction, or architectural related degree to get hands on experience working with professionals in a fast-paced environment. They will be a part of the global corporate real estate team that supports over 31 million square feet of space in over 50 countries. They should have an analytical background with some experience in real estate and a passion for continuous improvement and excellence. The intern should be creative with an attention to detail and the desire to manage and design space delivering the best employee and visitor experience, while supporting the company’s businesses in a fiscally responsible manner to ensure we’re maximizing shareholder value. The position starts in June, paid working 40 hours per week through August.

Essential Functions
Will work closely with the Director of Global Real Estate and the team on projects involving Thermo Fisher properties
Will be mentored by Real Estate Manager, Director of PMO (Project Management Office), Senior Office Services and other functional personnel to help develop the intern's skill set
Will have exposure to project management process for real estate including becoming familiar with the various technology platforms the group currently uses to support the portfolio and their facilities
Will participate in various quarterly reviews with the company’s divisional leadership teams and corporate functions such as IT, Security, Risk Management and other adjacent groups
Will help to review department’s reporting tools including the quarterly real estate report; the intern will be expected to evaluate and recommend ways to enhance these reports to provide better data analytics to the company
Will participate in developing KPIs and other ways to manage, evaluate and improve third party vendors such as facilities service providers, and CRE partners such as brokerage and project managers
Support an ongoing initiative to publish an updated corporate real estate playbook to document standards and processes as well as reviewing the company’s new Global Flexible Workplace Strategy and other ways to help drive improved productivity and space optimization
Participate in the team’s annual real estate meeting with exposure to the global team in Mid-June
Assist the facilities team with the day to day operation of the company’s global headquarters and become familiar with daily tasks to help review and make recommendations on ways we can improve the service delivery and overall efficiency of the team
Specific tasks will be tailored to the intern’s experience level and abilities
Accept candid feedback and look for areas of opportunity for continuous improvement and improved productivity

Skills And Abilities
Ability to work independently and as a member of a cross-functional team
Willingness to learn, be mentored, and improve their aptitude in global real estate
Desire to contribute and improve new and existing real estate processes
Exceptional customer focus – we strive to exceed expectations
Desire to teach members of the team about technology, trends and in other areas of expertise that can help improve the team’s ability to deliver best in class real estate solutions
Desire to contribute and improve new and existing real estate processes

Qualifications
Student currently enrolled in classes leading to a degree in a related field
Familiar with real estate, preferably commercial properties, construction or design

At Thermo Fisher Scientific, each one of our 80,000 extraordinary minds has a unique story to tell. Join us and contribute to our singular mission—enabling our customers to make the world healthier, cleaner and safer. Apply today!

Thermo Fisher Scientific is an EEO/Affirmative Action Employer and does not discriminate on the basis of race, color, religion, sex, sexual orientation, gender identity, national origin, protected veteran status, disability or any other legally protected status.",https://www.linkedin.com/jobs/view/externalApply/2495376449?url=https%3A%2F%2Fthermofisher%2Econtacthr%2Ecom%2F81988878%3FrefId%3D34jd24&urlHash=fprA&refId=9c41e111-a795-4d6f-b886-19ee165253de&trackingId=30KB7bMT%2BQNSLE7ehVJ8cQ%3D%3D&trk=public_jobs_apply-link-offsite
Real Estate Development Intern,Carmel Partners,"New York, NY","Carmel Partners is a well-capitalized private real estate firm with expertise in the investment and development of multi-family real estate. Our mission is to build and enhance high quality communities using innovative ideas and solutions that create value for our investors, residents and associates. 

The Development Intern will be responsible for supporting the Development and structured finance teams in providing financial modeling, deal underwriting and analysis, market research, transaction due diligence, and approval memoranda for development and acquisitions. This position offers an excellent opportunity to learn and experience the real estate development business. 

Who you are

You’re productive in collaborative team settings as well as on your own, and either way you deliver quality work. You’re a pro at communicating on and off the page, and understand the importance of building great relationships. You keep a cool head while managing multiple projects in a fast-paced environment. Above all, you always demonstrate impeccable judgement and integrity.

What you’ll do:

Conducts long term market research, and rent studies
Performs financial analysis
Assists with due diligence
Writes memoranda
Produces reports, including cash flow projections, excel modeling, and associated sensitivity analyses
Prepare development pro forma and perform financial feasibility and sensitivity analysis
Works closely with NY Development team members
Attend meetings with architects, sellers, brokers, site visits, etc.
Create and maintain routine and ad hoc reporting
Assist with closings
What you’ll bring

Currently pursuing an undergraduate or graduate degree in Architecture, Real Estate, Finance, Computer Science, or Business with a strong record of academic achievement
Familiarity with ESRI
General understanding of real estate and development industry
Strong Excel skills and financial modeling experience
General understanding of financial statement.
Excellent written communication skills
Key Program Components:

Internships last 8 - 12 weeks
Candidates must be authorized to work in the United States
Carmel Partners will not sponsor visas for this position
This is a paid internship program. Compensation is based on company guidelines. No additional benefits are offered with this position 
Carmel Partners, Inc. is an equal opportunity employer and affords equal opportunity to all applicants for all positions without regard to race, color, religion, gender (including pregnancy), national origin, age, disability, veteran status, sexual orientation, or any other status protected under local, state, or federal laws.",https://www.linkedin.com/jobs/view/externalApply/2466468044?url=https%3A%2F%2Frecruiting%2Eultipro%2Ecom%2FCAR1041%2FJobBoard%2Ff19a3aa9-abdb-1b6d-46ec-d3e4716019ec%2FOpportunity%2FOpportunityDetail%3FopportunityId%3Da4f54347-1f09-475d-a027-9dd832df8c81%26utm_source%3DLINKEDIN&urlHash=6is3&refId=9c41e111-a795-4d6f-b886-19ee165253de&trackingId=%2FHSU3YdYZi%2Bl2Boa%2BeDOuA%3D%3D&trk=public_jobs_apply-link-offsite
Real Estate Intern (Summer 2021),Rivian,"Los Angeles, CA","Rivian is on a mission to keep the world adventurous forever. This goes for the emissions-free Electric Adventure Vehicles we build, and the curious, courageous souls we seek to attract.

As a company, we constantly challenge what’s possible, never simply accepting what has always been done. We reframe old problems, seek new solutions and operate comfortably in areas that are unknown. Our backgrounds are diverse, but our team shares a love of the outdoors and a desire to protect it for future generations.

We operate development centers in Plymouth, Michigan; Southern California (Irvine, Carson & LA); Silicon Valley (San Jose and Palo Alto); Vancouver, British Columbia; and Surrey, England; as well as a manufacturing facility in Normal, Illinois.

Internship Term: Summer 2021
Rivian internships are experiences optimized for student candidates. To be eligible, you must be an undergraduate or graduate student in an accredited program during the internship term. If you are not pursuing a degree, please see our full time positions at Rivian.com/careers

Note that if your university has specific requirements for internship programs, it is your responsibility to fulfill those requirements.

Role Summary

In this position you will support a Regional Manager with the execution of new charging sites in target service areas for DCFC and L2 charging.

Responsibilities
Be the boots on the ground gathering market intelligence, identifying strategic sites and surveying key local partners.
Collaborate with data science team to build suggested travel stops including, but not limited to: SoC (State of Charge) needed when departing, necessary stops en route and charging time at each stop
Support Regional Manager with any documentation related to the transaction process flow and critical dates, such as notices to exercise lease options.
Monitor and maintain internal project tracking system to ensure timely transaction completion .
Preparing presentations to relevant cross functional teams including Legal, Environmental Health & Safety and Executive Leadership.
Autonomy to run full cycle real estate charging process from initial outreach to charger deployment and activation, with support from Regional Manager.
Exposure to all critical charging teams: Site Development (Real Estate), Deployment (Construction), Data Science and Vendor Partners.


Qualifications
Currently pursuing a Bachelor’s or Masters in Real Estate Management, Business, Sustainability or other relevant degrees
Requires strong PowerPoint or Keynote skills
Requires intermediate to advanced Excel skills
Requires a very organized and motivated personality
Requires curiosity, and a desire to learn real estate and the Electric Vehicle charging market.
Requires good communication, writing and presentation skills.


Equal Opportunity

Rivian is an Equal Opportunity Employer and Prohibits Discrimination and Harassment of Any Kind: Rivian is committed to the principle of equal employment opportunity for all employees and to providing employees with a work environment free of discrimination and harassment. All employment decisions at Rivian are based on business needs, job requirements and individual qualifications, without regard to race, color, religion or belief, family or parental status, or any other status protected by the laws or regulations in the locations where we operate. Rivian will not tolerate discrimination or harassment based on any of these characteristics. Rivian encourages applicants of all ages.

Privacy

We take your privacy seriously. For details please see our Candidate Privacy Notice.",https://www.linkedin.com/jobs/view/externalApply/2479941396?url=https%3A%2F%2Fboards%2Egreenhouse%2Eio%2Frivian%2Fjobs%2F4316645003%3Fs%3DLinkedIn%26source%3DLinkedIn&urlHash=0DeA&refId=9c41e111-a795-4d6f-b886-19ee165253de&trackingId=5jURhetx4i%2FlgzDpDiqDCQ%3D%3D&trk=public_jobs_apply-link-offsite
"Intern, Corporate Real Estate",Corning Incorporated,"Corning, NY","Requisition Number: 42711

Corning is one of the world’s leading innovators in materials science. For more than 160 years, Corning has applied its unparalleled expertise in specialty glass, ceramics, and optical physics to develop products that have created new industries and transformed people’s lives.

Corning succeeds through sustained investment in R&D, a unique combination of material and process innovation, and close collaboration with customers to solve tough technology challenges.

Corning’s summer internship experience is rich with hands-on learning. You’ll live, work, and experience the communities in which Corning operates, while building on-the-job skills.

The purpose of our Intern Program is to raise the bar on talent by strengthening our pipeline for entry level roles for our immediate and future needs.

To be considered for an internship at Corning Incorporated, you must be actively enrolled at a college or university as a full-time student seeking a bachelor’s degree or higher. You must also have a current cumulative GPA of 3.00 or higher (on a 0.00 to 4.00 scale).

Shape your future; apply today!

Program Benefits
Competitive salaries
Housing assistance
Travel reimbursement
Intern Activities
Social and networking events
Volunteer opportunities
Community Involvement
Travel Requirements (please Note If International)
Open to possible 1- or 2-week travel during the internship
Hours Of Work/work Schedule/flex-time
M-F 8am – 5pm
Duration: Summer 2021, 8-12 weeks
Responsibilities
Participate in corporate real estate transaction meetings
Perform initial real estate market research for newly initiated projects
Work to prepare financial analysis and review those performed by consultant
Assist performing Decision Analysis for real estate options
Review, Draft and propose edits to request for proposals, letter of intent and draft lease documents
Review draft leases based on CRE Lease Guidelines to make suggestions
Records Research – Easements, Access Agreements, Right of Way – Research at Office of Records to obtain copies for CRE files.
Cross check documents found at Office of Records with Harbor Flex System, scan missing docs for COA to upload to share drive and send to LSA.
Owned Properties - Organization of Folders
Review real estate files and make improvements on filing and cleaning out of duplicate material
Qualifications
BS in Finance, Interior Design, Architecture, Urban Planning or Construction/Project Management
Master’s degree or MBA in process
A degree of cultural awareness and demonstrated experience working with and understanding various cultures
Ability to analyze problems and opportunities, conclude direction and make critical decisions
Strong communications (written and verbal) skills.
This position does not support immigration sponsorship.

We prohibit discrimination on the basis of race, color, gender, age, religion, national origin, sexual orientation, gender identity or expression, disability, or veteran status or any other legally protected status.

We will ensure that individuals with disabilities are provided reasonable accommodation to participate in the job application or interview process, to perform essential job functions, and to receive other benefits and privileges of employment. Please contact us to request accommodation.",https://www.linkedin.com/jobs/view/externalApply/2455096191?url=https%3A%2F%2Fcorningjobs%2Ecorning%2Ecom%2Fjob%2FCorning-Intern%252C-Corporate-Real-Estate-NY-14831%2F690603900%2F%3Futm_source%3DLINKEDIN%26utm_medium%3Dreferrer&urlHash=SGf0&refId=9c41e111-a795-4d6f-b886-19ee165253de&trackingId=CpUZ3nIxQULDm%2FiFQcNf1g%3D%3D&trk=public_jobs_apply-link-offsite
Real Estate Research Intern - LLH,Thompson Thrift,"Indianapolis, IN","Thompson Thrift is one of the fastest growing real estate companies in North America and we are looking for you!
Are you a student looking for experience that helps you grow and expand your horizons?
Do you like a fast paced environment working with cutting-edge technologies?
Do you want to come back from your summer internship and brag to your friends about all of the cool projects and experiences you had?

If you answered YES to any of these questions, then we need you! Apply now

Position Overview
The intern will be splitting time between Research and Eric Wojak, SR. Development Director -Mixed Use, in the Luxury Leased Homes division. In Research, you will be monitoring and compiling information from a new research website, a subscription to the John Burns Real Estate Consulting platform and drawing data insights from that. In LLH, it will involve deep dives into selected target markets, pulling market data from desired submarkets using CoStar and other available secondary sources.",https://www.linkedin.com/jobs/view/externalApply/2495153127?url=https%3A%2F%2Fjsco%2Ere%2F9l3mp&urlHash=6GDs&refId=9c41e111-a795-4d6f-b886-19ee165253de&trackingId=nZ%2Bc%2BjozpvhtgjC8Wvcjag%3D%3D&trk=public_jobs_apply-link-offsite
Real Estate Development Intern,PulteGroup,"Tucson, AZ","We know that BUILDING HOMES & COMMUNITIES BEGINS WITH BUILDING THE BEST TEAM!

How would you like to be a part of team that has been providing the American Dream of homeownership to families for more than 60 years? PulteGroup is a FORTUNE 500 company and one of America’s top residential builders. We put the consumer at the center of everything we do and we stand above the competition in our commitment to quality.

Our Vision is to Build Consumer Inspired Homes & Communities to Make Lives Better and we believe that success starts with having the right people.

At PulteGroup, we are committed to diversity and inclusion. We value the differences of each employee and understand that being consumer inspired means that we reflect the diversity of the consumers we serve.

A position with PulteGroup offers a rich, fulfilling and rewarding career across multiple geographies and brands. If you are interested in being a part of our team, let’s talk about your career with PulteGroup!



PulteGroup is offering a unique opportunity to join our team in Tucson as an Intern. The development team at PulteGroup is a small, highly focused group supported by the Arizona Division for back office functions. The Tucson team is constantly evaluating sites for development, project managing new developments, and overseeing construction of new neighborhoods. PulteGroup in Tucson offers three distinct brands to consumers- Pulte Homes, Del Webb, and Centex. We are growing our pipeline of projects and have opened an opportunity for an internship in our Tucson office. Depending on the applicant’s schedule, this position will be around 20 hours per week and pays $20/hour. The Internship begins on April 1st and will run through Summer of 2021.




JOB RESPONSIBILITIES:


Assist in the evaluation and underwriting process for potential residential real estate developments
Attend meetings with consultants and contractors to assist planning a large, multi-phase development
Analyze past costs of development to help create a database of key figures for use in future investment analysis
Visit construction sites to advance knowledge of development and review status
More detailed responsibilities will be assigned depending on the Intern’s strengths and interests. In general, assist the team with acquisition, project management and development.",https://www.linkedin.com/jobs/view/externalApply/2457430623?url=https%3A%2F%2Frecruiting%2Eadp%2Ecom%2Fsrccar%2Fpublic%2FRTI%2Ehome%3Fr%3D5000698749406%26c%3D2160113%26d%3DExternalCareerSite&urlHash=MeIK&refId=9c41e111-a795-4d6f-b886-19ee165253de&trackingId=Rq3mLvv%2FMqINlyPjJ7pFeg%3D%3D&trk=public_jobs_apply-link-offsite
Summer Real Estate Intern,Wedgewood LLC,"Redondo Beach, CA","What began as a very small team more than three decades ago has grown into a nationally recognized leader in the real estate investment industry, and Wedgewood is ready for our next class of interns who share our drive to innovate, take risks, and grow. If you’re looking for a company that empowers their team and a chance to learn more than just data entry, you’ve found it. Our summer interns will specialize in their preferred fields, gaining hands-on real-world experience. You won’t just learn about Real Estate - you’ll learn about investment strategy, acquisitions, real estate brokerage, design and flips, asset management, and more, all in a competitive and fun environment.

Up for the challenge? We are looking for well-rounded, hardworking students who are eager to learn alongside successful professionals in a fast-paced team setting. Our program is designed so that you can gain a meaningful, consolidated and in-depth view of our business, giving you the tools you need to succeed long-term. 40% of our interns in the past received full-time offers - will you be next?

What You’ll Do
Assist our real estate brokerage team- Maxim Properties on regular projects
Work collaboratively with other departments on special intern projects
Perform additional duties as needed, including data entry, filing, and maintaining organizational systems

What You’ll Need
Junior or Senior class standing at your University or College
Coursework experience in Real Estate
Strong communication, organization, and time management skills
The ability to work collaboratively
Drive to learn, and willingness to take on challenges

What's In It For You
Direct exposure to high profile, successful entrepreneurs
Insight into the real estate industry and Wedgewood’s multiple lines of business including:
Acquisition & Rehab
Real Estate Brokerage: Asset Sales
Asset Management
Accounting & Finance
Private Money Lending
Legal
IT
The potential for full-time employment after graduation
If you are hired as a full-time employee after your internship, you will enjoy the subsequent benefits and perks.",https://www.linkedin.com/jobs/view/externalApply/2484932533?url=https%3A%2F%2Fapp%2Ejobvite%2Ecom%2FCompanyJobs%2FCareers%2Easpx%3Fk%3DApply%26j%3DoC76efwN%26s%3DLinkedInLimited&urlHash=WsxF&refId=9c41e111-a795-4d6f-b886-19ee165253de&trackingId=LdofR8N0DHIk5KbxDxOAUw%3D%3D&trk=public_jobs_apply-link-offsite
