title,company,location,requirements,link
"Intern, Real Estate Development",Enterprise Community Partners,"Baltimore, MD","Enterprise is a national nonprofit on a mission to make home and community places of pride, power and belonging for all. To make that possible, we operate the only organization designed to address America’s affordable housing crisis from every angle: we develop and deploy programs and support community organizations on the ground; we advocate for policy on a nonpartisan basis at every level of government; we invest capital to build and preserve rental homes people can afford; and we own, operate and provide resident services for affordable communities. All so that people not only make rent, they build futures. With this end-to-end approach, 40 years of experience and thousands of local partners, Enterprise has built and preserved 793,000 affordable homes, invested $61 billion in communities and changed millions of lives.

Enterprise offers career opportunities in our offices across the country with an exceptional benefits package .

Job Description Summary

Enterprise Community Development, Inc. (“ECD”) is the leading Mid-Atlantic nonprofit developer, owner, and operator of a $1 billion portfolio of 110+ apartment communities and 16,000+ homes. As part of the Enterprise family, ECD has access to a full suite of capital resources, housing solutions, and public policy support. Formed from two legacy organizations, Enterprise Homes, Inc., and Community Preservation and Development Corporation (CPDC), ECD has a combined 60 years of experience building and preserving affordable housing to uplift communities for economic stability and mobility.

The Intern will work with the Real Estate Development team to build and refine complicated Microsoft Excel models regarding the financing of affordable and mixed income housing projects, while providing support for project specific tasks that may include non-financial areas of the development process

Responsibilities

Job Description
Collect existing financial proformas from real estate development staff and create a consolidated Excel spreadsheet that integrates the presentation and functionality of existing models while making enhancement under direction of supervisor.
Develop a “feasibility” model in Microsoft Excel that builds off existing examples within ECD but integrates financial feasibility with zoning and construction inputs.
Work closely with one ongoing project in one of these key areas; prospective project, predevelopment project, or construction. Assist and shadow the development associate or officer on the project to help with daily needs and learn about this stage of the development process. Examples of tasks will be creating spreadsheets, looking at market research, mapping, creating presentations, and attending onsite meetings.

Qualifications
College graduate student with coursework and/or experience in real estate development, finance or urban planning is required.
Awareness of underlying formulas of real estate finance is essential.
Basic and advanced Excel modeling skills are a requirement including the ability to program Look Up and If Than functions.
Knowledge of land use and neighborhood planning and real estate development concepts are a plus
Training and Support
Orientation to ECD and its communities. Development of initial work plan and timeline with supervisor related to above tasks. Weekly meetings to review, plan, and provide coaching around various aspects of the internship experience. Participate in staff meetings, external meetings, and trainings as available and relevant to the scope of the position. Participate in an intern program feedback process.
Learning Opportunities
Witness the affordable housing development process from project selection to construction to asset management and resident engagement.
Experience the day to day operations of a real estate development in an affordable housing corporation and understand the federal, state, and local policies and programs used in this industry and how they influence operations of a nonprofit developer.
Gain exposure to the financing tools used in the industry, including Low-Income Housing Tax Credits (LIHTC), HUD financing products, and programs (e.g. Section 8), GSE products (e.g.’ Fannie Mae) and typical local government programs.
Develop a working knowledge of the policies and tools that local governments use in urban planning, land use, and real property development (e.g. comprehensive plans, small area plans and affordable housing policies.
Learn to function in a team environment and experience how the work develops through team meetings on a project, with staff, lenders, government stakeholders, and development consultants (e.g. architects and civil engineers).
Remote and virtual work available.",https://www.linkedin.com/jobs/view/externalApply/2442900237?url=https%3A%2F%2Fwd5%2Emyworkdaysite%2Ecom%2Fen-US%2Frecruiting%2Fenterprisecommunity%2FEnterpriseCareers%2Fjob%2FSilver-Spring-MD%2FIntern--Real-Estate-Development_REQ199&urlHash=kZPz&refId=9c41e111-a795-4d6f-b886-19ee165253de&trackingId=d1AGAjGuT3V7vnB1R%2FeoTA%3D%3D&trk=public_jobs_apply-link-offsite
Real Estate Intern,Cushman & Wakefield,"Cincinnati, OH","Job Title
Real Estate Intern

Job Description

Job Description Summary
Provide full administrative support, including front-line phone answering, opening/closing of office, attending/sitting at front reception desk, typing/completing reports, filing (paper and electronic), and distribution of correspondence.
Assist Project Manager with various appropriate duties and learn project management process.
Assist Transaction Manager with various appropriate duties and learn transaction management process.
Assist Capital Manager with various appropriate duties and learn capital project process.
Generate and distribute tenant communication blasts.
Set-up and appropriately utilize tenant contact distribution lists via email and text.
Schedule and coordinate meetings, conference calls, events, as requested.
Assist in client site/building on-boarding activities at the direction of Property Manager.
Execute lease administration activities including gaining initial tenant contact information, quarterly update to the real estate building reference manual, tenant insurance information, etc.
Build and generate reports as requested out of all databases in use (YARDI, CoStar, CMS).
Prepare and code invoices for Property Manager’s approval.
Ensure prompt and accurate completion of vendor/supplier contracts and supporting certificates of insurance. Save all to appropriate databases.
Track and file vendor/supplier contracts and certificates of insurance; utilize provided databases to keep track of expirations and gain new contracts at least 60 days prior to expiration of former contract.
Utilize, monitor, maintain the work order system and prepare monthly reports for Property Manager regarding performance and status of work orders.
Maintain property, lease and contract files (hard copy and electronic) and any other files located within the real estate office.
Promote and foster positive relationships with tenants and owners and track service calls via work order system.
Other duties as assigned.
Cushman & Wakefield provides equal employment opportunity. Discrimination of any type will not be tolerated. Cushman & Wakefield is an Equal Opportunity / Affirmative Action employer. All qualified applicants will receive consideration for employment without regard to race, color, religion, sex, national origin, sexual orientation, gender identity, disability, protected veteran status or any other characteristic protected by state, federal, or local law.",https://www.linkedin.com/jobs/view/externalApply/2425247914?url=https%3A%2F%2Fcareers%2Ecushmanwakefield%2Ecom%2Fglobal%2Fen%2Fjob%2FCUWAGLOBALR110487ENGLOBALEXTERNAL%2FReal-Estate-Intern%3Futm_source%3Dlinkedin%26utm_medium%3Dphenom-feeds&urlHash=zTqh&refId=9c41e111-a795-4d6f-b886-19ee165253de&trackingId=iUCktYIn0es%2FI7lpGNpyxQ%3D%3D&trk=public_jobs_apply-link-offsite
Campus Intern - Real Estate,JE Dunn Construction,"Kansas City, MO","Best people + right culture. These are the driving forces behind JE Dunn’s strategy for success. By hiring the best people we can find, giving them interesting and challenging work, and letting them share in the company’s rewards, we’ve found a sustainable way to grow in our industry for the last 90+ years.

JE Dunn believes in providing the best tools for employees to get the job done right. Lean operation processes. Digital document collaboration. LEED-certified, occupant-focused environments. We make sure our workforce is prepared for the job, and we expect the best. Our diverse teams around the country strive to enrich lives through inspired people and places every day, and we need inspired people like you to join us in our pursuit of building perfection.

Role Summary

Key Role Responsibilities - Core

Internship Overview – Projects And Responsibilities
Assist in screening of new investment opportunities, financial modeling, due diligence, and SREO updates as needed.
Intern will review and underwrite live investments with investment team members. An intern will gain proficiency in underwriting different property sectors and an understanding of the full investment process.
Assist in identifying and researching industry trends, and the competitive landscape of the markets across the country.
Entails reviewing third party research reports and preparing summarized reports for team members to review.
Collaborate with company employees in Pre-construction Services for new development opportunities.
Assist in researching and making recommendations on property/asset management issues and coordination.
Obtain additional estimates for ongoing maintenance requirements on company owned properties and compare and make recommendations. Investment managers will provide the agreement and communication from current providers and other pending bids for reference/comparison.
Work with project leads to obtain project related bids for certain properties.


Key Role Responsibilities - Additional Core
Assist in consolidating relevant information/questions in the focus areas where the team needs coordination help. This could be lead generation, and/or partnership opportunities.
Help interface with cross-functional teams
Property and asset management coordination as needed
Scope of internship is varied and complex and requires independent judgement, as it is required to assist where needed.


Knowledge, Skills & Abilities
Able to be flexible
High energy
Leadership potential
Strong work ethic
Excellent written and verbal communication skills
Works well under pressure and in deadline situations


Education
Enrollment in accredited Bachelors Degree program or higher, and coursework in the area(s) related to the internship opportunity


Experience

N/A

Working Environment

At JE Dunn, you’ll receive an abundance of resources dedicated to ensuring your success and future development

Employee-focused culture
Whether it’s our Employee Stock Ownership Plan (ESOP), company wellness program, or modern workspaces, we put the satisfaction of our employees at the forefront of everything we do.

Award-winning Benefits Package

Named one of Plan Sponsor Magazine’s 2015 Plan Sponsors of the Year, JE Dunn’s employee benefits package ranks among the top of our peer group, meeting and exceeding standard expectations.

Professional training opportunities
Our employee development team works full-time to create growth opportunities across the company. We encourage employees to take command of their own development, and we make sure they have what they need to take that next step.

Community-driven workforce
Corporate and personal involvement in the communities in which we work is simply part of the job--JE Dunn as an organization is proud to donate over 10 percent of our pre-tax earnings to charities around the country each year.

JE Dunn Construction is committed to hiring and retaining a diverse workforce. We are proud to be an Equal Opportunity/Affirmative Action Employer and it is our policy to provide equal opportunity to all people without regard to race, color, religion, national origin, ancestry, marital status, veteran status, age, disability, pregnancy, genetic information, citizenship status, sex, sexual orientation, gender identity or any other legally protected category. JE Dunn Construction is a background screening, drug-free workplace.

Accessibility: If you need an accommodation as part of the employment process please contact Human Resources at accommodations@jedunn.com

JE Dunn Construction Company does not accept unsolicited resumes from search firms or agencies. Any resume submitted to any employee of JE Dunn Construction without a prior written search agreement will be considered unsolicited and the property of JE Dunn Construction Company. Please, no phone calls or emails.",https://www.linkedin.com/jobs/view/externalApply/2485415736?url=https%3A%2F%2Fjobs%2Ejedunn%2Ecom%2Fjob%2FKansas-City-Campus-Intern-Real-Estate-MO-64106%2F722852600%2F&urlHash=2kZP&refId=9c41e111-a795-4d6f-b886-19ee165253de&trackingId=XyYQF9IqjrkdHqYeBAHl6A%3D%3D&trk=public_jobs_apply-link-offsite
Summer Real Estate Intern,"Advanced Air, LLC","Redondo Beach, CA","What began as a very small team more than three decades ago has grown into a nationally recognized leader in the real estate investment industry, and Wedgewood is ready for our next class of interns who share our drive to innovate, take risks, and grow. If you’re looking for a company that empowers their team and a chance to learn more than just data entry, you’ve found it. Our summer interns will specialize in their preferred fields, gaining hands-on real-world experience. You won’t just learn about Real Estate – you’ll learn about investment strategy, acquisitions, real estate brokerage, design and flips, asset management, and more, all in a competitive and fun environment.

Up for the challenge? We are looking for well-rounded, hardworking students who are eager to learn alongside successful professionals in a fast-paced team setting. Our program is designed so that you can gain a meaningful, consolidated and in-depth view of our business, giving you the tools you need to succeed long-term. 40% of our interns in the past received full-time offers – will you be next?

What You’ll Do
Assist our real estate brokerage team- Maxim Properties on regular projects
Work collaboratively with other departments on special intern projects
Perform additional duties as needed, including data entry, filing, and maintaining organizational systems

What You’ll Need
Junior or Senior class standing at your University or College
Coursework experience in Real Estate
Strong communication, organization, and time management skills
The ability to work collaboratively
Drive to learn, and willingness to take on challenges

What's In It For You
Direct exposure to high profile, successful entrepreneurs
Insight into the real estate industry and Wedgewood’s multiple lines of business including:
Acquisition & Rehab
Real Estate Brokerage: Asset Sales
Asset Management
Accounting & Finance
Private Money Lending
Legal
IT
The potential for full-time employment after graduation
If you are hired as a full-time employee after your internship, you will enjoy the subsequent benefits and perks.

SDL2019-128",https://www.linkedin.com/jobs/view/externalApply/2485916364?url=https%3A%2F%2Fwww%2Estartwire%2Ecom%2Fjobs%2Fredondo-beach-ca%2Fsummer-real-estate-intern-2760213221%3Fcampaign%3D129%26source%3DLI&urlHash=aTu7&refId=9c41e111-a795-4d6f-b886-19ee165253de&trackingId=RXw8MI2dv1wM46B%2F6LMzhA%3D%3D&trk=public_jobs_apply-link-offsite
Houston Real Estate / Acquisitions Intern,Xite Realty,"Austin, TX","Xite Realty, LLC is a Texas-based commercial real estate company focused on representing the needs of Healthcare professionals and organizations. Our growing, entrepreneurial firm seeks an intern for our Houston, TX office whose role will be to assist brokers in the day-to-day operations of the company.

Responsibilities
To provide administrative support as required for Houston and Austin teams
Run and manage our market area demographics using ESRI
Update our internal property map with brochure links
Handle communication of clients and others in an effective manner (i.e. gathering of building information for market studies)
Prepare (type, revise, add graphics, etc.) market studies
Assist brokers in the preparation of real estate documents such as letters of intent, market studies (in google maps), contracts, etc.
Organize and coordinate client/visitor/property tours
Assist brokers in preparation for meetings (i.e. set up the conference room with any materials needed & set up virtual meetings
Prepare (type, revise, add graphics, etc.) marketing materials
Provide database management (adding, updating, deleting, quality control) incorporating client-specific information into a CRM to manage clients and lead distribution


Requirements
Proficiency in Microsoft Word, Excel & Outlook, PowerPoint, ESRI, SalesForce, Costar, and Loopnet is a plus
Experience as an administrative assistant and/or in commercial real estate is a plus
Possess good organization, communication and follow-up skills
Be tactful and diplomatic through accurate verbal, written, and interpersonal skills
Be mature, reliable, dependable and professional
Be detail-oriented and possess critical thinking skills
Ability to work independently yet also thrive working as a team member
Willingness to learn
This position is not remote, only local resumes will be considered


Benefits

This position pays $10 per hour and is flexible to adapt to your schedule.

Schedule M-Th 10 00am-3 00pm | Flexible

Please email your resume’ to afox@xiterealty.com or visit our website at www.xiterealty.com",https://www.linkedin.com/jobs/view/externalApply/2485916364?url=https%3A%2F%2Fwww%2Estartwire%2Ecom%2Fjobs%2Fredondo-beach-ca%2Fsummer-real-estate-intern-2760213221%3Fcampaign%3D129%26source%3DLI&urlHash=aTu7&refId=9c41e111-a795-4d6f-b886-19ee165253de&trackingId=RXw8MI2dv1wM46B%2F6LMzhA%3D%3D&trk=public_jobs_apply-link-offsite
Real Estate Listing Intern,Furner Realty Group,"Lancaster, PA","Have you considered getting into Real Estate but not sure where to start? This is your opportunity to dip your toe in the water by helping out a quickly growing real estate team to achieve their 2021 goals! You will gain exposure to all aspects of Real Estate and work on incredibly valuable projects while receiving guaranteed pay. This is a part-time internship with flexible hours to start. Upon learning the culture and gaining experience there may be potential to join the team in the future!

Responsibilities:
• Assist with marketing efforts to find new seller clients
• Help new seller clients prepare to hit the market “for sale”
• Support the sales process for our clients from “for sale” through “SOLD”
• Opportunity to help with other high-value initiatives for the team

Qualifications:
• Must have a driver's license and access to a vehicle
• Must be local to local to Lancaster County, PA or able to travel to and from the area.
• Eager to learn about real estate and excited to work
• Ability to follow instructions and work independently (when appropriate)
• A real estate license is not necessary for this position.

What We Will Do For You:
• One-on-one access to the owner
• Coaching and training for all assigned initiatives
• Guaranteed hourly pay
• Moderate flexibility in hours worked with some remote work allowed

** Remote Work opportunity will be available, but this job will primarily entail in-person responsibilities. **",https://www.linkedin.com/jobs/view/externalApply/2485916364?url=https%3A%2F%2Fwww%2Estartwire%2Ecom%2Fjobs%2Fredondo-beach-ca%2Fsummer-real-estate-intern-2760213221%3Fcampaign%3D129%26source%3DLI&urlHash=aTu7&refId=9c41e111-a795-4d6f-b886-19ee165253de&trackingId=RXw8MI2dv1wM46B%2F6LMzhA%3D%3D&trk=public_jobs_apply-link-offsite
Real Estate Intern,Kroger,"Cincinnati, OH","Company Name: Kroger General Office
Position Type: Intern
FLSA Status: Non-exempt

Complete an 8-10 week program in the General Office, working with managers, to gain an understanding of the Corporate Real Estate Department. Role modeland demonstrate the company's core values of respect, honesty, integrity, diversity, inclusion and safety of others.

Essential Job Functions
Train at General Office Real Estate.
Participate in department meetings.
Complete specific internship assignments, as requested.
Complete cumulative project (summary of internship accomplishments) and present to appropriate Managers.
Must be able to perform the essential functions of this position with or without reasonable accommodation.
Minimum Position Qualifications:
Junior standing or higher at an accredited college or university
Major in Real Estate or Finance
Minimum 3.0 GPA in Major
Proven financial analysis skills required
Proven verbal and written communication skills required
Responds to change as a positive challenge
Significant level of multi-tasking required
Ability to preserve confidentiality of information
Accuracy and attention to detail
Ability to work on own initiative
Commitment to providing customer service
Proficiency in Microsoft Office Suite (Word, Excel, PowerPoint, Outlook, etc.)
Desired Previous Job Experience
Completion of some coursework in the field of Real Estate
Experience in a professional work environment
Managing multiple priorities between school, work, or extra-curricular activities
Involvement in high school or college leadership and community activities
Education Level: High School Diploma/ GED Required
Required Certifications/Licenses: None
Position Type: Intern
Shift(s): [[mfield4]]
Regions: General Office- Cincinnati

States: Indiana; Kentucky; Ohio
Keywords: Real Estate Intern

Jobs at Kroger: At Kroger, we hire people who have a passion for helping others and who want to build a relationship with our Customers. No matter what stage of your career, you can build your future at Kroger. We look for people who want more, aspire to be more and work hard to achieve their goals. Our focus on keeping the Customer first is what makes us successful. As the largest traditional grocery chain in the U.S. and one of the world's largest retailers, we employee nearly half a million Associates across 35 states. We offer many opportunities not only in our stores, but in Manufacturing, Logistics, Marketing, Finance, Human Resources, and many other fields.

Company Overview: Kroger Family of Companies employs nearly half a million associates who serve over 11 million customers daily through a seamless shopping experience under a variety of banner names . At The Kroger Co., we are Fresh for Everyone™ and dedicated to our Purpose: To Feed the Human Spirit®. We are committed to creating #ZeroHungerZeroWaste communities by 2025. Careers with The Kroger Co. and our family of companies offer competitive wages, flexible schedules, benefits and room for advancement.

Posting Notes: OH || Cincinnati || 1014 Vine Street || 45202 || Kroger General Office || [[mfield2]] || Real Estate || Intern || Non-Exempt || Intern || None",https://www.linkedin.com/jobs/view/externalApply/2482397331?url=https%3A%2F%2Fjobs%2Ekroger%2Ecom%2Fkroger%2Fjob%2FCincinnati-Real-Estate-Intern-OH-45202%2F728439800%2F%3Futm_source%3DLINKEDIN%26utm_medium%3Dreferrer&urlHash=YseX&refId=9c41e111-a795-4d6f-b886-19ee165253de&trackingId=4XLUBmQdQL5%2FFD%2Fwl3aKiQ%3D%3D&trk=public_jobs_apply-link-offsite
