Id,Title,Company,Location,Required Qualifications,Link,Page Rank,
12,"Merchandising Intern","Staples Stores","Framingham, MA","Description

Staples US Retail Merchandising is looking for an enthusiastic intern to join our team and help activate our Brand strategy. Staples US Retail is on a journey to transform to be the leader in working and learning, and this role is part of the team to bring it to life for our customers. You’ll be a part of one of the most exciting seasons of the year at Staples US Retail - Back to School. And will have the opportunity to roll your sleeves up in a fast-paced, dynamic environment with a fantastic group of team- and results-oriented professionals.

The ideal candidate would possess a desire to learn new ideas/concepts on a daily basis, have an ability to work independently as well as cross functionally with many teams both internally and externally, and perform in a fast-paced environment with strict attention to detail.

Primary Responsibilities
Assist in SKU and Vendor set-up and maintenance process
Assist in Advertising Database maintenance
Assist in POG and Promo Database maintenance
Assist in Pricing Database maintenance
Create ad hoc reports and analysis as needed
Collect and organize product information from vendors
With direction from the Category Merchant, conduct market research, gather industry data, track trends, themes, competitive shopping to assist with item selection
Obtain product samples for Category Managers. Coordinate samples for photo shoots as needed.
Proof all Marketing vehicles including sku, copy, pricing and images


Qualifications

Essential skills and experience:
A college student or graduate who possesses a relevant degree or an equivalent level of real-life experience


Preferred Skills And Experience
Excellent knowledge of MS Office
Passion for digital, mobile and e-commerce and its best practices; specific technical knowledge preferred


Click to learn more about the employee benefits, programs and perks offered at Staples.

Staples is an Equal Opportunity Employer. All qualified applicants will receive consideration for employment without regard to race, color, religion, age, sex, sexual orientation, gender identity, national origin, protected veteran status, disability, or any other basis protected by federal, state, or local law.","https://www.linkedin.com/jobs/view/externalApply/2466668658?url=https%3A%2F%2Fwww%2Eapplytracking%2Ecom%2Fx%2Easpx%3Fmethod%3Ddirect%26type%3Dapply%26board%3DD92FCD45-1292-4AE2-B555-D7A273418B42%26Job%3D1155867%26ClientCode%3D17604&urlHash=gaSY&refId=9611182f-ebf8-422e-8f2b-227b545209e3&trackingId=UhXkdSHFIMbfyEDXDvNT3Q%3D%3D&trk=public_jobs_apply-link-offsite",0.03409426002491168,
33,"Brand Merchandising Intern","Giant Eagle, Inc.","Pittsburgh, PA","Job Summary

As an Intern, you will be given real-world experience and challenging opportunities to develop and expand skills needed to be a leader in the organization.

Job Description
Experience Required: GPA of 3.0 or higher; Completion of Sophomore year in college studies working toward a degree, Excellent work record; 0 to 6 months working experience; Strong proficiency in MS Office applications PowerPoint, Word, Excel & Outlook;
Education Required: Bachelors Degree
Lifting Requirement: Up to 50 pounds; Up to 25 pounds
Travel Required: Regional - Daily, 10 - 25%; Regional - Daily, Less than 10%; Regional - Overnight, 10 - 25%
Age Requirement: At least 18 years of age

Job Responsibilities
Engage in the daily tasks and responsibilities of the department.
Assist with department needs as instructed.

About Us

At Giant Eagle Inc., we’re more than just food, fuel and convenience. We’re one giant family of diverse and talented Team Members. Our people are the heart and soul of our company. It’s why we strive to create a nurturing environment that offers countless career opportunities to grow. Deep caring and solid family values are what makes us the one of the top work places for jobs in the Greater Pittsburgh, Cleveland, Columbus and Indianapolis Areas. From our Warehouses to our GetGo’s, our grocery Stores through our Corporate home office we are working together to put food on shopper’s tables’ and smiles on their faces. We’re always searching for the best Team Members to welcome to our family. We invite you to join our Giant Eagle family. Come start a lasting career with us.","https://www.linkedin.com/jobs/view/externalApply/2437652781?url=https%3A%2F%2Fjobs%2Egianteagle%2Ecom%2Fjob%2F-%2F-%2F1472%2F4938127648&urlHash=nWLh&refId=a1f80d45-8b43-40b3-9b8f-f440454e2593&trackingId=lR8W7Vx%2Filu4LP233FpVkw%3D%3D&trk=public_jobs_apply-link-offsite",0.0064637270924974115,
46,"Inventory Analyst Intern","Staples","Framingham, MA","Position Overview

In this position, you will be a central part of our Supply Chain organization. You will also interact with the Merchandising organization that manages the product assortment for our online delivery business. You will manage the flow of product as we bring in the most exciting products to drive sales and profit, and deliver the best customer experience. Inventory Analysts will have the opportunity to work closely with external vendors like HP, Clorox, Proctor & Gamble, and 3M.

You will have high-level exposure, development opportunities and a great deal of responsibility managing a product line from purchasing through to the end customer. There will be training to learn about the business, including E3 education (Staples Buying/Planning tool), and the specifics of Supply Chain in our Delivery networks. You will have an opportunity to meet senior leaders. You will work on projects that truly contribute to the overall business success, and you will present your work up to business leaders.

Responsibilities
As an Inventory Analyst your primary responsibility is to get the right amount of product into the right place at the right time. You will manage inventory levels, ads/promotions, product transitions, the overall flow of product and vendor relations. All of these levers serve to drive customer satisfaction, increase efficiency and maximize profit.
Utilize forecasting/planning/allocation systems to order product and ensure smooth flow direct from vendors into our delivery fulfillment centers.
Maintain appropriate levels of inventory and reduce out of stocks during critical events such as weekly ads and seasonal promotions.
Work with the Merchandising team to successfully plan and execute a variety of product transitions including new item launches, special promotions, seasonal buys, daily deals, etc.
Understand and action key daily reports, such as inactive inventory, weekly out of stocks, and forecast exceptions.
Ad hoc analytical assignments aimed at solving for a specific business opportunity


Qualifications

Basic Qualifications:
Pursuing a Bachelor’s degree in business, finance, operations, or a supply chain field
Requires a GPA of 3.0 or higher
Strong Microsoft Office skills


Preferred Qualifications
Analytical and process-oriented
Passionate about supply chain and retail merchandising
Enjoy working in teams and being highly communicative
Able to multi-task and be flexible with new initiatives


Staples is The Worklife Fulfillment Company, helping businesses of all sizes be more productive, connected and inspired. With dedicated account teams, category professionals, innovative brands and a curated product assortment for business, Staples provides customized solutions to help organizations achieve their goals. Interested in joining the team? Check out our perks and benefits !

Staples is an Equal Opportunity Employer. All qualified applicants will receive consideration for employment without regard to race, color, religion, age, sex, sexual orientation, gender identity, national origin, protected veteran status, disability, or any other basis protected by federal, state, or local law.","https://www.linkedin.com/jobs/view/externalApply/2476918969?url=https%3A%2F%2Fcareers%2Estaples%2Ecom%2Fglobal%2Fen%2Fjob%2FSTDEGLOBAL1149175EXTERNALENGLOBAL%2FInventory-Analyst-Intern%3Futm_source%3Dlinkedin%26utm_medium%3Dphenom-feeds&urlHash=ea53&refId=a1f80d45-8b43-40b3-9b8f-f440454e2593&trackingId=3N7iiefIdSXcCv7bACM75A%3D%3D&trk=public_jobs_apply-link-offsite",0.015550387170196085,
0,"Internship: Website Merchandising and Content Creation","Twisted Throttle","Providence, RI","The Company. Twisted Throttle® is an established company with a healthy growth record and a dynamic management team. Located in Exeter, Rhode Island, Twisted Throttle was founded at the cusp of the now-exploding adventure motorcycling craze and is currently positioned as one of the major players in the market. We provide premium bolt-on motorcycle accessories for the adventure, sport-touring, and sport bike markets, primarily serving European and Japanese motorcycle riders. As exclusive North American distributor for leading powersports and ADV brands (including SW-Motech, R&G and others), we also specialize in prototyping, product development, wholesale distribution, and Internet retail sales for the full line of Twisted Throttle’s house of brands.

The Experience. Our interns are placed within teams and given a manager and mentor to help them build technical skills, cultural competencies, and self confidence. By being integrated into a team, our interns get the opportunity to work on projects that have a real impact on our bottom line. Paid internships are available for students in many of the functional areas of our company, including:
• Data loading and management
• Writing and maintaining compelling content
• Organizing and editing images, videos, and product attributes
• Optimizing pages and websites to drive sales
• and more!

We are located in Exeter, Rhode Island (20 minutes west of URI in South Kingstown via route 138, 30 minutes south of RISD in Providence via I-95, or 45 minutes west of Salve Regina in Newport). Seasonal and annual internships are available with flexible hours, and many interns stay on after graduation as full time employees. Come join us for fun, learning, and motos!

Working Conditions: Enthusiasm for motorcycles is preferred for all positions at Twisted Throttle, as enthusiasm for any sport, outdoor, or adventure activity is key to fitting in with our passionate culture. (All new hires without previous motorcycle experience are provided opportunity to attend the motorcycle safety course and obtain their motorcycle driver's license.) Whether you are a motorcycle enthusiast or not, count on the contagion of the Twisted Throttle organization’s passion and drive. You will work in an office environment with a great management team that loves to work hard, have fun, and win!

Benefits and Perks:
• The Tame. Twisted Throttle provides competitive benefits for full time staff, including multiple health, dental and vision insurance options, Health Savings Account (HSA), Flexible Spending Account (FSA), term life insurance equivalent to one year's pay, 401k with company match, gym membership reimbursement, an Employee Assistance Program (EAP), subsidized classes and convention entry for professional development, and paid time off that grows with your time at the company. AFLAC benefits, including Cancer, Life, Disability and Accident plans, are also available.
• The Twisted. Aside from awesome discounts on powersports gear and motorcycles, our culture includes a few unconventional traditions. Quarterly employee appreciation days include Nerf jousting, trips to breweries, and motorcycle release parties. Our weekly Meat Wednesday is a group lunch where all departments get together for fun, recognition and vittles. Our Ducati espresso machine keeps us fueled in the office, and our Moto Sabbatical rewards completing four years of service with a nine-day paid motorcycle-related trip; Twisted Crew members have ventured on two wheels to Alaska, Key West, the Alps, Mexico and more on their sabbaticals.

zxw5zRjpXa","https://www.glassdoor.com/job-listing/internship-website-merchandising-and-content-creation-twisted-throttle-JV_IC1151289_KO0,53_KE54,70.htm?jl=3669635134&utm_campaign=google_jobs_apply&utm_source=google_jobs_apply&utm_medium=organic",0.006737932975733084,
27,"QVC Intern - Merchandising Buying - Summer 2021","QVC","West Chester, PA","Job Description Details

The Opportunity
QVC's Merchandising department is currently recruiting for our very competitive internship program. We are looking for top talent with the passion to drive the business. This program is a great opportunity for anyone that is dedicated at growing their Merchandising career in our business.
Who We Are
QVC is the world’s leading video and ecommerce retailer, offering a curated collection of desirable brands to millions of customers around the globe each day through broadcast, Internet, and mobile sales platforms. We are ooking for interns with passion for product to intern in our various buying departments from June 1st to August 13th. This program is a great opportunity for anyone that is dedicated at growing their Merchandising career in our business.

You must be either a rising junior, rising senior, or graduate student at the time of the internship. We do not accept recent graduates into the internship program.

Your Impact
Track and process Buyer’s samples received from vendors.
Responsible for item creation, maintenance, monitoring Quality Assurance (QA) and warehouse processing.
Partner to issue and expedite timely purchase orders (PO’s).
Work with Internal Departments to ensure products are ready for their “air date”.
Guest Scheduling and communication.
Communicate with other departments to maximize effectiveness and efficiency of product lifecycle activities.
Responsible for vendor communication and education, which includes communicating QA comments.
Answer all vendor calls in a timely basis.
Responsible for daily office functions (e.g., filing, faxing, copying).

What You Bring
Must be able to work 37.5 hours/week from June 1st to August 13th
Enrolled at an accredited college or university (Must be a current student)
Completed at least four (4) semesters of college from the following majors: Merchandising, Retail Management, Business, Marketing, Economics
Experience in Retail is strongly preferred","https://www.linkedin.com/jobs/view/externalApply/2479923418?url=https%3A%2F%2Fqvc%2Ewd5%2Emyworkdayjobs%2Ecom%2Fen-US%2FQRG%2Fjob%2FUSA-PA-West-Chester%2FQVC-Intern---Merchandising-Buying---Summer-2021_R50375%3Fsource%3DLinkedin&urlHash=kU56&refId=9611182f-ebf8-422e-8f2b-227b545209e3&trackingId=fChLeTz0fksMB3cTmppADQ%3D%3D&trk=public_jobs_apply-link-offsite",0.014716454744469145,
39,"Site Merchant Intern - Summer 2021","Ashley Furniture Industries","Tampa, FL","Description

The Site Merchandising intern will work with the assistant and site manager to deliver an outstanding online shopping experience by ensuring customers easily find and buy the desired products through the development of merchandising strategies that drive sales and maximize conversion. They will assist with managing and reviewing the online assortment to ensure the categorization, imagery, copy, pricing, site placement and promotional tags are accurate and meet brand standards. They will also interact cross-functionally with Buying, Marketing and IT to identify business opportunities and help the team take advantage of those opportunities.

What Do You Need
Pursuing a degree in Business Administration, Marketing, Merchandising or related field or equivalent work experience
A positive, can-do attitude
Excellent verbal and written communication skills
Working knowledge of Google Suite and Microsoft Office programs specifically excel
Project management and communication skills, analytical skills and problem-solving skills
Attention to detail and accuracy
A passion for online shopping","https://www.linkedin.com/jobs/view/externalApply/2438139987?url=https%3A%2F%2Fashleycareers%2Ettcportals%2Ecom%2Fjobs%2F6411977-site-merchant-intern-summer-2021&urlHash=cqVw&refId=a1f80d45-8b43-40b3-9b8f-f440454e2593&trackingId=Q8Aofv0nQc%2FDz0HhRU5kUg%3D%3D&trk=public_jobs_apply-link-offsite",0.048366969415332785,
26,"Merchandising Summer 2021 Internship - Full Time","HSN","St Petersburg, FL","Are you looking to make the most of your college career? Do you have an interest in Retail Merchandising? Do you excel in a fast-paced environment?

If so, HSN is the place for you!!

HSN’s Merchandising departments (Buying and Planning) are currently recruiting for our very competitive Summer internship program. We are looking for top talent with the passion to drive the business.

You must be either a junior, senior, or graduate student at the time of the internship. We do not accept recent graduates into the internship program.

As of today, it is undetermined if the program will be remote or onsite. More details to come!

Job Description Details

The Opportunity

HSN, is a leading interactive entertainment and lifestyle retailer looking for interns with passion for product to intern in our various Merchandising departments . This program is a great opportunity for anyone that is dedicated at growing their Merchandising career in our business.

Who We Are

We are a diverse group of world class merchants taking a customer centric approach. We curate a compelling assortment of trend-led products for our customers, which we offer at a competitive value from a range of exclusive brands and strong well-known brands.

Your Impact

Planning Teams
Learn the Sales and Product Planning functions through the supervision of Planning Staff. Partner with mentor as well as Buying teams to plan for short/long term maximization of sales that will be successful in electronic retail and which will meet/exceed the expectations of the customer.
Analyze sales trends and be aware of inventory levels so as to maximize sales. Perform duties according to company policies and procedures with latitude for independent judgment and initiative.
Learn how to evaluate shows and show segments, time of day, scheduled host, etc. in order to maximize sales performance and dollars generated per minute.
Assist in the preparation of inventory and sales reports and in-depth analysis of major events for management review. Create show recaps and special reports for the Planners.
Learn how to analyze the product life cycle by closely monitoring sales history, pricing, decisions and retail trends.
Interface extensively with other HSN departments such as Buying, Broadcasting, Programming, etc.
Perform other duties and projects, research and organize data, such as inventory levels, or a specific product groups.

Buying Teams
Track and process Buyer’s samples received from vendors.
Responsible for item creation, maintenance, monitoring Quality Assurance (QA) and warehouse processing.
Partner to issue and expedite timely purchase orders (PO’s).
Work with Internal Departments to ensure products are ready for their “air date”.
Guest Scheduling and communication.
Communicate with other departments to maximize effectiveness and efficiency of product lifecycle activities.
Responsible for vendor communication: Answer all vendor calls, provide education and communicate QA comments.

What You Bring
Able to work a minimum of 40 hours per week (full time) for an 11-week program June 1st 2021 - August 13th 2021
Enrolled at an accredited college or university (Must be a current student the duration of the internship)
Completed at least four (4) semesters of college from the following majors: Merchandising, Retail Management, Economics, Business Administration, Business Management, Operations, International Business, Marketing, Product Development and Entrepreneurship.
Ability to analyze data and draw relevant conclusions to have positive effects on business
Experience in a traditional retail environment is strongly preferred.","https://www.linkedin.com/jobs/view/externalApply/2368005570?url=https%3A%2F%2Fqvc%2Ewd5%2Emyworkdayjobs%2Ecom%2Fen-US%2FQRG%2Fjob%2FUSA-FL-St-Petersburg%2FMerchandising-Summer-2021-Internship---Full-Time_R50287%3Fsource%3DLinkedin&urlHash=watb&refId=9611182f-ebf8-422e-8f2b-227b545209e3&trackingId=FeATBe4oBEHyVEIX1vsPlg%3D%3D&trk=public_jobs_apply-link-offsite",0.009130359369391338,
44,"E-Commerce Intern","Modell's Sporting Goods","New York, NY","MODELL'S SPORTING GOODS is the nation's largest family-owned sporting goods chain, operating stores throughout the Northeastern United States, from New England to Northern Virginia. Modell's offers value and quality customer service together with a wide variety of sporting goods, athletic and active apparel and footwear for the entire family. Founded in 1889, we continue to grow each year through the belief that our associates and customers are our number one asset. We are committed to proving this by Listening, Respecting and Responding to the needs of our associates as well as the needs of our customers.
We are currently seeking dedicated and enthusiastic E-Commerce Intern.

Responsibilities
Support e-commerce team
Assist in the development and strategy behind Modell's on-line expansion
Increase your understanding of the coordination between functional areas to deliver the best business results
Work closely with management, customers and associates to maximize e-commerce business potential
Pursue professional development through hands-on learning
Participate in meetings and provide feedback with cross functional partners.
Gain an understanding of the role of Merchandising, Planning or Allocation in the product lifecycle specific to the on-line world
Provide research, maintenance and support for assigned departmental projects and tasks as assigned
Optimize website content to increase search marketing rankings
Requirements
Strong academic record, all majors welcome but concentration or major in journalism a plus.
Detail oriented individual with strong organizational, communication, time management and interpersonal skills.
Strong analytical and problem solving skills
Ability to multi-task and work independently in a fast-paced environment
Proficiency in Microsoft Word and Microsoft Excel
Can do attitude and ability to promote teamwork","https://www.linkedin.com/jobs/view/externalApply/2467190933?url=http%3A%2F%2Fwww%2Elinkup%2Ecom%2Fdetails%2F737ef57971fd3e66b2ec33bd0a202e22&urlHash=cCSj&refId=a1f80d45-8b43-40b3-9b8f-f440454e2593&trackingId=XLPQo2nc9S8svrnySV7SBw%3D%3D&trk=public_jobs_apply-link-offsite",0.013974081664674188,
