Id,Title,Company,Location,Required Qualifications,Link,Page Rank,
10,"Intern - Merchandising","Crocs","Broomfield, CO","Crocs has always believed that everyone should be comfortable in their own shoes. We recognize and celebrate the uniqueness in everyone. We believe that comfort and style are in the eye of the beholder and that personal expression is an inalienable right. We believe that Come As You Are is more than a tagline, it is a way of living. We believe that seeing and accepting the things that make us one of a kind, brings us closer together.

Crocs' Americas Merchandising team in our Westwood, MA office is hiring! This summer Intern will execute day-to-day tasks necessary to assist the Crocs Merchandising team. Responsible for weekly reporting updates, assortment tool updates & coordination. Develop a broad, general understanding of all merchandising functions, responsibilities, and cross-functional interdependencies in order to provide merchandising support across multiple divisions/categories.

Responsibilities
Assist Director and Merchants in daily/weekly/seasonal merchandising functions including:
Create and maintain merchandising tools (Corporate Line sheet, Seasonal Buysheet, etc.)
Update data and templates for selling recaps
Prepare necessary materials for milestone meetings
Act as liaison between many departments: excellent communication and analytical skills
Make data-driven decisions and product related suggestions with regards to trend, pricing and assortment
Excellent networking ability with good follow-up skills
Should be confident working with numbers and have a solid understanding of Microsoft Excel
Ad Hoc Projects


Qualifications
Energetic, lover of product, with an interest in digging into sales trends!
Strong communication skills; Excellent written and verbal communication skills
Great teammate, enjoys working cross functionally with various teams and personality types
Highly organized, able to shift priorities with a sense of urgency, have excellent attention to detail
Highly proficient in Excel and have sophisticated knowledge of Powerpoint, Google Docs

Crocs is an Equal Opportunity Employer committed to a diverse and inclusive work environment.

Title and Job Level: Intern

Compensation: $15.00 per hour","https://www.linkedin.com/jobs/view/externalApply/2478385626?url=https%3A%2F%2Fboards%2Egreenhouse%2Eio%2Fcrocscorporate%2Fjobs%2F5185338002%3Fgh_src%3D375cdffe2%26s%3DLinkedIn%26source%3DLinkedIn&urlHash=4fyi&refId=9611182f-ebf8-422e-8f2b-227b545209e3&trackingId=vgGwZ6ic5SsAlhH16zk5tA%3D%3D&trk=public_jobs_apply-link-offsite",0.017573005498580867,
49,"Marketing Intern - Visual Merchandising","Behr Paint Company","Santa Ana, CA","Job Description

What YOU can expect from your internship?:
Participate in weekly workshops where you are able to gain valuable knowledge about our company and learn skills that can help you as a professional (because you want to be able to take skills used during this internship and use them even AFTER graduation!)
Partake in our Behr Cares Community Service event where you are to take half a day to help a local organization (because, here at Behr, our motto is Do The Right Thing!)
Getting paid $17 an hour (because YOU deserve getting paid for your hard work!)
What can WE expect from you?:
You are enrolled at an accredited University in a Bachelor's degree program
You are able to work 28 hours a week, but we will be flexible about how we allocate hours
You are available to work from June 14, 2021 - July 16, 2021
You are willing to think-outside-the-box and want to be in an environment that embraces your ideas
You are be excited about working in a team because most projects during our internship will require team member engagement
Part time
BEHR (the “Company”) is an equal opportunity employer and we want to have the best available persons in every job. The Company makes employment decisions only based on merit. It is the Company’s policy to prohibit discrimination in any employment opportunity (including but not limited to recruitment, employment, promotion, salary increases, benefits, termination and all other terms and conditions of employment) based on race, color, sex, sexual orientation, gender, gender identity, gender expression, genetic information, pregnancy, religious creed, national origin, ancestry, age, physical/mental disability, medical condition, marital/domestic partner status, military and veteran status, height, weight or any other such characteristic protected by federal, state or local law. The Company is committed to complying with all applicable laws providing equal employment opportunities. This commitment applies to all persons involved in the operations of the Company regardless of where the employee is located and prohibits unlawful discrimination by any employee of the Company.

BEHR is an E-Verify employer. E-Verify is an Internet based system operated by the Department of Homeland Security (DHS) in partnership with the Social Security Administration (SSA) that allows participating employers to electronically verify the employment eligibility of their newly hired employees in the United States. Please click on the following links for more information.

E-Verify Participation Poster: English & Spanish
E-Verify Right to Work Poster: English & Spanish","https://www.linkedin.com/jobs/view/externalApply/2446357913?url=https%3A%2F%2Fmasco%2Ewd1%2Emyworkdayjobs%2Ecom%2Fen-US%2FBehr%2Fjob%2FUS---California---Santa-Ana%2FMarketing-Intern---Visual-Merchandising_REQ30168-1%3Fsource%3DLinkedIn&urlHash=2SwT&refId=a1f80d45-8b43-40b3-9b8f-f440454e2593&trackingId=7Zr4tAZ9c%2BTTS1NLK6O1CA%3D%3D&trk=public_jobs_apply-link-offsite",0.007370500544837456,
42,"Merchandiser Intern","Scoular","Overland Park, KS","An employee-owned company with more than $4 billion in sales, Scoular employs more 1,000 people in over 100 offices and facilities in North and South America, and Asia. For 125 years, feed and food customers have been counting on Scoular people to create safe and reliable supply chain solutions for end-users and suppliers of grain, feed ingredients, and food ingredients around the globe.

The Scoular Company is seeking entrepreneurial individuals to learn more about agricultural commodity merchandising. Scoular’s Merchandising Internship immerses the individual in purchasing, selling, and transportation of agricultural commodities from producers, grain elevators and other domestic and international suppliers.

Job Responsibilities
Assist Merchandiser with purchasing and selling agricultural commodities (i.e. corn, wheat, and soybeans).
Learn logistical and supply chain management of agricultural commodities.
Develop an operational understanding of risk management.


Minimum Qualifications
Currently pursuing a bachelor’s degree in economics, business, entrepreneurship or related field.
Junior status preferred.
Strong mathematical and analytical skills.
Outstanding communication, customer service, problem solving & sales skills.
Strong interest in agricultural commodity markets preferred but not required.


The Scoular Company is an equal opportunity employer","https://www.linkedin.com/jobs/view/externalApply/2181397283?url=https%3A%2F%2Frecruiting%2Eultipro%2Ecom%2FSCO1004SCOUL%2FJobBoard%2F904d5661-9f19-47e5-961c-db382ebecada%2F%2FOpportunityDetail%3FopportunityId%3D76860949-3cba-4694-ad94-6da533d15d94%26utm_source%3DLINKEDIN&urlHash=I0lV&refId=a1f80d45-8b43-40b3-9b8f-f440454e2593&trackingId=XDoryxJlBYoEdnXG1uiFZQ%3D%3D&trk=public_jobs_apply-link-offsite",0.007738235871705367,
38,"TMO Marketing Intern, Summer 2021","Samsung Electronics America","Bellevue, WA","Position Summary

Samsung has been a leading force in innovation for decades. We believe that technology can, and should, make the world a better place, so we create new possibilities for people everywhere. We strive to create a place of endless learning where we’re pushed to discover our true potential. Our interns take real-world business problems and lead the charge on formulating creative solutions. Our Intern program prepares every intern for success by allowing them to fully integrate into our dynamic culture while contributing their own unique ideas. We create opportunities for both undergraduate and graduate students to impact change and make the impossible possible. Join #LifeatSamsung.

Role and Responsibilities



Position Summary and Project Details:



We’re looking for a best in class Intern, one with strong communications skills, can do attitude and a passion to learn and be a part of a high performance marketing team.  To be successful, you will have a foundation of marketing knowledge and understanding of how strategy drives decision making. You will be adaptive, a good listener, able to work in a fast pace environment and willing to support your colleagues as instructed and guided.  The Samsung T-Mobile Account team is not a brand marketing role,  it a channel marketing role serving the largest mobile carrier customer in the world. 



As a Samsung Intern you will work closely with your fellow marketing colleagues, taking direction and guidance to help build marketing programs that support areas of the business, such as product launches, local marketing, merchandising and digital advertising campaigns.



Our ideal Intern candidate will have an education in marketing and business and foundational knowledge of marketing as it relates to a Retail based business.  You will possess basic knowledge about the mobile industry, both devices and the carriers and their networks. You will have foundational knowledge of business and understand principals of supply and demand, price and promotion and analysis and performance.



As an Intern, you will be expected to support the marketing and account team as needed, in return, we promise you will have valuable experience, learning channel marketing in the fast pace mobile industry working for the most innovative brand in the world while serving the most dynamic carrier in the world.  



Essential Duties and Responsibilities of Intern:

Provide marketing support to entire marketing team as needed.
Partner with sales team on joint sales marketing initiatives that drive sales.
Liaison with Samsung brand colleagues to enable programs for the T-Mobile retail channel.
Be a Creative thinker to challenge the establishment and contribute to the success of the business.
Help coordinate weekly Samsung go-to-marketing meetings with entire account team.
Support the development and execution of local marketing programs that drive sales lift.
Support the development and execution of digital advertising programs that drive sales.
Develop ROI forecasts for program performance (prior to start) in partnership with business planning team.
Track program performance of marketing initiatives; coordinate ROI analysis reporting with business planning team.

Skills and Qualifications



Background/Experience:

Excellent verbal and written communication skills a must.
Ability to listen and take direction.
Ability to work in a fast pace environment and meet structured timelines.
Highly organized/detail oriented.
Project management capabilities.
Creative problem solving skills a key.
Above average MSFT office skills with focus on PPT.
Experience with Adobe Acrobat preferred
Solid customer relationship skills
Must be able to write, read, analyze, interpret, present, and explain mobile device technical product specifications when needed.

Physical/ Mental Demands and Conditions

Operate a computer keyboard and view a video display terminal more than 70% of work time.
Minimal travel required for event and local marketing support. 10%
Lift, move, or adjust general office equipment, boxes of marketing presentation, or media materials using proper procedures.
Physically make product marketing presentations or demonstrations to customers and internal and external groups using written and verbal communication skills accompanied by PowerPoint.

Internship Eligibility:

Must be enrolled in an accredited University
Proper work authorization
Maintain a 3.0 or higher GPA
Attend New Hire Orientation on first day

* Please visit Samsung membership to see Privacy Policy, which defaults according to your location. You can change Country/Language at the bottom of the page. If you are European Economic Resident, please click here .



* Samsung Electronics America, Inc. and its subsidiaries are committed to employing a diverse workforce, and  provide Equal Employment Opportunity for all individuals regardless of race, color, religion, gender, age, national origin, marital status, sexual orientation, gender identity, status as a protected veteran, genetic information, status as a qualified individual with a disability, or any other characteristic protected by law.","https://www.linkedin.com/jobs/view/externalApply/2479249403?url=https%3A%2F%2Fsec%2Ewd3%2Emyworkdayjobs%2Ecom%2Fen-US%2FSamsung_Careers%2Fjob%2F10400-NE-4th-St-Bellevue-WA-USA%2FTMO-Marketing-Intern--Summer-2021_R38178&urlHash=36r0&refId=a1f80d45-8b43-40b3-9b8f-f440454e2593&trackingId=VmSksBpTnH4bHFwOCaTTCg%3D%3D&trk=public_jobs_apply-link-offsite",0.008861353983500962,
54,"Product Strategy Internship, Consumer Care","Zymergen","Emeryville, CA","At Zymergen, our mission is to create a vibrant, sustainable future through biology. We have developed a platform with biotech capabilities to create new specialty molecules that were previously not available or practical through traditional petrochemical-based chemistry. Zymergen has demonstrated the promise of its platform to produce both new and known molecules through chemistry and biofacturing to deliver unique specialty materials. As an intern at Zymergen, you will work alongside industry leaders to learn, grow, and contribute your best to advance business initiatives and technologies. We strive to create an inclusive work environment where every employee and intern can do their best work and be their true selves. Let's make tomorrow together!

Zymergen's Consumer Products team plays a critical role in the development of new products that are expected to outperform the market while still being more natural and more sustainable. As a Product Development Intern, you will work closely with Product Directors on tasks such as designing a strategy around the development and commercialization of products in the early stage of the consumer care pipeline. This will include generating consumer insights, evaluating white space in the consumer care industry, and strategizing product positioning for Zymergen products. The intern in this particular role will also help bring one of Zymergen's first consumer products to market in personal care and work on later-stage development workstreams and channel activation strategies for the respective launch markets.

We encourage interested candidates from all ethnic groups, genders, sexuality, age, and abilities to apply. If this job description resonates with you, we want to hear from you!

Key Focus Areas Of The Role May Include
Conduct research about consumer preferences in Zymergen's focus areas. Conduct interviews and synthesize consumer insights based on interviews and research
Conduct research on competitive on market benchmarks to Zymergen products early in the pipeline
Synthesize research and translate to product strategy - including product positioning, target markets, end consumers, and ways to differentiate our product to those end consumers
Model economics and value at stake based on size of target markets
Research and develop activation strategies at channels in each of our launch markets including but limited to promotions, POS placement, online retailer campaigns, and other merchandising tactics.
Work cross-functionally with a number of partners on last stage development activities - including but limited to marketing, claims testing, packaging, and project management partners
Support new product development business cases with market opportunities/sizing and positioning


For Our Internship Roles, You Will Need To Be
Currently enrolled in an MBA program with at least one semester or quarter remaining post-internship
Available to work 40 hours per week during the summer
Major, experience, or demonstrable interest in the position you apply for
Authorized to work in the US


We Are Looking For Qualifications And Experience That Includes
Excellent communication as well as intercultural skills
Experience doing consumer research and consumer interviews
Experience valuing size of markets
Experience developing competitive landscapes and evaluating white space in a market
Experience with building financial models with limited data
Passion for next generation of skincare and skin protection products
Open-minded and motivated to work on a multi-cultural team
Strong analytical and relentless organizational skills
Strong customer service orientation


Additional Skills That Are Preferred But Not Required
Marketing or brand management experience
Consumer product development experience
International experience
Background in skin care or beauty products


As a Z-intern, You Will Enjoy
Meaningful projects with real business impact
Intern Specific Virtual Events
Career Development and Mentorship
Peer & Senior Level Networking
Participation in Company All-Hands meetings, Employee Resource Groups, and more!


In compliance with federal law, all persons hired will be required to verify identity and eligibility to work in the United States and to complete the required employment eligibility verification form upon hire.

Founded in 2013, Zymergen is a science and material innovation company rethinking biology and reimagining the world. A World Economic Forum Tech Pioneer, Zymergen partners with nature to create never-before imagined materials and products across industries – from agriculture to consumer electronics, personal care to pharmaceuticals, and more. The company's materials are in use today, creating value for Fortune 1000 companies and major corporations across the globe. Our clients have sold over $1 billion worth of products using Zymergen microbial strains. For more information visit: www.zymergen.com.","https://www.linkedin.com/jobs/view/externalApply/2495174183?url=https%3A%2F%2Fgrnh%2Ese%2F4e657c2d1us&urlHash=Ms7e&refId=cec8bccc-5e6b-42bf-9c62-f6721471cd60&trackingId=%2FZscm6gXnWVLUEBGrQhk%2Bg%3D%3D&trk=public_jobs_apply-link-offsite",0.005218725486320616,
23,"Marketing Intern","Shopbop | East Dane","New York, NY","Description

Shopbop, the leading online fashion boutique and Amazon subsidiary, is looking for a Marketing Intern. The Marketing Intern will be involved with planning, executing and measuring the performance of marketing activity on the Shopbop website. The successful candidate will play a key role in optimizing content for the best customer experience and business results. The intern will analyze and report on performance to management teams.

The Marketing Intern will be creative, analytical, team oriented, an effective communicator, have a desire to provide a best in class customer experience, and appreciate a dynamic environment with rapidly changing priorities. An understanding of, and passion for, fashion ecommerce is highly desired.


Basic Qualifications
Currently working towards a bachelor's degree in marketing, advertising, retail merchandising, or related field with an expected conferral date between December 2022 and May 2023
Work, internship, or other leadership experience in a professional environment
Computer skills, including Microsoft Office (e.g., Excel, Word) and ability to quickly learn new systems
Familiarity with and interest in fashion trends, designers, and ecommerce
Strong attention to detail
Preferred Qualifications
Ability to work well in a fast-paced, collaborative environment
Excellent analytical, communication and presentation skills

Company - ShopBop
Job ID: A1474072","https://www.linkedin.com/jobs/view/externalApply/2437198509?url=https%3A%2F%2Fwww%2Eamazon%2Ejobs%2Fjobs%2F1474072%2Fmarketing-intern%3Fcmpid%3DSPLICX0248M%26utm_source%3Dlinkedin%2Ecom%26utm_campaign%3Dcxro%26utm_medium%3Dsocial_media%26utm_content%3Djob_posting%26ss%3Dpaid&urlHash=Dlst&refId=9611182f-ebf8-422e-8f2b-227b545209e3&trackingId=2d%2F%2F87peoXU8Ob6QHiFZMA%3D%3D&trk=public_jobs_apply-link-offsite",0.03989028415080286,
50,"Marketing Intern","ShopStyle","San Francisco, CA","SUMMARY The ShopStyle Consumer Marketing team has a broad range of accountabilities, including the development of the marketing calendar, promotional planning, content/campaign strategy, membership, CRM, retention marketing strategy, campaign operations, site experience and site merchandising. As the MBA Marketing Intern, you will be responsible for assisting in content strategy and marketing operations, helping to integrate trends strategically into marketing communications and execution. You’ll have exposure to leadership in multiple business functions including global partnerships, global marketing and creative teams and will support performing data-driven analysis for customer engagement and site optimization. KEY RESPONSIBILITIES Perform research on search trends for key categories, identify opportunities for integrating findings into marketing campaigns and analyze marketing performance Participate in or lead marketing projects Scope can include category and retailer performance, marketing strategy and operations, process improvement, market research, international strategy and membership, etc. Support preparation of internal and external Executive partnership communications Take ownership and work with cross-functional teams within ShopStyle to ensure efficiencies in marketing strategy and operations MINIMUM REQUIREMENTS To perform this job successfully, an individual must be able to perform each essential duty satisfactorily. The requirements listed below are representative of the knowledge, skill, and/or ability required. Reasonable accommodations may be made to enable individuals with disabilities to perform the essential functions. Excellent analytics, result-oriented problem-solving and sound judgement Proficiency with web analytics tools required (i.e. Amplitude, Omniture, Coremetrics, Google Analytics, etc.). Tableau experience a plus Proficiency with Microsoft office suite Ability to draw insights and convey recommendations succinctly Strong communication and interpersonal skills to build relationships with diverse teams and stakeholders at all levels of the organization Innovative thinker; not afraid to question existing business models & go to market channels Passionately stays informed of new technologies and their applications Take initiative and ownership Results Focus: Own it, Do it, Test & Improve it Top-tier MBA, prior Computer Science or Technical degree preferred Experience in retail/eCommerce operations or product management are a plus QUALIFICATIONS Graduation date May-June 2022 2+ years of pre-MBA work experience with e-commerce, digital strategy and marketing required","https://www.linkedin.com/jobs/view/externalApply/2499357856?url=https%3A%2F%2Fneuvoo%2Ecom%2Fjob%2Ephp%3Fid%3De4e489f5a05a%26source%3Dlinkedin%26utm_source%3Dpartner%26utm_medium%3Dlinkedin%26puid%3Dfadbaddc7adbcddcddd8fdd78adafddbaadffddg3debcacffec3ddcg3e&urlHash=Z97r&refId=cec8bccc-5e6b-42bf-9c62-f6721471cd60&trackingId=R0dVF9Um05vi57S1EHnPNw%3D%3D&trk=public_jobs_apply-link-offsite",0.018817760039664233,
