Id,Title,Company,Location,Required Qualifications,Link,Page Rank,
53,"Intern, Merchandising","Hibbett Sports","Birmingham, AL","Hibbett Sports is looking for an Inventory Management Intern for the Summer of 2021. This full-time position will be located at our Corporate Office in Birmingham, AL.

The Following Areas Will Be Considered

The Inventory Management Intern will review the current process to fulfill customer orders from available store inventory. After researching & documenting the existing process, provide analytics and recommend best practices on how to improve the process moving forward.
What is being fulfilled go-forward merchandise or clearance product?
Are there particular items that tend to be fulfilled more online vs. in stores?
Amount of product fulfilled Store-to-store vs. E-Commerce
Is there an industry standard on what level of fulfillment (either in total or as a % of sales) is considered “acceptable”?
Ability to build a report within our Business Intelligence tool to track these metrics Can we create an exception report that will only flag stores with “unacceptable” levels of fulfillment?
How do we load this information into our other software applications for additional analysis & execution?
Identify where product is being shipped, especially as it relates to other stores. Are there assortment opportunities we are missing based on where we are shipping product?
The intern will work closely with the Director of Allocation, as well as the Inventory Management Training Coordinator, to recommend changes to drive efficiencies in the current processes. A formal presentation will be given to management with key takeaways & recommendations. The intern will learn about the Hibbett business model by visiting local stores as well as our Logistics Facility, which plays a big role in the fulfillment process.

The successful candidate will be a rising Junior or Senior with a least a 3.0 GPA. Knowledge of Word and Excel required.
Retail store experience preferred but not required
Area of study in one of the following Business Administration, Apparel Merchandising, Data Science or Supply Chain
Benefits will include 30% Employee Discount","https://www.linkedin.com/jobs/view/externalApply/2434450829?url=https%3A%2F%2Fcareers-hibbett%2Eicims%2Ecom%2Fjobs%2F28804%2Fintern%252c-merchandising%2Fjob%3Fmode%3Djob%26iis%3DJob%2BPosting%26iisn%3DLinkedIn&urlHash=RPsV&refId=cec8bccc-5e6b-42bf-9c62-f6721471cd60&trackingId=hr%2BulARsoHybWlcSFcinVw%3D%3D&trk=public_jobs_apply-link-offsite",0.013308649211766622,
63,"Merchandise Internship","Hasana, Inc.","Chicago, IL","Company Description

The Aparecio Foundation is a nonprofit organization that was designed as an economic development strategy to lift women out of poverty and as a community development approach to build the leadership capacity of low-income women. The Aparecio Foundation provides academic support and scholarship programs for hihh-potential, low-income women in public high schools through an eight-year multiple-mentor program.

The culture of Aparecio Foundation is characterized by an informal and laid back environment, where employees work independently and in teams to develop and carry out effective organizational structure and work processes. Employees are driven through self-motivation and passion for the not-for-profit sector. Through the development of quality services to the enhancement of the organization’s goals and objectives employees are able to use their strengths and skills the best ways they can! Therefore Aparecio Foundation employees are given freedom to be creative and energetic in performing their tasks and duties as professionals in their respective field of expertise.

Overview

Job Description

Hasana, Inc. is an accessible luxury brand. The spirit of the
collection features high-end men's and women's clothing and
accessories for timeless style. We provide custom, hand-made items
ranging from contemporary to classic. Each item purchased directly
benefits The Apareció Foundation and women's education.

Hasana, Inc. is seeking talented students in the Chicago Loop area for
a variety of spring internship positions. Take advantage of on the
job training, mentorship and exposure to all aspects of the fashion
industry.

Hasana, Inc. is committed to developing a fun and productive work
culture that is conducive to positive results!

We offer a uniquely open environment that demands initiative and
imagination from every single team member that are heard, tested, and
genuinely empowered to lead by example and create lasting impacts on
our organization, its programs, and the community.

Please note that these unpaid internships are located in the Chicago
Loop.

Responsibilities Include

As Merchandise Intern for Hasana, Inc. you will have a variety of responsibilities throughout the semester. Our Merchandise team is looking for interns with the ability to interpret lifestyle and design trends into merchandising initiatives, make merchandising suggestions for each brand based on market needs and select colors and prints for seasonal presentations to accounts.

Primary Responsibilities Include But Are Not Limited To

Develop CAD drawings for new style and color presentations for the Hasana, Inc. Brand.
Assist in development of Hasana, Inc. merchandising presentations to accounts.
Assist in analysis of retailer landscape and consumer information to support merchandising initiatives.
Assist in the preparation of color, print and trend boards.
Develop and present a Hasana, Inc. merchandising plan.
Be a part of the merchandising development process beginning from concept.

Qualifications

Qualifications

A passion for women’s economic opportunities
Must be a full or part-time student and working toward a degree
Must be eligible to receive school credit and commit to 2-3 days a week for 3 months
Comfortable with ambiguity and able to work autonomously
Ability to effectively present information to top management, public groups, and other groups as necessary both internally and externally
Flexible; ability to adapt to changing priorities and multiple tasks
Strong computer skills, PC/Mac with experience in Windows NT, Excel, PowerPoint,Adobe Photoshop / Illustrator and other applicable software
Integrity, honesty, openness and a willingness to operate as a team player

Additional Information

All your information will be kept confidential according to EEO guidelines.

SDL2019-256","https://www.linkedin.com/jobs/view/externalApply/2348285823?url=https%3A%2F%2Fwww%2Estartwire%2Ecom%2Fjobs%2Fchicago-il%2Fmerchandise-internship-2257281342%3Fcampaign%3D130%26source%3DLI&urlHash=Cemr&refId=cec8bccc-5e6b-42bf-9c62-f6721471cd60&trackingId=40z77rPJ4Ep29YFJe4FZzg%3D%3D&trk=public_jobs_apply-link-offsite",0.005059657191224572,
60,"Sls Rep Intern","Mondelēz International","Boston, MA","Job Description

Are You Ready to Make It Happen at Mondelēz International?

Join our Mission to Lead the Future of Snacking. Make It Matter.

As an organization we are committed to developing the next generation of Makers and Bakers. Joining us at an early career stage in our fast paced and ever changing environment will enable you to do more, learn more and grow more. You will be encouraged to step outside your comfort zone– you may even surprise yourself! We will ensure you are given the support you need to be at your best and enable you to be yourself and bring passion and personality. Here you can lean in and speak up and bring your own flavor.

Sales Representative Intern

An internship within Mondelēz International Sales & Customer Logistics organization is generally a 10-12 week assignment. The assignment, which closely mirrors experiences of a Nabisco Sales Representative, will provide a realistic preview of the Sales Representative's responsibilities and is geared towards developing knowledge of the Mondelēz International Field Sales & Customer Logistics organization. Individuals are exposed to sales (selling and merchandising), logistics, account teams, and human resources while growing the necessary skills to work independently and also function successfully as part of a team. Each intern is assigned a supervisor who designates projects, answers questions and provides guidance. Throughout the summer, the intern will be assessed on overall performance, including project management, and personal leadership skills.

Primary Responsibilities

Develop a knowledge of Mondelez products, sales systems and procedures including proper merchandising, sources of product and distribution, space management programs and uses, sales campaigns and promotions, sales brochures and order guides, and sales presentations.
Positively influence the sale of Mondelez products by exploiting selling opportunities at the store level consistent with company programs and strategies.
Maintain a timely and accurate call schedule.
Secure store-level support on special promotions, seasonal items, special product bookings and new items.
Meet or exceed all shelving standards and ensure inventory needs are met.
Develop strong business relationships with store management.
Monitor and report on competitive activity and document all pricing activities.
Provide order writing support on territories for Sales Representatives absent due to vacation or other reasons.
Complete administrative reporting responsibilities.
Provide specific feedback to Mondelez personnel while covering a Sales Representatives territory.
Professionally represent the Mondelez organization, acting in accordance with company business standards and managing financial activities in an ethical manner.
Present a project on customer or industry topics to senior management at end of summer.
Identify and communicate individual store problems and opportunities to the appropriate Mondelez personnel.

Benefits and Compensation:

This position is a paid internship, but does not offer a benefit package, bonus incentives, or company provided vehicles/ housing.

Key Competencies:
Learning on the Fly - Adaptable to new environments, quick learner, open to change
Intellectual Horsepower – Deals with concepts and complexity comfortably, intellectually sharp, capable and agile
Interpersonal Savvy – Relates well to all kinds of people, builds appropriate rapport and effective relationships
Peer Relationships – Team player, cooperative, easily gains trust and support of peers, encourages collaboration
Problem Solving – Looks beyond the obvious and doesn’t stop at the first answers, can see hidden problems, excellent at honest analysis
Perseverance - Pursues everything with energy, drive, and a need to finish; Seldom gives up before finishing, especially in the face of resistance or setbacks
Action Oriented - Enjoys working hard; Is action oriented and full of energy for the things he/she sees as challenging; Not fearful of acting with a minimum of planning; Seizes more opportunities than others
Personal Learning - Picks up on the need to change personal, interpersonal, and managerial behavior quickly; Watches others for their reactions to his/her attempts to influence and perform, and adjusts; Seeks feedback

Requirements:
You must be at least 18 years of age, have a valid driver's license, proof of auto insurance, and have access to the internet with a personal email account
Must be currently enrolled in a post-secondary degree program
A flexible work schedule is required, including being available to work weekends and holidays
Previous grocery, retail, sales, and/or customer service experience a plus
Must be open to performing Merchandiser responsibilities, as needed
Must be willing to relocate self for this position, if not a local applicant
Successful completion of drug test, MVR check, and general background check
No Relocation support available Business Unit Summary The United States is the largest market in the Mondelēz International family with a significant employee and manufacturing footprint. Here, weproduce our well-loved household favorites to provide our consumers with the right snack, at the right moment, made the right way. We have corporate offices, sales, manufacturing and distribution locations throughout the U.S. to ensure our iconic brands—including Oreo and Chips Ahoy! cookies, Ritz, Wheat Thins and Triscuit crackers, and Swedish Fish and Sour Patch Kids confectionery products —are close at hand for our consumers across the country.
Mondelēz Global LLC is an Equal Opportunity/Affirmative Action employer. All qualified applicants will receive consideration for employment without regard to race, color, religion, sex, national origin, disability, protected Veteran status, sexual orientation, gender identity, gender expression, genetic information, or any other characteristic protected by law. Applicants who require accommodation to participate in the job application process may contact 847-943-5460 for assistance.
Job Type Intern (Fixed Term)InternsEarly Careers","https://www.linkedin.com/jobs/view/externalApply/2400097304?url=https%3A%2F%2Fwd3%2Emyworkdaysite%2Ecom%2Fen-US%2Frecruiting%2Fmdlz%2FExternal%2Fjob%2FBoston-Massachusetts-United-States%2FSls-Rep-Intern_R-13793%3Fsrc%3DSNS-12680&urlHash=zg_V&refId=cec8bccc-5e6b-42bf-9c62-f6721471cd60&trackingId=vyVI8u50nimATPIrH4lvhg%3D%3D&trk=public_jobs_apply-link-offsite",0.005137851892507681,
19,"2021 Campus: Merchandising Intern","Walmart","Bentonville, AR","Position Summary... What You'll Do...

Conducts data analysis to drive business decisions by understanding business requirements and requests; determining needed data based on business requests; gathering data from internal and external sources; researching and evaluating environmental factors (for example, competition, customer needs, frequency) that could affect business outcomes; synthesizing data to ensure it is telling a consistent story; analyzing business trends; predicting future trends and their impact to the business; identifying potential business opportunities based on analysis and findings (for example, correlations, clustering); and recommending solutions and future strategies based on findings. Providing guidance on business processes and strategies by analyzing and mining data to identify areas of opportunities and gaps; interpreting results to provide localized data for specific business needs; benchmarking with key leaders to determine best practices; identifying innovative approaches to solve business issues; providing data to support business cases; defining and tracking performance metrics; supporting recommendations to cross-functional teams regarding gaps and solutions; and supporting the implementation of solutions. Supports process implementation and standardization by partnering with key stakeholders and cross-functional teams to ensure alignment and consistency; staying up-to-date on applicable federal and state laws and regulations; informing and guiding stakeholders on the implications of applicable laws; drafting and managing best practices documentation; communicating key information to support process improvements and process automation; and teaching others new and revised processes. Demonstrates up-to-date expertise and applies this to the development, execution, and improvement of action plans by providing expert advice and guidance to others in the application of information and best practices; supporting and aligning efforts to meet customer and business needs; and building commitment for perspectives and rationales. Provides and supports the implementation of business solutions by building relationships and partnerships with key stakeholders; identifying business needs; determining and carrying out necessary processes and practices; monitoring progress and results; recognizing and capitalizing on improvement opportunities; and adapting to competing demands, organizational changes, and new responsibilities. Models compliance with company policies and procedures and supports company mission, values, and standards of ethics and integrity by incorporating these into the development and implementation of business plans; using the Open Door Policy; and demonstrating and assisting others with how to apply these in executing business processes and practices.

Bachelor’s degree in Business, Finance, Mathematics, or related field preferred

Minimum Qualifications...

Outlined below are the required minimum qualifications for this position. If none are listed, there are no minimum qualifications.

Preferred Qualifications...

Outlined below are the optional preferred qualifications for this position. If none are listed, there are no preferred qualifications.","https://www.linkedin.com/jobs/view/externalApply/2411116272?url=https%3A%2F%2Fclick%2Eappcast%2Eio%2Ftrack%2F5kvfyq8-org%3Fcs%3D4c%26jg%3D1yfx%26bid%3DlUf2CslKyPxm6i440ZgUYA%3D%3D&urlHash=ro1O&refId=9611182f-ebf8-422e-8f2b-227b545209e3&trackingId=0elQXNbk%2FH8i2PC3IzNfLw%3D%3D&trk=public_jobs_apply-link-offsite",0.004839847414181876,
28,"Merchandising Intern - Summer 2021","Duluth Trading Company","Mount Horeb, WI","What You’ll Do
Assist in developing seasonal product strategies that deliver to financial targets.
Maintains the integrity of spreadsheets and planning databases.
Assists in retail, catalog, and email planning for the season.
Proofreads catalog pages during catalog production for content accuracy.
Provides weekly reporting and a regular recap of sales information to management.
Regular communication with key business partners.


What We’re Looking For
Strong computer skills - Fluent in Microsoft Office.
Comfortable learning new computer skills, new systems/tools.
Familiarity with omnichannel business model-catalog, online, and stores
Strong interpersonal skills to collaborate and influence key business partners.
Ability to set priorities and motivate cross-functional teams.
Strong communication skills - both verbal and written.
Proven ability to drive and deliver key timelines.
Solid organizational and planning skills.
Strong presentation skills.
Action-oriented and flexible - Must demonstrate a capacity to operate successfully in a fast-paced, changing environment to make fact-based decisions.
Ability to travel domestically.

Who We Are

We are a “no bull” brand that started in 1989 and we provide apparel and other gear for hardworking men and women. Favorites such as our Ballroom® Jeans featuring “crouch without the ouch, Buck Naked™ Underwear, and our Longtail T® Shirts that hide “plumber’s butt” reflect our attitude.

The heart of Duluth Trading’s success is creating one-of-a-kind men’s and women’s clothing, innovative tools, and ingenious gadgets while being humorous storytellers. The talented people we seek want to be proud of where they work, have a commitment to do things better and be part of a retail, web, and catalog apparel company that knows where it’s going.

The responsibilities outlined in this position description are a guideline for the general duties of the position and are not exhaustive of all duties inherent in the job. Duluth Trading Company is an equal opportunity employer.

INDHQ","https://www.linkedin.com/jobs/view/externalApply/2467373868?url=https%3A%2F%2Frecruiting%2Eultipro%2Ecom%2FDUL1000DHI%2FJobBoard%2Ff819122e-34dd-492a-b154-fdda55debecb%2F%2FOpportunityDetail%3FopportunityId%3D4dd04fbb-c960-4eac-bd21-70e21437e205%26utm_source%3DLINKEDIN&urlHash=bc3P&refId=9611182f-ebf8-422e-8f2b-227b545209e3&trackingId=IOuc5R3auBQWGJIVa527DA%3D%3D&trk=public_jobs_apply-link-offsite",0.00587343238349345,
57,"Digital Design Intern - Irvine","St. John Knits","Irvine, CA","The St. John Internship Program is designed to attract, coach and retain top talent graduating from leading local universities on disciplines related to St. John's business practices. Our goal is to help acclimate local university/college students to our company culture, build on their creativity, and allow them the best opportunity to get to know St. John.

The St. John Internship Programs occurs in the Spring, Summer and Fall seasons. The 10 week unpaid internship program will allow students to intern a minimum of 16 hours per week over the course of the season. Local candidates only, please.
Students must be able to receive school credits.
MAIN RESPONSIBILITY
Follow the creative project manager in her day to day activities
Learn how to build production timelines
Communicate with key people in the organization and request product delivery information
Process paperwork and assist with invoices payment and tracking
Follow-up with designers on assigned jobs
Preferred Abilities
Microsoft Office (Word, Excel, PowerPoint)
Business Management/International Business/Merchandising major
Retail sales experience
Customer service and detail-oriented","https://www.linkedin.com/jobs/view/externalApply/2491579802?url=https%3A%2F%2Fneuvoo%2Ecom%2Fjob%2Ephp%3Fid%3D96ee10141299%26source%3Dlinkedin%26utm_source%3Dpartner%26utm_medium%3Dlinkedin%26puid%3Dfdd7adda7adbcadbdddffddg8ddffddcaddffdde3de7cdc7fec3ddcg3e&urlHash=pcnn&refId=cec8bccc-5e6b-42bf-9c62-f6721471cd60&trackingId=uJNc6dfsVJ0trYcZuF8nhw%3D%3D&trk=public_jobs_apply-link-offsite",0.01649451780862316,
36,"Visual Merchandising Intern","Summer Classics","Pelham, AL","The Visual Intern role is responsible for providing support in planning, creating and executing a Visual Merchandising strategy in retail stores and wholesale showrooms.

Essential Job Duties
Assist Visual Team members in floor planning.
Assist Visual Team members in designing vignettes for retail and wholesale.
Creating a vignette presentation.
Drawing floor plans in Sketchup.
Creating and planning Wow Factors. Executing where possible.
Creating a Plug & Play playbook for new store openings.
Creating a styling playbook for photoshoots.
Attends market(s) to execute floor plan install for wholesale.
Attends Retail Resets to execute Wow factors and floor plans.
Assist in designing merchandising fixtures and/or planograms.","https://www.linkedin.com/jobs/view/externalApply/2495925855?url=https%3A%2F%2Fworkforcenow%2Eadp%2Ecom%2Fmascsr%2Fdefault%2Fmdf%2Frecruitment%2Frecruitment%2Ehtml%3Fcid%3D50ebad87-fc82-464e-91d1-fa1244aeb526%26source%3DIN%26selectedMenuKey%3DCurrentOpenings%26jobId%3D402894&urlHash=3ta7&refId=a1f80d45-8b43-40b3-9b8f-f440454e2593&trackingId=Res5JeGfp9LYED1NoqgM5w%3D%3D&trk=public_jobs_apply-link-offsite",0.011668422754931415,
5,"Intern - Merchandising","Crocs","Anywhere","Crocs has always believed that everyone should be comfortable in their own shoes. We recognize and celebrate the uniqueness in everyone. We believe that comfort and style are in the eye of the beholder and that personal expression is an inalienable right. We believe that Come As You Are is more than a tagline, it is a way of living. We believe that seeing and accepting the things that make us one of a kind, brings us closer together.

Crocs' Americas Merchandising team in our Westwood, MA office is hiring! This summer Intern will execute day-to-day tasks necessary to assist the Crocs Merchandising team. Responsible for weekly reporting updates, assortment tool updates & coordination. Develop a broad, general understanding of all merchandising functions, responsibilities, and cross-functional interdependencies in order to provide merchandising support across multiple divisions/categories.

Responsibilities:
• Assist Director and Merchants in daily/weekly/seasonal merchandising functions including:
• Create and maintain merchandising tools (Corporate Line sheet, Seasonal Buysheet, etc.)
• Update data and templates for selling recaps
• Prepare necessary materials for milestone meetings
• Act as liaison between many departments: excellent communication and analytical skills
• Make data-driven decisions and product related suggestions with regards to trend, pricing and assortment
• Excellent networking ability with good follow-up skills
• Should be confident working with numbers and have a solid understanding of Microsoft Excel
• Ad Hoc Projects

Qualifications:
• Energetic, lover of product, with an interest in digging into sales trends!
• Strong communication skills; Excellent written and verbal communication skills
• Great teammate, enjoys working cross functionally with various teams and personality types
• Highly organized, able to shift priorities with a sense of urgency, have excellent attention to detail
• Highly proficient in Excel and have sophisticated knowledge of Powerpoint, Google Docs

Crocs is an Equal Opportunity Employer committed to a diverse and inclusive work environment.

Title and Job Level: Intern

Compensation: $15.00 per hour","https://www.ziprecruiter.com/c/Crocs/Job/Intern-Merchandising/-in-Westwood,MA?jid=dc297254a18f6c36&utm_campaign=google_jobs_apply&utm_source=google_jobs_apply&utm_medium=organic",0.02662994886622458,
