Id,Title,Company,Location,Required Qualifications,Link,Page Rank,
11,"UI Intern","Sovos","Boulder, CO","We are building the future of Global Compliance Software. We want you to build your future with us!

Rising Stars Internship – Summer 2021

Sovos’ Summer Internship Program participants will be offered an unmatched, behind-the-scenes learning and practical experience that fosters and rewards accountability, teamwork, learning, and fun. At Sovos, we need a constant flow of ideas, energy, and innovation – which is where you come in. We are looking for a talented and motivated UI developer intern to join our team and build extraordinary products for our customers! We need a self-motivated individual who is passionate about product design and development. You will work closely with our UI platform team, and will have the support of a strong, energetic and co-located design team, as well as close collaboration with product owners and developers.

This is a dynamic internship that will result in code being shipped/used inside the organization and by our clients. This is a great opportunity to challenge yourself and have a strong impact on the experience of several products, as well as consuming and contributing to a component library.

What To Expect During The Summer

Internships at Sovos will run for 10 weeks throughout Summer 2021. During that time, you will:
Gain valuable real-world skills and make a significant and lasting impact on our business
Learn more about Sovos’ products and, working alongside Sovosians, immerse yourself into our company culture
Please note: all of our internships this year will be fully remote


The Work You’ll Do
Contribute to a component library built using React that other developers will use in the future
Contribute documentation through React Storybook showing how other developers can use the component library
Drive the team mission of Make Tax Intuitive forward by making the complex UIs easy to build

And much, much more!

What We Need From You
Excellent written and verbal communication skills
Strong follow through and ability to see projects to completion
Great team player
Familiarity with JavaScript and modern web frameworks preferred


Key Takeaways From Our Previous Rising Stars
No matter what your title is; at Sovos your voice and opinions can influence major decisions
The Sovos culture is a community where you can be your “true self” and are encouraged to seek growth opportunities
Sovos’ open door policy is invaluable to personal and professional growth","https://www.linkedin.com/jobs/view/externalApply/2474645452?url=https%3A%2F%2Frecruit%2Ehirebridge%2Ecom%2Fv3%2FJobs%2FJobDetails%2Easpx%3Fcid%3D6875%26jid%3D545361%26locvalue%3D1147%26bid%3D1&urlHash=r6Bm&refId=fab4990a-d3ec-44e3-8e95-7d86caa31a8a&trackingId=Wid4MKpwjFlEaNMgVmCvPA%3D%3D&trk=public_jobs_apply-link-offsite",0.012470221161412956,
28,"User Experience Intern - NetSuite","Oracle","Providence, RI","This job code is utilized for the majority of our temporary hires. The individual is performing hourly job duties as defined under the Fair Labor Standards Act..This is a remote/office based position which may be performed anywhere in the United States except for within the state of Colorado.*.Oracle is an Affirmative Action-Equal Employment Opportunity Employer. All qualified applicants will receive consideration for employment without regard to race, color, religion, sex, national origin, sexual orientation, gender identity, disability, protected veterans status, age, or any other characteristic protected by law.*.*.*This is an offer requisition for candidates who have completed the interview process on*210005NK*.* intern, user experience Bring your passion to learn to a diverse world-wide team of experience professionals.Position*: User Experience Intern.Company*: Oracle NetSuite.Us* A global team of designers and researchers pursuing innovative ways to build user-centered solutions that can scale over time.. We practice design thinking and iteratively craft our solutions based on customer research and testing. We follow agile methodologies, preceded by research, design and planning phases. We move fast but take the time to innovate, brainstorm, and explore. We feel the best solutions usually come from highly collaborative teams. We move forward by bridging experience design with product management and engineering at every step of the process..You* We're looking for a collaborative intern who is excited to work closely with cross-functional teams across the world. You should have some experience with design and research, and a bonus if you've studied design thinking and its methodologies. You will help contribute to a culture of excellence and comradery, adding your passion and personality to an already high-performing, fun and collaborative office..The role* You will be part of the Enterprise Resource Planning group, the backbone of the NetSuite business solution (accounting, billing, supply chain, timesheets, and more). You will have the opportunity to collaborate with customers and help shape the ideal end-user experience. You will work with product teams, and user experience professionals to understand their learning objectives, and you'll help develop appropriate activities to achieve those goals..Responsibilities*:. Hands-on creative problem solving in a cloud-driven enterprise software system.. Work with a multi-disciplined UX team of designers, user researchers and product managers in a fast-paced, dynamic, agile environment.. Produce deliverables that communicate solutions and facilitate discussion.. Demonstrate a passion for iteration and eager to receive feedback..Qualifications/Skills:* To be considered for a User Experience Intern position in the NetSuite GBU, you must possess the Objective Minimum Qualifications (OMQs) below..Please ensure that your application clearly indicates that you meet these OMQs*, either on your resume and/or by uploading additional documents such as a transcript.. Will be enrolled in a*Bachelor's degree*program in Product/Industrial Design, HCI, Human Factors, Usability Engineering, or a related field during the 2021-2022 school year.. Have completed*at least your sophomore year*toward your undergraduate degree, or higher, by summer 2021.. Have*no more than 12 months*of professional Full time work experience in the technology field (excluding internships, research and/or teaching assistant roles, and military experience). If you are interested in working at Oracle and you have more than 1 year of work experience in the technology field, please apply to Oracle's experienced job openings. For information on currently open positions at Oracle, please visit http://oracle.com/goto/careers. Have academic course work, completed project research or have prior work experience with*two or more*of the following design tools: o Figma, Adobe Creative Cloud (Photoshop, Illustrator, InDesign, Premier Pro, Dreamweaver, After Effects, etc.); Sketch; InVision; Principle; Axure; Balsamiq; or equivalent.. Have project experience, work experience, or academic course work in*two or more*of the following areas: o Information architecture, wireframing, storyboarding, visualization, prototyping, sketching, surveying, user research, personas, user testing.. Attend a university in the US.. Authorized to work in the US in 2021. Additional preferred qualifications include:. A positive and resilient personality. You will need to embrace feedback and have a desire for continuous iteration and improvement. Analytical and strategic mindset.. Solid communication skills.. Flexibility to work with geographically distributed teams./*Note*: This is a 12-week summer internship/*Job:*.*All Roles*.*Organization:*.*Oracle*.*Title:*.User Experience Intern - NetSuite*.*Location:*.United States*.*Requisition ID:*.21000GX2","https://blackberrystaff.com/jobs/user-experience-intern-netsuite-providence-rhode-island/258350249-2/?utm_campaign=google_jobs_apply&utm_source=google_jobs_apply&utm_medium=organic",0.008343610544208308,
25,"Research Intern, Neuromotor Interfaces (PhD)","Facebook","New York, NY","Facebook's mission is to give people the power to build community and bring the world closer together. Through our family of apps and services, we're building a different kind of company that connects billions of people around the world, gives them ways to share what matters most to them, and helps bring people closer together. Whether we're creating new products or helping a small business expand its reach, people at Facebook are builders at heart. Our global teams are constantly iterating, solving problems, and working together to empower people around the world to build community and connect in meaningful ways. Together, we can help people build stronger communities - we're just getting started.

Facebook Reality Labs is looking for interns to advance our pioneering work in neuromotor interfaces , which has grown out of the acquisition of CTRL-labs. This technology could become one of the main pillars for interaction with the virtual and augmented world. Help us unleash human potential by erasing the bottlenecks between user intent and action. In this role you will embed with a world-class, multi-disciplinary team of researchers to investigate the nature of human neuromotor signals (EMG), develop novel signal processing and machine learning methods to infer a user’s intent, and create novel interaction techniques and user experiences.Our internships are twelve (12) to twenty four (24) weeks long, and we have various start dates throughout the year.

Responsibilities
Plan and execute cutting-edge applied research to advance neuromotor interface capabilities.
Collaborate with engineering and Human-Computer Interactions (HCI) teams to translate fundamental scientific knowledge into new technology and user experiences.
Use quantitative research methods to define, iterate upon and advance key areas of our research agenda.
Minimum Qualification
Must obtain work authorization in the country of employment at the time of hire and maintain ongoing work authorization during employment.
Currently has, or is in the process of obtaining a PhD, in [one or more of the following fields:] systems neuroscience, computational neuroscience, machine learning, biophysics, physics, electrical engineering, computer science, statistics, or related fields.
Strong research-oriented implementation skills, including fluency in scientific Python and PyTorch.
Interpersonal experience: cross-group and cross-culture collaboration

Preferred Qualification
Intent to return to degree-program after the completion of the internship.
Familiarity with scientific communication tools (jupyter, matplotlib).
Experience in software engineering in industry.
Experience in signal processing and familiarity with real-time signals.
Experience working with neural data or other physiological signals.
Facebook is proud to be an Equal Opportunity and Affirmative Action employer. We do not discriminate based upon race, religion, color, national origin, sex (including pregnancy, childbirth, or related medical conditions), sexual orientation, gender, gender identity, gender expression, transgender status, sexual stereotypes, age, status as a protected veteran, status as an individual with a disability, or other applicable legally protected characteristics. We also consider qualified applicants with criminal histories, consistent with applicable federal, state and local law. Facebook is committed to providing reasonable accommodations for candidates with disabilities in our recruiting process. If you need any assistance or accommodations due to a disability, please let us know at accommodations-ext@fb.com.","https://www.linkedin.com/jobs/view/externalApply/2439381893?url=https%3A%2F%2Fwww%2Efacebook%2Ecom%2Fcareers%2Fv2%2Fjobs%2F2161235280676979%2F&urlHash=CsbF&refId=5c3e81bb-92f6-42d7-bd9e-f3bc2c1ef9d9&trackingId=6M3NO%2FWmXXCMMRQrdEp%2FuA%3D%3D&trk=public_jobs_apply-link-offsite",0.0061216332783983075,
27,"UI/UX Design Intern","Konrad","New York, NY","Konrad Group

Konrad Group is a next generation digital consultancy. We are dedicated to solving complex business problems for our global clients with creative and forward-thinking solutions. Our employees enjoy a culture built on innovation and a commitment to creating best-in-class digital products in use by hundreds of millions of consumers around the world. We hire exceptionally smart, analytical, and hard working people who are lifelong learners.

Experience Design Intern (UI/UX)

As an Experience Design Intern (UI/UX), you will be involved in our design thinking process and the creation of innovative mobile, tablet and web products. You will bridge the gap between design, business, and technology to ship world-class digital experiences for leading companies and global brands.

Responsibilities
• Work with design leads to create compelling interactive experiences
• Perform user research and develop information architecture, user goals, journey maps, and design wireframes and visual interfaces
• Collaborate with developers to ensure pixel perfect execution across all project deliverables
• Work with the consulting team to gain insights into clients' business and project objectives
• Learn the end-to-end process of project delivery and the associated design tools involved

Successful candidates will have
• Firm grasp of design fundamentals demonstrated by a strong portfolio of digital projects
• Meticulous attention to detail and a keen eye for typography and visual hierarchy
• Clear and effective communication skills in articulating design concepts and rationales
• Proficient in Sketch and Adobe Creative Suite, and an eagerness to learn new tools
• Positive attitude with a desire to grow within a collaborative, inspiring teamwork environment

Perks and Benefits
• Flexible Vacation Policy
• Health & Wellness Programs
• Culture of Learning & Development
• Fully-Stocked Kitchens & Lounges
• New Shiny Device Upgrades
• Monthly Socials & Team Outings

Bonus Points: Have you taken any courses at BrainStation? A lot of our design and development best practices and processes are taught during our courses - make sure to highlight this experience in your cover letter if you have!

Konrad Group is committed to maintaining a diverse work environment and is proud to be an equal opportunity employer. All qualified applicants, regardless of race, color, religion, gender, gender identity or expression, sexual orientation, national origin, genetics, disability, age, or veteran status will receive consideration for employment. If you have any accessibility requirements or concerns regarding the hiring process or employment with us, please notify us so we can provide suitable accommodation.

While we sincerely appreciate all applications, only those candidates selected for an interview will be contacted","https://www.glassdoor.com/job-listing/ui-ux-design-intern-konrad-JV_IC1132348_KO0,19_KE20,26.htm?jl=3527232727&utm_campaign=google_jobs_apply&utm_source=google_jobs_apply&utm_medium=organic",0.01928610056002047,
31,"User Experience Design Intern - Advanced Technology Center","World Wide Technology","Cranston, RI","","https://www.jobs4millennials.com/Cranston-Rhode-Island-USA-job/USER-EXPERIENCE-DESIGN-INTERN-ADVANCED-TECHNOLOGY-CENTER/43bd0846d3cb2b53/?utm_campaign=google_jobs_apply&utm_source=google_jobs_apply&utm_medium=organic",0.004761904761904762,
7,"UX Design Intern","Masonite®","Tampa, FL","We heard you knock!
At Masonite, we make doors that do more. Our Purpose is We help people walk through walls , and by doing this we open new doors of opportunity for customers, partners and employees.

Six Cultural Pillars represent our organization’s culture and the behaviors employees demonstrate:
Integrity Under Pressure
People Are Key
Hold the Door Open
Flexibility in Every Fiber
Results Hinge on Accountability
On the Threshold of What’s Next

Design at Masonite has been growing steadily in reach and impact across the company—from the design of systems to hardware nuts & bolts, equipment & devices to digital experience, logistics & manufacturing process to environmental impact, from physical retail to e-commerce and more—all while creating and cultivating experiences that touch Masonite customers everywhere, every day. Masonite design teams include every flavor of the design discipline, including UX, UI, visual, industrial, interaction, illustration, animation, brand, and marketing design roles—as well as design technologists, ethnographic researchers, UX writers, and more. Check out masonite.design, to learn more and come build the future with us.

As a UX Design Intern, you will collaborate with a team that defines and designs user experience across products and services and input into the design of experiences, interfaces, systems, as well as user interaction, visual, and communication/engagement design.

Responsibilities
Design thoughtful, beautiful, and useful product and service experiences in a team environment
Create user-centered designs by considering market analysis, customer feedback, business metrics, and usability insights
Use business requirements, along with user and market research to assist in developing scenarios, use cases, and high-level requirements
Develop conceptual user experience journey maps
Develop conceptual wireframes, visual mockups, and prototypes
Work with stakeholders to plan projects for effective delivery while maintaining high standards for design
Be a passionate and effective advocate for design with non-design audiences


Essential Qualifications
Six-month internship and/or project experience in design
Experience working in a collaborative team environment to deliver high-quality design solutions
Experience in a variety of design and prototyping tools

Desired Qualifications
Experience with consumer brand experience design and an understanding of storytelling
Visual design expertise demonstrated through mockups and style guides
Additional design skills in related fields, including filmmaking, animation, motion design, and prototyping
Ability to extract complex concepts and quickly turn around detailed flows and mock-ups reflecting a range of options
Ability to proficiently present design solutions to stakeholders in design, engineering and product management
Ability to drive the design review cycle and close on design requirements independently
Able to use best practices for mobile and web-based information architecture and design, as well as knowledge of usability principles and techniques
Excellent communication, presentation, and interpersonal skills
A portfolio demonstrating past work experience and school projects

Education
Pursuing a bachelor’s degree in computer science, human-centered interaction, design, statistics, psychology, human studies or a related field
Juniors and Senior level students. Seniors should have at least a semester or a quarter left out of their studies
Open to extraordinary!","https://www.linkedin.com/jobs/view/externalApply/2294487252?url=https%3A%2F%2Fmasonite%2Ewd1%2Emyworkdayjobs%2Ecom%2Fen-US%2Fmasonite_careers%2Fjob%2FTampa-FL%2FUX-Design-Intern_R-118533&urlHash=jv4T&refId=fab4990a-d3ec-44e3-8e95-7d86caa31a8a&trackingId=4EYYifShG2dcEDi1K60fNw%3D%3D&trk=public_jobs_apply-link-offsite",0.006615504655820604,
0,"UI/UX Design Intern","Konrad Group","New York, NY","Konrad Group

Konrad Group is a next generation digital consultancy. We are dedicated to solving complex business problems for our global clients with creative and forward-thinking solutions. Our employees enjoy a culture built on innovation and a commitment to creating best-in-class digital products in use by hundreds of millions of consumers around the world. We hire exceptionally smart, analytical, and hard working people who are lifelong learners.

Experience Design Intern (UI/UX)

As an Experience Design Intern (UI/UX), you will be involved in our design thinking process and the creation of innovative mobile, tablet and web products. You will bridge the gap between design, business, and technology to ship world-class digital experiences for leading companies and global brands.

Responsibilities
Work with design leads to create compelling interactive experiences
Perform user research and develop information architecture, user goals, journey maps, and design wireframes and visual interfaces
Collaborate with developers to ensure pixel perfect execution across all project deliverables
Work with the consulting team to gain insights into clients' business and project objectives
Learn the end-to-end process of project delivery and the associated design tools involved

Successful candidates will have
Firm grasp of design fundamentals demonstrated by a strong portfolio of digital projects
Meticulous attention to detail and a keen eye for typography and visual hierarchy
Clear and effective communication skills in articulating design concepts and rationales
Proficient in Sketch and Adobe Creative Suite, and an eagerness to learn new tools
Positive attitude with a desire to grow within a collaborative, inspiring teamwork environment


Perks And Benefits
Flexible Vacation Policy
Health & Wellness Programs
Culture of Learning & Development
Fully-Stocked Kitchens & Lounges
New Shiny Device Upgrades
Monthly Socials & Team Outings

Bonus Points: Have you taken any courses at BrainStation? A lot of our design and development best practices and processes are taught during our courses - make sure to highlight this experience in your cover letter if you have!

Konrad Group is committed to maintaining a diverse work environment and is proud to be an equal opportunity employer. All qualified applicants, regardless of race, color, religion, gender, gender identity or expression, sexual orientation, national origin, genetics, disability, age, or veteran status will receive consideration for employment. If you have any accessibility requirements or concerns regarding the hiring process or employment with us, please notify us so we can provide suitable accommodation.

While we sincerely appreciate all applications, only those candidates selected for an interview will be contacted.","https://www.linkedin.com/jobs/view/externalApply/2495152726?url=https%3A%2F%2Fgrnh%2Ese%2F8be458f63&urlHash=1UM8&refId=fab4990a-d3ec-44e3-8e95-7d86caa31a8a&trackingId=5ORY%2F48JjapszEkFRjobkw%3D%3D&trk=public_jobs_apply-link-offsite",0.022564737655223953,
