Id,Title,Company,Location,Required Qualifications,Link,Page Rank,
26,"Summer 2021 Internships: UX/UI Design Research Intern","The Motley Fool","Philadelphia, PA","Description

Want to spend your summer interning at a company that is consistently rated as one of the best places to work in the country? Is this a rhetorical question??

The Motley Fool is a multimedia financial services company that provides financial solutions for investors through various stock, investing, and personal finance services. We've been on the block for about 26 years and have honed a reputation for producing industry-leading work in a nationally recognized workplace. Our mission is to help the world become happier, smarter, and richer and the backbone supporting this global mission is our top-notch tech team. If you dream of becoming a brilliant and skilled web designer and are ready to work hard on cutting edge technologies alongside awesome coworkers, then step up to the plate, and tell us why you should land a spot among our Foolish ranks.

For eight Foolish weeks as a UX/UI Design Research Intern, you'll be embedded with the Design and Web Technologies teams that support, build, and maintain our Foolish products and websites. You will have hands-on experience working with users and internal teams to investigate existing user mental models and design products that sustainably address our end users' needs. You will gain exposure to the entire UX Design process -- from the initial research to design, design testing, as well as the hand off to development! You'll also collaboratively shape what success looks like for the changes you propose. The projects you could work on may be team-level or span our entire tech organization.

You'll be challenged and mentored by some of our greatest designers all summer, and in turn, you'll develop the skills it takes to cultivate a user first mindset that will set you apart from your peers. We're excited to open our doors for Summer 2021 Design Intern applicants, so send us your most Foolishly written cover letter and your ultra-impressive resume. We're prepared to be wowed!

What You Need To Succeed
Excellent problem-solving skills with the ability to analyze situations, identify existing or potential opportunities, and recommend solutions.
Ability to present complex qualitative and quantitative data to diverse audiences in an understandable format via excellent verbal and written and/or visual communication skills.
Flexibility and ability to learn quickly.
Extraordinary critical thinking skills.
High-performing problem solving and collaborative skills.
Ability to communicate clearly and demonstrate emotional intelligence.
Ability to think quickly, resolve problems, and multi-task across numerous projects and teams.
Ability to keep a calm and pleasant demeanor under tight, evolving, and sometimes unpredictable timeframes and priorities.
Ability to translate insights into workable prototypes for testing and future iteration.

What would be really cool of you to have, but not required:
Experience applying qualitative research methods.
Experience with full-life cycle research and inspection methods which occur from ethnography all the way to statistically-based user testing.
Experience working on enterprise-level experiences that span multiple channels such as web, mobile, and offline interactions.
Experience with quantitative, behavioral analysis, and statistical concepts.
Experience managing digital product analytics with tools such as Google Analytics, Tableau, Airtable, or Spaghetti and Meatballs.
Experience using design methods and user research data to influence business strategy and leadership.
Familiarity with basic concepts of investing and finance.","https://www.linkedin.com/jobs/view/externalApply/2438556325?url=http%3A%2F%2Fjobs%2Ejobvite%2Ecom%2Fthemotleyfool%2Fjob%2FoKKpefwR%3F__jvst%3DJob%2BBoard%26__jvsd%3DLinkedIn&urlHash=nrkY&refId=76eb4ba7-93bd-4243-afaf-62206d803ac6&trackingId=qDpOmFoJZjqiJWQf79%2Flxg%3D%3D&trk=public_jobs_apply-link-offsite",0.3266201673705799,
8,"Product Design Intern - Summer 2021","Paradox","Scottsdale, AZ","Are you a web designer with a passion for intuitive UX and beautiful, simple design?

Do you have a less is more design philosophy and believe that the highest form of art is simplicity? (so do we!)

Are you looking to kick start a career in product design at a values-driven tech startup?

At Paradox, we believe when you get the people thing right you can build teams that can change the world. We’re a high performance culture with laser focus on building world class products and a team that our clients love. Our flagship product, Olivia, is the AI assistant helping companies around the world reimagine the way they hire: conversations instead of job applications, automatic interview scheduling, and so much more.

Recently named one of Forbes’ Top 500 Startup Employers, we’re looking for top performers who have a track record of success and want to build a company together as we continue our triple-digit growth.

We’re a company that believes software should be so simple it feels like magic. Our recruiting products are used by job seekers and hiring teams around the world and we’re looking for a UI designer who wants to help bring great design and delightful UX to the long-neglected world of HR technology. As a member of our Product team, you’ll work closely with engineers and PMs to design and ship simple, beautiful software that our clients and users love.

Sound like your dream job? We want to hear from you!

As a Product Design Intern, You Will
Design simple, intuitive web and mobile interfaces, translating business requirements into magical user experiences across the portfolio of Paradox products
Partner with Product and Engineering teams on end-to-end UI design initiatives, from conceptualizing and prototyping to building & shipping software
Create mockups, wireframes, prototypes, and user flows to showcase your user interface proposals and UX ideas
Participate in a highly collaborative, iterative design process, proactively giving and receiving feedback from team members
Uphold our high product standards and design philosophy
Continuously research and apply the latest UX/UI standards and industry trends

Experience & Skills Required
Pursuing a Bachelor’s degree in UI/UX design, graphic design, human computer interaction or related field (rising seniors preferred)
Experience in web and mobile user interface (UI) design - and a spectacular portfolio to show for it!
Excellent understanding of UX design principles and research methodologies
Familiarity with prototyping software such as Sketch, Framer, InVision, Figma, or Balsamiq
Openness to constructive design feedback
Ability to work independently and manage multiple projects simultaneously
Available to work May-August 2021 from our Scottsdale, AZ headquarters (40 hrs/week)
Authorization to work in the United States

Why You Should Work At Paradox
Work side by side with passionate, purposeful people - Talent is our DNA and we pride ourselves on having the best!
Ability to make a big impact on a growing organization and drive your own growth
The opportunity to build the next big thing in recruiting technology
Internal and external professional development, coaching, and continuous education opportunities","https://www.linkedin.com/jobs/view/externalApply/2490800610?url=https%3A%2F%2Fcareers%2Eparadox%2Eai%2Fproduct-design-intern-summer-2021%2Fjob%2F15982848&urlHash=JDWO&refId=fab4990a-d3ec-44e3-8e95-7d86caa31a8a&trackingId=iGuG%2F1qRMOsRIoCsUQxk5A%3D%3D&trk=public_jobs_apply-link-offsite",0.015270449534100092,
22,"Product Design Intern - Summer 2021","Paradox","Scottsdale, AZ","Are you a web designer with a passion for intuitive UX and beautiful, simple design?

Do you have a less is more design philosophy and believe that the highest form of art is simplicity? (so do we!)

Are you looking to kick start a career in product design at a values-driven tech startup?

At Paradox, we believe when you get the people thing right you can build teams that can change the world. We’re a high performance culture with laser focus on building world class products and a team that our clients love. Our flagship product, Olivia, is the AI assistant helping companies around the world reimagine the way they hire: conversations instead of job applications, automatic interview scheduling, and so much more.

Recently named one of Forbes’ Top 500 Startup Employers, we’re looking for top performers who have a track record of success and want to build a company together as we continue our triple-digit growth.

We’re a company that believes software should be so simple it feels like magic. Our recruiting products are used by job seekers and hiring teams around the world and we’re looking for a UI designer who wants to help bring great design and delightful UX to the long-neglected world of HR technology. As a member of our Product team, you’ll work closely with engineers and PMs to design and ship simple, beautiful software that our clients and users love.

Sound like your dream job? We want to hear from you!

As a Product Design Intern, You Will
Design simple, intuitive web and mobile interfaces, translating business requirements into magical user experiences across the portfolio of Paradox products
Partner with Product and Engineering teams on end-to-end UI design initiatives, from conceptualizing and prototyping to building & shipping software
Create mockups, wireframes, prototypes, and user flows to showcase your user interface proposals and UX ideas
Participate in a highly collaborative, iterative design process, proactively giving and receiving feedback from team members
Uphold our high product standards and design philosophy
Continuously research and apply the latest UX/UI standards and industry trends

Experience & Skills Required
Pursuing a Bachelor’s degree in UI/UX design, graphic design, human computer interaction or related field (rising seniors preferred)
Experience in web and mobile user interface (UI) design - and a spectacular portfolio to show for it!
Excellent understanding of UX design principles and research methodologies
Familiarity with prototyping software such as Sketch, Framer, InVision, Figma, or Balsamiq
Openness to constructive design feedback
Ability to work independently and manage multiple projects simultaneously
Available to work May-August 2021 from our Scottsdale, AZ headquarters (40 hrs/week)
Authorization to work in the United States

Why You Should Work At Paradox
Work side by side with passionate, purposeful people - Talent is our DNA and we pride ourselves on having the best!
Ability to make a big impact on a growing organization and drive your own growth
The opportunity to build the next big thing in recruiting technology
Internal and external professional development, coaching, and continuous education opportunities","https://www.linkedin.com/jobs/view/externalApply/2491365977?url=http%3A%2F%2Fcareers%2Eparadox%2Eai%2Fproduct-design-intern-summer-2021%2Fjob%2F15982848%3Fsource%3Dlinkedin&urlHash=eH5G&refId=6ba51620-5cc8-472d-b833-9a9f2592073c&trackingId=41iTtfpQhZngG80nq5qesQ%3D%3D&trk=public_jobs_apply-link-offsite",0.015270449534100092,
9,"UI/UX Intern","Treatspace","Pittsburgh, PA","About Treatspace

Treatspace is a SaaS-based healthcare platform that is disrupting and improving every day, critical healthcare processes that no longer work in a rapidly changing regulatory and reimbursement landscape. Our innovations help practices solve patient access and acquisition challenges. Treatspace received the Global Action Challenge Award in Nashville, Tennessee in 2015, competing against hundreds of other healthcare companies nationally and is one of the Top 5 Startups named by the Pittsburgh Technology Council Tech 50 Awards. We have also raised several million dollars of venture capital fund

How you will contribute:

You will be working closely with the engineering and product development team to own the product design lifecycle from end to end. You will begin by gaining a deep understanding of our users through research and behavior analysis. As a fast-growing company, we are constantly building new products, features, and tools that require forward-thinking designers to help us remain industry leaders. You will work to create wireframes, beautiful icons, and layouts for desktop and mobile responsive sites.

Skills you’ll bring:
Experience or interest designing and shipping web-based products and interfaces
Strong experience working from flows and wireframes through to the final product
UX and UI experience
Experience working with a SaaS product
Designing wireframes and mock-ups of new features
Collaborating with team members during design reviews to refine the user experience
Working with software engineers to ensure consistency between design and implementation.
Propose solutions to solve design/user experience challenges
Writing clean, concise and descriptive documentation of your features
Why you're important to us:

This role will impact our organization by creating beautiful designs for our products while continually improving our overall aesthetic. You will work in a fast-paced environment where continuous innovation is the bar and high attention to detail is a must have. The ability to manage multiple, competing priorities simultaneously will be the key to success in this role.

What You'll Need:
Currently enrolled in or recently graduated from a Bachelor's Degree
Knowledge of UI/UX best practices and trends
Portfolio of UI/UX related work
Powered by JazzHR

HM0c7qbeBM","https://www.linkedin.com/jobs/view/externalApply/2462829530?url=http%3A%2F%2Fjobs%2Etreatspace%2Ecom%2Fapply%2FHM0c7qbeBM%2FUIUX-Intern%3Fsource%3DLILI%23HM0c7qbeBM&urlHash=OIhK&refId=fab4990a-d3ec-44e3-8e95-7d86caa31a8a&trackingId=Dx%2FsKS6uZCnMuB6er3nnTQ%3D%3D&trk=public_jobs_apply-link-offsite",0.011493291393007334,
12,"Intern - UX Designer","S&C Electric Company","Rockville, MD","Job Description

We are hiring multiple enterprise Software Engineer Interns. This position combines the best features of both a start-up and an established corporation. You’ll be working with a small team in a fast-paced environment to develop new Smart Grid application software. You won’t get lost in a crowd. Your skills will be seen and appreciated!

The ideal candidate for the UI/UX design intern position is ready to bring their skills to a driven team that is working on ground breaking technology. The UI/UX design intern will research, design and iterate upon designs for multiple desktop, web and mobile applications.

If you are passionate about design and innovative technologies, we are looking for you!

Learn more about S&C's Product Innovation Team here: https://youtu.be/qVrfxa4JM0A

What Needs To Be Done

Design a desktop and web application for controlling and monitoring assets
Create user personas that will be used to guide the design process
Conduct market research to better understand the users’ needs and expectations
Define user flows
Follow best practices and work in an Agile environment
Have a proactive approach to improving the application with every sprint
Work with software engineers to implement an intuitive user experience
Work with team members to coordinate the development of new features
Understand the overall application feature set and goals
Work with software development team members to design and distribute assets for an android application
Support design needs of the software development team
Assist in the documentation process
Create and design end-of-program presentation to be given to management
Organize and catalog all assets for the application
Participate in the brainstorming and creation of design concepts

To select this job as one of interest to you, at a minimum, you must have the following:

Must be a student in good standing at an accredited university pursuing a degree in Computer Science, Graphic/Visual Design or a related field and returning to school full-time at the end of the internship.
Minimum of 1 year of hands on experience with UI and UX design.
Experience with designing vector graphics, icon creation/management, graphic design software (ie. Photoshop, Sketch, etc.), design for either web or mobile based applications.
Strong layout/typography skills and understanding of visual hierarchy and its importance in UI/UX design.
Excellent written and oral communication skills and organizational skills.
Good understanding of color theory.
User interface and use centered design skills.

Major Physical Demands

Standing: Occasional standing for work
Lifting: Occasional lifting of controls and test equipment, less than 50 pounds
Walking: Occasional walking throughout the facility
Carrying: Occasional carrying of light objects
Pushing: Infrequent pushing of objects, possibly related to rearrangement work
Pulling: Infrequent pulling of objects, possibly related to rearrangement work
Bending: Occasional bending during access to equipment
Reaching: Infrequent reaching
Handling: Frequent handling of parts or tools
Environment: Standard office / desktop workspace","https://www.linkedin.com/jobs/view/externalApply/2492520104?url=https%3A%2F%2Fejia%2Efa%2Eus6%2Eoraclecloud%2Ecom%2FhcmUI%2FCandidateExperience%2Fen%3FjobPipeline%3DLinkedIn%23%2Fjob%2F100347%2F%3Futm_medium%3Djobshare&urlHash=hH1o&refId=fab4990a-d3ec-44e3-8e95-7d86caa31a8a&trackingId=IoWNgxRjUYCOSSEbB1JhYA%3D%3D&trk=public_jobs_apply-link-offsite",0.010668878086335924,
29,"User Experience Design Intern - Advanced Technology Center","World Wide Technology","Warwick, RI","","https://www.genzjobsearch.com/Warwick-Rhode-Island-USA-job/USER-EXPERIENCE-DESIGN-INTERN-ADVANCED-TECHNOLOGY-CENTER/2717796bef25ac52/?utm_campaign=google_jobs_apply&utm_source=google_jobs_apply&utm_medium=organic",0.004761904761904762,
23,"UI Browser Automation Intern","Envestnet, Inc","Berwyn, PA","It's fun to work in a company where people truly BELIEVE in what they're doing!

We're committed to bringing passion and customer focus to the business.

Job Description Summary

Envestnet is a leading independent provider of technology-enabled, web-based investment solutions and services to financial advisors. Our mission is to help investors achieve their financial goals, by providing financial advisors the access, tools, and support they need to deliver excellence in wealth management.

The Envestnet Summer Internship is a full-time internship program designed for qualified college students to gain hands on experience within the Envestnet location Office. Interns will work alongside various department experts and collaborate with fellow Envestnet interns on a project presented to leaders in the company.

The Summer Internship program will run from June 2, 2021 through August 6, 2021.

Job Description

Essential Duties and Responsibilities
UI Development
Modern JavaScript & UI research
Unit testing code development

Knowledge, Skills, And Abilities
Knowledge in developing React, Typescript, Redux applications (ES6+)
Team player with positive attitude, who can work collaboratively with other members of Envestnet
Excellent communication skills, both written and verbal
Excellent analytic and problem solving skills
Good understanding of Javascript, React, DOM and relevant concepts
NOTE: This is intended to describe the general content of and qualifications for the job. It is not intended as an exhaustive statement of all functions, duties, or desired qualifications.

Envestnet is an Equal Opportunity Employer

If you like wild growth and working with happy, enthusiastic over-achievers, you'll enjoy your career with us!","https://www.linkedin.com/jobs/view/externalApply/2430024041?url=https%3A%2F%2Fenvestnet%2Ewd5%2Emyworkdayjobs%2Ecom%2Fen-US%2FENV%2Fjob%2FBerwyn-PA%2FUI-Browser-Automation-Intern_Req21156-%3Fsource%3DLinkedin&urlHash=1Chv&refId=6ba51620-5cc8-472d-b833-9a9f2592073c&trackingId=UtMKCoJa%2B0WFMJRR1Msw%2FQ%3D%3D&trk=public_jobs_apply-link-offsite",0.0072051985543845065,
2,"Intern, UI/UX","NEON","Los Gatos, CA","The Tech Team is responsible for the integral development of core technology and the science behind NEON. We are passionate about researching and building future generation of products to be used by millions of people.

As an Intern in UI/UX, you will be a part of the R&D team. You will be instrumental in developing interfaces and experiences that maximize the impact NEON has to B2B partners and to end users on mobile, web, and display. Your designs will be see by many customers or different types, and above all, you will be working outside your comfort zone while making an impact and having fun.

Preferred candidate should be a recent graduate with experience in UI/UX.
A high level of proficiency with industry standard design software (i.e Sketch, Adobe CC, and/or other UX related tools).
Prior experience of designing websites, mobile applications a major plus.
Ability to perform rapid prototyping, Wireframes and illustrations.
Experience with frontend implementation (i.e. HTML, CSS, JavaScript, React).
Ability to create, maintain and deploy UI assets and interaction flows.
Excellent writer with the ability to easily change voice, tone, and persona to match that of the company.
Passionate about marketing and communication.

Learn more at: https://neon.life/","https://www.linkedin.com/jobs/view/externalApply/2483585691?url=https%3A%2F%2Fwww%2Enotion%2Eso%2FBins-Storage-Internship-Opportunity-cf36ae4293a043f182f393fab755db9d&urlHash=rb2T&refId=fab4990a-d3ec-44e3-8e95-7d86caa31a8a&trackingId=sSi%2FcFjI4597CQeM%2FFLHMA%3D%3D&trk=public_jobs_apply-link-offsite",0.005024014778325123,
1,"UI/UX Intern","Bins Storage","Los Angeles Metropolitan Area","Description: Bins Storage is a startup that offers a platform that helps traditional self-storage facilities transform units into valet or full-service units. Tenants can use the Bins Storage app to request deliveries and view their items in storage. Facilities and movers use the app to manage tenants and orders.

Note: this is an unpaid position.

Responsibilities: We place emphasis on clear communication, ownership, and learning within our team. Interns will have projects with high autonomy and responsibility, allowing them to make a significant impact on the platform's technology.
Oversee UI/UX for front-end of customer and enterprise web/mobile applications
Design user flows and wireframes, test and gain user feedback
Communicate and work with software engineers to integrate designs into application
Work together with team in a collaborative environment to deliver high-quality products","https://www.linkedin.com/jobs/view/externalApply/2483585691?url=https%3A%2F%2Fwww%2Enotion%2Eso%2FBins-Storage-Internship-Opportunity-cf36ae4293a043f182f393fab755db9d&urlHash=rb2T&refId=fab4990a-d3ec-44e3-8e95-7d86caa31a8a&trackingId=sSi%2FcFjI4597CQeM%2FFLHMA%3D%3D&trk=public_jobs_apply-link-offsite",0.004880952380952382,
